endoso_code,text,extracted_parameters,cost_metrics,nom_subg,contract_no
endoso_84,"CONT-040 CONTINUIDAD GARANTIZADA_Los Asegurados podrán ejercer el beneficio de continuidad de cobertura_contratando una Póliza Individual en el Producto Flex Plus con Continuidad_Garantizada, con características similares a las que tenían contratadas en la_Póliza Colectiva y conforme a la oferta vigente en el Producto Individual,_con la finalidad que la Compañía cubra los gastos derivados de padecimientos_y/o enfermedades que hayan sido diagnosticados o pagados a partir de la fecha_de antigüedad del Asegurado reconocida en esta Póliza Colectiva, siempre y_cuando:_1. El Asegurado haya ingresado a la póliza colectiva del mismo Contratante_con una edad máxima de 64 años._2. El Asegurado haya estado vigente de forma ininterrumpida en la Póliza_Colectiva del mismo Contratante_3. La Suma Asegurada en la Póliza Colectiva con AXA no haya sido agotada._En caso de solicitar un plan con mayor cobertura o solicite coberturas_adicionales, se deberán aplicar las políticas de selección vigentes y la_aceptación quedará a cargo de la Compañía._Para el pago de complementos en la Póliza Individual:_1. El límite de responsabilidad de la Compañía, para cada padecimiento y/o_enfermedad, será la Suma Asegurada contratada en la Póliza Individual._2. Se deberá cubrir nuevamente el deducible, coaseguro y tope de coaseguro_vigentes en la Póliza Individual, sin importar que estos hayan sido cubiertos_en la Póliza Colectiva._3. Se cubren los gastos médicos derivados de padecimientos o enfermedades que_estén cubiertos por la Póliza Individual._Para otorgar este beneficio el Asegurado deberá:_1. Solicitar la Póliza Individual en el Producto Flex Plus con Continuidad_Garantizada, durante los 45 días naturales, posteriores a la fecha de su_separación laboral de la empresa o baja definitiva de la Institución_Educativa, en su caso.__2. Requisitar y firmar la ¿Solicitud de Seguro Gastos Médicos Flex Plus¿,_declarando los padecimientos que tenga el Asegurado._3. Presentar la documentación requerida por la Compañía para comprobar la_separación laboral de la empresa o baja definitiva de la Institución_Educativa._4. En caso que los dependientes causen baja por condiciones específicas_contratadas en ésta Póliza colectiva no se pedirá los requisitos mencionados_en el punto anterior._La fecha de antigüedad generada en esta Póliza Colectiva, será reconocida en_la Póliza individual._Para los demás términos y condiciones, aplicarán las Condiciones Generales_vigentes del producto contratado._Este Endoso forma parte del Contrato de Seguro.","{'endoso_id': 'endoso_84', 'endoso_master_id': '84', 'contract_no': 'FW53936C', 'subgrupo': 'GENERAL', 'type': 'standard', 'endoso_details': {'name': 'CONTINUIDAD GARANTIZADA', 'key': 'CONT-040', 'title': '', 'subtitle': '', 'description': 'Los Asegurados podrán ejercer el beneficio de continuidad de cobertura contratando una Póliza Individual en el Producto Flex Plus con Continuidad Garantizada, con características similares a las que tenían contratadas en la Póliza Colectiva y conforme a la oferta vigente en el Producto Individual, con la finalidad que la Compañía cubra los gastos derivados de padecimientos y/o enfermedades que hayan sido diagnosticados o pagados a partir de la fecha de antigüedad del Asegurado reconocida en esta Póliza Colectiva, siempre y cuando: 1. El Asegurado haya ingresado a la póliza colectiva del mismo Contratante con una edad máxima de 64 años. 2. El Asegurado haya estado vigente de forma ininterrumpida en la Póliza Colectiva del mismo Contratante 3. La Suma Asegurada en la Póliza Colectiva con AXA no haya sido agotada. En caso de solicitar un plan con mayor cobertura o solicite coberturas adicionales, se deberán aplicar las políticas de selección vigentes y la aceptación quedará a cargo de la Compañía. Para el pago de complementos en la Póliza Individual: 1. El límite de responsabilidad de la Compañía, para cada padecimiento y/o enfermedad, será la Suma Asegurada contratada en la Póliza Individual. 2. Se deberá cubrir nuevamente el deducible, coaseguro y tope de coaseguro vigentes en la Póliza Individual, sin importar que estos hayan sido cubiertos en la Póliza Colectiva. 3. Se cubren los gastos médicos derivados de padecimientos o enfermedades que estén cubiertos por la Póliza Individual. Para otorgar este beneficio el Asegurado deberá: 1. Solicitar la Póliza Individual en el Producto Flex Plus con Continuidad Garantizada, durante los 45 días naturales, posteriores a la fecha de su separación laboral de la empresa o baja definitiva de la Institución Educativa, en su caso. 2. Requisitar y firmar la ¿Solicitud de Seguro Gastos Médicos Flex Plus¿, declarando los padecimientos que tenga el Asegurado. 3. Presentar la documentación requerida por la Compañía para comprobar la separación laboral de la empresa o baja definitiva de la Institución Educativa. 4. En caso que los dependientes causen baja por condiciones específicas contratadas en ésta Póliza colectiva no se pedirá los requisitos mencionados en el punto anterior. La fecha de antigüedad generada en esta Póliza Colectiva, será reconocida en la Póliza individual. Para los demás términos y condiciones, aplicarán las Condiciones Generales vigentes del producto contratado. Este Endoso forma parte del Contrato de Seguro.', 'parameters': {'column_parameters': [{'column_parameter_name': 'Urgencias Médicas', 'column_parameter_details': [{'sub_column_parameter_name': '', 'row_parameters': [{'row_parameter_name': 'suma asegurada', 'value': '', 'unit': '', 'type': 'std'}, {'row_parameter_name': 'deducible', 'value': '', 'unit': '', 'type': 'std'}, {'row_parameter_name': 'coaseguro', 'value': '', 'unit': '', 'type': 'std'}, {'row_parameter_name': 'información adicional', 'value': '', 'type': 'std'}, {'row_parameter_name': 'gastos cubiertos', 'value': 'Se cubren los gastos médicos derivados de padecimientos o enfermedades que estén cubiertos por la Póliza Individual.', 'type': 'std'}, {'row_parameter_name': 'gastos no cubiertos', 'value': '', 'type': 'std'}, {'row_parameter_name': 'aplicación de deducible y/o coaseguro', 'value': 'true', 'type': 'std'}, {'row_parameter_name': 'condiciones generales', 'value': 'Para los demás términos y condiciones, aplicarán las Condiciones Generales vigentes del producto contratado. Este Endoso forma parte del Contrato de Seguro.', 'type': 'std'}, {'row_parameter_name': 'elegibilidad', 'value': '', 'type': 'exception'}, {'row_parameter_name': 'periodo de espera', 'value': '', 'type': 'exception'}, {'row_parameter_name': 'tope de coaseguro', 'value': '', 'type': 'exception'}, {'row_parameter_name': 'territorio de cobertura', 'value': '', 'type': 'exception'}]}]}]}, 'legal': 'Para los demás términos y condiciones, aplicarán las Condiciones Generales vigentes del producto contratado. Este Endoso forma parte del Contrato de Seguro.'}, 'global_information': {'effective_date': '', 'expiration_date': '', 'factor': '', 'type': ''}, 'business_rules': {'experience': '', 'product_type': '', 'min_net_premium': '', 'min_population': ''}, 'status': '', 'comment': [{'name': '', 'date': '', 'comment': ''}]}","{'token_cost': 0.021060000000000002, 'image_cost': 0, 'total_cost': 0.021060000000000002}",GENERAL,FW53936C
endoso_82,"PREEXISTENCIA__La Companía cubrirá los gastos médicos erogados por el Asegurado, durante la_vigencia de esta Póliza, por tratamientos y/o procedimientos derivados de_Padecimientos Preexistentes a partir de la fecha de antigüedad reconocida en_esta póliza por el contratante siempre y cuando no hayan sido cubiertos ni_pagados en una póliza de Gastos Médicos Mayores del mismo Contratante o_empresas del mismo grupo, emitida por esta u otra institución de seguros, y_el Asegurado no tenga periodos al descubierto, hasta los límites de_responsabilidad que se establecen en este Endoso._Periodo de espera: No Aplica_Se cubre en territorio: Nacional_Para los demás términos y condiciones, aplicarán las Condiciones Generales_vigentes del producto contratado._Este Endoso forma parte del Contrato de Seguro.","{'endoso_id': 'endoso_82', 'endoso_master_id': '82', 'contract_no': 'FW38091E', 'subgrupo': 'PERSONA', 'type': 'standard', 'endoso_details': {'name': 'PREEXISTENCIA', 'key': '', 'title': '', 'subtitle': '', 'description': 'La Companía cubrirá los gastos médicos erogados por el Asegurado, durante la vigencia de esta Póliza, por tratamientos y/o procedimientos derivados de Padecimientos Preexistentes a partir de la fecha de antigüedad reconocida en esta póliza por el contratante siempre y cuando no hayan sido cubiertos ni pagados en una póliza de Gastos Médicos Mayores del mismo Contratante o empresas del mismo grupo, emitida por esta u otra institución de seguros, y el Asegurado no tenga periodos al descubierto, hasta los límites de responsabilidad que se establecen en este Endoso. Periodo de espera: No Aplica Se cubre en territorio: Nacional Para los demás términos y condiciones, aplicarán las Condiciones Generales vigentes del producto contratado. Este Endoso forma parte del Contrato de Seguro.', 'parameters': {'column_parameters': '', 'row_parameters': [{'row_parameter_name': 'suma asegurada', 'value': '', 'unit': '', 'type': 'std'}, {'row_parameter_name': 'deducible', 'value': '', 'unit': '', 'type': 'std'}, {'row_parameter_name': 'coaseguro', 'value': '', 'unit': '', 'type': 'std'}, {'row_parameter_name': 'tope de coaseguro', 'value': '', 'unit': '', 'type': 'std'}, {'row_parameter_name': 'periodo espera', 'value': 'No Aplica', 'unit': '', 'type': 'std'}, {'row_parameter_name': 'reconocimiento de antigüedad', 'value': '', 'unit': '', 'type': 'std'}, {'row_parameter_name': 'requisitos', 'value': '', 'unit': '', 'type': 'std'}, {'row_parameter_name': 'gastos cubiertos', 'value': '', 'unit': '', 'type': 'std'}, {'row_parameter_name': 'gastos no cubiertos', 'value': '', 'unit': '', 'type': 'std'}, {'row_parameter_name': 'aplicación de deducible y/o coaseguro', 'value': '', 'unit': '', 'type': 'std'}, {'row_parameter_name': 'condiciones generales', 'value': 'Para los demás términos y condiciones, aplicarán las Condiciones Generales vigentes del producto contratado. Este Endoso forma parte del Contrato de Seguro.', 'unit': '', 'type': 'std'}, {'row_parameter_name': 'elegibilidad', 'value': '', 'unit': '', 'type': 'exception'}, {'row_parameter_name': 'territorio de cobertura', 'value': 'Nacional', 'unit': '', 'type': 'exception'}], 'legal': ''}}, 'global_information': {'effective_date': '', 'expiration_date': '', 'factor': '', 'type': ''}, 'business_rules': {'experience': '', 'product_type': '', 'min_net_premium': '', 'min_population': ''}, 'status': '', 'comment': [{'name': '', 'date': '', 'comment': ''}]}","{'token_cost': 0.014682500000000001, 'image_cost': 0, 'total_cost': 0.014682500000000001}",PERSONA,FW38091E
endoso_84,Se cubren los tratamientos médicos y/o quirúrgicos para corregir la,"{'endoso_id': 'endoso_84', 'endoso_master_id': '84', 'contract_no': 'FW19103O', 'subgrupo': 'GENERAL', 'type': 'standard', 'endoso_details': {'name': 'URGENCIA MÉDICA EN EL EXTRANJERO (UMEX)', 'key': '', 'title': '', 'subtitle': '', 'description': 'Se cubren los tratamientos médicos y/o quirúrgicos para corregir la', 'parameters': {'column_parameters': [{'column_parameter_name': 'Urgencias Médicas', 'column_parameter_details': [{'sub_column_parameter_name': '', 'row_parameters': [{'row_parameter_name': 'suma asegurada', 'value': '', 'unit': '', 'type': 'std'}, {'row_parameter_name': 'deducible', 'value': '', 'unit': '', 'type': 'std'}, {'row_parameter_name': 'coaseguro', 'value': '', 'unit': '', 'type': 'std'}, {'row_parameter_name': 'información adicional', 'value': '', 'type': 'std'}, {'row_parameter_name': 'gastos cubiertos', 'value': '', 'type': 'std'}, {'row_parameter_name': 'gastos no cubiertos', 'value': '', 'type': 'std'}, {'row_parameter_name': 'aplicación de deducible y/o coaseguro', 'value': '', 'type': 'std'}, {'row_parameter_name': 'condiciones generales', 'value': 'Para los demás términos y condiciones, aplicarán las Condiciones Generales vigentes del producto contratado. Este Endoso forma parte del Contrato de Seguro.', 'type': 'std'}, {'row_parameter_name': 'elegibilidad', 'value': '', 'type': 'exception'}, {'row_parameter_name': 'periodo de espera', 'value': '', 'type': 'exception'}, {'row_parameter_name': 'tope de coaseguro', 'value': '', 'type': 'exception'}, {'row_parameter_name': 'territorio de cobertura', 'value': '', 'type': 'exception'}]}]}, {'column_parameter_name': 'Accidente', 'column_parameter_details': [{'sub_column_parameter_name': '', 'row_parameters': [{'row_parameter_name': 'suma asegurada', 'value': '', 'unit': '', 'type': 'std'}, {'row_parameter_name': 'deducible', 'value': '', 'unit': '', 'type': 'std'}, {'row_parameter_name': 'coaseguro', 'value': '', 'unit': '', 'type': 'std'}, {'row_parameter_name': 'información adicional', 'value': '', 'type': 'std'}, {'row_parameter_name': 'gastos cubiertos', 'value': '', 'type': 'std'}, {'row_parameter_name': 'gastos no cubiertos', 'value': '', 'type': 'std'}, {'row_parameter_name': 'aplicación de deducible y/o coaseguro', 'value': '', 'type': 'std'}, {'row_parameter_name': 'condiciones generales', 'value': 'Para los demás términos y condiciones, aplicarán las Condiciones Generales vigentes del producto contratado. Este Endoso forma parte del Contrato de Seguro.', 'type': 'std'}, {'row_parameter_name': 'elegibilidad', 'value': '', 'type': 'exception'}, {'row_parameter_name': 'periodo de espera', 'value': '', 'type': 'exception'}, {'row_parameter_name': 'tope de coaseguro', 'value': '', 'type': 'exception'}, {'row_parameter_name': 'territorio de cobertura', 'value': '', 'type': 'exception'}]}]}]}, 'legal': ''}, 'global_information': {'effective_date': '', 'expiration_date': '', 'factor': '', 'type': ''}, 'business_rules': {'experience': '', 'product_type': '', 'min_net_premium': '', 'min_population': ''}, 'status': '', 'comment': [{'name': '', 'date': '', 'comment': ''}]}","{'token_cost': 0.0182975, 'image_cost': 0, 'total_cost': 0.0182975}",GENERAL,FW19103O
endoso_84,"La Compañía cubrirá los gastos médicos erogados durante la vigencia de ésta_póliza, por Urgencias Médicas en el Extranjero  modificando los límites de_responsabilidad  de esta cobertura, hasta los que se  indiquen en este_endoso:__Suma Asegurada: 50,000 USD_Deducible: 50 USD__Para este Endoso no es aplicable el Endoso de  Aplicación de Deducible y/o_Coaseguro.__Para los demás términos y condiciones, aplicarán las Condiciones Generales_vigentes del producto contratado.__Este Endoso forma parte del Contrato de Seguro.""","{'endoso_id': 'endoso_84', 'endoso_master_id': '84', 'contract_no': 'FW54006B', 'subgrupo': 'GRUPO 2', 'type': 'standard', 'endoso_details': {'name': 'URGENCIA MÉDICA EN EL EXTRANJERO (UMEX)', 'key': '', 'title': '', 'subtitle': '', 'description': 'La Compañía cubrirá los gastos médicos erogados durante la vigencia de ésta póliza, por Urgencias Médicas en el Extranjero modificando los límites de responsabilidad de esta cobertura, hasta los que se indiquen en este endoso: Suma Asegurada: 50,000 USD Deducible: 50 USD Para este Endoso no es aplicable el Endoso de Aplicación de Deducible y/o Coaseguro. Para los demás términos y condiciones, aplicarán las Condiciones Generales vigentes del producto contratado. Este Endoso forma parte del Contrato de Seguro.', 'parameters': {'column_parameters': [{'column_parameter_name': 'Urgencias Médicas', 'column_parameter_details': [{'sub_column_parameter_name': '', 'row_parameters': [{'row_parameter_name': 'suma asegurada', 'value': '50,000', 'unit': 'USD', 'type': 'std'}, {'row_parameter_name': 'deducible', 'value': '50', 'unit': 'USD', 'type': 'std'}, {'row_parameter_name': 'coaseguro', 'value': '', 'type': 'std'}, {'row_parameter_name': 'información adicional', 'value': '', 'type': 'std'}, {'row_parameter_name': 'gastos cubiertos', 'value': '', 'type': 'std'}, {'row_parameter_name': 'gastos no cubiertos', 'value': '', 'type': 'std'}, {'row_parameter_name': 'aplicación de deducible y/o coaseguro', 'value': 'false', 'type': 'std'}, {'row_parameter_name': 'condiciones generales', 'value': 'Para los demás términos y condiciones, aplicarán las Condiciones Generales vigentes del producto contratado. Este Endoso forma parte del Contrato de Seguro.', 'type': 'std'}, {'row_parameter_name': 'elegibilidad', 'value': '', 'type': 'exception'}, {'row_parameter_name': 'periodo de espera', 'value': '', 'type': 'exception'}, {'row_parameter_name': 'tope de coaseguro', 'value': '', 'type': 'exception'}, {'row_parameter_name': 'territorio de cobertura', 'value': '', 'type': 'exception'}]}]}, {'column_parameter_name': 'Accidente', 'column_parameter_details': [{'sub_column_parameter_name': '', 'row_parameters': [{'row_parameter_name': 'suma asegurada', 'value': '', 'unit': '', 'type': 'std'}, {'row_parameter_name': 'deducible', 'value': '', 'unit': '', 'type': 'std'}, {'row_parameter_name': 'coaseguro', 'value': '', 'type': 'std'}, {'row_parameter_name': 'información adicional', 'value': '', 'type': 'std'}, {'row_parameter_name': 'gastos cubiertos', 'value': '', 'type': 'std'}, {'row_parameter_name': 'gastos no cubiertos', 'value': '', 'type': 'std'}, {'row_parameter_name': 'aplicación de deducible y/o coaseguro', 'value': '', 'type': 'std'}, {'row_parameter_name': 'condiciones generales', 'value': 'Para los demás términos y condiciones, aplicarán las Condiciones Generales vigentes del producto contratado. Este Endoso forma parte del Contrato de Seguro.', 'type': 'std'}, {'row_parameter_name': 'elegibilidad', 'value': '', 'type': 'exception'}, {'row_parameter_name': 'periodo de espera', 'value': '', 'type': 'exception'}, {'row_parameter_name': 'tope de coaseguro', 'value': '', 'type': 'exception'}, {'row_parameter_name': 'territorio de cobertura', 'value': '', 'type': 'exception'}]}]}]}, 'legal': 'Para los demás términos y condiciones, aplicarán las Condiciones Generales vigentes del producto contratado. Este Endoso forma parte del Contrato de Seguro.'}, 'global_information': {'effective_date': '', 'expiration_date': '', 'factor': '', 'type': ''}, 'business_rules': {'experience': '', 'product_type': '', 'min_net_premium': '', 'min_population': ''}, 'status': '', 'comment': [{'name': '', 'date': '', 'comment': ''}]}","{'token_cost': 0.01947, 'image_cost': 0, 'total_cost': 0.01947}",GRUPO 2,FW54006B
endoso_142,"Se  cubren  los  tratamientos  médico-quirúrgicos por  desmenuzamiento o_fragmentación de  un  cálculo,  conocido  como  litotripsias,  bajo  las_coberturas arriba señaladas, siempre y cuando se cumpla con lo siguiente:  La_suma asegurada indicada incluye todas las sesiones de litotripsia, el equipo_especial, hospitalización si la hubiera y honorarios médicos.  El  presente_ endoso  modifica la cláusula IV Gastos Cubiertos con Periodo de Espera.  Los_demás términos y condiciones de la póliza  quedan  sin  alteración alguna.","{'endoso_id': 'endoso_142', 'endoso_master_id': '142', 'contract_no': 'FD02070U', 'subgrupo': 'ING SEG', 'type': 'standard', 'endoso_details': {'name': 'LITOTRIPSIAS', 'key': '', 'title': '', 'subtitle': '', 'description': 'Se  cubren  los  tratamientos  médico-quirúrgicos por  desmenuzamiento o fragmentación de  un  cálculo,  conocido  como  litotripsias,  bajo  las coberturas arriba señaladas, siempre y cuando se cumpla con lo siguiente:  La suma asegurada indicada incluye todas las sesiones de litotripsia, el equipo especial, hospitalización si la hubiera y honorarios médicos.  El  presente endoso  modifica la cláusula IV Gastos Cubiertos con Periodo de Espera.  Los demás términos y condiciones de la póliza  quedan  sin  alteración alguna.', 'parameters': {'column_parameters': [{'column_parameter_name': 'Pago directo', 'column_parameter_details': [{'sub_column_parameter_name': '', 'row_parameters': [{'row_parameter_name': 'suma asegurada', 'value': '', 'unit': '', 'type': 'std'}, {'row_parameter_name': 'deducible', 'value': '', 'unit': '', 'type': 'std'}, {'row_parameter_name': 'coaseguro', 'value': '', 'unit': '', 'type': 'std'}, {'row_parameter_name': 'periodo espera', 'value': '', 'unit': '', 'type': 'std'}, {'row_parameter_name': 'territorio de cobertura', 'value': '', 'unit': '', 'type': 'std'}, {'row_parameter_name': 'consulta postoperatoria', 'value': '', 'type': 'std'}, {'row_parameter_name': 'consulta preoperatoria', 'value': '', 'type': 'std'}, {'row_parameter_name': 'aplicación de deducible y/o coaseguro', 'value': '', 'type': 'std'}, {'row_parameter_name': 'condiciones generales', 'value': 'Para los demás términos y condiciones, aplicarán las Condiciones Generales vigentes del producto contratado. Este Endoso forma parte del Contrato de Seguro.', 'type': 'std'}, {'row_parameter_name': 'elegibilidad', 'value': '', 'type': 'exception'}, {'row_parameter_name': 'tope de coaseguro', 'value': '', 'type': 'exception'}, {'row_parameter_name': 'número de sesiones', 'value': '', 'type': 'exception'}]}]}, {'column_parameter_name': 'Reembolso', 'column_parameter_details': [{'sub_column_parameter_name': '', 'row_parameters': [{'row_parameter_name': 'suma asegurada', 'value': '', 'unit': '', 'type': 'std'}, {'row_parameter_name': 'deducible', 'value': '', 'unit': '', 'type': 'std'}, {'row_parameter_name': 'coaseguro', 'value': '', 'unit': '', 'type': 'std'}, {'row_parameter_name': 'periodo espera', 'value': '', 'unit': '', 'type': 'std'}, {'row_parameter_name': 'territorio de cobertura', 'value': '', 'unit': '', 'type': 'std'}, {'row_parameter_name': 'consulta postoperatoria', 'value': '', 'type': 'std'}, {'row_parameter_name': 'consulta preoperatoria', 'value': '', 'type': 'std'}, {'row_parameter_name': 'aplicación de deducible y/o coaseguro', 'value': '', 'type': 'std'}, {'row_parameter_name': 'condiciones generales', 'value': 'Para los demás términos y condiciones, aplicarán las Condiciones Generales vigentes del producto contratado. Este Endoso forma parte del Contrato de Seguro.', 'type': 'std'}, {'row_parameter_name': 'elegibilidad', 'value': '', 'type': 'exception'}, {'row_parameter_name': 'tope de coaseguro', 'value': '', 'type': 'exception'}, {'row_parameter_name': 'número de sesiones', 'value': '', 'type': 'exception'}]}]}]}, 'legal': 'Para los demás términos y condiciones, aplicarán las Condiciones Generales vigentes del producto contratado. Este Endoso forma parte del Contrato de Seguro.'}, 'global_information': {'effective_date': '', 'expiration_date': '', 'factor': '', 'type': ''}, 'business_rules': {'experience': '', 'product_type': '', 'min_net_premium': '', 'min_population': ''}, 'status': '', 'comment': [{'name': '', 'date': '', 'comment': ''}]}","{'token_cost': 0.020130000000000002, 'image_cost': 0, 'total_cost': 0.020130000000000002}",ING SEG,FD02070U
endoso_155,"La presenta poliza incluye una Base de Procedimeintos Terapeuticos de:______*** $ 29,626.32____________El Factor de Reembolso de cada Procedimiento Terapeutico incluido en las______Condiciones Generales correspondientes a esta póliza esta expresado de______manera porcentual, por lo que para cualquier efecto dicho factor debera______dividirse entre 100.__________","{'endoso_id': 'endoso_155', 'endoso_master_id': '155', 'contract_no': 'FW34188E', 'subgrupo': 'PERSONA', 'type': 'standard', 'endoso_details': {'name': 'Factor', 'key': '', 'title': '', 'subtitle': '', 'description': 'La presenta poliza incluye una Base de Procedimeintos Terapeuticos de: $ 29,626.32 El Factor de Reembolso de cada Procedimiento Terapeutico incluido en las Condiciones Generales correspondientes a esta póliza esta expresado de manera porcentual, por lo que para cualquier efecto dicho factor debera dividirse entre 100.', 'parameters': {'column_parameters': '', 'row_parameters': [{'row_parameter_name': 'Descripcion', 'editable': True, 'active': True, 'type': 'std', 'value_type': 'text', 'value': 'La presenta poliza incluye una Base de Procedimeintos Terapeuticos de: $ 29,626.32 El Factor de Reembolso de cada Procedimiento Terapeutico incluido en las Condiciones Generales correspondientes a esta póliza esta expresado de manera porcentual, por lo que para cualquier efecto dicho factor debera dividirse entre 100.'}, {'row_parameter_name': 'Factor', 'editable': True, 'active': True, 'type': 'std', 'value_type': 'digits', 'value': ''}, {'row_parameter_name': 'Condiciones Generales', 'editable': True, 'active': True, 'type': 'std', 'value_type': 'string', 'value': 'Para los demás términos y condiciones, aplicarán las Condiciones Generales vigentes del producto contratado. Este Endoso forma parte del Contrato de Seguro'}]}, 'legal': ''}, 'global_information': {'effective_date': '', 'expiration_date': '', 'factor': '', 'type': ''}, 'business_rules': {'experience': '', 'product_type': '', 'min_net_premium': '', 'min_population': ''}, 'status': '', 'comment': [{'name': '', 'date': '', 'comment': ''}]}","{'token_cost': 0.009775, 'image_cost': 0, 'total_cost': 0.009775}",PERSONA,FW34188E
