endoso_code,text,extracted_parameters,cost_metrics,nom_subg,contract_no
endoso_142,"Como litotripsia se entiende el desmenuzamiento o fragmentación de un_ cálculo por medio del litotriptor.__Este endoso ampara el pago de honorarios médicos, gastos de_ hospitalización, medicamentos, renta del litotriptor endoscópico o_ extracorpóreo y demás gastos cubiertos generados dentro del hospital.__El monto máximo a indemnizar para este beneficio y/o cobertura será:  _De acuerdo a las condiciones generales (26 veces el S.M.G.M)__Monto Máximo a Indemnizar 26 SMGM  __Pago Directo (Médico y Hospital en convenio de acuerdo al nivel_ hospitalario contratado)__Deducible            7,500.00   M.N. ___Coaseguro                0.00   % __Reembolso:__Deducible           10,000.00   M.N. __Coaseguro               10.00   % __En caso de modificación del deducible y/o coaseguro originalmente pactado,_ invariablemente se aplicarán los deducibles y coaseguros antes_ mencionados en dicha cobertura/condición.__El Asegurado deberá cumplir con un periodo de espera, a partir de su_ inscripción en la póliza: _Se elimina periodo de espera__Se cubre únicamente en territorio nacional.__Los demás términos y condiciones, deben operar conforme se señala en las_ Condiciones Generales del producto contratado.__Este endoso forma parte integral y complementa las Condiciones Generales_ del Seguro_","{'endoso_id': 'endoso_142', 'endoso_master_id': '142', 'contract_no': 'FW35175F', 'subgrupo': 'GENERAL', 'type': 'standard', 'endoso_details': {'name': 'LITOTRIPSIAS', 'key': '', 'title': '', 'subtitle': '', 'description': 'Como litotripsia se entiende el desmenuzamiento o fragmentación de un cálculo por medio del litotriptor. Este endoso ampara el pago de honorarios médicos, gastos de hospitalización, medicamentos, renta del litotriptor endoscópico o extracorpóreo y demás gastos cubiertos generados dentro del hospital. El monto máximo a indemnizar para este beneficio y/o cobertura será: De acuerdo a las condiciones generales (26 veces el S.M.G.M) Monto Máximo a Indemnizar 26 SMGM Pago Directo (Médico y Hospital en convenio de acuerdo al nivel hospitalario contratado) Deducible 7,500.00 M.N. Coaseguro 0.00 % Reembolso: Deducible 10,000.00 M.N. Coaseguro 10.00 % En caso de modificación del deducible y/o coaseguro originalmente pactado, invariablemente se aplicarán los deducibles y coaseguros antes mencionados en dicha cobertura/condición. El Asegurado deberá cumplir con un periodo de espera, a partir de su inscripción en la póliza: Se elimina periodo de espera Se cubre únicamente en territorio nacional. Los demás términos y condiciones, deben operar conforme se señala en las Condiciones Generales del producto contratado. Este endoso forma parte integral y complementa las Condiciones Generales del Seguro', 'parameters': {'column_parameters': [{'column_parameter_name': 'Pago directo', 'column_parameter_details': [{'sub_column_parameter_name': '', 'row_parameters': [{'row_parameter_name': 'suma asegurada', 'value': '', 'unit': '', 'type': 'std'}, {'row_parameter_name': 'deducible', 'value': '7500.00', 'unit': 'M.N.', 'type': 'std'}, {'row_parameter_name': 'coaseguro', 'value': '0.00', 'unit': '%', 'type': 'std'}, {'row_parameter_name': 'periodo espera', 'value': 'Se elimina periodo de espera', 'unit': '', 'type': 'std'}, {'row_parameter_name': 'territorio de cobertura', 'value': 'nacional', 'unit': '', 'type': 'std'}, {'row_parameter_name': 'consulta postoperatoria', 'value': '', 'unit': '', 'type': 'std'}, {'row_parameter_name': 'consulta preoperatoria', 'value': '', 'unit': '', 'type': 'std'}, {'row_parameter_name': 'aplicación de deducible y/o coaseguro', 'value': 'true', 'unit': '', 'type': 'std'}, {'row_parameter_name': 'condiciones generales', 'value': 'Los demás términos y condiciones, deben operar conforme se señala en las Condiciones Generales del producto contratado. Este endoso forma parte integral y complementa las Condiciones Generales del Seguro.', 'unit': '', 'type': 'std'}, {'row_parameter_name': 'elegibilidad', 'value': '', 'unit': '', 'type': 'exception'}, {'row_parameter_name': 'tope de coaseguro', 'value': '', 'unit': '', 'type': 'exception'}, {'row_parameter_name': 'número de sesiones', 'value': '', 'unit': '', 'type': 'exception'}]}]}, {'column_parameter_name': 'Reembolso', 'column_parameter_details': [{'sub_column_parameter_name': '', 'row_parameters': [{'row_parameter_name': 'suma asegurada', 'value': '', 'unit': '', 'type': 'std'}, {'row_parameter_name': 'deducible', 'value': '10000.00', 'unit': 'M.N.', 'type': 'std'}, {'row_parameter_name': 'coaseguro', 'value': '10.00', 'unit': '%', 'type': 'std'}, {'row_parameter_name': 'periodo espera', 'value': 'Se elimina periodo de espera', 'unit': '', 'type': 'std'}, {'row_parameter_name': 'territorio de cobertura', 'value': 'nacional', 'unit': '', 'type': 'std'}, {'row_parameter_name': 'consulta postoperatoria', 'value': '', 'unit': '', 'type': 'std'}, {'row_parameter_name': 'consulta preoperatoria', 'value': '', 'unit': '', 'type': 'std'}, {'row_parameter_name': 'aplicación de deducible y/o coaseguro', 'value': 'true', 'unit': '', 'type': 'std'}, {'row_parameter_name': 'condiciones generales', 'value': 'Los demás términos y condiciones, deben operar conforme se señala en las Condiciones Generales del producto contratado. Este endoso forma parte integral y complementa las Condiciones Generales del Seguro.', 'unit': '', 'type': 'std'}, {'row_parameter_name': 'elegibilidad', 'value': '', 'unit': '', 'type': 'exception'}, {'row_parameter_name': 'tope de coaseguro', 'value': '', 'unit': '', 'type': 'exception'}, {'row_parameter_name': 'número de sesiones', 'value': '', 'unit': '', 'type': 'exception'}]}]}]}, 'legal': 'Los demás términos y condiciones, deben operar conforme se señala en las Condiciones Generales del producto contratado. Este endoso forma parte integral y complementa las Condiciones Generales del Seguro.'}, 'global_information': {'effective_date': '', 'expiration_date': '', 'factor': '', 'type': ''}, 'business_rules': {'experience': '', 'product_type': '', 'min_net_premium': '', 'min_population': ''}, 'status': '', 'comment': [{'name': '', 'date': '', 'comment': ''}]}","{'token_cost': 0.023540000000000002, 'image_cost': 0, 'total_cost': 0.023540000000000002}",GENERAL,FW35175F
endoso_142,"Como litotripsia se entiende el desmenuzamiento o fragmentación de un_ cálculo por medio del litotriptor.__Este endoso ampara el pago de honorarios médicos, gastos de_ hospitalización, medicamentos, renta del litotriptor endoscópico o_ extracorpóreo y demás gastos cubiertos generados dentro del hospital.__El monto máximo a indemnizar para este beneficio y/o cobertura será:_Hasta el G.U.A.__Monto Máximo a Indemnizar GUA__Pago Directo (Médico y Hospital en convenio de acuerdo al nivel_ hospitalario contratado)__Deducible 2500  M.N.__Coaseguro 0  %__Reembolso:__Deducible 5000  M.N.__Coaseguro 10  %__En caso de modificación del deducible y/o coaseguro originalmente pactado,_ invariablemente se aplicarán los deducibles y coaseguros antes_ mencionados en dicha cobertura/condición.__El Asegurado deberá cumplir con un periodo de espera, a partir de su_ inscripción en la póliza:_De acuerdo a condiciones (1 año)__Se cubre únicamente en territorio nacional.__Los demás términos y condiciones, deben operar conforme se señala en las_ Condiciones Generales del producto contratado.__Este endoso forma parte integral y complementa las Condiciones Generales_ del Seguro","{'endoso_id': 'endoso_142', 'endoso_master_id': '142', 'contract_no': 'FW52495A', 'subgrupo': '01 Ofim', 'type': 'standard', 'endoso_details': {'name': 'LITOTRIPSIAS', 'key': '', 'title': '', 'subtitle': '', 'description': 'Como litotripsia se entiende el desmenuzamiento o fragmentación de un cálculo por medio del litotriptor. Este endoso ampara el pago de honorarios médicos, gastos de hospitalización, medicamentos, renta del litotriptor endoscópico o extracorpóreo y demás gastos cubiertos generados dentro del hospital. El monto máximo a indemnizar para este beneficio y/o cobertura será: Hasta el G.U.A. Monto Máximo a Indemnizar GUA Pago Directo (Médico y Hospital en convenio de acuerdo al nivel hospitalario contratado) Deducible 2500 M.N. Coaseguro 0 % Reembolso: Deducible 5000 M.N. Coaseguro 10 % En caso de modificación del deducible y/o coaseguro originalmente pactado, invariablemente se aplicarán los deducibles y coaseguros antes mencionados en dicha cobertura/condición. El Asegurado deberá cumplir con un periodo de espera, a partir de su inscripción en la póliza: De acuerdo a condiciones (1 año) Se cubre únicamente en territorio nacional. Los demás términos y condiciones, deben operar conforme se señala en las Condiciones Generales del producto contratado. Este endoso forma parte integral y complementa las Condiciones Generales del Seguro', 'parameters': {'column_parameters': [{'column_parameter_name': 'Pago directo', 'column_parameter_details': [{'sub_column_parameter_name': '', 'row_parameters': [{'row_parameter_name': 'suma asegurada', 'value': '', 'unit': '', 'type': 'std'}, {'row_parameter_name': 'deducible', 'value': '2500', 'unit': 'M.N.', 'type': 'std'}, {'row_parameter_name': 'coaseguro', 'value': '0', 'unit': '%', 'type': 'std'}, {'row_parameter_name': 'periodo espera', 'value': '1', 'unit': 'año', 'type': 'std'}, {'row_parameter_name': 'territorio de cobertura', 'value': 'nacional', 'type': 'std'}, {'row_parameter_name': 'consulta postoperatoria', 'value': '', 'type': 'std'}, {'row_parameter_name': 'consulta preoperatoria', 'value': '', 'type': 'std'}, {'row_parameter_name': 'aplicación de deducible y/o coaseguro', 'value': 'true', 'type': 'std'}, {'row_parameter_name': 'condiciones generales', 'value': 'Los demás términos y condiciones, deben operar conforme se señala en las Condiciones Generales del producto contratado. Este endoso forma parte integral y complementa las Condiciones Generales del Seguro.', 'type': 'std'}, {'row_parameter_name': 'elegibilidad', 'value': '', 'type': 'exception'}, {'row_parameter_name': 'tope de coaseguro', 'value': '', 'type': 'exception'}, {'row_parameter_name': 'número de sesiones', 'value': '', 'type': 'exception'}]}]}, {'column_parameter_name': 'Reembolso', 'column_parameter_details': [{'sub_column_parameter_name': '', 'row_parameters': [{'row_parameter_name': 'suma asegurada', 'value': '', 'unit': '', 'type': 'std'}, {'row_parameter_name': 'deducible', 'value': '5000', 'unit': 'M.N.', 'type': 'std'}, {'row_parameter_name': 'coaseguro', 'value': '10', 'unit': '%', 'type': 'std'}, {'row_parameter_name': 'periodo espera', 'value': '1', 'unit': 'año', 'type': 'std'}, {'row_parameter_name': 'territorio de cobertura', 'value': 'nacional', 'type': 'std'}, {'row_parameter_name': 'consulta postoperatoria', 'value': '', 'type': 'std'}, {'row_parameter_name': 'consulta preoperatoria', 'value': '', 'type': 'std'}, {'row_parameter_name': 'aplicación de deducible y/o coaseguro', 'value': 'true', 'type': 'std'}, {'row_parameter_name': 'condiciones generales', 'value': 'Los demás términos y condiciones, deben operar conforme se señala en las Condiciones Generales del producto contratado. Este endoso forma parte integral y complementa las Condiciones Generales del Seguro.', 'type': 'std'}, {'row_parameter_name': 'elegibilidad', 'value': '', 'type': 'exception'}, {'row_parameter_name': 'tope de coaseguro', 'value': '', 'type': 'exception'}, {'row_parameter_name': 'número de sesiones', 'value': '', 'type': 'exception'}]}]}]}, 'legal': 'Los demás términos y condiciones, deben operar conforme se señala en las Condiciones Generales del producto contratado. Este endoso forma parte integral y complementa las Condiciones Generales del Seguro.'}, 'global_information': {'effective_date': '', 'expiration_date': '', 'factor': '', 'type': ''}, 'business_rules': {'experience': '', 'product_type': '', 'min_net_premium': '', 'min_population': ''}, 'status': '', 'comment': [{'name': '', 'date': '', 'comment': ''}]}","{'token_cost': 0.022415, 'image_cost': 0, 'total_cost': 0.022415}",01 Ofim,FW52495A
endoso_38,"Se ampara el tratamiento médico quirúrgico de hallux valgus o juanetes,_ siempre y cuando no sea de carácter estético.__El monto a indemnizar para este beneficio y/o cobertura será:_Hasta el G.U.A.__Monto Máximo a Indemnizar GUA__Con un periodo de espera de:_1 Año__Aplicación de deducible y coaseguro:__Pago Directo (Médico y Hospital en convenio de acuerdo al nivel_ hospitalario contratado)__Deducible 2500  M.N.__Coaseguro 0  %__Reembolso:__Deducible 5000  M.N.__Coaseguro 10  %__En caso de modificación del deducible y/o coaseguro originalmente pactado,_ invariablemente se aplicarán los deducibles y coaseguros antes_ mencionados en dicha cobertura/condición.__El presente endoso modifica el capítulo de Gastos Médicos Mayores No_ Cubiertos en su inciso de Tratamiento Médico o Quirúrgico de Hallux_ Valgus o Juanetes.__Se cubre únicamente en territorio nacional.__Este endoso forma parte integral y complementa las Condiciones Generales_ del Seguro","{'endoso_id': 'endoso_38', 'endoso_master_id': '38', 'contract_no': 'FW52495A', 'subgrupo': '01 Ofim', 'type': 'standard', 'endoso_details': {'name': 'HALLUX VALGUS', 'key': '', 'title': '', 'subtitle': '', 'description': 'Se ampara el tratamiento médico quirúrgico de hallux valgus o juanetes, siempre y cuando no sea de carácter estético. El monto a indemnizar para este beneficio y/o cobertura será: Hasta el G.U.A. Monto Máximo a Indemnizar GUA Con un periodo de espera de: 1 Año Aplicación de deducible y coaseguro: Pago Directo (Médico y Hospital en convenio de acuerdo al nivel hospitalario contratado) Deducible 2500 M.N. Coaseguro 0 % Reembolso: Deducible 5000 M.N. Coaseguro 10 % En caso de modificación del deducible y/o coaseguro originalmente pactado, invariablemente se aplicarán los deducibles y coaseguros antes mencionados en dicha cobertura/condición. El presente endoso modifica el capítulo de Gastos Médicos Mayores No Cubiertos en su inciso de Tratamiento Médico o Quirúrgico de Hallux Valgus o Juanetes. Se cubre únicamente en territorio nacional. Este endoso forma parte integral y complementa las Condiciones Generales del Seguro', 'parameters': {'column_parameters': [{'column_parameter_name': 'Pago directo', 'column_parameter_details': [{'sub_column_parameter_name': '', 'row_parameters': [{'row_parameter_name': 'suma asegurada', 'value': '', 'unit': '', 'type': 'std'}, {'row_parameter_name': 'deducible', 'value': '2500', 'unit': 'M.N.', 'type': 'std'}, {'row_parameter_name': 'coaseguro', 'value': '0', 'unit': '%', 'type': 'std'}, {'row_parameter_name': 'tope de coaseguro', 'value': '', 'unit': '', 'type': 'std'}, {'row_parameter_name': 'territorio de cobertura', 'value': 'nacional', 'type': 'std'}, {'row_parameter_name': 'periodo espera', 'value': '1', 'unit': 'Año', 'type': 'std'}, {'row_parameter_name': 'gastos cubiertos', 'value': '', 'type': 'std'}, {'row_parameter_name': 'gastos no cubiertos', 'value': '', 'type': 'std'}, {'row_parameter_name': 'aplicación de deducible y/o coaseguro', 'value': 'true', 'type': 'std'}, {'row_parameter_name': 'condiciones generales', 'value': 'Este endoso forma parte integral y complementa las Condiciones Generales del Seguro', 'type': 'std'}, {'row_parameter_name': 'consulta postoperatoria', 'value': '', 'type': 'exception'}, {'row_parameter_name': 'consulta preoperatoria', 'value': '', 'type': 'exception'}]}]}, {'column_parameter_name': 'Reembolso', 'column_parameter_details': [{'sub_column_parameter_name': '', 'row_parameters': [{'row_parameter_name': 'suma asegurada', 'value': '', 'unit': '', 'type': 'std'}, {'row_parameter_name': 'deducible', 'value': '5000', 'unit': 'M.N.', 'type': 'std'}, {'row_parameter_name': 'coaseguro', 'value': '10', 'unit': '%', 'type': 'std'}, {'row_parameter_name': 'tope de coaseguro', 'value': '', 'unit': '', 'type': 'std'}, {'row_parameter_name': 'territorio de cobertura', 'value': 'nacional', 'type': 'std'}, {'row_parameter_name': 'periodo espera', 'value': '1', 'unit': 'Año', 'type': 'std'}, {'row_parameter_name': 'gastos cubiertos', 'value': '', 'type': 'std'}, {'row_parameter_name': 'gastos no cubiertos', 'value': '', 'type': 'std'}, {'row_parameter_name': 'aplicación de deducible y/o coaseguro', 'value': 'true', 'type': 'std'}, {'row_parameter_name': 'condiciones generales', 'value': 'Este endoso forma parte integral y complementa las Condiciones Generales del Seguro', 'type': 'std'}, {'row_parameter_name': 'consulta postoperatoria', 'value': '', 'type': 'exception'}, {'row_parameter_name': 'consulta preoperatoria', 'value': '', 'type': 'exception'}]}]}]}, 'legal': 'Este endoso forma parte integral y complementa las Condiciones Generales del Seguro'}, 'global_information': {'effective_date': '', 'expiration_date': '', 'factor': '', 'type': ''}, 'business_rules': {'experience': '', 'product_type': '', 'min_net_premium': '', 'min_population': ''}, 'status': '', 'comment': [{'name': '', 'date': '', 'comment': ''}]}","{'token_cost': 0.021427500000000002, 'image_cost': 0, 'total_cost': 0.021427500000000002}",01 Ofim,FW52495A
endoso_38,"Se ampara el tratamiento médico quirúrgico de hallux valgus o juanetes,_ siempre y cuando no sea de carácter estético.__El monto a indemnizar para este beneficio y/o cobertura será:_Hasta el G.U.A.__Monto Máximo a Indemnizar GUA__Con un periodo de espera de:_1 Año__Aplicación de deducible y coaseguro:__Pago Directo (Médico y Hospital en convenio de acuerdo al nivel_ hospitalario contratado)__Deducible 2500  M.N.__Coaseguro 0  %__Reembolso:__Deducible 5000  M.N.__Coaseguro 0  %__En caso de modificación del deducible y/o coaseguro originalmente pactado,_ invariablemente se aplicarán los deducibles y coaseguros antes_ mencionados en dicha cobertura/condición.__El presente endoso modifica el capítulo de Gastos Médicos Mayores No_ Cubiertos en su inciso de Tratamiento Médico o Quirúrgico de Hallux_ Valgus o Juanetes.__Se cubre únicamente en territorio nacional.__Este endoso forma parte integral y complementa las Condiciones Generales_ del Seguro","{'endoso_id': 'endoso_38', 'endoso_master_id': '38', 'contract_no': 'FW52495A', 'subgrupo': '02 Ofim', 'type': 'standard', 'endoso_details': {'name': 'HALLUX VALGUS', 'key': '', 'title': '', 'subtitle': '', 'description': 'Se ampara el tratamiento médico quirúrgico de hallux valgus o juanetes, siempre y cuando no sea de carácter estético. El monto a indemnizar para este beneficio y/o cobertura será: Hasta el G.U.A. Monto Máximo a Indemnizar GUA Con un periodo de espera de: 1 Año Aplicación de deducible y coaseguro: Pago Directo (Médico y Hospital en convenio de acuerdo al nivel hospitalario contratado) Deducible 2500 M.N. Coaseguro 0 % Reembolso: Deducible 5000 M.N. Coaseguro 0 % En caso de modificación del deducible y/o coaseguro originalmente pactado, invariablemente se aplicarán los deducibles y coaseguros antes mencionados en dicha cobertura/condición. El presente endoso modifica el capítulo de Gastos Médicos Mayores No Cubiertos en su inciso de Tratamiento Médico o Quirúrgico de Hallux Valgus o Juanetes. Se cubre únicamente en territorio nacional. Este endoso forma parte integral y complementa las Condiciones Generales del Seguro', 'parameters': {'column_parameters': [{'column_parameter_name': 'Pago directo', 'column_parameter_details': [{'sub_column_parameter_name': '', 'row_parameters': [{'row_parameter_name': 'suma asegurada', 'value': '', 'unit': '', 'type': 'std'}, {'row_parameter_name': 'deducible', 'value': '2500', 'unit': 'M.N.', 'type': 'std'}, {'row_parameter_name': 'coaseguro', 'value': '0', 'unit': '%', 'type': 'std'}, {'row_parameter_name': 'tope de coaseguro', 'value': '', 'unit': '', 'type': 'std'}, {'row_parameter_name': 'territorio de cobertura', 'value': 'nacional', 'type': 'std'}, {'row_parameter_name': 'periodo espera', 'value': '1', 'unit': 'Año', 'type': 'std'}, {'row_parameter_name': 'gastos cubiertos', 'value': '', 'type': 'std'}, {'row_parameter_name': 'gastos no cubiertos', 'value': 'El presente endoso modifica el capítulo de Gastos Médicos Mayores No Cubiertos en su inciso de Tratamiento Médico o Quirúrgico de Hallux Valgus o Juanetes.', 'type': 'std'}, {'row_parameter_name': 'aplicación de deducible y/o coaseguro', 'value': 'true', 'type': 'std'}, {'row_parameter_name': 'condiciones generales', 'value': 'Este endoso forma parte integral y complementa las Condiciones Generales del Seguro', 'type': 'std'}, {'row_parameter_name': 'consulta postoperatoria', 'value': '', 'type': 'exception'}, {'row_parameter_name': 'consulta preoperatoria', 'value': '', 'type': 'exception'}]}]}, {'column_parameter_name': 'Reembolso', 'column_parameter_details': [{'sub_column_parameter_name': '', 'row_parameters': [{'row_parameter_name': 'suma asegurada', 'value': '', 'unit': '', 'type': 'std'}, {'row_parameter_name': 'deducible', 'value': '5000', 'unit': 'M.N.', 'type': 'std'}, {'row_parameter_name': 'coaseguro', 'value': '0', 'unit': '%', 'type': 'std'}, {'row_parameter_name': 'tope de coaseguro', 'value': '', 'unit': '', 'type': 'std'}, {'row_parameter_name': 'territorio de cobertura', 'value': 'nacional', 'type': 'std'}, {'row_parameter_name': 'periodo espera', 'value': '1', 'unit': 'Año', 'type': 'std'}, {'row_parameter_name': 'gastos cubiertos', 'value': '', 'type': 'std'}, {'row_parameter_name': 'gastos no cubiertos', 'value': 'El presente endoso modifica el capítulo de Gastos Médicos Mayores No Cubiertos en su inciso de Tratamiento Médico o Quirúrgico de Hallux Valgus o Juanetes.', 'type': 'std'}, {'row_parameter_name': 'aplicación de deducible y/o coaseguro', 'value': 'true', 'type': 'std'}, {'row_parameter_name': 'condiciones generales', 'value': 'Este endoso forma parte integral y complementa las Condiciones Generales del Seguro', 'type': 'std'}, {'row_parameter_name': 'consulta postoperatoria', 'value': '', 'type': 'exception'}, {'row_parameter_name': 'consulta preoperatoria', 'value': '', 'type': 'exception'}]}]}]}, 'legal': 'Este endoso forma parte integral y complementa las Condiciones Generales del Seguro'}, 'global_information': {'effective_date': '', 'expiration_date': '', 'factor': '', 'type': ''}, 'business_rules': {'experience': '', 'product_type': '', 'min_net_premium': '', 'min_population': ''}, 'status': '', 'comment': [{'name': '', 'date': '', 'comment': ''}]}","{'token_cost': 0.022187500000000002, 'image_cost': 0, 'total_cost': 0.022187500000000002}",02 Ofim,FW52495A
