endoso_code,text,extracted_parameters,cost_metrics,nom_subg,contract_no
endoso_84,"UMEX-URGENCIA MÉDICA EN EL EXTRANJERO__La Compañía cubrirá los gastos médicos erogados durante la vigencia de ésta_póliza, por Urgencias Médicas en el Extranjero  modificando los límites de_responsabilidad  de esta cobertura, hasta los que se  indiquen en este_endoso:_ _Suma Asegurada: 100,000 USD_Deducible:   100  USD_Coaseguro: 0%__Para este Endoso no es aplicable la Cláusula 27. Pago de Indemnizaciones de_Siniestros, apartado Modificación de Participación de Deducible y Coaseguro_de las Condiciones Generales del producto. __Para los demás términos y condiciones, aplicarán las Condiciones Generales_vigentes del producto contratado._Este Endoso forma parte del Contrato de Seguro.","{'endoso_id': 'endoso_84', 'endoso_master_id': '84', 'contract_no': 'FW87874A', 'subgrupo': 'GENERAL', 'type': 'standard', 'endoso_details': {'name': 'URGENCIA MÉDICA EN EL EXTRANJERO (UMEX)', 'key': 'UMEX-URGENCIA MÉDICA EN EL EXTRANJERO', 'title': '', 'subtitle': '', 'description': 'La Compañía cubrirá los gastos médicos erogados durante la vigencia de ésta póliza, por Urgencias Médicas en el Extranjero modificando los límites de responsabilidad de esta cobertura, hasta los que se indiquen en este endoso: Suma Asegurada: 100,000 USD Deducible: 100 USD Coaseguro: 0% Para este Endoso no es aplicable la Cláusula 27. Pago de Indemnizaciones de Siniestros, apartado Modificación de Participación de Deducible y Coaseguro de las Condiciones Generales del producto. Para los demás términos y condiciones, aplicarán las Condiciones Generales vigentes del producto contratado. Este Endoso forma parte del Contrato de Seguro.', 'parameters': {'column_parameters': [{'column_parameter_name': 'Urgencias Médicas', 'column_parameter_details': [{'sub_column_parameter_name': '', 'row_parameters': [{'row_parameter_name': 'suma asegurada', 'value': '100,000', 'unit': 'USD', 'type': 'std'}, {'row_parameter_name': 'deducible', 'value': '100', 'unit': 'USD', 'type': 'std'}, {'row_parameter_name': 'coaseguro', 'value': '0', 'unit': '%', 'type': 'std'}, {'row_parameter_name': 'información adicional', 'value': '', 'type': 'std'}, {'row_parameter_name': 'gastos cubiertos', 'value': '', 'type': 'std'}, {'row_parameter_name': 'gastos no cubiertos', 'value': '', 'type': 'std'}, {'row_parameter_name': 'aplicación de deducible y/o coaseguro', 'value': 'false', 'type': 'std'}, {'row_parameter_name': 'condiciones generales', 'value': 'Para los demás términos y condiciones, aplicarán las Condiciones Generales vigentes del producto contratado. Este Endoso forma parte del Contrato de Seguro.', 'type': 'std'}, {'row_parameter_name': 'elegibilidad', 'value': '', 'type': 'exception'}, {'row_parameter_name': 'periodo de espera', 'value': '', 'type': 'exception'}, {'row_parameter_name': 'tope de coaseguro', 'value': '', 'type': 'exception'}, {'row_parameter_name': 'territorio de cobertura', 'value': '', 'type': 'exception'}]}]}, {'column_parameter_name': 'Accidente', 'column_parameter_details': [{'sub_column_parameter_name': '', 'row_parameters': [{'row_parameter_name': 'suma asegurada', 'value': '', 'type': 'std'}, {'row_parameter_name': 'deducible', 'value': '', 'type': 'std'}, {'row_parameter_name': 'coaseguro', 'value': '', 'type': 'std'}, {'row_parameter_name': 'información adicional', 'value': '', 'type': 'std'}, {'row_parameter_name': 'gastos cubiertos', 'value': '', 'type': 'std'}, {'row_parameter_name': 'gastos no cubiertos', 'value': '', 'type': 'std'}, {'row_parameter_name': 'aplicación de deducible y/o coaseguro', 'value': '', 'type': 'std'}, {'row_parameter_name': 'condiciones generales', 'value': 'Para los demás términos y condiciones, aplicarán las Condiciones Generales vigentes del producto contratado. Este Endoso forma parte del Contrato de Seguro.', 'type': 'std'}, {'row_parameter_name': 'elegibilidad', 'value': '', 'type': 'exception'}, {'row_parameter_name': 'periodo de espera', 'value': '', 'type': 'exception'}, {'row_parameter_name': 'tope de coaseguro', 'value': '', 'type': 'exception'}, {'row_parameter_name': 'territorio de cobertura', 'value': '', 'type': 'exception'}]}]}]}, 'legal': 'Para los demás términos y condiciones, aplicarán las Condiciones Generales vigentes del producto contratado. Este Endoso forma parte del Contrato de Seguro.'}, 'global_information': {'effective_date': '', 'expiration_date': '', 'factor': '', 'type': ''}, 'business_rules': {'experience': '', 'product_type': '', 'min_net_premium': '', 'min_population': ''}, 'status': '', 'comment': [{'name': '', 'date': '', 'comment': ''}]}","{'token_cost': 0.0200075, 'image_cost': 0, 'total_cost': 0.0200075}",GENERAL,FW87874A
endoso_84,"Es la aparición repentina de una alteración de la salud del Asegurado, la_cual se manifiesta a través de síntomas agudos de tal severidad, que ponen_en peligro la vida del enfermo o accidentado, su integridad corporal o la_viabilidad de alguno de sus órganos.__Por medio de este documento se hace constar que:_Se cubren los gastos originados en caso de sufrir alguna enfermedad o_accidente que pueda ser considerada como urgencia médica en cualquier_lugar del mundo, para la cual no se haya presentado atención médica previa_al acontecimiento en territorio nacional.__Si, a la solicitud del seguro, El Contratante requiere incluir algún(os)_padecimiento(s) a la póliza que esté especificado como exclusión en las_Condiciones Generales del Seguro, éste(os) se deberá(n) incluir mediante_endoso especial. Dicho(s) padecimiento(s) podrá(n) cubrirse en territorio_extranjero con las limitaciones y condiciones de la cobertura de urgencia_médica en el extranjero.__Esta cobertura aplica de acuerdo con los siguientes límites y condiciones:_Pago de Reclamaciones_Sistema de Pago por Reembolso:_Funciona para aquellos gastos cubiertos por la póliza en atención médica de_urgencia que:_-El servicio médico se hubiere proporcionado en hospitales no afiliados._- Por la situación del internamiento (falta de documentos, duda en cuanto_a la vigencia de la póliza, coberturas, alta de asegurados, pagos, etc.)_no se hubiera dado autorización de pago directo.__Sistema de Pago Directo:_A través de este sistema La Compañía pagará, si así lo autoriza,_directamente a los médicos y hospitales que acepten el pago directo sin_que el asegurado tenga que realizar desembolso por los gastos erogados,_quedando únicamente a su cargo los gastos no cubiertos.__En caso de que el asegurado optara por atenderse en un hospital y con_médicos afiliados y que el internamiento sea mayor a 24 hrs., podrá hacer_uso del sistema de pago directo en el que, previa verificación de La_Compañía respecto a la procedencia del caso, vigencia de póliza, endosos_especiales, alta de asegurados, pagos, etc., si procede el internamiento,_La Compañía efectuará el pago de los gastos cubiertos por la póliza en_forma directa al hospital y médicos afiliados, eliminando en estos casos_la cantidad por concepto de deducible.__Para operar dicho sistema se entregará al asegurado una tarjeta de_identificación en la que se consignan los teléfonos de servicios en los_que se proporcionará los nombres de los hospitales y médicos afiliados que_lo puedan atender. Este sistema se otorgará sin cargo adicional de prima.__Gastos Cubiertos_1.- Cuarto semi-privado y alimentos del paciente._2.- Médicos y/o cirujanos. Honorarios por intervención quirúrgica, así como_visitas intrahospitalarias._3.- Anestesista. Honorarios profesionales._4.- Suministros en el hospital. Medicamentos, material médico, equipos_anestésicos y sala de operaciones._5.- Servicio de diagnóstico. Exámenes de laboratorio y gabinete,_radiografías, etc._6.- Servicio de ambulancia terrestre. En la localidad hacia o desde el_hospital, siempre y cuando médicamente sea necesario._7.- Aparatos ortopédicos y prótesis, necesarios para el tratamiento médico a_excepción de reemplazos._8.- Para UME Los gastos médicos del recién nacido quedarán cubiertos a_partir del primer día de nacido de acuerdo a las condiciones generales_de la póliza y/o endosos especiales.__Esta cobertura no ampara:_A. Las exclusiones y limitaciones de los gastos que se encuentran_estipulados como gastos no cubiertos de las Condiciones Generales del_Seguro salvo lo especificado en los endosos adicionales que forman parte_integral de la póliza y en apego a la definición de urgencia médica._B. Tratamientos que no sean catalogados como de urgencia, de común acuerdo_por el médico tratante y La Compañía._C. No quedarán cubiertos los accidentes o enfermedades que se hayan_originado en la República Mexicana, así como sus consecuencias o_complicaciones, sean o no motivo de la estancia o el viaje._D. No q","{'endoso_id': 'endoso_84', 'endoso_master_id': '84', 'contract_no': 'FW56349A', 'subgrupo': 'DIRECTORES', 'type': 'standard', 'endoso_details': {'name': 'URGENCIA MÉDICA EN EL EXTRANJERO (UMEX)', 'key': '', 'title': '', 'subtitle': '', 'description': 'Es la aparición repentina de una alteración de la salud del Asegurado, la cual se manifiesta a través de síntomas agudos de tal severidad, que ponen en peligro la vida del enfermo o accidentado, su integridad corporal o la viabilidad de alguno de sus órganos. Por medio de este documento se hace constar que: Se cubren los gastos originados en caso de sufrir alguna enfermedad o accidente que pueda ser considerada como urgencia médica en cualquier lugar del mundo, para la cual no se haya presentado atención médica previa al acontecimiento en territorio nacional. Si, a la solicitud del seguro, El Contratante requiere incluir algún(os) padecimiento(s) a la póliza que esté especificado como exclusión en las Condiciones Generales del Seguro, éste(os) se deberá(n) incluir mediante endoso especial. Dicho(s) padecimiento(s) podrá(n) cubrirse en territorio extranjero con las limitaciones y condiciones de la cobertura de urgencia médica en el extranjero. Esta cobertura aplica de acuerdo con los siguientes límites y condiciones: Pago de Reclamaciones Sistema de Pago por Reembolso: Funciona para aquellos gastos cubiertos por la póliza en atención médica de urgencia que: -El servicio médico se hubiere proporcionado en hospitales no afiliados. - Por la situación del internamiento (falta de documentos, duda en cuanto a la vigencia de la póliza, coberturas, alta de asegurados, pagos, etc.) no se hubiera dado autorización de pago directo. Sistema de Pago Directo: A través de este sistema La Compañía pagará, si así lo autoriza, directamente a los médicos y hospitales que acepten el pago directo sin que el asegurado tenga que realizar desembolso por los gastos erogados, quedando únicamente a su cargo los gastos no cubiertos. En caso de que el asegurado optara por atenderse en un hospital y con médicos afiliados y que el internamiento sea mayor a 24 hrs., podrá hacer uso del sistema de pago directo en el que, previa verificación de La Compañía respecto a la procedencia del caso, vigencia de póliza, endosos especiales, alta de asegurados, pagos, etc., si procede el internamiento, La Compañía efectuará el pago de los gastos cubiertos por la póliza en forma directa al hospital y médicos afiliados, eliminando en estos casos la cantidad por concepto de deducible. Para operar dicho sistema se entregará al asegurado una tarjeta de identificación en la que se consignan los teléfonos de servicios en los que se proporcionará los nombres de los hospitales y médicos afiliados que lo puedan atender. Este sistema se otorgará sin cargo adicional de prima. Gastos Cubiertos 1.- Cuarto semi-privado y alimentos del paciente. 2.- Médicos y/o cirujanos. Honorarios por intervención quirúrgica, así como visitas intrahospitalarias. 3.- Anestesista. Honorarios profesionales. 4.- Suministros en el hospital. Medicamentos, material médico, equipos anestésicos y sala de operaciones. 5.- Servicio de diagnóstico. Exámenes de laboratorio y gabinete, radiografías, etc. 6.- Servicio de ambulancia terrestre. En la localidad hacia o desde el hospital, siempre y cuando médicamente sea necesario. 7.- Aparatos ortopédicos y prótesis, necesarios para el tratamiento médico a excepción de reemplazos. 8.- Para UME Los gastos médicos del recién nacido quedarán cubiertos a partir del primer día de nacido de acuerdo a las condiciones generales de la póliza y/o endosos especiales. Esta cobertura no ampara: A. Las exclusiones y limitaciones de los gastos que se encuentran estipulados como gastos no cubiertos de las Condiciones Generales del Seguro salvo lo especificado en los endosos adicionales que forman parte integral de la póliza y en apego a la definición de urgencia médica. B. Tratamientos que no sean catalogados como de urgencia, de común acuerdo por el médico tratante y La Compañía. C. No quedarán cubiertos los accidentes o enfermedades que se hayan originado en la República Mexicana, así como sus consecuencias o complicaciones, sean o no motivo de la estancia o el viaje.', 'parameters': {'column_parameters': [{'column_parameter_name': 'Urgencias Médicas', 'column_parameter_details': [{'sub_column_parameter_name': '', 'row_parameters': [{'row_parameter_name': 'suma asegurada', 'value': '', 'unit': '', 'type': 'std'}, {'row_parameter_name': 'deducible', 'value': '', 'unit': '', 'type': 'std'}, {'row_parameter_name': 'coaseguro', 'value': '', 'unit': '', 'type': 'std'}, {'row_parameter_name': 'información adicional', 'value': '', 'type': 'std'}, {'row_parameter_name': 'gastos cubiertos', 'value': 'Cuarto semi-privado y alimentos del paciente, Médicos y/o cirujanos, Anestesista, Suministros en el hospital, Servicio de diagnóstico, Servicio de ambulancia terrestre, Aparatos ortopédicos y prótesis', 'type': 'std'}, {'row_parameter_name': 'gastos no cubiertos', 'value': 'Las exclusiones y limitaciones de los gastos que se encuentran estipulados como gastos no cubiertos de las Condiciones Generales del Seguro salvo lo especificado en los endosos adicionales que forman parte integral de la póliza y en apego a la definición de urgencia médica, Tratamientos que no sean catalogados como de urgencia, No quedarán cubiertos los accidentes o enfermedades que se hayan originado en la República Mexicana', 'type': 'std'}, {'row_parameter_name': 'aplicación de deducible y/o coaseguro', 'value': 'false', 'type': 'std'}, {'row_parameter_name': 'condiciones generales', 'value': 'Para los demás términos y condiciones, aplicarán las Condiciones Generales vigentes del producto contratado. Este Endoso forma parte del Contrato de Seguro.', 'type': 'std'}, {'row_parameter_name': 'elegibilidad', 'value': '', 'type': 'exception'}, {'row_parameter_name': 'periodo de espera', 'value': '', 'type': 'exception'}, {'row_parameter_name': 'tope de coaseguro', 'value': '', 'type': 'exception'}, {'row_parameter_name': 'territorio de cobertura', 'value': 'extranjero', 'type': 'exception'}]}]}, {'column_parameter_name': 'Accidente', 'column_parameter_details': [{'sub_column_parameter_name': '', 'row_parameters': [{'row_parameter_name': 'suma asegurada', 'value': '', 'unit': '', 'type': 'std'}, {'row_parameter_name': 'deducible', 'value': '', 'unit': '', 'type': 'std'}, {'row_parameter_name': 'coaseguro', 'value': '', 'unit': '', 'type': 'std'}, {'row_parameter_name': 'información adicional', 'value': '', 'type': 'std'}, {'row_parameter_name': 'gastos cubiertos', 'value': '', 'type': 'std'}, {'row_parameter_name': 'gastos no cubiertos', 'value': '', 'type': 'std'}, {'row_parameter_name': 'aplicación de deducible y/o coaseguro', 'value': '', 'type': 'std'}, {'row_parameter_name': 'condiciones generales', 'value': 'Para los demás términos y condiciones, aplicarán las Condiciones Generales vigentes del producto contratado. Este Endoso forma parte del Contrato de Seguro.', 'type': 'std'}, {'row_parameter_name': 'elegibilidad', 'value': '', 'type': 'exception'}, {'row_parameter_name': 'periodo de espera', 'value': '', 'type': 'exception'}, {'row_parameter_name': 'tope de coaseguro', 'value': '', 'type': 'exception'}, {'row_parameter_name': 'territorio de cobertura', 'value': '', 'type': 'exception'}]}]}]}, 'legal': 'Para los demás términos y condiciones, aplicarán las Condiciones Generales vigentes del producto contratado. Este Endoso forma parte del Contrato de Seguro.'}, 'global_information': {'effective_date': '', 'expiration_date': '', 'factor': '', 'type': ''}, 'business_rules': {'experience': '', 'product_type': '', 'min_net_premium': '', 'min_population': ''}, 'status': '', 'comment': [{'name': '', 'date': '', 'comment': ''}]}","{'token_cost': 0.030305000000000002, 'image_cost': 0, 'total_cost': 0.030305000000000002}",DIRECTORES,FW56349A
endoso_38,"Por medio de este documento se hace constar que:_Se ampara el tratamiento médico quirúrgico de hallux valgus o juanetes,_siempre y cuando no sea de carácter estético._Quedará cubierto de la siguiente manera:_Hasta el monto máximo de:_Suma Asegurada 10.0 S.M.G.M._Con un periodo de espera de:_1 Año_Aplicación de deducible y coaseguro:_Pago Directo:_Deducible 1.5 S.M.G.M._Coaseguro 10.0 %_Reembolso:_Deducible 1.5 S.M.G.M._Coaseguro 10.0 %_El presente endoso modifica el capítulo de Gastos Médicos Mayores No_Cubiertos en su inciso de Tratamiento Médico o Quirúrgico de Hallux Valgus_o Juanetes._Invariablemente se aplicarán los deducibles y coaseguros antes mencionados__en dicha cobertura._Se cubre únicamente en territorio nacional._Este endoso forma parte integral y complementa las Condiciones Generales_del Seguro.__","{'endoso_id': 'endoso_38', 'endoso_master_id': '38', 'contract_no': 'FW27694H', 'subgrupo': 'LABINAL CASH FLOW', 'type': 'standard', 'endoso_details': {'name': 'HALLUX VALGUS', 'key': '', 'title': '', 'subtitle': '', 'description': 'Por medio de este documento se hace constar que: Se ampara el tratamiento médico quirúrgico de hallux valgus o juanetes, siempre y cuando no sea de carácter estético. Quedará cubierto de la siguiente manera: Hasta el monto máximo de: Suma Asegurada 10.0 S.M.G.M. Con un periodo de espera de: 1 Año Aplicación de deducible y coaseguro: Pago Directo: Deducible 1.5 S.M.G.M. Coaseguro 10.0 % Reembolso: Deducible 1.5 S.M.G.M. Coaseguro 10.0 % El presente endoso modifica el capítulo de Gastos Médicos Mayores No Cubiertos en su inciso de Tratamiento Médico o Quirúrgico de Hallux Valgus o Juanetes. Invariablemente se aplicarán los deducibles y coaseguros antes mencionados en dicha cobertura. Se cubre únicamente en territorio nacional. Este endoso forma parte integral y complementa las Condiciones Generales del Seguro.', 'parameters': {'column_parameters': [{'column_parameter_name': 'Pago directo', 'column_parameter_details': [{'sub_column_parameter_name': '', 'row_parameters': [{'row_parameter_name': 'suma asegurada', 'value': '10.0', 'unit': 'S.M.G.M.', 'type': 'std'}, {'row_parameter_name': 'deducible', 'value': '1.5', 'unit': 'S.M.G.M.', 'type': 'std'}, {'row_parameter_name': 'coaseguro', 'value': '10.0', 'unit': '%', 'type': 'std'}, {'row_parameter_name': 'tope de coaseguro', 'value': '', 'unit': '', 'type': 'std'}, {'row_parameter_name': 'territorio de cobertura', 'value': 'nacional', 'type': 'std'}, {'row_parameter_name': 'periodo espera', 'value': '1', 'unit': 'Año', 'type': 'std'}, {'row_parameter_name': 'gastos cubiertos', 'value': '', 'type': 'std'}, {'row_parameter_name': 'gastos no cubiertos', 'value': '', 'type': 'std'}, {'row_parameter_name': 'aplicación de deducible y/o coaseguro', 'value': 'true', 'type': 'std'}, {'row_parameter_name': 'condiciones generales', 'value': 'Este endoso forma parte integral y complementa las Condiciones Generales del Seguro.', 'type': 'std'}, {'row_parameter_name': 'consulta postoperatoria', 'value': '', 'type': 'exception'}, {'row_parameter_name': 'consulta preoperatoria', 'value': '', 'type': 'exception'}]}]}, {'column_parameter_name': 'Reembolso', 'column_parameter_details': [{'sub_column_parameter_name': '', 'row_parameters': [{'row_parameter_name': 'suma asegurada', 'value': '10.0', 'unit': 'S.M.G.M.', 'type': 'std'}, {'row_parameter_name': 'deducible', 'value': '1.5', 'unit': 'S.M.G.M.', 'type': 'std'}, {'row_parameter_name': 'coaseguro', 'value': '10.0', 'unit': '%', 'type': 'std'}, {'row_parameter_name': 'tope de coaseguro', 'value': '', 'unit': '', 'type': 'std'}, {'row_parameter_name': 'territorio de cobertura', 'value': 'nacional', 'type': 'std'}, {'row_parameter_name': 'periodo espera', 'value': '1', 'unit': 'Año', 'type': 'std'}, {'row_parameter_name': 'gastos cubiertos', 'value': '', 'type': 'std'}, {'row_parameter_name': 'gastos no cubiertos', 'value': '', 'type': 'std'}, {'row_parameter_name': 'aplicación de deducible y/o coaseguro', 'value': 'true', 'type': 'std'}, {'row_parameter_name': 'condiciones generales', 'value': 'Este endoso forma parte integral y complementa las Condiciones Generales del Seguro.', 'type': 'std'}, {'row_parameter_name': 'consulta postoperatoria', 'value': '', 'type': 'exception'}, {'row_parameter_name': 'consulta preoperatoria', 'value': '', 'type': 'exception'}]}]}]}, 'legal': 'Este endoso forma parte integral y complementa las Condiciones Generales del Seguro.'}, 'global_information': {'effective_date': '', 'expiration_date': '', 'factor': '', 'type': ''}, 'business_rules': {'experience': '', 'product_type': '', 'min_net_premium': '', 'min_population': ''}, 'status': '', 'comment': [{'name': '', 'date': '', 'comment': ''}]}","{'token_cost': 0.021525000000000002, 'image_cost': 0, 'total_cost': 0.021525000000000002}",LABINAL CASH FLOW,FW27694H
endoso_84,_Todas las demás condiciones y coberturaspermanecen sin cambios ni_modificaciones.,"{'endoso_id': 'endoso_84', 'endoso_master_id': '84', 'contract_no': 'FW43423E', 'subgrupo': 'SUPERIOR', 'type': 'standard', 'endoso_details': {'name': 'URGENCIA MÉDICA EN EL EXTRANJERO (UMEX)', 'key': '', 'title': '', 'subtitle': '', 'description': 'Todas las demás condiciones y coberturaspermanecen sin cambios ni modificaciones.', 'parameters': {'column_parameters': [{'column_parameter_name': 'Urgencias Médicas', 'column_parameter_details': [{'sub_column_parameter_name': '', 'row_parameters': [{'row_parameter_name': 'suma asegurada', 'value': '', 'unit': '', 'type': 'std'}, {'row_parameter_name': 'deducible', 'value': '', 'unit': '', 'type': 'std'}, {'row_parameter_name': 'coaseguro', 'value': '', 'unit': '', 'type': 'std'}, {'row_parameter_name': 'información adicional', 'value': '', 'type': 'std'}, {'row_parameter_name': 'gastos cubiertos', 'value': '', 'type': 'std'}, {'row_parameter_name': 'gastos no cubiertos', 'value': '', 'type': 'std'}, {'row_parameter_name': 'aplicación de deducible y/o coaseguro', 'value': '', 'type': 'std'}, {'row_parameter_name': 'condiciones generales', 'value': 'Para los demás términos y condiciones, aplicarán las Condiciones Generales vigentes del producto contratado. Este Endoso forma parte del Contrato de Seguro', 'type': 'std'}, {'row_parameter_name': 'elegibilidad', 'value': '', 'type': 'exception'}, {'row_parameter_name': 'periodo de espera', 'value': '', 'type': 'exception'}, {'row_parameter_name': 'tope de coaseguro', 'value': '', 'type': 'exception'}, {'row_parameter_name': 'territorio de cobertura', 'value': '', 'type': 'exception'}]}]}, {'column_parameter_name': 'Accidente', 'column_parameter_details': [{'sub_column_parameter_name': '', 'row_parameters': [{'row_parameter_name': 'suma asegurada', 'value': '', 'unit': '', 'type': 'std'}, {'row_parameter_name': 'deducible', 'value': '', 'unit': '', 'type': 'std'}, {'row_parameter_name': 'coaseguro', 'value': '', 'unit': '', 'type': 'std'}, {'row_parameter_name': 'información adicional', 'value': '', 'type': 'std'}, {'row_parameter_name': 'gastos cubiertos', 'value': '', 'type': 'std'}, {'row_parameter_name': 'gastos no cubiertos', 'value': '', 'type': 'std'}, {'row_parameter_name': 'aplicación de deducible y/o coaseguro', 'value': '', 'type': 'std'}, {'row_parameter_name': 'condiciones generales', 'value': 'Para los demás términos y condiciones, aplicarán las Condiciones Generales vigentes del producto contratado. Este Endoso forma parte del Contrato de Seguro', 'type': 'std'}, {'row_parameter_name': 'elegibilidad', 'value': '', 'type': 'exception'}, {'row_parameter_name': 'periodo de espera', 'value': '', 'type': 'exception'}, {'row_parameter_name': 'tope de coaseguro', 'value': '', 'type': 'exception'}, {'row_parameter_name': 'territorio de cobertura', 'value': '', 'type': 'exception'}]}]}]}, 'legal': ''}, 'global_information': {'effective_date': '', 'expiration_date': '', 'factor': '', 'type': ''}, 'business_rules': {'experience': '', 'product_type': '', 'min_net_premium': '', 'min_population': ''}, 'status': '', 'comment': [{'name': '', 'date': '', 'comment': ''}]}","{'token_cost': 0.018327500000000004, 'image_cost': 0, 'total_cost': 0.018327500000000004}",SUPERIOR,FW43423E
