endoso_code,text,extracted_parameters,cost_metrics,nom_subg,contract_no
endoso_142,"Como litotripsia se entiende el desmenuzamiento o fragmentación de un_ cálculo por medio del litotriptor.__Este endoso ampara el pago de honorarios médicos, gastos de_ hospitalización, medicamentos, renta del litotriptor endoscópico o_ extracorpóreo y demás gastos cubiertos generados dentro del hospital.__El monto máximo a indemnizar para este beneficio y/o cobertura será:  _De acuerdo a lo siguiente:__Monto Máximo a Indemnizar 1200 SMGM __Pago Directo (Médico y Hospital en convenio de acuerdo al nivel_ hospitalario contratado)__Deducible                0.00   S.M.G.M. __Coaseguro                0.00   % __Reembolso:__Deducible                2.00   S.M.G.M. __Coaseguro               10.00   % __En caso de modificación del deducible y/o coaseguro originalmente pactado,_ invariablemente se aplicarán los deducibles y coaseguros antes_ mencionados en dicha cobertura/condición.__El Asegurado deberá cumplir con un periodo de espera, a partir de su_ inscripción en la póliza: _Se elimina periodo de espera__Se cubre únicamente en territorio nacional.__Los demás términos y condiciones, deben operar conforme se señala en las_ Condiciones Generales del producto contratado.__Este endoso forma parte integral y complementa las Condiciones Generales_ del Seguro_","{'endoso_id': 'endoso_142', 'endoso_master_id': '142', 'contract_no': 'FW45843B', 'subgrupo': 'EMPLEAD', 'type': 'standard', 'endoso_details': {'name': 'LITOTRIPSIAS', 'key': '', 'title': '', 'subtitle': '', 'description': 'Como litotripsia se entiende el desmenuzamiento o fragmentación de un cálculo por medio del litotriptor. Este endoso ampara el pago de honorarios médicos, gastos de hospitalización, medicamentos, renta del litotriptor endoscópico o extracorpóreo y demás gastos cubiertos generados dentro del hospital. El monto máximo a indemnizar para este beneficio y/o cobertura será: De acuerdo a lo siguiente: Monto Máximo a Indemnizar 1200 SMGM Pago Directo (Médico y Hospital en convenio de acuerdo al nivel hospitalario contratado) Deducible 0.00 S.M.G.M. Coaseguro 0.00 % Reembolso: Deducible 2.00 S.M.G.M. Coaseguro 10.00 % En caso de modificación del deducible y/o coaseguro originalmente pactado, invariablemente se aplicarán los deducibles y coaseguros antes mencionados en dicha cobertura/condición. El Asegurado deberá cumplir con un periodo de espera, a partir de su inscripción en la póliza: Se elimina periodo de espera Se cubre únicamente en territorio nacional. Los demás términos y condiciones, deben operar conforme se señala en las Condiciones Generales del producto contratado. Este endoso forma parte integral y complementa las Condiciones Generales del Seguro', 'parameters': {'column_parameters': [{'column_parameter_name': 'Pago directo', 'column_parameter_details': [{'sub_column_parameter_name': '', 'row_parameters': [{'row_parameter_name': 'suma asegurada', 'value': '1200', 'unit': 'SMGM', 'type': 'std'}, {'row_parameter_name': 'deducible', 'value': '0.00', 'unit': 'S.M.G.M.', 'type': 'std'}, {'row_parameter_name': 'coaseguro', 'value': '0.00', 'unit': '%', 'type': 'std'}, {'row_parameter_name': 'periodo espera', 'value': 'Se elimina periodo de espera', 'type': 'std'}, {'row_parameter_name': 'territorio de cobertura', 'value': 'nacional', 'type': 'std'}, {'row_parameter_name': 'consulta postoperatoria', 'value': '', 'type': 'std'}, {'row_parameter_name': 'consulta preoperatoria', 'value': '', 'type': 'std'}, {'row_parameter_name': 'aplicación de deducible y/o coaseguro', 'value': 'true', 'type': 'std'}, {'row_parameter_name': 'condiciones generales', 'value': 'Los demás términos y condiciones, deben operar conforme se señala en las Condiciones Generales del producto contratado. Este endoso forma parte integral y complementa las Condiciones Generales del Seguro', 'type': 'std'}, {'row_parameter_name': 'elegibilidad', 'value': '', 'type': 'exception'}, {'row_parameter_name': 'tope de coaseguro', 'value': '', 'type': 'exception'}, {'row_parameter_name': 'número de sesiones', 'value': '', 'type': 'exception'}]}]}, {'column_parameter_name': 'Reembolso', 'column_parameter_details': [{'sub_column_parameter_name': '', 'row_parameters': [{'row_parameter_name': 'suma asegurada', 'value': '1200', 'unit': 'SMGM', 'type': 'std'}, {'row_parameter_name': 'deducible', 'value': '2.00', 'unit': 'S.M.G.M.', 'type': 'std'}, {'row_parameter_name': 'coaseguro', 'value': '10.00', 'unit': '%', 'type': 'std'}, {'row_parameter_name': 'periodo espera', 'value': 'Se elimina periodo de espera', 'type': 'std'}, {'row_parameter_name': 'territorio de cobertura', 'value': 'nacional', 'type': 'std'}, {'row_parameter_name': 'consulta postoperatoria', 'value': '', 'type': 'std'}, {'row_parameter_name': 'consulta preoperatoria', 'value': '', 'type': 'std'}, {'row_parameter_name': 'aplicación de deducible y/o coaseguro', 'value': 'true', 'type': 'std'}, {'row_parameter_name': 'condiciones generales', 'value': 'Los demás términos y condiciones, deben operar conforme se señala en las Condiciones Generales del producto contratado. Este endoso forma parte integral y complementa las Condiciones Generales del Seguro', 'type': 'std'}, {'row_parameter_name': 'elegibilidad', 'value': '', 'type': 'exception'}, {'row_parameter_name': 'tope de coaseguro', 'value': '', 'type': 'exception'}, {'row_parameter_name': 'número de sesiones', 'value': '', 'type': 'exception'}]}]}]}, 'legal': 'Los demás términos y condiciones, deben operar conforme se señala en las Condiciones Generales del producto contratado. Este endoso forma parte integral y complementa las Condiciones Generales del Seguro'}, 'global_information': {'effective_date': '', 'expiration_date': '', 'factor': '', 'type': ''}, 'business_rules': {'experience': '', 'product_type': '', 'min_net_premium': '', 'min_population': ''}, 'status': '', 'comment': [{'name': '', 'date': '', 'comment': ''}]}","{'token_cost': 0.022705000000000003, 'image_cost': 0, 'total_cost': 0.022705000000000003}",EMPLEAD,FW45843B
endoso_82,"La Companía cubrirá los gastos médicos erogados por el Asegurado, durante la_vigencia de esta Póliza, por tratamientos y/o_procedimientos derivados de Padecimientos Preexistentes a la fecha de alta_del Asegurado en esta Póliza, siempre y cuando no_hayan sido cubiertos ni pagados en una póliza de Gastos Médicos Mayores del_mismo Contratante o empresas del mismo grupo,_emitida por esta u otra institución de seguros, hasta los límites de_responsabilidad que se establecen en este Endoso.__Periodo de espera: No aplica__Se cubre en territorio: Nacional__Para los demás términos y condiciones, aplicarán las Condiciones Generales_vigentes del producto contratado.__Este Endoso forma parte del Contrato de Seguro","{'endoso_id': 'endoso_82', 'endoso_master_id': '82', 'contract_no': 'FW45843B', 'subgrupo': 'EMPLEAD', 'type': 'standard', 'endoso_details': {'name': 'PREEXISTENCIA', 'key': '', 'title': '', 'subtitle': '', 'description': 'La Companía cubrirá los gastos médicos erogados por el Asegurado, durante la vigencia de esta Póliza, por tratamientos y/o procedimientos derivados de Padecimientos Preexistentes a la fecha de alta del Asegurado en esta Póliza, siempre y cuando no hayan sido cubiertos ni pagados en una póliza de Gastos Médicos Mayores del mismo Contratante o empresas del mismo grupo, emitida por esta u otra institución de seguros, hasta los límites de responsabilidad que se establecen en este Endoso. Periodo de espera: No aplica Se cubre en territorio: Nacional Para los demás términos y condiciones, aplicarán las Condiciones Generales vigentes del producto contratado. Este Endoso forma parte del Contrato de Seguro', 'parameters': {'column_parameters': '', 'row_parameters': [{'row_parameter_name': 'suma asegurada', 'editable': True, 'active': True, 'type': 'std', 'value_type': 'digits/currency (pesos, UMAM)/ de la poliza', 'value': ''}, {'row_parameter_name': 'deducible', 'editable': True, 'active': True, 'type': 'std', 'value_type': 'digits / de la poliza', 'value': ''}, {'row_parameter_name': 'coaseguro', 'editable': True, 'active': True, 'type': 'std', 'value_type': 'digits', 'value': ''}, {'row_parameter_name': 'tope de coaseguro', 'editable': True, 'active': True, 'type': 'std', 'value_type': 'digits / sin tope', 'value': ''}, {'row_parameter_name': 'periodo espera', 'editable': True, 'active': True, 'type': 'std', 'value_type': 'digits', 'value': 'No aplica'}, {'row_parameter_name': 'reconocimiento de antigüedad', 'editable': True, 'active': True, 'type': 'std', 'value_type': 'aplica/no aplica', 'value': ''}, {'row_parameter_name': 'requisitos', 'editable': True, 'active': True, 'type': 'std', 'value_type': 'text', 'value': ''}, {'row_parameter_name': 'gastos cubiertos', 'editable': True, 'active': True, 'type': 'std', 'value_type': 'text', 'value': ''}, {'row_parameter_name': 'gastos no cubiertos', 'editable': True, 'active': True, 'type': 'std', 'value_type': 'text', 'value': ''}, {'row_parameter_name': 'aplicación de deducible y/o coaseguro', 'editable': True, 'active': True, 'type': 'std', 'value_type': 'Y/N', 'value': ''}, {'row_parameter_name': 'condiciones generales', 'editable': True, 'active': True, 'type': 'std', 'value_type': 'string', 'value': 'Para los demás términos y condiciones, aplicarán las Condiciones Generales vigentes del producto contratado. Este Endoso forma parte del Contrato de Seguro'}, {'row_parameter_name': 'elegibilidad', 'editable': True, 'active': True, 'type': 'exception', 'value_type': 'titular / conyuge / hijos', 'value': ''}, {'row_parameter_name': 'territorio de cobertura', 'editable': True, 'active': True, 'type': 'exception', 'value_type': 'nacional / extranjero / inetrnacional', 'value': 'Nacional'}], 'legal': ''}}, 'global_information': {'effective_date': '', 'expiration_date': '', 'factor': '', 'type': ''}, 'business_rules': {'experience': '', 'product_type': '', 'min_net_premium': '', 'min_population': ''}, 'status': '', 'comment': [{'name': '', 'date': '', 'comment': ''}]}","{'token_cost': 0.016825, 'image_cost': 0, 'total_cost': 0.016825}",EMPLEAD,FW45843B
endoso_155,"ENDOSO FACTOR DE REEMBOLSO                                                 _El factor de reembolso de cada procedimiento terapéutico incluido en las   _Condiciones generales correspondientes a esta póliza esta expresado de     _manera porcentual, por lo que para cualquier efecto dicho factor deberá    _dividirse entre 100. _","{'endoso_id': 'endoso_155', 'endoso_master_id': '155', 'contract_no': 'FW30043O', 'subgrupo': 'GENERAL', 'type': 'standard', 'endoso_details': {'name': 'Factor', 'key': '', 'title': '', 'subtitle': '', 'description': 'El factor de reembolso de cada procedimiento terapéutico incluido en las Condiciones generales correspondientes a esta póliza esta expresado de manera porcentual, por lo que para cualquier efecto dicho factor deberá dividirse entre 100.', 'parameters': {'column_parameters': '', 'row_parameters': [{'row_parameter_name': 'Descripcion', 'editable': True, 'active': True, 'type': 'std', 'value_type': 'text', 'value': 'El factor de reembolso de cada procedimiento terapéutico incluido en las Condiciones generales correspondientes a esta póliza esta expresado de manera porcentual, por lo que para cualquier efecto dicho factor deberá dividirse entre 100.'}, {'row_parameter_name': 'Factor', 'editable': True, 'active': True, 'type': 'std', 'value_type': 'digits', 'value': ''}, {'row_parameter_name': 'Condiciones Generales', 'editable': True, 'active': True, 'type': 'std', 'value_type': 'string', 'value': 'Para los demás términos y condiciones, aplicarán las Condiciones Generales vigentes del producto contratado. Este Endoso forma parte del Contrato de Seguro'}], 'legal': ''}}, 'global_information': {'effective_date': '', 'expiration_date': '', 'factor': '', 'type': ''}, 'business_rules': {'experience': '', 'product_type': '', 'min_net_premium': '', 'min_population': ''}, 'status': '', 'comment': [{'name': '', 'date': '', 'comment': ''}]}","{'token_cost': 0.009210000000000001, 'image_cost': 0, 'total_cost': 0.009210000000000001}",GENERAL,FW30043O
endoso_84,"Los demás términos y condiciones, deben operar conforme se señala en las_ Condiciones Generales del producto contratado.__Este endoso forma parte integral y complementa las Condiciones Generales_ del Seguro","{'endoso_id': 'endoso_84', 'endoso_master_id': '84', 'contract_no': 'FW21409K', 'subgrupo': 'FUNCION', 'type': 'standard', 'endoso_details': {'name': 'URGENCIA MÉDICA EN EL EXTRANJERO (UMEX)', 'key': '', 'title': '', 'subtitle': '', 'description': 'Los demás términos y condiciones, deben operar conforme se señala en las Condiciones Generales del producto contratado. Este endoso forma parte integral y complementa las Condiciones Generales del Seguro', 'parameters': {'column_parameters': [{'column_parameter_name': 'Urgencias Médicas', 'column_parameter_details': [{'sub_column_parameter_name': '', 'row_parameters': [{'row_parameter_name': 'suma asegurada', 'value': '', 'unit': '', 'type': 'std'}, {'row_parameter_name': 'deducible', 'value': '', 'unit': '', 'type': 'std'}, {'row_parameter_name': 'coaseguro', 'value': '', 'unit': '', 'type': 'std'}, {'row_parameter_name': 'información adicional', 'value': '', 'type': 'std'}, {'row_parameter_name': 'gastos cubiertos', 'value': '', 'type': 'std'}, {'row_parameter_name': 'gastos no cubiertos', 'value': '', 'type': 'std'}, {'row_parameter_name': 'aplicación de deducible y/o coaseguro', 'value': '', 'type': 'std'}, {'row_parameter_name': 'condiciones generales', 'value': 'Los demás términos y condiciones, deben operar conforme se señala en las Condiciones Generales del producto contratado. Este endoso forma parte integral y complementa las Condiciones Generales del Seguro', 'type': 'std'}, {'row_parameter_name': 'elegibilidad', 'value': '', 'type': 'exception'}, {'row_parameter_name': 'periodo de espera', 'value': '', 'type': 'exception'}, {'row_parameter_name': 'tope de coaseguro', 'value': '', 'type': 'exception'}, {'row_parameter_name': 'territorio de cobertura', 'value': '', 'type': 'exception'}]}]}, {'column_parameter_name': 'Accidente', 'column_parameter_details': [{'sub_column_parameter_name': '', 'row_parameters': [{'row_parameter_name': 'suma asegurada', 'value': '', 'unit': '', 'type': 'std'}, {'row_parameter_name': 'deducible', 'value': '', 'unit': '', 'type': 'std'}, {'row_parameter_name': 'coaseguro', 'value': '', 'unit': '', 'type': 'std'}, {'row_parameter_name': 'información adicional', 'value': '', 'type': 'std'}, {'row_parameter_name': 'gastos cubiertos', 'value': '', 'type': 'std'}, {'row_parameter_name': 'gastos no cubiertos', 'value': '', 'type': 'std'}, {'row_parameter_name': 'aplicación de deducible y/o coaseguro', 'value': '', 'type': 'std'}, {'row_parameter_name': 'condiciones generales', 'value': 'Los demás términos y condiciones, deben operar conforme se señala en las Condiciones Generales del producto contratado. Este endoso forma parte integral y complementa las Condiciones Generales del Seguro', 'type': 'std'}, {'row_parameter_name': 'elegibilidad', 'value': '', 'type': 'exception'}, {'row_parameter_name': 'periodo de espera', 'value': '', 'type': 'exception'}, {'row_parameter_name': 'tope de coaseguro', 'value': '', 'type': 'exception'}, {'row_parameter_name': 'territorio de cobertura', 'value': '', 'type': 'exception'}]}]}]}, 'legal': 'Los demás términos y condiciones, deben operar conforme se señala en las Condiciones Generales del producto contratado. Este endoso forma parte integral y complementa las Condiciones Generales del Seguro'}, 'global_information': {'effective_date': '', 'expiration_date': '', 'factor': '', 'type': ''}, 'business_rules': {'experience': '', 'product_type': '', 'min_net_premium': '', 'min_population': ''}, 'status': '', 'comment': [{'name': '', 'date': '', 'comment': ''}]}","{'token_cost': 0.01947, 'image_cost': 0, 'total_cost': 0.01947}",FUNCION,FW21409K
endoso_82,"PREE-005 PREEXISTENCIA__La Companía cubrirá los gastos médicos erogados por el Asegurado, durante la_vigencia de esta Póliza, por tratamientos y/o_procedimientos derivados de Padecimientos Preexistentes a partir de la fecha_de antigüedad reconocida en esta póliza por el_contratante siempre y cuando no hayan sido cubiertos ni pagadosen una póliza_de Gastos Médicos Mayores del mismo Contratante_o empresas del mismo grupo, emitida por esta u otra institución de seguros, y_el Asegurado no tenga periodos al descubierto, hasta_los límites de responsabilidad que se establecen en este Endoso._Periodo de espera: 24 meses_Se cubre en territorio: Nacional_Para los demás términos y condiciones, aplicarán las Condiciones Generales_vigentes del producto contratado._Este Endoso forma parte del Contrato de Seguro.","{'endoso_id': 'endoso_82', 'endoso_master_id': '82', 'contract_no': 'FW21912L', 'subgrupo': 'ADMINIS', 'type': 'standard', 'endoso_details': {'name': 'PREEXISTENCIA', 'key': 'PREE-005', 'title': '', 'subtitle': '', 'description': 'La Companía cubrirá los gastos médicos erogados por el Asegurado, durante la vigencia de esta Póliza, por tratamientos y/o procedimientos derivados de Padecimientos Preexistentes a partir de la fecha de antigüedad reconocida en esta póliza por el contratante siempre y cuando no hayan sido cubiertos ni pagadosen una póliza de Gastos Médicos Mayores del mismo Contratante o empresas del mismo grupo, emitida por esta u otra institución de seguros, y el Asegurado no tenga periodos al descubierto, hasta los límites de responsabilidad que se establecen en este Endoso. Periodo de espera: 24 meses Se cubre en territorio: Nacional Para los demás términos y condiciones, aplicarán las Condiciones Generales vigentes del producto contratado. Este Endoso forma parte del Contrato de Seguro.', 'parameters': {'column_parameters': '', 'row_parameters': [{'row_parameter_name': 'suma asegurada', 'editable': True, 'active': True, 'type': 'std', 'value_type': 'digits/currency (pesos, UMAM)/ de la poliza', 'value': ''}, {'row_parameter_name': 'deducible', 'editable': True, 'active': True, 'type': 'std', 'value_type': 'digits / de la poliza', 'value': ''}, {'row_parameter_name': 'coaseguro', 'editable': True, 'active': True, 'type': 'std', 'value_type': 'digits', 'value': ''}, {'row_parameter_name': 'tope de coaseguro', 'editable': True, 'active': True, 'type': 'std', 'value_type': 'digits / sin tope', 'value': ''}, {'row_parameter_name': 'periodo espera', 'editable': True, 'active': True, 'type': 'std', 'value_type': 'digits', 'value': '24'}, {'row_parameter_name': 'reconocimiento de antigüedad', 'editable': True, 'active': True, 'type': 'std', 'value_type': 'aplica/no aplica', 'value': ''}, {'row_parameter_name': 'requisitos', 'editable': True, 'active': True, 'type': 'std', 'value_type': 'text', 'value': ''}, {'row_parameter_name': 'gastos cubiertos', 'editable': True, 'active': True, 'type': 'std', 'value_type': 'text', 'value': ''}, {'row_parameter_name': 'gastos no cubiertos', 'editable': True, 'active': True, 'type': 'std', 'value_type': 'text', 'value': ''}, {'row_parameter_name': 'aplicación de deducible y/o coaseguro', 'editable': True, 'active': True, 'type': 'std', 'value_type': 'Y/N', 'value': ''}, {'row_parameter_name': 'condiciones generales', 'editable': True, 'active': True, 'type': 'std', 'value_type': 'string', 'value': 'Para los demás términos y condiciones, aplicarán las Condiciones Generales vigentes del producto contratado. Este Endoso forma parte del Contrato de Seguro.'}, {'row_parameter_name': 'elegibilidad', 'editable': True, 'active': True, 'type': 'exception', 'value_type': 'titular / conyuge / hijos', 'value': ''}, {'row_parameter_name': 'territorio de cobertura', 'editable': True, 'active': True, 'type': 'exception', 'value_type': 'nacional / extranjero / inetrnacional', 'value': 'Nacional'}], 'legal': ''}}, 'global_information': {'effective_date': '', 'expiration_date': '', 'factor': '', 'type': ''}, 'business_rules': {'experience': '', 'product_type': '', 'min_net_premium': '', 'min_population': ''}, 'status': '', 'comment': [{'name': '', 'date': '', 'comment': ''}]}","{'token_cost': 0.0170825, 'image_cost': 0, 'total_cost': 0.0170825}",ADMINIS,FW21912L
endoso_38,"HALL-022 HALLUX VALGUS__La Compañía cubrirá los gastos médicos erogados durante la vigencia de esta_Póliza, para corregir hallux valgus o juanetes siempre y_cuando no sea de carácter estético, hasta los límites de responsabilidad que_se establecen en este Endoso._Para este Endoso sí es aplicable el Endoso de Aplicación de Deducible y/o_Coaseguro._Para los demás términos y condiciones, aplicarán las Condiciones Generales_vigentes del producto contratado._Este Endoso forma parte del Contrato de Seguro.","{'endoso_id': 'endoso_38', 'endoso_master_id': '38', 'contract_no': 'FW21912L', 'subgrupo': 'ADMINIS', 'type': 'standard', 'endoso_details': {'name': 'HALLUX VALGUS', 'key': 'HALL-022', 'title': '', 'subtitle': '', 'description': 'La Compañía cubrirá los gastos médicos erogados durante la vigencia de esta Póliza, para corregir hallux valgus o juanetes siempre y cuando no sea de carácter estético, hasta los límites de responsabilidad que se establecen en este Endoso. Para este Endoso sí es aplicable el Endoso de Aplicación de Deducible y/o Coaseguro. Para los demás términos y condiciones, aplicarán las Condiciones Generales vigentes del producto contratado. Este Endoso forma parte del Contrato de Seguro.', 'parameters': {'column_parameters': [{'column_parameter_name': 'Pago directo', 'column_parameter_details': [{'row_parameters': [{'row_parameter_name': 'suma asegurada', 'value': '', 'unit': '', 'type': 'std'}, {'row_parameter_name': 'deducible', 'value': '', 'unit': '', 'type': 'std'}, {'row_parameter_name': 'coaseguro', 'value': '', 'unit': '', 'type': 'std'}, {'row_parameter_name': 'tope de coaseguro', 'value': '', 'unit': '', 'type': 'std'}, {'row_parameter_name': 'territorio de cobertura', 'value': '', 'type': 'std'}, {'row_parameter_name': 'periodo espera', 'value': '', 'unit': '', 'type': 'std'}, {'row_parameter_name': 'gastos cubiertos', 'value': '', 'type': 'std'}, {'row_parameter_name': 'gastos no cubiertos', 'value': '', 'type': 'std'}, {'row_parameter_name': 'aplicación de deducible y/o coaseguro', 'value': 'true', 'type': 'std'}, {'row_parameter_name': 'condiciones generales', 'value': 'Para los demás términos y condiciones, aplicarán las Condiciones Generales vigentes del producto contratado. Este Endoso forma parte del Contrato de Seguro.', 'type': 'std'}, {'row_parameter_name': 'consulta postoperatoria', 'value': '', 'type': 'exception'}, {'row_parameter_name': 'consulta preoperatoria', 'value': '', 'type': 'exception'}]}]}, {'column_parameter_name': 'Reembolso', 'column_parameter_details': [{'row_parameters': [{'row_parameter_name': 'suma asegurada', 'value': '', 'unit': '', 'type': 'std'}, {'row_parameter_name': 'deducible', 'value': '', 'unit': '', 'type': 'std'}, {'row_parameter_name': 'coaseguro', 'value': '', 'unit': '', 'type': 'std'}, {'row_parameter_name': 'tope de coaseguro', 'value': '', 'unit': '', 'type': 'std'}, {'row_parameter_name': 'territorio de cobertura', 'value': '', 'type': 'std'}, {'row_parameter_name': 'periodo espera', 'value': '', 'unit': '', 'type': 'std'}, {'row_parameter_name': 'gastos cubiertos', 'value': '', 'type': 'std'}, {'row_parameter_name': 'gastos no cubiertos', 'value': '', 'type': 'std'}, {'row_parameter_name': 'aplicación de deducible y/o coaseguro', 'value': 'true', 'type': 'std'}, {'row_parameter_name': 'condiciones generales', 'value': 'Para los demás términos y condiciones, aplicarán las Condiciones Generales vigentes del producto contratado. Este Endoso forma parte del Contrato de Seguro.', 'type': 'std'}, {'row_parameter_name': 'consulta postoperatoria', 'value': '', 'type': 'exception'}, {'row_parameter_name': 'consulta preoperatoria', 'value': '', 'type': 'exception'}]}]}]}, 'legal': 'Para los demás términos y condiciones, aplicarán las Condiciones Generales vigentes del producto contratado. Este Endoso forma parte del Contrato de Seguro.'}, 'global_information': {'effective_date': '', 'expiration_date': '', 'factor': '', 'type': ''}, 'business_rules': {'experience': '', 'product_type': '', 'min_net_premium': '', 'min_population': ''}, 'status': '', 'comment': [{'name': '', 'date': '', 'comment': ''}]}","{'token_cost': 0.019807500000000002, 'image_cost': 0, 'total_cost': 0.019807500000000002}",ADMINIS,FW21912L
