endoso_code,text,extracted_parameters,cost_metrics,nom_subg,contract_no
endoso_84,"UMEX- 032 URGENCIA MÉDICA EN EL EXTRANJERO__La Compañía cubrirá los gastos médicos erogados durante la vigencia de esta_Póliza, por Urgencias Médicas en el Extranjero modificando los límites de_responsabilidad de esta cobertura, hasta los que se indiquen en este Endoso:__Suma Asegurada: USD 50,000.00__Deducible: USD 50.00__Para este Endoso no es aplicable el Endoso de Aplicación de Deducible y/o_Coaseguro.__Para los demás términos y condiciones, aplicarán las Condiciones Generales_vigentes del producto contratado.__Este Endoso forma parte del Contrato de Seguro.""","{'endoso_id': 'endoso_84', 'endoso_master_id': '84', 'contract_no': 'FW52558D', 'subgrupo': 'EMPLEADOS', 'type': 'standard', 'endoso_details': {'name': 'URGENCIA MÉDICA EN EL EXTRANJERO (UMEX)', 'key': 'UMEX- 032', 'title': '', 'subtitle': '', 'description': 'La Compañía cubrirá los gastos médicos erogados durante la vigencia de esta Póliza, por Urgencias Médicas en el Extranjero modificando los límites de responsabilidad de esta cobertura, hasta los que se indiquen en este Endoso: Suma Asegurada: USD 50,000.00 Deducible: USD 50.00 Para este Endoso no es aplicable el Endoso de Aplicación de Deducible y/o Coaseguro. Para los demás términos y condiciones, aplicarán las Condiciones Generales vigentes del producto contratado. Este Endoso forma parte del Contrato de Seguro.', 'parameters': {'column_parameters': [{'column_parameter_name': 'Urgencias Médicas', 'column_parameter_details': [{'row_parameters': [{'row_parameter_name': 'suma asegurada', 'value': '50,000.00', 'unit': 'USD', 'type': 'std'}, {'row_parameter_name': 'deducible', 'value': '50.00', 'unit': 'USD', 'type': 'std'}, {'row_parameter_name': 'coaseguro', 'value': '', 'type': 'std'}, {'row_parameter_name': 'información adicional', 'value': '', 'type': 'std'}, {'row_parameter_name': 'gastos cubiertos', 'value': '', 'type': 'std'}, {'row_parameter_name': 'gastos no cubiertos', 'value': '', 'type': 'std'}, {'row_parameter_name': 'aplicación de deducible y/o coaseguro', 'value': 'false', 'type': 'std'}, {'row_parameter_name': 'condiciones generales', 'value': 'Para los demás términos y condiciones, aplicarán las Condiciones Generales vigentes del producto contratado. Este Endoso forma parte del Contrato de Seguro.', 'type': 'std'}, {'row_parameter_name': 'elegibilidad', 'value': '', 'type': 'exception'}, {'row_parameter_name': 'periodo de espera', 'value': '', 'type': 'exception'}, {'row_parameter_name': 'tope de coaseguro', 'value': '', 'type': 'exception'}, {'row_parameter_name': 'territorio de cobertura', 'value': '', 'type': 'exception'}]}]}, {'column_parameter_name': 'Accidente', 'column_parameter_details': [{'row_parameters': [{'row_parameter_name': 'suma asegurada', 'value': '', 'type': 'std'}, {'row_parameter_name': 'deducible', 'value': '', 'type': 'std'}, {'row_parameter_name': 'coaseguro', 'value': '', 'type': 'std'}, {'row_parameter_name': 'información adicional', 'value': '', 'type': 'std'}, {'row_parameter_name': 'gastos cubiertos', 'value': '', 'type': 'std'}, {'row_parameter_name': 'gastos no cubiertos', 'value': '', 'type': 'std'}, {'row_parameter_name': 'aplicación de deducible y/o coaseguro', 'value': '', 'type': 'std'}, {'row_parameter_name': 'condiciones generales', 'value': 'Para los demás términos y condiciones, aplicarán las Condiciones Generales vigentes del producto contratado. Este Endoso forma parte del Contrato de Seguro.', 'type': 'std'}, {'row_parameter_name': 'elegibilidad', 'value': '', 'type': 'exception'}, {'row_parameter_name': 'periodo de espera', 'value': '', 'type': 'exception'}, {'row_parameter_name': 'tope de coaseguro', 'value': '', 'type': 'exception'}, {'row_parameter_name': 'territorio de cobertura', 'value': '', 'type': 'exception'}]}]}], 'legal': 'Para los demás términos y condiciones, aplicarán las Condiciones Generales vigentes del producto contratado. Este Endoso forma parte del Contrato de Seguro.'}}, 'global_information': {'effective_date': '', 'expiration_date': '', 'factor': '', 'type': ''}, 'business_rules': {'experience': '', 'product_type': '', 'min_net_premium': '', 'min_population': ''}, 'status': '', 'comment': [{'name': '', 'date': '', 'comment': ''}]}","{'token_cost': 0.0193825, 'image_cost': 0, 'total_cost': 0.0193825}",EMPLEADOS,FW52558D
endoso_84,"Es la aparición repentina de una alteración de la salud del Asegurado, la_cual se manifiesta a través de síntomas agudos de tal severidad, que ponen_en peligro la vida del enfermo o accidentado, su integridad corporal o la_viabilidad de alguno de sus órganos.__Por medio de este documento se hace constar que:__Se cubren los gastos originados en caso de sufrir alguna enfermedad o_accidente que pueda ser considerada como urgencia médica en cualquier lugar_del mundo, para la cual no se haya presentado atención médica previa al_acontecimiento en territorio nacional.__Si, a la solicitud del seguro, El Contratante requiere incluir algún(os)_padecimiento(s) a la póliza que esté especificado como exclusión en las_Condiciones Generales del Seguro, éste(os) se deberá(n) incluir mediante_endoso especial. Dicho(s) padecimiento(s) podrá(n) cubrirse en territorio_extranjero con las limitaciones y condiciones de la cobertura de urgencia_médica en el extranjero.__Esta cobertura aplica de acuerdo con los siguientes límites y condiciones:_Pago de Reclamaciones_Sistema de Pago por Reembolso:_Funciona para aquellos gastos cubiertos por la póliza en atención médica de_urgencia que:_- El servicio médico se hubiere proporcionado en hospitales no afiliados._- Por la situación del internamiento (falta de documentos, duda en cuanto a_  la vigencia de la póliza, coberturas, alta de asegurados, pagos, etc.) no_  se hubiera dado autorización de pago directo.__Sistema de Pago Directo:_A través de este sistema La Compañía pagará, si así lo autoriza,_directamente a los médicos y hospitales que acepten el pago directo sin que_el asegurado tenga que realizar desembolso por los gastos erogados, quedando_únicamente a su cargo los gastos no cubiertos.__En caso de que el asegurado optara por atenderse en un hospital y con_médicos afiliados y que el internamiento sea mayor a 24 hrs., podrá hacer_uso del sistema de pago directo en el que, previa verificación de La_Compañía respecto a la procedencia del caso, vigencia de póliza, endosos_especiales, alta de asegurados, pagos, etc., si procede el internamiento, La_Compañía efectuará el pago de los gastos cubiertos por la póliza en forma_directa al hospital y médicos afiliados, eliminando en estos casos la_cantidad por concepto de deducible.__Para operar dicho sistema se entregará al asegurado una tarjeta de_identificación en la que se consignan los teléfonos de servicios en los que_se proporcionará los nombres de los hospitales y médicos afiliados que lo_puedan atender. Este sistema se otorgará sin cargo adicional de prima._Gastos Cubiertos_1.- Cuarto semi-privado y alimentos del paciente._2.- Médicos y/o cirujanos. Honorarios por intervención quirúrgica, así como_    visitas intrahospitalarias._3.- Anestesista. Honorarios profesionales._4.- Suministros en el hospital. Medicamentos, material médico, equipos_    anestésicos y sala de operaciones._5.- Servicio de diagnóstico. Exámenes de laboratorio y gabinete,_    radiografías, etc._6.- Servicio de ambulancia terrestre. En la localidad hacia o desde el_    hospital, siempre y cuando médicamente sea necesario._7.- Aparatos ortopédicos y prótesis, necesarios para el tratamiento médico a_    excepción de reemplazos._8.- Para UME Los gastos médicos del recién nacido quedarán cubiertos a_    partir del primer día de nacido de acuerdo a las condiciones generales_    de la póliza y/o endosos especiales. Esta cobertura no ampara:__A. Las exclusiones y limitaciones de los gastos que se encuentran_estipulados como gastos no cubiertos de las Condiciones Generales del Seguro_salvo lo especificado en los endosos adicionales que forman parte integral_de la póliza y en apego a la definición de urgencia médica.__B. Tratamientos que no sean catalogados como de urgencia, de común acuerdo_por el médico tratante y La Compañía._C. No quedarán cubiertos los accidentes o enfermedades que se hayan_originado en la República Mexicana, así como sus consecuencias o_complicaciones, sean o no motivo","{'endoso_id': 'endoso_84', 'endoso_master_id': '84', 'contract_no': 'FW19027V', 'subgrupo': 'BERMUDEZ MASCARENA', 'type': 'standard', 'endoso_details': {'name': 'URGENCIA MÉDICA EN EL EXTRANJERO (UMEX)', 'key': '', 'title': '', 'subtitle': '', 'description': 'Es la aparición repentina de una alteración de la salud del Asegurado, la cual se manifiesta a través de síntomas agudos de tal severidad, que ponen en peligro la vida del enfermo o accidentado, su integridad corporal o la viabilidad de alguno de sus órganos. Por medio de este documento se hace constar que: Se cubren los gastos originados en caso de sufrir alguna enfermedad o accidente que pueda ser considerada como urgencia médica en cualquier lugar del mundo, para la cual no se haya presentado atención médica previa al acontecimiento en territorio nacional. Si, a la solicitud del seguro, El Contratante requiere incluir algún(os) padecimiento(s) a la póliza que esté especificado como exclusión en las Condiciones Generales del Seguro, éste(os) se deberá(n) incluir mediante endoso especial. Dicho(s) padecimiento(s) podrá(n) cubrirse en territorio extranjero con las limitaciones y condiciones de la cobertura de urgencia médica en el extranjero. Esta cobertura aplica de acuerdo con los siguientes límites y condiciones: Pago de Reclamaciones Sistema de Pago por Reembolso: Funciona para aquellos gastos cubiertos por la póliza en atención médica de urgencia que: - El servicio médico se hubiere proporcionado en hospitales no afiliados. - Por la situación del internamiento (falta de documentos, duda en cuanto a la vigencia de la póliza, coberturas, alta de asegurados, pagos, etc.) no se hubiera dado autorización de pago directo. Sistema de Pago Directo: A través de este sistema La Compañía pagará, si así lo autoriza, directamente a los médicos y hospitales que acepten el pago directo sin que el asegurado tenga que realizar desembolso por los gastos erogados, quedando únicamente a su cargo los gastos no cubiertos. En caso de que el asegurado optara por atenderse en un hospital y con médicos afiliados y que el internamiento sea mayor a 24 hrs., podrá hacer uso del sistema de pago directo en el que, previa verificación de La Compañía respecto a la procedencia del caso, vigencia de póliza, endosos especiales, alta de asegurados, pagos, etc., si procede el internamiento, La Compañía efectuará el pago de los gastos cubiertos por la póliza en forma directa al hospital y médicos afiliados, eliminando en estos casos la cantidad por concepto de deducible. Para operar dicho sistema se entregará al asegurado una tarjeta de identificación en la que se consignan los teléfonos de servicios en los que se proporcionará los nombres de los hospitales y médicos afiliados que lo puedan atender. Este sistema se otorgará sin cargo adicional de prima. Gastos Cubiertos 1.- Cuarto semi-privado y alimentos del paciente. 2.- Médicos y/o cirujanos. Honorarios por intervención quirúrgica, así como visitas intrahospitalarias. 3.- Anestesista. Honorarios profesionales. 4.- Suministros en el hospital. Medicamentos, material médico, equipos anestésicos y sala de operaciones. 5.- Servicio de diagnóstico. Exámenes de laboratorio y gabinete, radiografías, etc. 6.- Servicio de ambulancia terrestre. En la localidad hacia o desde el hospital, siempre y cuando médicamente sea necesario. 7.- Aparatos ortopédicos y prótesis, necesarios para el tratamiento médico a excepción de reemplazos. 8.- Para UME Los gastos médicos del recién nacido quedarán cubiertos a partir del primer día de nacido de acuerdo a las condiciones generales de la póliza y/o endosos especiales. Esta cobertura no ampara: A. Las exclusiones y limitaciones de los gastos que se encuentran estipulados como gastos no cubiertos de las Condiciones Generales del Seguro salvo lo especificado en los endosos adicionales que forman parte integral de la póliza y en apego a la definición de urgencia médica. B. Tratamientos que no sean catalogados como de urgencia, de común acuerdo por el médico tratante y La Compañía. C. No quedarán cubiertos los accidentes o enfermedades que se hayan originado en la República Mexicana, así como sus consecuencias o complicaciones, sean o no motivo', 'parameters': {'column_parameters': [{'column_parameter_name': 'Urgencias Médicas', 'column_parameter_details': [{'sub_column_parameter_name': '', 'row_parameters': [{'row_parameter_name': 'suma asegurada', 'value': '', 'unit': '', 'type': 'std'}, {'row_parameter_name': 'deducible', 'value': '', 'unit': '', 'type': 'std'}, {'row_parameter_name': 'coaseguro', 'value': '', 'unit': '', 'type': 'std'}, {'row_parameter_name': 'información adicional', 'value': '', 'type': 'std'}, {'row_parameter_name': 'gastos cubiertos', 'value': 'Cuarto semi-privado y alimentos del paciente, Médicos y/o cirujanos, Anestesista, Suministros en el hospital, Servicio de diagnóstico, Servicio de ambulancia terrestre, Aparatos ortopédicos y prótesis', 'type': 'std'}, {'row_parameter_name': 'gastos no cubiertos', 'value': 'Las exclusiones y limitaciones de los gastos que se encuentran estipulados como gastos no cubiertos de las Condiciones Generales del Seguro salvo lo especificado en los endosos adicionales que forman parte integral de la póliza y en apego a la definición de urgencia médica, Tratamientos que no sean catalogados como de urgencia, No quedarán cubiertos los accidentes o enfermedades que se hayan originado en la República Mexicana', 'type': 'std'}, {'row_parameter_name': 'aplicación de deducible y/o coaseguro', 'value': '', 'type': 'std'}, {'row_parameter_name': 'condiciones generales', 'value': 'Para los demás términos y condiciones, aplicarán las Condiciones Generales vigentes del producto contratado. Este Endoso forma parte del Contrato de Seguro.', 'type': 'std'}, {'row_parameter_name': 'elegibilidad', 'value': '', 'type': 'exception'}, {'row_parameter_name': 'periodo de espera', 'value': '', 'type': 'exception'}, {'row_parameter_name': 'tope de coaseguro', 'value': '', 'type': 'exception'}, {'row_parameter_name': 'territorio de cobertura', 'value': 'internacional', 'type': 'exception'}]}]}]}, 'legal': ''}, 'global_information': {'effective_date': '', 'expiration_date': '', 'factor': '', 'type': ''}, 'business_rules': {'experience': '', 'product_type': '', 'min_net_premium': '', 'min_population': ''}, 'status': '', 'comment': [{'name': '', 'date': '', 'comment': ''}]}","{'token_cost': 0.0256375, 'image_cost': 0, 'total_cost': 0.0256375}",BERMUDEZ MASCARENA,FW19027V
endoso_84,"UMEX-032 URGENCIA MÉDICA EN EL EXTRANJERO__La Compañía cubrirá los gastos médicos erogados durante la vigencia de esta_Póliza, por Urgencias Médicas en el Extranjero  modificando los límites de_responsabilidad  de esta cobertura, hasta los que se indiquen en este_Endoso:__Suma Asegurada: USD 100,000__Deducible: USD 100__Para este Endoso no es aplicable el Endoso de  Aplicación de Deducible y/o_Coaseguro.__Para los demás términos y condiciones, aplicarán las Condiciones Generales_vigentes del producto contratado.__Este Endoso forma parte del Contrato de Seguro.","{'endoso_id': 'endoso_84', 'endoso_master_id': '84', 'contract_no': 'FW71132A', 'subgrupo': 'GENERAL', 'type': 'standard', 'endoso_details': {'name': 'URGENCIA MÉDICA EN EL EXTRANJERO (UMEX)', 'key': 'UMEX-032', 'title': '', 'subtitle': '', 'description': 'La Compañía cubrirá los gastos médicos erogados durante la vigencia de esta Póliza, por Urgencias Médicas en el Extranjero modificando los límites de responsabilidad de esta cobertura, hasta los que se indiquen en este Endoso: Suma Asegurada: USD 100,000 Deducible: USD 100 Para este Endoso no es aplicable el Endoso de Aplicación de Deducible y/o Coaseguro. Para los demás términos y condiciones, aplicarán las Condiciones Generales vigentes del producto contratado. Este Endoso forma parte del Contrato de Seguro.', 'parameters': {'column_parameters': [{'column_parameter_name': 'Urgencias Médicas', 'column_parameter_details': [{'sub_column_parameter_name': '', 'row_parameters': [{'row_parameter_name': 'suma asegurada', 'value': '100,000', 'unit': 'USD', 'type': 'std'}, {'row_parameter_name': 'deducible', 'value': '100', 'unit': 'USD', 'type': 'std'}, {'row_parameter_name': 'coaseguro', 'value': '', 'type': 'std'}, {'row_parameter_name': 'información adicional', 'value': '', 'type': 'std'}, {'row_parameter_name': 'gastos cubiertos', 'value': '', 'type': 'std'}, {'row_parameter_name': 'gastos no cubiertos', 'value': '', 'type': 'std'}, {'row_parameter_name': 'aplicación de deducible y/o coaseguro', 'value': 'false', 'type': 'std'}, {'row_parameter_name': 'condiciones generales', 'value': 'Para los demás términos y condiciones, aplicarán las Condiciones Generales vigentes del producto contratado. Este Endoso forma parte del Contrato de Seguro.', 'type': 'std'}, {'row_parameter_name': 'elegibilidad', 'value': '', 'type': 'exception'}, {'row_parameter_name': 'periodo de espera', 'value': '', 'type': 'exception'}, {'row_parameter_name': 'tope de coaseguro', 'value': '', 'type': 'exception'}, {'row_parameter_name': 'territorio de cobertura', 'value': '', 'type': 'exception'}]}]}, {'column_parameter_name': 'Accidente', 'column_parameter_details': [{'sub_column_parameter_name': '', 'row_parameters': [{'row_parameter_name': 'suma asegurada', 'value': '', 'type': 'std'}, {'row_parameter_name': 'deducible', 'value': '', 'type': 'std'}, {'row_parameter_name': 'coaseguro', 'value': '', 'type': 'std'}, {'row_parameter_name': 'información adicional', 'value': '', 'type': 'std'}, {'row_parameter_name': 'gastos cubiertos', 'value': '', 'type': 'std'}, {'row_parameter_name': 'gastos no cubiertos', 'value': '', 'type': 'std'}, {'row_parameter_name': 'aplicación de deducible y/o coaseguro', 'value': '', 'type': 'std'}, {'row_parameter_name': 'condiciones generales', 'value': 'Para los demás términos y condiciones, aplicarán las Condiciones Generales vigentes del producto contratado. Este Endoso forma parte del Contrato de Seguro.', 'type': 'std'}, {'row_parameter_name': 'elegibilidad', 'value': '', 'type': 'exception'}, {'row_parameter_name': 'periodo de espera', 'value': '', 'type': 'exception'}, {'row_parameter_name': 'tope de coaseguro', 'value': '', 'type': 'exception'}, {'row_parameter_name': 'territorio de cobertura', 'value': '', 'type': 'exception'}]}]}]}, 'legal': 'Para los demás términos y condiciones, aplicarán las Condiciones Generales vigentes del producto contratado. Este Endoso forma parte del Contrato de Seguro.'}, 'global_information': {'effective_date': '', 'expiration_date': '', 'factor': '', 'type': ''}, 'business_rules': {'experience': '', 'product_type': '', 'min_net_premium': '', 'min_population': ''}, 'status': '', 'comment': [{'name': '', 'date': '', 'comment': ''}]}","{'token_cost': 0.019422500000000002, 'image_cost': 0, 'total_cost': 0.019422500000000002}",GENERAL,FW71132A
endoso_84,"UMEX-032 URGENCIA MÉDICA EN EL EXTRANJERO__La Compañía cubrirá los gastos médicos erogados durante la vigencia de esta_Póliza, por Urgencias Médicas en el Extranjero  modificando los límites de_responsabilidad  de esta cobertura, hasta los que se  indiquen en este_Endoso:__Suma Asegurada: $50,000 USD__Deducible: $50 USD__Para este Endoso no es aplicable el Endoso de  Aplicación de Deducible y/o_Coaseguro.__Para los demás términos y condiciones, aplicarán las Condiciones Generales_vigentes del producto contratado.__Este Endoso forma parte del Contrato de Seguro.","{'endoso_id': 'endoso_84', 'endoso_master_id': '84', 'contract_no': 'FW72830A', 'subgrupo': 'DIRECTORES', 'type': 'standard', 'endoso_details': {'name': 'URGENCIA MÉDICA EN EL EXTRANJERO (UMEX)', 'key': 'UMEX-032', 'title': '', 'subtitle': '', 'description': 'La Compañía cubrirá los gastos médicos erogados durante la vigencia de esta Póliza, por Urgencias Médicas en el Extranjero modificando los límites de responsabilidad de esta cobertura, hasta los que se indiquen en este Endoso: Suma Asegurada: $50,000 USD Deducible: $50 USD Para este Endoso no es aplicable el Endoso de Aplicación de Deducible y/o Coaseguro. Para los demás términos y condiciones, aplicarán las Condiciones Generales vigentes del producto contratado. Este Endoso forma parte del Contrato de Seguro.', 'parameters': {'column_parameters': [{'column_parameter_name': 'Urgencias Médicas', 'column_parameter_details': [{'sub_column_parameter_name': '', 'row_parameters': [{'row_parameter_name': 'suma asegurada', 'value': '50,000', 'unit': 'USD', 'type': 'std'}, {'row_parameter_name': 'deducible', 'value': '50', 'unit': 'USD', 'type': 'std'}, {'row_parameter_name': 'coaseguro', 'value': '', 'type': 'std'}, {'row_parameter_name': 'información adicional', 'value': '', 'type': 'std'}, {'row_parameter_name': 'gastos cubiertos', 'value': '', 'type': 'std'}, {'row_parameter_name': 'gastos no cubiertos', 'value': '', 'type': 'std'}, {'row_parameter_name': 'aplicación de deducible y/o coaseguro', 'value': 'false', 'type': 'std'}, {'row_parameter_name': 'condiciones generales', 'value': 'Para los demás términos y condiciones, aplicarán las Condiciones Generales vigentes del producto contratado. Este Endoso forma parte del Contrato de Seguro.', 'type': 'std'}, {'row_parameter_name': 'elegibilidad', 'value': '', 'type': 'exception'}, {'row_parameter_name': 'periodo de espera', 'value': '', 'type': 'exception'}, {'row_parameter_name': 'tope de coaseguro', 'value': '', 'type': 'exception'}, {'row_parameter_name': 'territorio de cobertura', 'value': '', 'type': 'exception'}]}]}, {'column_parameter_name': 'Accidente', 'column_parameter_details': [{'row_parameters': [{'row_parameter_name': 'suma asegurada', 'value': '', 'type': 'std'}, {'row_parameter_name': 'deducible', 'value': '', 'type': 'std'}, {'row_parameter_name': 'coaseguro', 'value': '', 'type': 'std'}, {'row_parameter_name': 'información adicional', 'value': '', 'type': 'std'}, {'row_parameter_name': 'gastos cubiertos', 'value': '', 'type': 'std'}, {'row_parameter_name': 'gastos no cubiertos', 'value': '', 'type': 'std'}, {'row_parameter_name': 'aplicación de deducible y/o coaseguro', 'value': '', 'type': 'std'}, {'row_parameter_name': 'condiciones generales', 'value': 'Para los demás términos y condiciones, aplicarán las Condiciones Generales vigentes del producto contratado. Este Endoso forma parte del Contrato de Seguro.', 'type': 'std'}, {'row_parameter_name': 'elegibilidad', 'value': '', 'type': 'exception'}, {'row_parameter_name': 'periodo de espera', 'value': '', 'type': 'exception'}, {'row_parameter_name': 'tope de coaseguro', 'value': '', 'type': 'exception'}, {'row_parameter_name': 'territorio de cobertura', 'value': '', 'type': 'exception'}]}]}]}, 'legal': 'Para los demás términos y condiciones, aplicarán las Condiciones Generales vigentes del producto contratado. Este Endoso forma parte del Contrato de Seguro.'}, 'global_information': {'effective_date': '', 'expiration_date': '', 'factor': '', 'type': ''}, 'business_rules': {'experience': '', 'product_type': '', 'min_net_premium': '', 'min_population': ''}, 'status': '', 'comment': [{'name': '', 'date': '', 'comment': ''}]}","{'token_cost': 0.0193575, 'image_cost': 0, 'total_cost': 0.0193575}",DIRECTORES,FW72830A
