endoso_code,text,extracted_parameters,cost_metrics,nom_subg,contract_no
endoso_82,"_Quedan cubiertas las enfermedades o accidentes preexistentes cubiertos por_ la presente póliza, aún y cuando:__a) La sintomatología previa a dicha enfermedad no haya pasado_ desapercibida.__b) Se hubiera establecido diagnóstico antes del alta del Asegurado en esta_ póliza.__c) Existan  gastos efectuados con anterioridad al inicio de la Cobertura.__Sólo quedaran cubiertos los gastos realizados durante la vigencia de esta_ póliza.__Este endoso modifica la exclusión estipulada en las Condiciones Generales_ del producto contratado, en el apartado V. Gastos Médicos Mayores No_ Cubiertos, inciso 1.__El asegurado deberá cumplir con un periodo de espera, a partir de su_ inscripción en la póliza, de 2 años.__AXA Seguros, S.A. de C.V.:_No reconocerá la antigüedad generada en otras compañías__Esta cobertura aplicará de acuerdo a lo arriba señalado.__Se cubre únicamente en territorio nacional.__Los demás términos y condiciones, deben operar conforme se señala en las_ Condiciones Generales del producto contratado.__Este endoso forma parte integral y complementa las Condiciones Generales_ del Seguro","{'endoso_id': 'endoso_82', 'endoso_master_id': '82', 'contract_no': 'FW18838M', 'subgrupo': 'SOCIOS 3', 'type': 'standard', 'endoso_details': {'name': 'PREEXISTENCIA', 'key': '', 'title': '', 'subtitle': '', 'description': 'Quedan cubiertas las enfermedades o accidentes preexistentes cubiertos por la presente póliza, aún y cuando: a) La sintomatología previa a dicha enfermedad no haya pasado desapercibida. b) Se hubiera establecido diagnóstico antes del alta del Asegurado en esta póliza. c) Existan  gastos efectuados con anterioridad al inicio de la Cobertura. Sólo quedaran cubiertos los gastos realizados durante la vigencia de esta póliza. Este endoso modifica la exclusión estipulada en las Condiciones Generales del producto contratado, en el apartado V. Gastos Médicos Mayores No Cubiertos, inciso 1. El asegurado deberá cumplir con un periodo de espera, a partir de su inscripción en la póliza, de 2 años. AXA Seguros, S.A. de C.V.: No reconocerá la antigüedad generada en otras compañías Esta cobertura aplicará de acuerdo a lo arriba señalado. Se cubre únicamente en territorio nacional. Los demás términos y condiciones, deben operar conforme se señala en las Condiciones Generales del producto contratado. Este endoso forma parte integral y complementa las Condiciones Generales del Seguro', 'parameters': {'column_parameters': '', 'row_parameters': [{'row_parameter_name': 'suma asegurada', 'editable': True, 'active': True, 'type': 'std', 'value_type': 'digits/currency (pesos, UMAM)/ de la poliza', 'value': ''}, {'row_parameter_name': 'deducible', 'editable': True, 'active': True, 'type': 'std', 'value_type': 'digits / de la poliza', 'value': ''}, {'row_parameter_name': 'coaseguro', 'editable': True, 'active': True, 'type': 'std', 'value_type': 'digits', 'value': ''}, {'row_parameter_name': 'tope de coaseguro', 'editable': True, 'active': True, 'type': 'std', 'value_type': 'digits / sin tope', 'value': ''}, {'row_parameter_name': 'periodo espera', 'editable': True, 'active': True, 'type': 'std', 'value_type': 'digits', 'value': '2'}, {'row_parameter_name': 'reconocimiento de antigüedad', 'editable': True, 'active': True, 'type': 'std', 'value_type': 'aplica/no aplica', 'value': 'no aplica'}, {'row_parameter_name': 'requisitos', 'editable': True, 'active': True, 'type': 'std', 'value_type': 'text', 'value': ''}, {'row_parameter_name': 'gastos cubiertos', 'editable': True, 'active': True, 'type': 'std', 'value_type': 'text', 'value': 'Quedan cubiertas las enfermedades o accidentes preexistentes cubiertos por la presente póliza'}, {'row_parameter_name': 'gastos no cubiertos', 'editable': True, 'active': True, 'type': 'std', 'value_type': 'text', 'value': ''}, {'row_parameter_name': 'aplicación de deducible y/o coaseguro', 'editable': True, 'active': True, 'type': 'std', 'value_type': 'Y/N', 'value': ''}, {'row_parameter_name': 'condiciones generales', 'editable': True, 'active': True, 'type': 'std', 'value_type': 'string', 'value': 'Los demás términos y condiciones, deben operar conforme se señala en las Condiciones Generales del producto contratado. Este endoso forma parte integral y complementa las Condiciones Generales del Seguro'}, {'row_parameter_name': 'elegibilidad', 'editable': True, 'active': True, 'type': 'exception', 'value_type': 'titular / conyuge / hijos', 'value': ''}, {'row_parameter_name': 'territorio de cobertura', 'editable': True, 'active': True, 'type': 'exception', 'value_type': 'nacional / extranjero / inetrnacional', 'value': 'nacional'}], 'legal': 'Los demás términos y condiciones, deben operar conforme se señala en las Condiciones Generales del producto contratado. Este endoso forma parte integral y complementa las Condiciones Generales del Seguro'}}, 'global_information': {'effective_date': '', 'expiration_date': '', 'factor': '', 'type': ''}, 'business_rules': {'experience': '', 'product_type': '', 'min_net_premium': '', 'min_population': ''}, 'status': '', 'comment': [{'name': '', 'date': '', 'comment': ''}]}","{'token_cost': 0.0185475, 'image_cost': 0, 'total_cost': 0.0185475}",SOCIOS 3,FW18838M
endoso_82,"Quedan cubiertas las enfermedades o accidentes preexistentes cubiertos por_la presente póliza, aún y cuando:_a) La sintomatología previa a dicha enfermedad no haya pasado desapercibida._b) Se hubiera establecido diagnóstico antes del alta del Asegurado en esta_póliza._c) Existan  gastos efectuados con anterioridad al inicio de la Cobertura._Sólo quedaran cubiertos los gastos realizados durante la vigencia de esta_póliza._Este endoso modifica la exclusión estipulada en las Condiciones Generales_del  producto contratado,  en el apartado  V. Gastos  Médicos  Mayores No_Cubiertos, inciso 1._El asegurado deberá cumplir con un periodo de espera, a partir de su_inscripción en la póliza, de 2 años._AXA Seguros, S.A. de C.V.:_No reconocerá la antigüedad generada en otras compañías_Esta cobertura aplicará de acuerdo a lo arriba señalado._Se cubre únicamente en territorio nacional._Los demás términos y condiciones, deben operar conforme se señala en las_Condiciones Generales del producto contratado.__Este endoso forma parte integral y complementa las Condiciones Generales_del Seguro.__","{'endoso_id': 'endoso_82', 'endoso_master_id': '82', 'contract_no': 'FW35125E', 'subgrupo': 'Centro Universitar', 'type': 'standard', 'endoso_details': {'name': 'PREEXISTENCIA', 'key': '', 'title': '', 'subtitle': '', 'description': 'Quedan cubiertas las enfermedades o accidentes preexistentes cubiertos por la presente póliza, aún y cuando: a) La sintomatología previa a dicha enfermedad no haya pasado desapercibida. b) Se hubiera establecido diagnóstico antes del alta del Asegurado en esta póliza. c) Existan  gastos efectuados con anterioridad al inicio de la Cobertura. Sólo quedaran cubiertos los gastos realizados durante la vigencia de esta póliza. Este endoso modifica la exclusión estipulada en las Condiciones Generales del  producto contratado,  en el apartado  V. Gastos  Médicos  Mayores No Cubiertos, inciso 1. El asegurado deberá cumplir con un periodo de espera, a partir de su inscripción en la póliza, de 2 años. AXA Seguros, S.A. de C.V.: No reconocerá la antigüedad generada en otras compañías Esta cobertura aplicará de acuerdo a lo arriba señalado. Se cubre únicamente en territorio nacional. Los demás términos y condiciones, deben operar conforme se señala en las Condiciones Generales del producto contratado. Este endoso forma parte integral y complementa las Condiciones Generales del Seguro.', 'parameters': {'column_parameters': '', 'row_parameters': [{'row_parameter_name': 'suma asegurada', 'value': '', 'unit': '', 'type': 'std'}, {'row_parameter_name': 'deducible', 'value': '', 'unit': '', 'type': 'std'}, {'row_parameter_name': 'coaseguro', 'value': '', 'unit': '', 'type': 'std'}, {'row_parameter_name': 'tope de coaseguro', 'value': '', 'unit': '', 'type': 'std'}, {'row_parameter_name': 'periodo espera', 'value': '2', 'unit': 'años', 'type': 'std'}, {'row_parameter_name': 'reconocimiento de antigüedad', 'value': 'no aplica', 'type': 'std'}, {'row_parameter_name': 'requisitos', 'value': '', 'type': 'std'}, {'row_parameter_name': 'gastos cubiertos', 'value': 'Quedan cubiertas las enfermedades o accidentes preexistentes cubiertos por la presente póliza.', 'type': 'std'}, {'row_parameter_name': 'gastos no cubiertos', 'value': 'Este endoso modifica la exclusión estipulada en las Condiciones Generales del producto contratado, en el apartado V. Gastos Médicos Mayores No Cubiertos, inciso 1.', 'type': 'std'}, {'row_parameter_name': 'aplicación de deducible y/o coaseguro', 'value': '', 'type': 'std'}, {'row_parameter_name': 'condiciones generales', 'value': 'Los demás términos y condiciones, deben operar conforme se señala en las Condiciones Generales del producto contratado. Este endoso forma parte integral y complementa las Condiciones Generales del Seguro.', 'type': 'std'}, {'row_parameter_name': 'elegibilidad', 'value': '', 'type': 'exception'}, {'row_parameter_name': 'territorio de cobertura', 'value': 'nacional', 'type': 'exception'}], 'legal': 'Los demás términos y condiciones, deben operar conforme se señala en las Condiciones Generales del producto contratado. Este endoso forma parte integral y complementa las Condiciones Generales del Seguro.'}}, 'global_information': {'effective_date': '', 'expiration_date': '', 'factor': '', 'type': ''}, 'business_rules': {'experience': '', 'product_type': '', 'min_net_premium': '', 'min_population': ''}, 'status': '', 'comment': [{'name': '', 'date': '', 'comment': ''}]}","{'token_cost': 0.016225000000000003, 'image_cost': 0, 'total_cost': 0.016225000000000003}",Centro Universitar,FW35125E
endoso_38,"Se ampara el tratamiento médico quirúrgico de hallux valgus o juanetes,_ siempre y cuando no sea de carácter estético.__El monto a indemnizar para este beneficio y/o cobertura será: _De acuerdo a lo siguiente:__Monto Máximo a Indemnizar SA DE LA POLIZA __Con un periodo de espera de: _Sin periodo de espera__Aplicación de deducible y coaseguro:__Pago Directo (Médico y Hospital en convenio de acuerdo al nivel_ hospitalario contratado)__Deducible DE LA POLIZA  S.M.G.M. __Coaseguro DE LA POLIZA   % __Reembolso:__Deducible DE LA POLIZA   S.M.G.M. __Coaseguro DE LA POLIZA  % __En caso de modificación del deducible y/o coaseguro originalmente pactado,_ invariablemente se aplicarán los deducibles y coaseguros antes_ mencionados en dicha cobertura/condición.__El presente endoso modifica el capítulo de Gastos Médicos Mayores No_ Cubiertos en su inciso de Tratamiento Médico o Quirúrgico de Hallux_ Valgus o Juanetes.__Se cubre únicamente en territorio nacional.__Este endoso forma parte integral y complementa las Condiciones Generales_ del Seguro_","{'endoso_id': 'endoso_38', 'endoso_master_id': '38', 'contract_no': 'FW42129D', 'subgrupo': 'SUBGRUPO I', 'type': 'standard', 'endoso_details': {'name': 'HALLUX VALGUS', 'key': '', 'title': '', 'subtitle': '', 'description': 'Se ampara el tratamiento médico quirúrgico de hallux valgus o juanetes, siempre y cuando no sea de carácter estético. El monto a indemnizar para este beneficio y/o cobertura será: De acuerdo a lo siguiente: Monto Máximo a Indemnizar SA DE LA POLIZA Con un periodo de espera de: Sin periodo de espera Aplicación de deducible y coaseguro: Pago Directo (Médico y Hospital en convenio de acuerdo al nivel hospitalario contratado) Deducible DE LA POLIZA S.M.G.M. Coaseguro DE LA POLIZA % Reembolso: Deducible DE LA POLIZA S.M.G.M. Coaseguro DE LA POLIZA % En caso de modificación del deducible y/o coaseguro originalmente pactado, invariablemente se aplicarán los deducibles y coaseguros antes mencionados en dicha cobertura/condición. El presente endoso modifica el capítulo de Gastos Médicos Mayores No Cubiertos en su inciso de Tratamiento Médico o Quirúrgico de Hallux Valgus o Juanetes. Se cubre únicamente en territorio nacional. Este endoso forma parte integral y complementa las Condiciones Generales del Seguro', 'parameters': {'column_parameters': [{'column_parameter_name': 'Pago directo', 'column_parameter_details': [{'sub_column_parameter_name': '', 'row_parameters': [{'row_parameter_name': 'suma asegurada', 'value': 'SA DE LA POLIZA', 'unit': '', 'type': 'std'}, {'row_parameter_name': 'deducible', 'value': 'DE LA POLIZA', 'unit': 'S.M.G.M.', 'type': 'std'}, {'row_parameter_name': 'coaseguro', 'value': 'DE LA POLIZA', 'unit': '%', 'type': 'std'}, {'row_parameter_name': 'tope de coaseguro', 'value': '', 'unit': '', 'type': 'std'}, {'row_parameter_name': 'territorio de cobertura', 'value': 'nacional', 'unit': '', 'type': 'std'}, {'row_parameter_name': 'periodo espera', 'value': 'Sin periodo de espera', 'unit': '', 'type': 'std'}, {'row_parameter_name': 'gastos cubiertos', 'value': '', 'unit': '', 'type': 'std'}, {'row_parameter_name': 'gastos no cubiertos', 'value': 'El presente endoso modifica el capítulo de Gastos Médicos Mayores No Cubiertos en su inciso de Tratamiento Médico o Quirúrgico de Hallux Valgus o Juanetes.', 'unit': '', 'type': 'std'}, {'row_parameter_name': 'aplicación de deducible y/o coaseguro', 'value': 'Y', 'unit': '', 'type': 'std'}, {'row_parameter_name': 'condiciones generales', 'value': 'Este endoso forma parte integral y complementa las Condiciones Generales del Seguro', 'unit': '', 'type': 'std'}, {'row_parameter_name': 'consulta postoperatoria', 'value': '', 'unit': '', 'type': 'exception'}, {'row_parameter_name': 'consulta preoperatoria', 'value': '', 'unit': '', 'type': 'exception'}]}]}, {'column_parameter_name': 'Reembolso', 'column_parameter_details': [{'sub_column_parameter_name': '', 'row_parameters': [{'row_parameter_name': 'suma asegurada', 'value': 'SA DE LA POLIZA', 'unit': '', 'type': 'std'}, {'row_parameter_name': 'deducible', 'value': 'DE LA POLIZA', 'unit': 'S.M.G.M.', 'type': 'std'}, {'row_parameter_name': 'coaseguro', 'value': 'DE LA POLIZA', 'unit': '%', 'type': 'std'}, {'row_parameter_name': 'tope de coaseguro', 'value': '', 'unit': '', 'type': 'std'}, {'row_parameter_name': 'territorio de cobertura', 'value': 'nacional', 'unit': '', 'type': 'std'}, {'row_parameter_name': 'periodo espera', 'value': 'Sin periodo de espera', 'unit': '', 'type': 'std'}, {'row_parameter_name': 'gastos cubiertos', 'value': '', 'unit': '', 'type': 'std'}, {'row_parameter_name': 'gastos no cubiertos', 'value': 'El presente endoso modifica el capítulo de Gastos Médicos Mayores No Cubiertos en su inciso de Tratamiento Médico o Quirúrgico de Hallux Valgus o Juanetes.', 'unit': '', 'type': 'std'}, {'row_parameter_name': 'aplicación de deducible y/o coaseguro', 'value': 'Y', 'unit': '', 'type': 'std'}, {'row_parameter_name': 'condiciones generales', 'value': 'Este endoso forma parte integral y complementa las Condiciones Generales del Seguro', 'unit': '', 'type': 'std'}, {'row_parameter_name': 'consulta postoperatoria', 'value': '', 'unit': '', 'type': 'exception'}, {'row_parameter_name': 'consulta preoperatoria', 'value': '', 'unit': '', 'type': 'exception'}]}]}]}, 'legal': 'Este endoso forma parte integral y complementa las Condiciones Generales del Seguro'}, 'global_information': {'effective_date': '', 'expiration_date': '', 'factor': '', 'type': ''}, 'business_rules': {'experience': '', 'product_type': '', 'min_net_premium': '', 'min_population': ''}, 'status': '', 'comment': [{'name': '', 'date': '', 'comment': ''}]}","{'token_cost': 0.023360000000000002, 'image_cost': 0, 'total_cost': 0.023360000000000002}",SUBGRUPO I,FW42129D
endoso_142,"LITOTRIPSIAS_Como litotripsia se entiende el desmenuzamiento o fragmentación de un_cálculo por medio del litotriptor._Este endoso ampara el pago de honorarios médicos, gastos de  hospitalización,_medicamentos, renta del litotriptor endoscópico o  extracorpóreo y demás_gastos cubiertos generados dentro del hospital._El monto máximo a indemnizar para este beneficio y/o cobertura será:_De acuerdo a lo siguiente:_Monto Máximo a Indemnizar $1,500,000.00_Pago Directo (Médico y Hospital en convenio de acuerdo al nivel  hospitalario_contratado)_Deducible                3.00   S.M.G.M._Coaseguro               10.00   %_Reembolso:_Deducible                3.00   S.M.G.M._Coaseguro               10.00   %_En caso de modificación del deducible y/o coaseguro originalmente pactado,_invariablemente se aplicarán los deducibles y coaseguros antes  mencionados_en dicha cobertura/condición._El Asegurado deberá cumplir con un periodo de espera, a partir de su_inscripción en la póliza:_Se elimina periodo de espera_Se cubre únicamente en territorio nacional._Los demás términos y condiciones, deben operar conforme se señala en las_Condiciones Generales del producto contratado._Este endoso forma parte integral y complementa las Condiciones Generales  del_Seguro","{'endoso_id': 'endoso_142', 'endoso_master_id': '142', 'contract_no': 'FW47100B', 'subgrupo': 'MANAGERS', 'type': 'standard', 'endoso_details': {'name': 'LITOTRIPSIAS', 'key': '', 'title': '', 'subtitle': '', 'description': 'Como litotripsia se entiende el desmenuzamiento o fragmentación de un cálculo por medio del litotriptor. Este endoso ampara el pago de honorarios médicos, gastos de hospitalización, medicamentos, renta del litotriptor endoscópico o extracorpóreo y demás gastos cubiertos generados dentro del hospital. El monto máximo a indemnizar para este beneficio y/o cobertura será: De acuerdo a lo siguiente: Monto Máximo a Indemnizar $1,500,000.00 Pago Directo (Médico y Hospital en convenio de acuerdo al nivel hospitalario contratado) Deducible 3.00 S.M.G.M. Coaseguro 10.00 % Reembolso: Deducible 3.00 S.M.G.M. Coaseguro 10.00 % En caso de modificación del deducible y/o coaseguro originalmente pactado, invariablemente se aplicarán los deducibles y coaseguros antes mencionados en dicha cobertura/condición. El Asegurado deberá cumplir con un periodo de espera, a partir de su inscripción en la póliza: Se elimina periodo de espera Se cubre únicamente en territorio nacional. Los demás términos y condiciones, deben operar conforme se señala en las Condiciones Generales del producto contratado. Este endoso forma parte integral y complementa las Condiciones Generales del Seguro', 'parameters': {'column_parameters': [{'column_parameter_name': 'Pago directo', 'column_parameter_details': [{'sub_column_parameter_name': '', 'row_parameters': [{'row_parameter_name': 'suma asegurada', 'value': '1,500,000', 'unit': 'MXN', 'type': 'std'}, {'row_parameter_name': 'deducible', 'value': '3.00', 'unit': 'S.M.G.M.', 'type': 'std'}, {'row_parameter_name': 'coaseguro', 'value': '10.00', 'unit': '%', 'type': 'std'}, {'row_parameter_name': 'periodo espera', 'value': 'Se elimina periodo de espera', 'type': 'std'}, {'row_parameter_name': 'territorio de cobertura', 'value': 'nacional', 'type': 'std'}, {'row_parameter_name': 'consulta postoperatoria', 'value': '', 'type': 'std'}, {'row_parameter_name': 'consulta preoperatoria', 'value': '', 'type': 'std'}, {'row_parameter_name': 'aplicación de deducible y/o coaseguro', 'value': 'true', 'type': 'std'}, {'row_parameter_name': 'condiciones generales', 'value': 'Los demás términos y condiciones, deben operar conforme se señala en las Condiciones Generales del producto contratado. Este endoso forma parte integral y complementa las Condiciones Generales del Seguro.', 'type': 'std'}, {'row_parameter_name': 'elegibilidad', 'value': '', 'type': 'exception'}, {'row_parameter_name': 'tope de coaseguro', 'value': '', 'type': 'exception'}, {'row_parameter_name': 'número de sesiones', 'value': '', 'type': 'exception'}]}]}, {'column_parameter_name': 'Reembolso', 'column_parameter_details': [{'sub_column_parameter_name': '', 'row_parameters': [{'row_parameter_name': 'suma asegurada', 'value': '1,500,000', 'unit': 'MXN', 'type': 'std'}, {'row_parameter_name': 'deducible', 'value': '3.00', 'unit': 'S.M.G.M.', 'type': 'std'}, {'row_parameter_name': 'coaseguro', 'value': '10.00', 'unit': '%', 'type': 'std'}, {'row_parameter_name': 'periodo espera', 'value': 'Se elimina periodo de espera', 'type': 'std'}, {'row_parameter_name': 'territorio de cobertura', 'value': 'nacional', 'type': 'std'}, {'row_parameter_name': 'consulta postoperatoria', 'value': '', 'type': 'std'}, {'row_parameter_name': 'consulta preoperatoria', 'value': '', 'type': 'std'}, {'row_parameter_name': 'aplicación de deducible y/o coaseguro', 'value': 'true', 'type': 'std'}, {'row_parameter_name': 'condiciones generales', 'value': 'Los demás términos y condiciones, deben operar conforme se señala en las Condiciones Generales del producto contratado. Este endoso forma parte integral y complementa las Condiciones Generales del Seguro.', 'type': 'std'}, {'row_parameter_name': 'elegibilidad', 'value': '', 'type': 'exception'}, {'row_parameter_name': 'tope de coaseguro', 'value': '', 'type': 'exception'}, {'row_parameter_name': 'número de sesiones', 'value': '', 'type': 'exception'}]}]}]}, 'legal': 'Los demás términos y condiciones, deben operar conforme se señala en las Condiciones Generales del producto contratado. Este endoso forma parte integral y complementa las Condiciones Generales del Seguro.'}, 'global_information': {'effective_date': '', 'expiration_date': '', 'factor': '', 'type': ''}, 'business_rules': {'experience': '', 'product_type': '', 'min_net_premium': '', 'min_population': ''}, 'status': '', 'comment': [{'name': '', 'date': '', 'comment': ''}]}","{'token_cost': 0.022825, 'image_cost': 0, 'total_cost': 0.022825}",MANAGERS,FW47100B
