endoso_code,text,extracted_parameters,cost_metrics,nom_subg,contract_no
endoso_142,"Como litotripsia se entiende el desmenuzamiento o fragmentación de un_ cálculo por medio del litotriptor.__Este endoso ampara el pago de honorarios médicos, gastos de_ hospitalización, medicamentos, renta del litotriptor endoscópico o_ extracorpóreo y demás gastos cubiertos generados dentro del hospital.__El monto máximo a indemnizar para este beneficio y/o cobertura será:  _De acuerdo a las condiciones generales (26 veces el S.M.G.M)__Monto Máximo a Indemnizar 26 SMGM __Pago Directo (Médico y Hospital en convenio de acuerdo al nivel_ hospitalario contratado)__Deducible            2,500.00   M.N. __Coaseguro                0.00   % __Reembolso:__Deducible            5,000.00   M.N. __Coaseguro               10.00   % __En caso de modificación del deducible y/o coaseguro originalmente pactado,_ invariablemente se aplicarán los deducibles y coaseguros antes_ mencionados en dicha cobertura/condición.__El Asegurado deberá cumplir con un periodo de espera, a partir de su_ inscripción en la póliza: _Se elimina periodo de espera__Se cubre únicamente en territorio nacional.__Los demás términos y condiciones, deben operar conforme se señala en las_ Condiciones Generales del producto contratado.__Este endoso forma parte integral y complementa las Condiciones Generales_ del Seguro_","{'endoso_id': 'endoso_142', 'endoso_master_id': '142', 'contract_no': 'FW43960C', 'subgrupo': 'ADMINISTRATIVOS', 'type': 'standard', 'endoso_details': {'name': 'LITOTRIPSIAS', 'key': '', 'title': '', 'subtitle': '', 'description': 'Como litotripsia se entiende el desmenuzamiento o fragmentación de un cálculo por medio del litotriptor. Este endoso ampara el pago de honorarios médicos, gastos de hospitalización, medicamentos, renta del litotriptor endoscópico o extracorpóreo y demás gastos cubiertos generados dentro del hospital. El monto máximo a indemnizar para este beneficio y/o cobertura será: De acuerdo a las condiciones generales (26 veces el S.M.G.M) Monto Máximo a Indemnizar 26 SMGM Pago Directo (Médico y Hospital en convenio de acuerdo al nivel hospitalario contratado) Deducible 2,500.00 M.N. Coaseguro 0.00 % Reembolso: Deducible 5,000.00 M.N. Coaseguro 10.00 % En caso de modificación del deducible y/o coaseguro originalmente pactado, invariablemente se aplicarán los deducibles y coaseguros antes mencionados en dicha cobertura/condición. El Asegurado deberá cumplir con un periodo de espera, a partir de su inscripción en la póliza: Se elimina periodo de espera Se cubre únicamente en territorio nacional. Los demás términos y condiciones, deben operar conforme se señala en las Condiciones Generales del producto contratado. Este endoso forma parte integral y complementa las Condiciones Generales del Seguro', 'parameters': {'column_parameters': [{'column_parameter_name': 'Pago directo', 'column_parameter_details': [{'sub_column_parameter_name': '', 'row_parameters': [{'row_parameter_name': 'suma asegurada', 'value': '', 'unit': '', 'type': 'std'}, {'row_parameter_name': 'deducible', 'value': '2,500.00', 'unit': 'M.N.', 'type': 'std'}, {'row_parameter_name': 'coaseguro', 'value': '0.00', 'unit': '%', 'type': 'std'}, {'row_parameter_name': 'periodo espera', 'value': 'Se elimina periodo de espera', 'unit': '', 'type': 'std'}, {'row_parameter_name': 'territorio de cobertura', 'value': 'nacional', 'unit': '', 'type': 'std'}, {'row_parameter_name': 'consulta postoperatoria', 'value': '', 'unit': '', 'type': 'std'}, {'row_parameter_name': 'consulta preoperatoria', 'value': '', 'unit': '', 'type': 'std'}, {'row_parameter_name': 'aplicación de deducible y/o coaseguro', 'value': 'true', 'unit': '', 'type': 'std'}, {'row_parameter_name': 'condiciones generales', 'value': 'Los demás términos y condiciones, deben operar conforme se señala en las Condiciones Generales del producto contratado. Este endoso forma parte integral y complementa las Condiciones Generales del Seguro.', 'unit': '', 'type': 'std'}, {'row_parameter_name': 'elegibilidad', 'value': '', 'unit': '', 'type': 'exception'}, {'row_parameter_name': 'tope de coaseguro', 'value': '', 'unit': '', 'type': 'exception'}, {'row_parameter_name': 'número de sesiones', 'value': '', 'unit': '', 'type': 'exception'}]}]}, {'column_parameter_name': 'Reembolso', 'column_parameter_details': [{'sub_column_parameter_name': '', 'row_parameters': [{'row_parameter_name': 'suma asegurada', 'value': '', 'unit': '', 'type': 'std'}, {'row_parameter_name': 'deducible', 'value': '5,000.00', 'unit': 'M.N.', 'type': 'std'}, {'row_parameter_name': 'coaseguro', 'value': '10.00', 'unit': '%', 'type': 'std'}, {'row_parameter_name': 'periodo espera', 'value': 'Se elimina periodo de espera', 'unit': '', 'type': 'std'}, {'row_parameter_name': 'territorio de cobertura', 'value': 'nacional', 'unit': '', 'type': 'std'}, {'row_parameter_name': 'consulta postoperatoria', 'value': '', 'unit': '', 'type': 'std'}, {'row_parameter_name': 'consulta preoperatoria', 'value': '', 'unit': '', 'type': 'std'}, {'row_parameter_name': 'aplicación de deducible y/o coaseguro', 'value': 'true', 'unit': '', 'type': 'std'}, {'row_parameter_name': 'condiciones generales', 'value': 'Los demás términos y condiciones, deben operar conforme se señala en las Condiciones Generales del producto contratado. Este endoso forma parte integral y complementa las Condiciones Generales del Seguro.', 'unit': '', 'type': 'std'}, {'row_parameter_name': 'elegibilidad', 'value': '', 'unit': '', 'type': 'exception'}, {'row_parameter_name': 'tope de coaseguro', 'value': '', 'unit': '', 'type': 'exception'}, {'row_parameter_name': 'número de sesiones', 'value': '', 'unit': '', 'type': 'exception'}]}]}]}, 'legal': 'Los demás términos y condiciones, deben operar conforme se señala en las Condiciones Generales del producto contratado. Este endoso forma parte integral y complementa las Condiciones Generales del Seguro.'}, 'global_information': {'effective_date': '', 'expiration_date': '', 'factor': '', 'type': ''}, 'business_rules': {'experience': '', 'product_type': '', 'min_net_premium': '', 'min_population': ''}, 'status': '', 'comment': [{'name': '', 'date': '', 'comment': ''}]}","{'token_cost': 0.023595, 'image_cost': 0, 'total_cost': 0.023595}",ADMINISTRATIVOS,FW43960C
endoso_84,_Este Endoso forma parte del Contrato de Seguro.,"{'endoso_id': 'endoso_84', 'endoso_master_id': '84', 'contract_no': 'FW50475B', 'subgrupo': 'Novachem', 'type': 'standard', 'endoso_details': {'name': 'URGENCIA MÉDICA EN EL EXTRANJERO (UMEX)', 'key': '', 'title': '', 'subtitle': '', 'description': 'Este Endoso forma parte del Contrato de Seguro.', 'parameters': {'column_parameters': [{'column_parameter_name': 'Urgencias Médicas', 'column_parameter_details': [{'sub_column_parameter_name': '', 'row_parameters': [{'row_parameter_name': 'suma asegurada', 'value': '', 'unit': '', 'type': 'std'}, {'row_parameter_name': 'deducible', 'value': '', 'unit': '', 'type': 'std'}, {'row_parameter_name': 'coaseguro', 'value': '', 'unit': '', 'type': 'std'}, {'row_parameter_name': 'información adicional', 'value': '', 'type': 'std'}, {'row_parameter_name': 'gastos cubiertos', 'value': '', 'type': 'std'}, {'row_parameter_name': 'gastos no cubiertos', 'value': '', 'type': 'std'}, {'row_parameter_name': 'aplicación de deducible y/o coaseguro', 'value': '', 'type': 'std'}, {'row_parameter_name': 'condiciones generales', 'value': 'Para los demás términos y condiciones, aplicarán las Condiciones Generales vigentes del producto contratado. Este Endoso forma parte del Contrato de Seguro.', 'type': 'std'}, {'row_parameter_name': 'elegibilidad', 'value': '', 'type': 'exception'}, {'row_parameter_name': 'periodo de espera', 'value': '', 'type': 'exception'}, {'row_parameter_name': 'tope de coaseguro', 'value': '', 'type': 'exception'}, {'row_parameter_name': 'territorio de cobertura', 'value': '', 'type': 'exception'}]}]}, {'column_parameter_name': 'Accidente', 'column_parameter_details': [{'sub_column_parameter_name': '', 'row_parameters': [{'row_parameter_name': 'suma asegurada', 'value': '', 'unit': '', 'type': 'std'}, {'row_parameter_name': 'deducible', 'value': '', 'unit': '', 'type': 'std'}, {'row_parameter_name': 'coaseguro', 'value': '', 'unit': '', 'type': 'std'}, {'row_parameter_name': 'información adicional', 'value': '', 'type': 'std'}, {'row_parameter_name': 'gastos cubiertos', 'value': '', 'type': 'std'}, {'row_parameter_name': 'gastos no cubiertos', 'value': '', 'type': 'std'}, {'row_parameter_name': 'aplicación de deducible y/o coaseguro', 'value': '', 'type': 'std'}, {'row_parameter_name': 'condiciones generales', 'value': 'Para los demás términos y condiciones, aplicarán las Condiciones Generales vigentes del producto contratado. Este Endoso forma parte del Contrato de Seguro.', 'type': 'std'}, {'row_parameter_name': 'elegibilidad', 'value': '', 'type': 'exception'}, {'row_parameter_name': 'periodo de espera', 'value': '', 'type': 'exception'}, {'row_parameter_name': 'tope de coaseguro', 'value': '', 'type': 'exception'}, {'row_parameter_name': 'territorio de cobertura', 'value': '', 'type': 'exception'}]}]}]}, 'legal': 'Para los demás términos y condiciones, aplicarán las Condiciones Generales vigentes del producto contratado. Este Endoso forma parte del Contrato de Seguro.'}, 'global_information': {'effective_date': '', 'expiration_date': '', 'factor': '', 'type': ''}, 'business_rules': {'experience': '', 'product_type': '', 'min_net_premium': '', 'min_population': ''}, 'status': '', 'comment': [{'name': '', 'date': '', 'comment': ''}]}","{'token_cost': 0.018732500000000003, 'image_cost': 0, 'total_cost': 0.018732500000000003}",Novachem,FW50475B
endoso_84,__Este endoso forma parte integral y complementa las Condiciones Generales_del Seguro.,"{'endoso_id': 'endoso_84', 'endoso_master_id': '84', 'contract_no': 'FW50475B', 'subgrupo': 'Novachem', 'type': 'standard', 'endoso_details': {'name': 'URGENCIA MÉDICA EN EL EXTRANJERO (UMEX)', 'key': '', 'title': '', 'subtitle': '', 'description': 'Este endoso forma parte integral y complementa las Condiciones Generales del Seguro.', 'parameters': {'column_parameters': [{'column_parameter_name': 'Urgencias Médicas', 'column_parameter_details': [{'sub_column_parameter_name': '', 'row_parameters': [{'row_parameter_name': 'suma asegurada', 'value': '', 'unit': '', 'type': 'std'}, {'row_parameter_name': 'deducible', 'value': '', 'unit': '', 'type': 'std'}, {'row_parameter_name': 'coaseguro', 'value': '', 'unit': '', 'type': 'std'}, {'row_parameter_name': 'información adicional', 'value': '', 'type': 'std'}, {'row_parameter_name': 'gastos cubiertos', 'value': '', 'type': 'std'}, {'row_parameter_name': 'gastos no cubiertos', 'value': '', 'type': 'std'}, {'row_parameter_name': 'aplicación de deducible y/o coaseguro', 'value': '', 'type': 'std'}, {'row_parameter_name': 'condiciones generales', 'value': 'Para los demás términos y condiciones, aplicarán las Condiciones Generales vigentes del producto contratado. Este Endoso forma parte del Contrato de Seguro.', 'type': 'std'}, {'row_parameter_name': 'elegibilidad', 'value': '', 'type': 'exception'}, {'row_parameter_name': 'periodo de espera', 'value': '', 'type': 'exception'}, {'row_parameter_name': 'tope de coaseguro', 'value': '', 'type': 'exception'}, {'row_parameter_name': 'territorio de cobertura', 'value': '', 'type': 'exception'}]}]}, {'column_parameter_name': 'Accidente', 'column_parameter_details': [{'sub_column_parameter_name': '', 'row_parameters': [{'row_parameter_name': 'suma asegurada', 'value': '', 'unit': '', 'type': 'std'}, {'row_parameter_name': 'deducible', 'value': '', 'unit': '', 'type': 'std'}, {'row_parameter_name': 'coaseguro', 'value': '', 'unit': '', 'type': 'std'}, {'row_parameter_name': 'información adicional', 'value': '', 'type': 'std'}, {'row_parameter_name': 'gastos cubiertos', 'value': '', 'type': 'std'}, {'row_parameter_name': 'gastos no cubiertos', 'value': '', 'type': 'std'}, {'row_parameter_name': 'aplicación de deducible y/o coaseguro', 'value': '', 'type': 'std'}, {'row_parameter_name': 'condiciones generales', 'value': 'Para los demás términos y condiciones, aplicarán las Condiciones Generales vigentes del producto contratado. Este Endoso forma parte del Contrato de Seguro.', 'type': 'std'}, {'row_parameter_name': 'elegibilidad', 'value': '', 'type': 'exception'}, {'row_parameter_name': 'periodo de espera', 'value': '', 'type': 'exception'}, {'row_parameter_name': 'tope de coaseguro', 'value': '', 'type': 'exception'}, {'row_parameter_name': 'territorio de cobertura', 'value': '', 'type': 'exception'}]}]}]}, 'legal': 'Este endoso forma parte integral y complementa las Condiciones Generales del Seguro.'}, 'global_information': {'effective_date': '', 'expiration_date': '', 'factor': '', 'type': ''}, 'business_rules': {'experience': '', 'product_type': '', 'min_net_premium': '', 'min_population': ''}, 'status': '', 'comment': [{'name': '', 'date': '', 'comment': ''}]}","{'token_cost': 0.018507500000000003, 'image_cost': 0, 'total_cost': 0.018507500000000003}",Novachem,FW50475B
endoso_84,"Es la aparición repentina de una alteración de la salud del Asegurado, la_cual se manifiesta a través de síntomas agudos de tal severidad, que ponen_en peligro la vida del enfermo o accidentado, su integridad corporal o la_viabilidad de alguno de sus órganos.__Por medio de este documento se hace constar que:_Se cubren los gastos originados en caso de sufrir alguna enfermedad o_accidente que pueda ser considerada como urgencia médica en cualquier lugar_del mundo, para la cual no se haya presentado atención médica previa al_acontecimiento en territorio nacional.__Si, a la solicitud del seguro, El Contratante requiere incluir algún(os)_padecimiento(s) a la póliza que esté especificado como exclusión en las_Condiciones Generales del Seguro, éste(os) se deberá(n) incluir mediante_endoso especial. Dicho(s) padecimiento(s) podrá(n) cubrirse en territorio_extranjero con las limitaciones y condiciones de la cobertura de urgencia_médica en el extranjero.__Esta cobertura aplica de acuerdo con los siguientes límites y condiciones:__Pago de Reclamaciones__Sistema de Pago por Reembolso:_Funciona para aquellos gastos cubiertos por la póliza en atención médica de_urgencia que:_-El servicio médico se hubiere proporcionado en hospitales no afiliados._- Por la situación del internamiento (falta de documentos, duda en cuanto_a la vigencia de la póliza, coberturas, alta de asegurados, pagos, etc.)_no se hubiera dado autorización de pago directo.__Sistema de Pago Directo:_A través de este sistema La Compañía pagará, si así lo autoriza,_directamente a los médicos y hospitales que acepten el pago directo sin_que el asegurado tenga que realizar desembolso por los gastos erogados,_quedando únicamente a su cargo los gastos no cubiertos.__En caso de que el asegurado optara por atenderse en un hospital y con_médicos afiliados y que el internamiento sea mayor a 24 hrs., podrá hacer_uso del sistema de pago directo en el que, previa verificación de La_Compañía respecto a la procedencia del caso, vigencia de póliza, endosos_especiales, alta de asegurados, pagos, etc., si procede el internamiento,_La Compañía efectuará el pago de los gastos cubiertos por la póliza en_forma directa al hospital y médicos afiliados, eliminando en estos casos_la cantidad por concepto de deducible.__Para operar dicho sistema se entregará al asegurado una tarjeta de_identificación en la que se consignan los teléfonos de servicios en los_que se proporcionará los nombres de los hospitales y médicos afiliados que_lo puedan atender. Este sistema se otorgará sin cargo adicional de prima.__Gastos Cubiertos_1.- Cuarto semi-privado y alimentos del paciente._2. Médicos y/o cirujanos. Honorarios por intervención quirúrgica, así como_visitas intrahospitalarias._3. Anestesista. Honorarios profesionales._4. Suministros en el hospital. Medicamentos, material médico, equipos_anestésicos y sala de operaciones._5. Servicio de diagnóstico. Exámenes de laboratorio y gabinete,_radiografías, etc._6. Servicio de ambulancia terrestre. En la localidad hacia o desde el_hospital, siempre y cuando médicamente sea necesario._7. Aparatos ortopédicos y prótesis, necesarios para el tratamiento médico a_excepción de reemplazos._8. Para UME Los gastos médicos del recién nacido quedarán cubiertos a_partir del primer día de nacido de acuerdo a las condiciones generales_de la póliza y/o endosos especiales.__Esta cobertura no ampara:_A. Las exclusiones y limitaciones de los gastos que se encuentran_estipulados como gastos no cubiertos de las Condiciones Generales del_Seguro salvo lo especificado en los endosos adicionales que forman parte_integral de la póliza y en apego a la definición de urgencia médica._B. Tratamientos que no sean catalogados como de urgencia, de común acuerdo_por el médico tratante y La Compañía._C. No quedarán cubiertos los accidentes o enfermedades que se hayan_originado en la República Mexicana, así como sus consecuencias o_complicaciones, sean o no motivo de la estancia o el viaje._D. No quedar","{'endoso_id': 'endoso_84', 'endoso_master_id': '84', 'contract_no': 'FW54113A', 'subgrupo': 'DIRECTORES', 'type': 'standard', 'endoso_details': {'name': 'URGENCIA MÉDICA EN EL EXTRANJERO (UMEX)', 'key': '', 'title': '', 'subtitle': '', 'description': 'Es la aparición repentina de una alteración de la salud del Asegurado, la cual se manifiesta a través de síntomas agudos de tal severidad, que ponen en peligro la vida del enfermo o accidentado, su integridad corporal o la viabilidad de alguno de sus órganos. Por medio de este documento se hace constar que: Se cubren los gastos originados en caso de sufrir alguna enfermedad o accidente que pueda ser considerada como urgencia médica en cualquier lugar del mundo, para la cual no se haya presentado atención médica previa al acontecimiento en territorio nacional. Si, a la solicitud del seguro, El Contratante requiere incluir algún(os) padecimiento(s) a la póliza que esté especificado como exclusión en las Condiciones Generales del Seguro, éste(os) se deberá(n) incluir mediante endoso especial. Dicho(s) padecimiento(s) podrá(n) cubrirse en territorio extranjero con las limitaciones y condiciones de la cobertura de urgencia médica en el extranjero. Esta cobertura aplica de acuerdo con los siguientes límites y condiciones: Pago de Reclamaciones Sistema de Pago por Reembolso: Funciona para aquellos gastos cubiertos por la póliza en atención médica de urgencia que: -El servicio médico se hubiere proporcionado en hospitales no afiliados. - Por la situación del internamiento (falta de documentos, duda en cuanto a la vigencia de la póliza, coberturas, alta de asegurados, pagos, etc.) no se hubiera dado autorización de pago directo. Sistema de Pago Directo: A través de este sistema La Compañía pagará, si así lo autoriza, directamente a los médicos y hospitales que acepten el pago directo sin que el asegurado tenga que realizar desembolso por los gastos erogados, quedando únicamente a su cargo los gastos no cubiertos. En caso de que el asegurado optara por atenderse en un hospital y con médicos afiliados y que el internamiento sea mayor a 24 hrs., podrá hacer uso del sistema de pago directo en el que, previa verificación de La Compañía respecto a la procedencia del caso, vigencia de póliza, endosos especiales, alta de asegurados, pagos, etc., si procede el internamiento, La Compañía efectuará el pago de los gastos cubiertos por la póliza en forma directa al hospital y médicos afiliados, eliminando en estos casos la cantidad por concepto de deducible. Para operar dicho sistema se entregará al asegurado una tarjeta de identificación en la que se consignan los teléfonos de servicios en los que se proporcionará los nombres de los hospitales y médicos afiliados que lo puedan atender. Este sistema se otorgará sin cargo adicional de prima. Gastos Cubiertos 1.- Cuarto semi-privado y alimentos del paciente. 2. Médicos y/o cirujanos. Honorarios por intervención quirúrgica, así como visitas intrahospitalarias. 3. Anestesista. Honorarios profesionales. 4. Suministros en el hospital. Medicamentos, material médico, equipos anestésicos y sala de operaciones. 5. Servicio de diagnóstico. Exámenes de laboratorio y gabinete, radiografías, etc. 6. Servicio de ambulancia terrestre. En la localidad hacia o desde el hospital, siempre y cuando médicamente sea necesario. 7. Aparatos ortopédicos y prótesis, necesarios para el tratamiento médico a excepción de reemplazos. 8. Para UME Los gastos médicos del recién nacido quedarán cubiertos a partir del primer día de nacido de acuerdo a las condiciones generales de la póliza y/o endosos especiales. Esta cobertura no ampara: A. Las exclusiones y limitaciones de los gastos que se encuentran estipulados como gastos no cubiertos de las Condiciones Generales del Seguro salvo lo especificado en los endosos adicionales que forman parte integral de la póliza y en apego a la definición de urgencia médica. B. Tratamientos que no sean catalogados como de urgencia, de común acuerdo por el médico tratante y La Compañía. C. No quedarán cubiertos los accidentes o enfermedades que se hayan originado en la República Mexicana, así como sus consecuencias o complicaciones, sean o no motivo de la estancia o el viaje.', 'parameters': {'column_parameters': [{'column_parameter_name': 'Urgencias Médicas', 'column_parameter_details': [{'sub_column_parameter_name': '', 'row_parameters': [{'row_parameter_name': 'suma asegurada', 'value': '', 'unit': '', 'type': 'std'}, {'row_parameter_name': 'deducible', 'value': '', 'unit': '', 'type': 'std'}, {'row_parameter_name': 'coaseguro', 'value': '', 'unit': '', 'type': 'std'}, {'row_parameter_name': 'información adicional', 'value': '', 'type': 'std'}, {'row_parameter_name': 'gastos cubiertos', 'value': '1.- Cuarto semi-privado y alimentos del paciente. 2. Médicos y/o cirujanos. Honorarios por intervención quirúrgica, así como visitas intrahospitalarias. 3. Anestesista. Honorarios profesionales. 4. Suministros en el hospital. Medicamentos, material médico, equipos anestésicos y sala de operaciones. 5. Servicio de diagnóstico. Exámenes de laboratorio y gabinete, radiografías, etc. 6. Servicio de ambulancia terrestre. En la localidad hacia o desde el hospital, siempre y cuando médicamente sea necesario. 7. Aparatos ortopédicos y prótesis, necesarios para el tratamiento médico a excepción de reemplazos. 8. Para UME Los gastos médicos del recién nacido quedarán cubiertos a partir del primer día de nacido de acuerdo a las condiciones generales de la póliza y/o endosos especiales.', 'type': 'std'}, {'row_parameter_name': 'gastos no cubiertos', 'value': 'A. Las exclusiones y limitaciones de los gastos que se encuentran estipulados como gastos no cubiertos de las Condiciones Generales del Seguro salvo lo especificado en los endosos adicionales que forman parte integral de la póliza y en apego a la definición de urgencia médica. B. Tratamientos que no sean catalogados como de urgencia, de común acuerdo por el médico tratante y La Compañía. C. No quedarán cubiertos los accidentes o enfermedades que se hayan originado en la República Mexicana, así como sus consecuencias o complicaciones, sean o no motivo de la estancia o el viaje.', 'type': 'std'}, {'row_parameter_name': 'aplicación de deducible y/o coaseguro', 'value': 'false', 'type': 'std'}, {'row_parameter_name': 'condiciones generales', 'value': 'Para los demás términos y condiciones, aplicarán las Condiciones Generales vigentes del producto contratado. Este Endoso forma parte del Contrato de Seguro.', 'type': 'std'}, {'row_parameter_name': 'elegibilidad', 'value': '', 'type': 'exception'}, {'row_parameter_name': 'periodo de espera', 'value': '', 'type': 'exception'}, {'row_parameter_name': 'tope de coaseguro', 'value': '', 'type': 'exception'}, {'row_parameter_name': 'territorio de cobertura', 'value': 'extranjero', 'type': 'exception'}]}]}]}, 'legal': 'Para los demás términos y condiciones, aplicarán las Condiciones Generales vigentes del producto contratado. Este Endoso forma parte del Contrato de Seguro.'}, 'global_information': {'effective_date': '', 'expiration_date': '', 'factor': '', 'type': ''}, 'business_rules': {'experience': '', 'product_type': '', 'min_net_premium': '', 'min_population': ''}, 'status': '', 'comment': [{'name': '', 'date': '', 'comment': ''}]}","{'token_cost': 0.02771, 'image_cost': 0, 'total_cost': 0.02771}",DIRECTORES,FW54113A
