endoso_code,text,extracted_parameters,cost_metrics,nom_subg,contract_no
endoso_38,"Se ampara el tratamiento médico quirúrgico de hallux valgus o juanetes,_siempre y cuando no sea de carácter estético.__El monto a indemnizar para este beneficio y/o cobertura será:_Hasta el G.U.A.__Sin periodo de espera__Aplicación de deducible y coaseguro:_Pago Directo (Médico y Hospital de Red):_Deducible: Se elimina hasta $2,500.00 M.N._Coaseguro: Se elimina hasta 10 puntos porcentuales._Reembolso:_Deducible: Aplica el contratado en la caratula de la poliza_Coaseguro: Aplica el contratado en la caratula de la poliza_En caso de modificación del deducible y/o coaseguro originalmente pactado,_invariablemente se aplicarán los deducibles y coaseguros antes mencionados_en dicha cobertura/condición._El presente endoso modifica el capítulo de Gastos Médicos Mayores No Cubier-_en su inciso de Tratamiento Médico o Quirúrgico de Hallux Valgus o Juanetes._Se cubre únicamente en territorio nacional.__Este endoso forma parte integral y complementa las Condiciones Generales del_Seguro.___","{'endoso_id': 'endoso_38', 'endoso_master_id': '38', 'contract_no': 'FW27500H', 'subgrupo': 'SUPERIO', 'type': 'standard', 'endoso_details': {'name': 'HALLUX VALGUS', 'key': '', 'title': '', 'subtitle': '', 'description': 'Se ampara el tratamiento médico quirúrgico de hallux valgus o juanetes, siempre y cuando no sea de carácter estético. El monto a indemnizar para este beneficio y/o cobertura será: Hasta el G.U.A. Sin periodo de espera Aplicación de deducible y coaseguro: Pago Directo (Médico y Hospital de Red): Deducible: Se elimina hasta $2,500.00 M.N. Coaseguro: Se elimina hasta 10 puntos porcentuales. Reembolso: Deducible: Aplica el contratado en la caratula de la poliza Coaseguro: Aplica el contratado en la caratula de la poliza En caso de modificación del deducible y/o coaseguro originalmente pactado, invariablemente se aplicarán los deducibles y coaseguros antes mencionados en dicha cobertura/condición. El presente endoso modifica el capítulo de Gastos Médicos Mayores No Cubier- en su inciso de Tratamiento Médico o Quirúrgico de Hallux Valgus o Juanetes. Se cubre únicamente en territorio nacional. Este endoso forma parte integral y complementa las Condiciones Generales del Seguro.', 'parameters': {'column_parameters': [{'column_parameter_name': 'Pago directo', 'column_parameter_details': [{'sub_column_parameter_name': '', 'row_parameters': [{'row_parameter_name': 'suma asegurada', 'value': 'Hasta el G.U.A.', 'unit': '', 'type': 'std'}, {'row_parameter_name': 'deducible', 'value': 'Se elimina hasta 2,500.00', 'unit': 'M.N.', 'type': 'std'}, {'row_parameter_name': 'coaseguro', 'value': 'Se elimina hasta 10', 'unit': 'puntos porcentuales', 'type': 'std'}, {'row_parameter_name': 'tope de coaseguro', 'value': '', 'unit': '', 'type': 'std'}, {'row_parameter_name': 'territorio de cobertura', 'value': 'nacional', 'unit': '', 'type': 'std'}, {'row_parameter_name': 'periodo espera', 'value': 'Sin periodo de espera', 'unit': '', 'type': 'std'}, {'row_parameter_name': 'gastos cubiertos', 'value': '', 'unit': '', 'type': 'std'}, {'row_parameter_name': 'gastos no cubiertos', 'value': '', 'unit': '', 'type': 'std'}, {'row_parameter_name': 'aplicación de deducible y/o coaseguro', 'value': 'Y', 'unit': '', 'type': 'std'}, {'row_parameter_name': 'condiciones generales', 'value': 'Para los demás términos y condiciones, aplicarán las Condiciones Generales vigentes del producto contratado. Este Endoso forma parte del Contrato de Seguro.', 'unit': '', 'type': 'std'}, {'row_parameter_name': 'consulta postoperatoria', 'value': '', 'unit': '', 'type': 'exception'}, {'row_parameter_name': 'consulta preoperatoria', 'value': '', 'unit': '', 'type': 'exception'}]}]}, {'column_parameter_name': 'Reembolso', 'column_parameter_details': [{'sub_column_parameter_name': '', 'row_parameters': [{'row_parameter_name': 'suma asegurada', 'value': 'Hasta el G.U.A.', 'unit': '', 'type': 'std'}, {'row_parameter_name': 'deducible', 'value': 'Aplica el contratado en la caratula de la poliza', 'unit': '', 'type': 'std'}, {'row_parameter_name': 'coaseguro', 'value': 'Aplica el contratado en la caratula de la poliza', 'unit': '', 'type': 'std'}, {'row_parameter_name': 'tope de coaseguro', 'value': '', 'unit': '', 'type': 'std'}, {'row_parameter_name': 'territorio de cobertura', 'value': 'nacional', 'unit': '', 'type': 'std'}, {'row_parameter_name': 'periodo espera', 'value': 'Sin periodo de espera', 'unit': '', 'type': 'std'}, {'row_parameter_name': 'gastos cubiertos', 'value': '', 'unit': '', 'type': 'std'}, {'row_parameter_name': 'gastos no cubiertos', 'value': '', 'unit': '', 'type': 'std'}, {'row_parameter_name': 'aplicación de deducible y/o coaseguro', 'value': 'Y', 'unit': '', 'type': 'std'}, {'row_parameter_name': 'condiciones generales', 'value': 'Para los demás términos y condiciones, aplicarán las Condiciones Generales vigentes del producto contratado. Este Endoso forma parte del Contrato de Seguro.', 'unit': '', 'type': 'std'}, {'row_parameter_name': 'consulta postoperatoria', 'value': '', 'unit': '', 'type': 'exception'}, {'row_parameter_name': 'consulta preoperatoria', 'value': '', 'unit': '', 'type': 'exception'}]}]}]}, 'legal': 'Este endoso forma parte integral y complementa las Condiciones Generales del Seguro.'}, 'global_information': {'effective_date': '', 'expiration_date': '', 'factor': '', 'type': ''}, 'business_rules': {'experience': '', 'product_type': '', 'min_net_premium': '', 'min_population': ''}, 'status': '', 'comment': [{'name': '', 'date': '', 'comment': ''}]}","{'token_cost': 0.0229975, 'image_cost': 0, 'total_cost': 0.0229975}",SUPERIO,FW27500H
endoso_82,"La Compañía cubrirá los gastos médicos erogados por el Asegurado, durante_la_vigencia de esta Póliza, por tratamientos y/o  procedimientos  derivados de_Padecimientos Preexistentes a la fecha de alta del Asegurado  en esta Póliza,___siempre y cuando no hayan sido cubiertos ni pagados en  una póliza de Gastos_Médicos Mayores del mismo Contratante o empresas del  mismo grupo, emitida_por esta u otra institución de seguros, hasta los  límites de responsabilidad_que se establecen en este Endoso.  Periodo de espera: 2 años  Se cubre en_territorio:  Nacional  Para los demás términos y condiciones, aplicarán las_Condiciones Generales  vigentes del producto contratado.  Este Endoso forma_parte del Contrato de Seguro.","{'endoso_id': 'endoso_82', 'endoso_master_id': '82', 'contract_no': 'FW46807H', 'subgrupo': 'MAGNO B', 'type': 'standard', 'endoso_details': {'name': 'PREEXISTENCIA', 'key': '', 'title': '', 'subtitle': '', 'description': 'La Compañía cubrirá los gastos médicos erogados por el Asegurado, durante la vigencia de esta Póliza, por tratamientos y/o procedimientos derivados de Padecimientos Preexistentes a la fecha de alta del Asegurado en esta Póliza, siempre y cuando no hayan sido cubiertos ni pagados en una póliza de Gastos Médicos Mayores del mismo Contratante o empresas del mismo grupo, emitida por esta u otra institución de seguros, hasta los límites de responsabilidad que se establecen en este Endoso. Periodo de espera: 2 años Se cubre en territorio: Nacional Para los demás términos y condiciones, aplicarán las Condiciones Generales vigentes del producto contratado. Este Endoso forma parte del Contrato de Seguro.', 'parameters': {'column_parameters': [], 'row_parameters': [{'row_parameter_name': 'suma asegurada', 'value': '', 'unit': '', 'type': 'std'}, {'row_parameter_name': 'deducible', 'value': '', 'unit': '', 'type': 'std'}, {'row_parameter_name': 'coaseguro', 'value': '', 'unit': '', 'type': 'std'}, {'row_parameter_name': 'tope de coaseguro', 'value': '', 'unit': '', 'type': 'std'}, {'row_parameter_name': 'periodo espera', 'value': '2', 'unit': 'años', 'type': 'std'}, {'row_parameter_name': 'reconocimiento de antigüedad', 'value': '', 'type': 'std'}, {'row_parameter_name': 'requisitos', 'value': '', 'type': 'std'}, {'row_parameter_name': 'gastos cubiertos', 'value': '', 'type': 'std'}, {'row_parameter_name': 'gastos no cubiertos', 'value': '', 'type': 'std'}, {'row_parameter_name': 'aplicación de deducible y/o coaseguro', 'value': '', 'type': 'std'}, {'row_parameter_name': 'condiciones generales', 'value': 'Para los demás términos y condiciones, aplicarán las Condiciones Generales vigentes del producto contratado. Este Endoso forma parte del Contrato de Seguro.', 'type': 'std'}, {'row_parameter_name': 'elegibilidad', 'value': '', 'type': 'exception'}, {'row_parameter_name': 'territorio de cobertura', 'value': 'Nacional', 'type': 'exception'}]}, 'legal': 'Para los demás términos y condiciones, aplicarán las Condiciones Generales vigentes del producto contratado. Este Endoso forma parte del Contrato de Seguro.'}, 'global_information': {'effective_date': '', 'expiration_date': '', 'factor': '', 'type': ''}, 'business_rules': {'experience': '', 'product_type': '', 'min_net_premium': '', 'min_population': ''}, 'status': '', 'comment': [{'name': '', 'date': '', 'comment': ''}]}","{'token_cost': 0.014440000000000001, 'image_cost': 0, 'total_cost': 0.014440000000000001}",MAGNO B,FW46807H
endoso_84,"""REAN-002 RECONOCIMIENTO DE ANTIGÜEDAD PARA REDUCCION DE PERIODOS DE ESPERA_se establecen en este Endoso.""","{'endoso_id': 'endoso_84', 'endoso_master_id': '84', 'contract_no': 'FW49630B', 'subgrupo': 'GENERAL', 'type': 'standard', 'endoso_details': {'name': 'RECONOCIMIENTO DE ANTIGÜEDAD PARA REDUCCION DE PERIODOS DE ESPERA', 'key': 'REAN-002', 'title': '', 'subtitle': '', 'description': 'se establecen en este Endoso.', 'parameters': {'column_parameters': [{'column_parameter_name': 'Urgencias Médicas', 'column_parameter_details': [{'sub_column_parameter_name': '', 'row_parameters': [{'row_parameter_name': 'suma asegurada', 'value': '', 'unit': '', 'type': 'std'}, {'row_parameter_name': 'deducible', 'value': '', 'unit': '', 'type': 'std'}, {'row_parameter_name': 'coaseguro', 'value': '', 'unit': '', 'type': 'std'}, {'row_parameter_name': 'información adicional', 'value': '', 'type': 'std'}, {'row_parameter_name': 'gastos cubiertos', 'value': '', 'type': 'std'}, {'row_parameter_name': 'gastos no cubiertos', 'value': '', 'type': 'std'}, {'row_parameter_name': 'aplicación de deducible y/o coaseguro', 'value': '', 'type': 'std'}, {'row_parameter_name': 'condiciones generales', 'value': 'Para los demás términos y condiciones, aplicarán las Condiciones Generales vigentes del producto contratado. Este Endoso forma parte del Contrato de Seguro.', 'type': 'std'}, {'row_parameter_name': 'elegibilidad', 'value': '', 'type': 'exception'}, {'row_parameter_name': 'periodo de espera', 'value': '', 'type': 'exception'}, {'row_parameter_name': 'tope de coaseguro', 'value': '', 'type': 'exception'}, {'row_parameter_name': 'territorio de cobertura', 'value': '', 'type': 'exception'}]}]}, {'column_parameter_name': 'Accidente', 'column_parameter_details': [{'sub_column_parameter_name': '', 'row_parameters': [{'row_parameter_name': 'suma asegurada', 'value': '', 'unit': '', 'type': 'std'}, {'row_parameter_name': 'deducible', 'value': '', 'unit': '', 'type': 'std'}, {'row_parameter_name': 'coaseguro', 'value': '', 'unit': '', 'type': 'std'}, {'row_parameter_name': 'información adicional', 'value': '', 'type': 'std'}, {'row_parameter_name': 'gastos cubiertos', 'value': '', 'type': 'std'}, {'row_parameter_name': 'gastos no cubiertos', 'value': '', 'type': 'std'}, {'row_parameter_name': 'aplicación de deducible y/o coaseguro', 'value': '', 'type': 'std'}, {'row_parameter_name': 'condiciones generales', 'value': 'Para los demás términos y condiciones, aplicarán las Condiciones Generales vigentes del producto contratado. Este Endoso forma parte del Contrato de Seguro.', 'type': 'std'}, {'row_parameter_name': 'elegibilidad', 'value': '', 'type': 'exception'}, {'row_parameter_name': 'periodo de espera', 'value': '', 'type': 'exception'}, {'row_parameter_name': 'tope de coaseguro', 'value': '', 'type': 'exception'}, {'row_parameter_name': 'territorio de cobertura', 'value': '', 'type': 'exception'}]}]}]}, 'legal': ''}, 'global_information': {'effective_date': '', 'expiration_date': '', 'factor': '', 'type': ''}, 'business_rules': {'experience': '', 'product_type': '', 'min_net_premium': '', 'min_population': ''}, 'status': '', 'comment': [{'name': '', 'date': '', 'comment': ''}]}","{'token_cost': 0.017750000000000002, 'image_cost': 0, 'total_cost': 0.017750000000000002}",GENERAL,FW49630B
endoso_84,"""NARI-005 NARIZ Y SENOS PARANASALES__Este Endoso forma parte del Contrato de Seguro.""","{'endoso_id': 'endoso_84', 'endoso_master_id': '84', 'contract_no': 'FW49630B', 'subgrupo': 'GENERAL', 'type': 'standard', 'endoso_details': {'name': 'NARIZ Y SENOS PARANASALES', 'key': 'NARI-005', 'title': '', 'subtitle': '', 'description': 'Este Endoso forma parte del Contrato de Seguro.', 'parameters': {'column_parameters': [{'column_parameter_name': 'Urgencias Médicas', 'column_parameter_details': [{'sub_column_parameter_name': '', 'row_parameters': [{'row_parameter_name': 'suma asegurada', 'value': '', 'unit': '', 'type': 'std'}, {'row_parameter_name': 'deducible', 'value': '', 'unit': '', 'type': 'std'}, {'row_parameter_name': 'coaseguro', 'value': '', 'unit': '', 'type': 'std'}, {'row_parameter_name': 'información adicional', 'value': '', 'type': 'std'}, {'row_parameter_name': 'gastos cubiertos', 'value': '', 'type': 'std'}, {'row_parameter_name': 'gastos no cubiertos', 'value': '', 'type': 'std'}, {'row_parameter_name': 'aplicación de deducible y/o coaseguro', 'value': '', 'type': 'std'}, {'row_parameter_name': 'condiciones generales', 'value': 'Para los demás términos y condiciones, aplicarán las Condiciones Generales vigentes del producto contratado. Este Endoso forma parte del Contrato de Seguro.', 'type': 'std'}, {'row_parameter_name': 'elegibilidad', 'value': '', 'type': 'exception'}, {'row_parameter_name': 'periodo de espera', 'value': '', 'type': 'exception'}, {'row_parameter_name': 'tope de coaseguro', 'value': '', 'type': 'exception'}, {'row_parameter_name': 'territorio de cobertura', 'value': '', 'type': 'exception'}]}]}, {'column_parameter_name': 'Accidente', 'column_parameter_details': [{'sub_column_parameter_name': '', 'row_parameters': [{'row_parameter_name': 'suma asegurada', 'value': '', 'unit': '', 'type': 'std'}, {'row_parameter_name': 'deducible', 'value': '', 'unit': '', 'type': 'std'}, {'row_parameter_name': 'coaseguro', 'value': '', 'unit': '', 'type': 'std'}, {'row_parameter_name': 'información adicional', 'value': '', 'type': 'std'}, {'row_parameter_name': 'gastos cubiertos', 'value': '', 'type': 'std'}, {'row_parameter_name': 'gastos no cubiertos', 'value': '', 'type': 'std'}, {'row_parameter_name': 'aplicación de deducible y/o coaseguro', 'value': '', 'type': 'std'}, {'row_parameter_name': 'condiciones generales', 'value': 'Para los demás términos y condiciones, aplicarán las Condiciones Generales vigentes del producto contratado. Este Endoso forma parte del Contrato de Seguro.', 'type': 'std'}, {'row_parameter_name': 'elegibilidad', 'value': '', 'type': 'exception'}, {'row_parameter_name': 'periodo de espera', 'value': '', 'type': 'exception'}, {'row_parameter_name': 'tope de coaseguro', 'value': '', 'type': 'exception'}, {'row_parameter_name': 'territorio de cobertura', 'value': '', 'type': 'exception'}]}]}]}, 'legal': 'Para los demás términos y condiciones, aplicarán las Condiciones Generales vigentes del producto contratado. Este Endoso forma parte del Contrato de Seguro.'}, 'global_information': {'effective_date': '', 'expiration_date': '', 'factor': '', 'type': ''}, 'business_rules': {'experience': '', 'product_type': '', 'min_net_premium': '', 'min_population': ''}, 'status': '', 'comment': [{'name': '', 'date': '', 'comment': ''}]}","{'token_cost': 0.0187025, 'image_cost': 0, 'total_cost': 0.0187025}",GENERAL,FW49630B
endoso_84,CIRRE - 006 CIRUGÍA REFRACTIVA_Este Endoso forma parte del Contrato de Seguro.,"{'endoso_id': 'endoso_84', 'endoso_master_id': '84', 'contract_no': 'FW49630B', 'subgrupo': 'GENERAL', 'type': 'standard', 'endoso_details': {'name': 'CIRUGÍA REFRACTIVA', 'key': 'CIRRE - 006', 'title': '', 'subtitle': '', 'description': 'Este Endoso forma parte del Contrato de Seguro.', 'parameters': {'column_parameters': [{'column_parameter_name': 'Urgencias Médicas', 'column_parameter_details': [{'sub_column_parameter_name': '', 'row_parameters': [{'row_parameter_name': 'suma asegurada', 'value': '', 'unit': '', 'type': 'std'}, {'row_parameter_name': 'deducible', 'value': '', 'unit': '', 'type': 'std'}, {'row_parameter_name': 'coaseguro', 'value': '', 'unit': '', 'type': 'std'}, {'row_parameter_name': 'información adicional', 'value': '', 'type': 'std'}, {'row_parameter_name': 'gastos cubiertos', 'value': '', 'type': 'std'}, {'row_parameter_name': 'gastos no cubiertos', 'value': '', 'type': 'std'}, {'row_parameter_name': 'aplicación de deducible y/o coaseguro', 'value': '', 'type': 'std'}, {'row_parameter_name': 'condiciones generales', 'value': 'Para los demás términos y condiciones, aplicarán las Condiciones Generales vigentes del producto contratado. Este Endoso forma parte del Contrato de Seguro.', 'type': 'std'}, {'row_parameter_name': 'elegibilidad', 'value': '', 'type': 'exception'}, {'row_parameter_name': 'periodo de espera', 'value': '', 'type': 'exception'}, {'row_parameter_name': 'tope de coaseguro', 'value': '', 'type': 'exception'}, {'row_parameter_name': 'territorio de cobertura', 'value': '', 'type': 'exception'}]}]}, {'column_parameter_name': 'Accidente', 'column_parameter_details': [{'sub_column_parameter_name': '', 'row_parameters': [{'row_parameter_name': 'suma asegurada', 'value': '', 'unit': '', 'type': 'std'}, {'row_parameter_name': 'deducible', 'value': '', 'unit': '', 'type': 'std'}, {'row_parameter_name': 'coaseguro', 'value': '', 'unit': '', 'type': 'std'}, {'row_parameter_name': 'información adicional', 'value': '', 'type': 'std'}, {'row_parameter_name': 'gastos cubiertos', 'value': '', 'type': 'std'}, {'row_parameter_name': 'gastos no cubiertos', 'value': '', 'type': 'std'}, {'row_parameter_name': 'aplicación de deducible y/o coaseguro', 'value': '', 'type': 'std'}, {'row_parameter_name': 'condiciones generales', 'value': 'Para los demás términos y condiciones, aplicarán las Condiciones Generales vigentes del producto contratado. Este Endoso forma parte del Contrato de Seguro.', 'type': 'std'}, {'row_parameter_name': 'elegibilidad', 'value': '', 'type': 'exception'}, {'row_parameter_name': 'periodo de espera', 'value': '', 'type': 'exception'}, {'row_parameter_name': 'tope de coaseguro', 'value': '', 'type': 'exception'}, {'row_parameter_name': 'territorio de cobertura', 'value': '', 'type': 'exception'}]}]}]}, 'legal': 'Para los demás términos y condiciones, aplicarán las Condiciones Generales vigentes del producto contratado. Este Endoso forma parte del Contrato de Seguro.'}, 'global_information': {'effective_date': '', 'expiration_date': '', 'factor': '', 'type': ''}, 'business_rules': {'experience': '', 'product_type': '', 'min_net_premium': '', 'min_population': ''}, 'status': '', 'comment': [{'name': '', 'date': '', 'comment': ''}]}","{'token_cost': 0.0187, 'image_cost': 0, 'total_cost': 0.0187}",GENERAL,FW49630B
endoso_84,"UMEX-032 URGENCIA MÉDICA EN EL EXTRANJERO                                  _                                                                           _La Compañía cubrirá los gastos médicos erogados durante la vigencia de esta_Póliza, por Urgencias Médicas en el Extranjero  modificando los límites de _responsabilidad  de esta cobertura, hasta los que se  indiquen en este     _Endoso:                                                                    _                                                                           _Suma Asegurada: $100,000 USD                                               _                                                                           _Deducible: 100 USD                                                         _                                                                           _Para este Endoso no es aplicable el Endoso de  Aplicación de Deducible y/o _Coaseguro.                                                                 _                                                                           _Para los demás términos y condiciones, aplicarán las Condiciones Generales _vigentes del producto contratado.                                          _                                                                           _                                                                           _Este Endoso forma parte del Contrato de Seguro.                            _","{'endoso_id': 'endoso_84', 'endoso_master_id': '84', 'contract_no': 'FW46041H', 'subgrupo': 'ADMINIS', 'type': 'standard', 'endoso_details': {'name': 'URGENCIA MÉDICA EN EL EXTRANJERO (UMEX)', 'key': 'UMEX-032', 'title': '', 'subtitle': '', 'description': 'La Compañía cubrirá los gastos médicos erogados durante la vigencia de esta Póliza, por Urgencias Médicas en el Extranjero modificando los límites de responsabilidad de esta cobertura, hasta los que se indiquen en este Endoso: Suma Asegurada: $100,000 USD Deducible: 100 USD Para este Endoso no es aplicable el Endoso de Aplicación de Deducible y/o Coaseguro. Para los demás términos y condiciones, aplicarán las Condiciones Generales vigentes del producto contratado. Este Endoso forma parte del Contrato de Seguro.', 'parameters': {'column_parameters': [{'column_parameter_name': 'Urgencias Médicas', 'column_parameter_details': [{'sub_column_parameter_name': '', 'row_parameters': [{'row_parameter_name': 'suma asegurada', 'value': '100,000', 'unit': 'USD', 'type': 'std'}, {'row_parameter_name': 'deducible', 'value': '100', 'unit': 'USD', 'type': 'std'}, {'row_parameter_name': 'coaseguro', 'value': '', 'type': 'std'}, {'row_parameter_name': 'información adicional', 'value': '', 'type': 'std'}, {'row_parameter_name': 'gastos cubiertos', 'value': '', 'type': 'std'}, {'row_parameter_name': 'gastos no cubiertos', 'value': '', 'type': 'std'}, {'row_parameter_name': 'aplicación de deducible y/o coaseguro', 'value': 'false', 'type': 'std'}, {'row_parameter_name': 'condiciones generales', 'value': 'Para los demás términos y condiciones, aplicarán las Condiciones Generales vigentes del producto contratado. Este Endoso forma parte del Contrato de Seguro.', 'type': 'std'}, {'row_parameter_name': 'elegibilidad', 'value': '', 'type': 'exception'}, {'row_parameter_name': 'periodo de espera', 'value': '', 'type': 'exception'}, {'row_parameter_name': 'tope de coaseguro', 'value': '', 'type': 'exception'}, {'row_parameter_name': 'territorio de cobertura', 'value': '', 'type': 'exception'}]}]}, {'column_parameter_name': 'Accidente', 'column_parameter_details': [{'sub_column_parameter_name': '', 'row_parameters': [{'row_parameter_name': 'suma asegurada', 'value': '', 'type': 'std'}, {'row_parameter_name': 'deducible', 'value': '', 'type': 'std'}, {'row_parameter_name': 'coaseguro', 'value': '', 'type': 'std'}, {'row_parameter_name': 'información adicional', 'value': '', 'type': 'std'}, {'row_parameter_name': 'gastos cubiertos', 'value': '', 'type': 'std'}, {'row_parameter_name': 'gastos no cubiertos', 'value': '', 'type': 'std'}, {'row_parameter_name': 'aplicación de deducible y/o coaseguro', 'value': '', 'type': 'std'}, {'row_parameter_name': 'condiciones generales', 'value': 'Para los demás términos y condiciones, aplicarán las Condiciones Generales vigentes del producto contratado. Este Endoso forma parte del Contrato de Seguro.', 'type': 'std'}, {'row_parameter_name': 'elegibilidad', 'value': '', 'type': 'exception'}, {'row_parameter_name': 'periodo de espera', 'value': '', 'type': 'exception'}, {'row_parameter_name': 'tope de coaseguro', 'value': '', 'type': 'exception'}, {'row_parameter_name': 'territorio de cobertura', 'value': '', 'type': 'exception'}]}]}]}, 'legal': 'Para los demás términos y condiciones, aplicarán las Condiciones Generales vigentes del producto contratado. Este Endoso forma parte del Contrato de Seguro.'}, 'global_information': {'effective_date': '', 'expiration_date': '', 'factor': '', 'type': ''}, 'business_rules': {'experience': '', 'product_type': '', 'min_net_premium': '', 'min_population': ''}, 'status': '', 'comment': [{'name': '', 'date': '', 'comment': ''}]}","{'token_cost': 0.019505, 'image_cost': 0, 'total_cost': 0.019505}",ADMINIS,FW46041H
