endoso_code,text,extracted_parameters,cost_metrics,nom_subg,contract_no
endoso_155,"_El Factor de Reembolso de cada Procedimiento Terapéutico incluido en las_Condiciones Generales correspondientes a esta póliza esta expresado de manera_porcentual, por lo que para cualquier efecto dicho factor deberá dividirse_entre 100.____","{'endoso_id': 'endoso_155', 'endoso_master_id': '155', 'contract_no': 'FW26750K', 'subgrupo': 'EMPLEADOS', 'type': 'standard', 'endoso_details': {'name': 'Factor', 'key': '', 'title': '', 'subtitle': '', 'description': 'El Factor de Reembolso de cada Procedimiento Terapéutico incluido en las Condiciones Generales correspondientes a esta póliza esta expresado de manera porcentual, por lo que para cualquier efecto dicho factor deberá dividirse entre 100.', 'parameters': {'column_parameters': '', 'row_parameters': [{'row_parameter_name': 'Descripcion', 'editable': True, 'active': True, 'type': 'std', 'value_type': 'text', 'value': 'El Factor de Reembolso de cada Procedimiento Terapéutico incluido en las Condiciones Generales correspondientes a esta póliza esta expresado de manera porcentual, por lo que para cualquier efecto dicho factor deberá dividirse entre 100.'}, {'row_parameter_name': 'Factor', 'editable': True, 'active': True, 'type': 'std', 'value_type': 'digits', 'value': '100'}, {'row_parameter_name': 'Condiciones Generales', 'editable': True, 'active': True, 'type': 'std', 'value_type': 'string', 'value': 'Para los demás términos y condiciones, aplicarán las Condiciones Generales vigentes del producto contratado. Este Endoso forma parte del Contrato de Seguro'}]}, 'legal': ''}, 'global_information': {'effective_date': '', 'expiration_date': '', 'factor': '', 'type': ''}, 'business_rules': {'experience': '', 'product_type': '', 'min_net_premium': '', 'min_population': ''}, 'status': '', 'comment': [{'name': '', 'date': '', 'comment': ''}]}","{'token_cost': 0.009257500000000002, 'image_cost': 0, 'total_cost': 0.009257500000000002}",EMPLEADOS,FW26750K
endoso_84,"CERO (0) DEDUCIBLE POR ACCIDENTE DESDE EL PRIMER PESO (LINEA HOSPITALARIA)__Se aplican los límites establecidos en este Endoso respecto al deducible_y/o coaseguro, para accidentes, cubiertos por este contrato de Seguro.__Deducible y Coaseguro por Accidente:_a) Pago Directo siempre que se utilice Prestadores en Convenio o en caso de_que el médico no se encuentre en convenio con AXA pero se ajuste a los_honorarios médicos._Deducible: $0   siempre y cuando los gastos rebasen el monto de  0 M.N;_Coaseguro:  0%_b)Pago por reembolso:_Deducible: 0 M.N. siempre y cuando los gastos procedentes rebasen el monto_de 0 M.N.; Coaseguro 0%__Este endoso modifica el alcance del endoso de APLICACION DE DEDUCIBLE Y/O_COASEGURO, unicamente  para los parámetros de acciente.__Para los demás términos y condiciones, aplicarán las Condiciones Generales_vigentes del producto contratado.__Este Endoso forma parte del Contrato de Seguro.","{'endoso_id': 'endoso_84', 'endoso_master_id': '84', 'contract_no': 'FW59156B', 'subgrupo': 'Administrativo', 'type': 'standard', 'endoso_details': {'name': 'CERO (0) DEDUCIBLE POR ACCIDENTE DESDE EL PRIMER PESO (LINEA HOSPITALARIA)', 'key': '', 'title': '', 'subtitle': '', 'description': 'Se aplican los límites establecidos en este Endoso respecto al deducible y/o coaseguro, para accidentes, cubiertos por este contrato de Seguro. Deducible y Coaseguro por Accidente: a) Pago Directo siempre que se utilice Prestadores en Convenio o en caso de que el médico no se encuentre en convenio con AXA pero se ajuste a los honorarios médicos. Deducible: $0 siempre y cuando los gastos rebasen el monto de 0 M.N; Coaseguro: 0% b)Pago por reembolso: Deducible: 0 M.N. siempre y cuando los gastos procedentes rebasen el monto de 0 M.N.; Coaseguro 0% Este endoso modifica el alcance del endoso de APLICACION DE DEDUCIBLE Y/O COASEGURO, unicamente para los parámetros de acciente. Para los demás términos y condiciones, aplicarán las Condiciones Generales vigentes del producto contratado. Este Endoso forma parte del Contrato de Seguro.', 'parameters': {'column_parameters': [{'column_parameter_name': 'Urgencias Médicas', 'column_parameter_details': [{'sub_column_parameter_name': '', 'row_parameters': [{'row_parameter_name': 'suma asegurada', 'value': '', 'unit': '', 'type': 'std'}, {'row_parameter_name': 'deducible', 'value': '0', 'unit': 'M.N.', 'type': 'std'}, {'row_parameter_name': 'coaseguro', 'value': '0', 'unit': '%', 'type': 'std'}, {'row_parameter_name': 'información adicional', 'value': '', 'type': 'std'}, {'row_parameter_name': 'gastos cubiertos', 'value': '', 'type': 'std'}, {'row_parameter_name': 'gastos no cubiertos', 'value': '', 'type': 'std'}, {'row_parameter_name': 'aplicación de deducible y/o coaseguro', 'value': 'false', 'type': 'std'}, {'row_parameter_name': 'condiciones generales', 'value': 'Para los demás términos y condiciones, aplicarán las Condiciones Generales vigentes del producto contratado. Este Endoso forma parte del Contrato de Seguro.', 'type': 'std'}, {'row_parameter_name': 'elegibilidad', 'value': '', 'type': 'exception'}, {'row_parameter_name': 'periodo de espera', 'value': '', 'type': 'exception'}, {'row_parameter_name': 'tope de coaseguro', 'value': '', 'type': 'exception'}, {'row_parameter_name': 'territorio de cobertura', 'value': '', 'type': 'exception'}]}]}, {'column_parameter_name': 'Accidente', 'column_parameter_details': [{'sub_column_parameter_name': '', 'row_parameters': [{'row_parameter_name': 'suma asegurada', 'value': '', 'unit': '', 'type': 'std'}, {'row_parameter_name': 'deducible', 'value': '0', 'unit': 'M.N.', 'type': 'std'}, {'row_parameter_name': 'coaseguro', 'value': '0', 'unit': '%', 'type': 'std'}, {'row_parameter_name': 'información adicional', 'value': '', 'type': 'std'}, {'row_parameter_name': 'gastos cubiertos', 'value': '', 'type': 'std'}, {'row_parameter_name': 'gastos no cubiertos', 'value': '', 'type': 'std'}, {'row_parameter_name': 'aplicación de deducible y/o coaseguro', 'value': 'false', 'type': 'std'}, {'row_parameter_name': 'condiciones generales', 'value': 'Para los demás términos y condiciones, aplicarán las Condiciones Generales vigentes del producto contratado. Este Endoso forma parte del Contrato de Seguro.', 'type': 'std'}, {'row_parameter_name': 'elegibilidad', 'value': '', 'type': 'exception'}, {'row_parameter_name': 'periodo de espera', 'value': '', 'type': 'exception'}, {'row_parameter_name': 'tope de coaseguro', 'value': '', 'type': 'exception'}, {'row_parameter_name': 'territorio de cobertura', 'value': '', 'type': 'exception'}]}]}]}, 'legal': 'Para los demás términos y condiciones, aplicarán las Condiciones Generales vigentes del producto contratado. Este Endoso forma parte del Contrato de Seguro.'}, 'global_information': {'effective_date': '', 'expiration_date': '', 'factor': '', 'type': ''}, 'business_rules': {'experience': '', 'product_type': '', 'min_net_premium': '', 'min_population': ''}, 'status': '', 'comment': [{'name': '', 'date': '', 'comment': ''}]}","{'token_cost': 0.0209525, 'image_cost': 0, 'total_cost': 0.0209525}",Administrativo,FW59156B
endoso_38,"Se ampara el tratamiento médico quirúrgico de hallux valgus o juanetes,_siempre y cuando no sea de carácter estético.__El monto a indemnizar para este beneficio y/o cobertura será:_De acuerdo a lo siguiente:_Monto Máximo a Indemnizar: 50,000 M.N._Con un periodo de espera de: Sin periodo de espera_Aplicación de deducible y coaseguro:_Pago Directo (Médico y Hospital en convenio de acuerdo al nivel_hospitalario contratado)_Deducible 0.00 M.N._Coaseguro 0.00 %_Reembolso:_Deducible 6,000.00 M.N._Coaseguro 10.00 %_En caso de modificación del deducible y/o coaseguro originalmente pactado,_invariablemente se aplicarán los deducibles y coaseguros antes mencionados_en dicha cobertura/condición.__El presente endoso modifica el capítulo de Gastos Médicos Mayores No_Cubiertos  en su inciso de Tratamiento Médico o Quirúrgico de Hallux_Valgus o Juanetes.__Se cubre únicamente en territorio nacional.__Este endoso forma parte integral y complementa las Condiciones Generales_del Seguro.","{'endoso_id': 'endoso_38', 'endoso_master_id': '38', 'contract_no': 'FW43278F', 'subgrupo': 'Ainive', 'type': 'standard', 'endoso_details': {'name': 'HALLUX VALGUS', 'key': '', 'title': '', 'subtitle': '', 'description': 'Se ampara el tratamiento médico quirúrgico de hallux valgus o juanetes, siempre y cuando no sea de carácter estético. El monto a indemnizar para este beneficio y/o cobertura será: De acuerdo a lo siguiente: Monto Máximo a Indemnizar: 50,000 M.N. Con un periodo de espera de: Sin periodo de espera Aplicación de deducible y coaseguro: Pago Directo (Médico y Hospital en convenio de acuerdo al nivel hospitalario contratado) Deducible 0.00 M.N. Coaseguro 0.00 % Reembolso: Deducible 6,000.00 M.N. Coaseguro 10.00 % En caso de modificación del deducible y/o coaseguro originalmente pactado, invariablemente se aplicarán los deducibles y coaseguros antes mencionados en dicha cobertura/condición. El presente endoso modifica el capítulo de Gastos Médicos Mayores No Cubiertos en su inciso de Tratamiento Médico o Quirúrgico de Hallux Valgus o Juanetes. Se cubre únicamente en territorio nacional. Este endoso forma parte integral y complementa las Condiciones Generales del Seguro.', 'parameters': {'column_parameters': [{'column_parameter_name': 'Pago directo', 'column_parameter_details': [{'sub_column_parameter_name': '', 'row_parameters': [{'row_parameter_name': 'suma asegurada', 'value': '50,000', 'unit': 'M.N.', 'type': 'std'}, {'row_parameter_name': 'deducible', 'value': '0.00', 'unit': 'M.N.', 'type': 'std'}, {'row_parameter_name': 'coaseguro', 'value': '0.00', 'unit': '%', 'type': 'std'}, {'row_parameter_name': 'tope de coaseguro', 'value': '', 'unit': '', 'type': 'std'}, {'row_parameter_name': 'territorio de cobertura', 'value': 'nacional', 'type': 'std'}, {'row_parameter_name': 'periodo espera', 'value': 'Sin periodo de espera', 'type': 'std'}, {'row_parameter_name': 'gastos cubiertos', 'value': '', 'type': 'std'}, {'row_parameter_name': 'gastos no cubiertos', 'value': '', 'type': 'std'}, {'row_parameter_name': 'aplicación de deducible y/o coaseguro', 'value': 'Y', 'type': 'std'}, {'row_parameter_name': 'condiciones generales', 'value': 'Este endoso forma parte integral y complementa las Condiciones Generales del Seguro.', 'type': 'std'}, {'row_parameter_name': 'consulta postoperatoria', 'value': '', 'type': 'exception'}, {'row_parameter_name': 'consulta preoperatoria', 'value': '', 'type': 'exception'}]}]}, {'column_parameter_name': 'Reembolso', 'column_parameter_details': [{'sub_column_parameter_name': '', 'row_parameters': [{'row_parameter_name': 'suma asegurada', 'value': '50,000', 'unit': 'M.N.', 'type': 'std'}, {'row_parameter_name': 'deducible', 'value': '6,000.00', 'unit': 'M.N.', 'type': 'std'}, {'row_parameter_name': 'coaseguro', 'value': '10.00', 'unit': '%', 'type': 'std'}, {'row_parameter_name': 'tope de coaseguro', 'value': '', 'unit': '', 'type': 'std'}, {'row_parameter_name': 'territorio de cobertura', 'value': 'nacional', 'type': 'std'}, {'row_parameter_name': 'periodo espera', 'value': 'Sin periodo de espera', 'type': 'std'}, {'row_parameter_name': 'gastos cubiertos', 'value': '', 'type': 'std'}, {'row_parameter_name': 'gastos no cubiertos', 'value': '', 'type': 'std'}, {'row_parameter_name': 'aplicación de deducible y/o coaseguro', 'value': 'Y', 'type': 'std'}, {'row_parameter_name': 'condiciones generales', 'value': 'Este endoso forma parte integral y complementa las Condiciones Generales del Seguro.', 'type': 'std'}, {'row_parameter_name': 'consulta postoperatoria', 'value': '', 'type': 'exception'}, {'row_parameter_name': 'consulta preoperatoria', 'value': '', 'type': 'exception'}]}]}]}, 'legal': 'Este endoso forma parte integral y complementa las Condiciones Generales del Seguro.'}, 'global_information': {'effective_date': '', 'expiration_date': '', 'factor': '', 'type': ''}, 'business_rules': {'experience': '', 'product_type': '', 'min_net_premium': '', 'min_population': ''}, 'status': '', 'comment': [{'name': '', 'date': '', 'comment': ''}]}","{'token_cost': 0.021715, 'image_cost': 0, 'total_cost': 0.021715}",Ainive,FW43278F
endoso_84,"La Compañía cubrirá los gastos médicos erogados durante la vigencia de esta_Póliza, por Urgencias Médicas en el Extranjero modificando los límites de_responsabilidad de esta cobertura, hasta los que se indiquen en este Endoso:_Suma Asegurada: USD 100,000.00Deducible: USD 100.00Para este Endoso no es_aplicable el Endoso de Aplicación de Deducible y/o Coaseguro.Para los demás_términos y condiciones, aplicarán las Condiciones Generales vigentes del_producto contratado.Este Endoso forma parte del Contrato de Seguro.","{'endoso_id': 'endoso_84', 'endoso_master_id': '84', 'contract_no': 'FW35314H', 'subgrupo': 'GENERAL', 'type': 'standard', 'endoso_details': {'name': 'URGENCIA MÉDICA EN EL EXTRANJERO (UMEX)', 'key': '', 'title': '', 'subtitle': '', 'description': 'La Compañía cubrirá los gastos médicos erogados durante la vigencia de esta Póliza, por Urgencias Médicas en el Extranjero modificando los límites de responsabilidad de esta cobertura, hasta los que se indiquen en este Endoso: Suma Asegurada: USD 100,000.00 Deducible: USD 100.00 Para este Endoso no es aplicable el Endoso de Aplicación de Deducible y/o Coaseguro.Para los demás términos y condiciones, aplicarán las Condiciones Generales vigentes del producto contratado.Este Endoso forma parte del Contrato de Seguro.', 'parameters': {'column_parameters': [{'column_parameter_name': 'Urgencias Médicas', 'column_parameter_details': [{'sub_column_parameter_name': '', 'row_parameters': [{'row_parameter_name': 'suma asegurada', 'value': '100,000', 'unit': 'USD', 'type': 'std'}, {'row_parameter_name': 'deducible', 'value': '100', 'unit': 'USD', 'type': 'std'}, {'row_parameter_name': 'coaseguro', 'value': '', 'type': 'std'}, {'row_parameter_name': 'información adicional', 'value': '', 'type': 'std'}, {'row_parameter_name': 'gastos cubiertos', 'value': '', 'type': 'std'}, {'row_parameter_name': 'gastos no cubiertos', 'value': '', 'type': 'std'}, {'row_parameter_name': 'aplicación de deducible y/o coaseguro', 'value': 'false', 'type': 'std'}, {'row_parameter_name': 'condiciones generales', 'value': 'Para los demás términos y condiciones, aplicarán las Condiciones Generales vigentes del producto contratado. Este Endoso forma parte del Contrato de Seguro.', 'type': 'std'}, {'row_parameter_name': 'elegibilidad', 'value': '', 'type': 'exception'}, {'row_parameter_name': 'periodo de espera', 'value': '', 'type': 'exception'}, {'row_parameter_name': 'tope de coaseguro', 'value': '', 'type': 'exception'}, {'row_parameter_name': 'territorio de cobertura', 'value': '', 'type': 'exception'}]}]}, {'column_parameter_name': 'Accidente', 'column_parameter_details': [{'sub_column_parameter_name': '', 'row_parameters': [{'row_parameter_name': 'suma asegurada', 'value': '', 'type': 'std'}, {'row_parameter_name': 'deducible', 'value': '', 'type': 'std'}, {'row_parameter_name': 'coaseguro', 'value': '', 'type': 'std'}, {'row_parameter_name': 'información adicional', 'value': '', 'type': 'std'}, {'row_parameter_name': 'gastos cubiertos', 'value': '', 'type': 'std'}, {'row_parameter_name': 'gastos no cubiertos', 'value': '', 'type': 'std'}, {'row_parameter_name': 'aplicación de deducible y/o coaseguro', 'value': '', 'type': 'std'}, {'row_parameter_name': 'condiciones generales', 'value': 'Para los demás términos y condiciones, aplicarán las Condiciones Generales vigentes del producto contratado. Este Endoso forma parte del Contrato de Seguro.', 'type': 'std'}, {'row_parameter_name': 'elegibilidad', 'value': '', 'type': 'exception'}, {'row_parameter_name': 'periodo de espera', 'value': '', 'type': 'exception'}, {'row_parameter_name': 'tope de coaseguro', 'value': '', 'type': 'exception'}, {'row_parameter_name': 'territorio de cobertura', 'value': '', 'type': 'exception'}]}]}], 'legal': 'Para los demás términos y condiciones, aplicarán las Condiciones Generales vigentes del producto contratado. Este Endoso forma parte del Contrato de Seguro.'}}, 'global_information': {'effective_date': '', 'expiration_date': '', 'factor': '', 'type': ''}, 'business_rules': {'experience': '', 'product_type': '', 'min_net_premium': '', 'min_population': ''}, 'status': '', 'comment': [{'name': '', 'date': '', 'comment': ''}]}","{'token_cost': 0.019367500000000003, 'image_cost': 0, 'total_cost': 0.019367500000000003}",GENERAL,FW35314H
endoso_84,vigencia de la Póliza no generarán cobro o devolución de primas.,"{'endoso_id': 'endoso_84', 'endoso_master_id': '84', 'contract_no': 'FW56221B', 'subgrupo': 'GENERAL', 'type': 'standard', 'endoso_details': {'name': 'URGENCIA MÉDICA EN EL EXTRANJERO (UMEX)', 'key': '', 'title': '', 'subtitle': '', 'description': 'vigencia de la Póliza no generarán cobro o devolución de primas.', 'parameters': {'column_parameters': [{'column_parameter_name': 'Urgencias Médicas', 'column_parameter_details': [{'sub_column_parameter_name': '', 'row_parameters': [{'row_parameter_name': 'suma asegurada', 'value': '', 'unit': '', 'type': 'std'}, {'row_parameter_name': 'deducible', 'value': '', 'unit': '', 'type': 'std'}, {'row_parameter_name': 'coaseguro', 'value': '', 'unit': '', 'type': 'std'}, {'row_parameter_name': 'información adicional', 'value': '', 'type': 'std'}, {'row_parameter_name': 'gastos cubiertos', 'value': '', 'type': 'std'}, {'row_parameter_name': 'gastos no cubiertos', 'value': '', 'type': 'std'}, {'row_parameter_name': 'aplicación de deducible y/o coaseguro', 'value': '', 'type': 'std'}, {'row_parameter_name': 'condiciones generales', 'value': 'Para los demás términos y condiciones, aplicarán las Condiciones Generales vigentes del producto contratado. Este Endoso forma parte del Contrato de Seguro.', 'type': 'std'}, {'row_parameter_name': 'elegibilidad', 'value': '', 'type': 'exception'}, {'row_parameter_name': 'periodo de espera', 'value': '', 'type': 'exception'}, {'row_parameter_name': 'tope de coaseguro', 'value': '', 'type': 'exception'}, {'row_parameter_name': 'territorio de cobertura', 'value': '', 'type': 'exception'}]}]}, {'column_parameter_name': 'Accidente', 'column_parameter_details': [{'sub_column_parameter_name': '', 'row_parameters': [{'row_parameter_name': 'suma asegurada', 'value': '', 'unit': '', 'type': 'std'}, {'row_parameter_name': 'deducible', 'value': '', 'unit': '', 'type': 'std'}, {'row_parameter_name': 'coaseguro', 'value': '', 'unit': '', 'type': 'std'}, {'row_parameter_name': 'información adicional', 'value': '', 'type': 'std'}, {'row_parameter_name': 'gastos cubiertos', 'value': '', 'type': 'std'}, {'row_parameter_name': 'gastos no cubiertos', 'value': '', 'type': 'std'}, {'row_parameter_name': 'aplicación de deducible y/o coaseguro', 'value': '', 'type': 'std'}, {'row_parameter_name': 'condiciones generales', 'value': 'Para los demás términos y condiciones, aplicarán las Condiciones Generales vigentes del producto contratado. Este Endoso forma parte del Contrato de Seguro.', 'type': 'std'}, {'row_parameter_name': 'elegibilidad', 'value': '', 'type': 'exception'}, {'row_parameter_name': 'periodo de espera', 'value': '', 'type': 'exception'}, {'row_parameter_name': 'tope de coaseguro', 'value': '', 'type': 'exception'}, {'row_parameter_name': 'territorio de cobertura', 'value': '', 'type': 'exception'}]}]}]}, 'legal': ''}, 'global_information': {'effective_date': '', 'expiration_date': '', 'factor': '', 'type': ''}, 'business_rules': {'experience': '', 'product_type': '', 'min_net_premium': '', 'min_population': ''}, 'status': '', 'comment': [{'name': '', 'date': '', 'comment': ''}]}","{'token_cost': 0.01845, 'image_cost': 0, 'total_cost': 0.01845}",GENERAL,FW56221B
endoso_38,"HALLUX VALGUS_Se amparan los gastos médicos y quirúrgicos a consecuencia de Hallux Valgus o_Juanetes que no sean de carácter estético, fundamentando el diagnóstico_mediante un estudio radiológico. Las condiciones que aplicarán para esta_cobertura son las siguientes: Suma Asegurada   De la póliza Deducible    De_la póliza Coaseguro    De la póliza Período de Espera   No aplica Segunda_Valoración Médica   No requerida  Para esta cobertura opera el endoso de_aplicación de deducible y coaseguro con el que cuenta la presente póliza. Los_demás términos y condiciones permanecen sin modificación alguna.","{'endoso_id': 'endoso_38', 'endoso_master_id': '38', 'contract_no': 'FW64645A', 'subgrupo': 'GENERAL', 'type': 'standard', 'endoso_details': {'name': 'HALLUX VALGUS', 'key': '', 'title': '', 'subtitle': '', 'description': 'Se amparan los gastos médicos y quirúrgicos a consecuencia de Hallux Valgus o Juanetes que no sean de carácter estético, fundamentando el diagnóstico mediante un estudio radiológico. Las condiciones que aplicarán para esta cobertura son las siguientes: Suma Asegurada   De la póliza Deducible    De la póliza Coaseguro    De la póliza Período de Espera   No aplica Segunda Valoración Médica   No requerida  Para esta cobertura opera el endoso de aplicación de deducible y coaseguro con el que cuenta la presente póliza. Los demás términos y condiciones permanecen sin modificación alguna.', 'parameters': {'column_parameters': [{'column_parameter_name': 'Pago directo', 'column_parameter_details': [{'sub_column_parameter_name': '', 'row_parameters': [{'row_parameter_name': 'suma asegurada', 'value': 'De la póliza', 'unit': '', 'type': 'std'}, {'row_parameter_name': 'deducible', 'value': 'De la póliza', 'unit': '', 'type': 'std'}, {'row_parameter_name': 'coaseguro', 'value': 'De la póliza', 'unit': '', 'type': 'std'}, {'row_parameter_name': 'tope de coaseguro', 'value': '', 'unit': '', 'type': 'std'}, {'row_parameter_name': 'territorio de cobertura', 'value': '', 'unit': '', 'type': 'std'}, {'row_parameter_name': 'periodo espera', 'value': 'No aplica', 'unit': '', 'type': 'std'}, {'row_parameter_name': 'gastos cubiertos', 'value': '', 'unit': '', 'type': 'std'}, {'row_parameter_name': 'gastos no cubiertos', 'value': '', 'unit': '', 'type': 'std'}, {'row_parameter_name': 'aplicación de deducible y/o coaseguro', 'value': 'true', 'type': 'std'}, {'row_parameter_name': 'condiciones generales', 'value': 'Los demás términos y condiciones permanecen sin modificación alguna.', 'type': 'std'}, {'row_parameter_name': 'consulta postoperatoria', 'value': '', 'type': 'exception'}, {'row_parameter_name': 'consulta preoperatoria', 'value': '', 'type': 'exception'}]}]}, {'column_parameter_name': 'Reembolso', 'column_parameter_details': [{'sub_column_parameter_name': '', 'row_parameters': [{'row_parameter_name': 'suma asegurada', 'value': 'De la póliza', 'unit': '', 'type': 'std'}, {'row_parameter_name': 'deducible', 'value': 'De la póliza', 'unit': '', 'type': 'std'}, {'row_parameter_name': 'coaseguro', 'value': 'De la póliza', 'unit': '', 'type': 'std'}, {'row_parameter_name': 'tope de coaseguro', 'value': '', 'unit': '', 'type': 'std'}, {'row_parameter_name': 'territorio de cobertura', 'value': '', 'unit': '', 'type': 'std'}, {'row_parameter_name': 'periodo espera', 'value': 'No aplica', 'unit': '', 'type': 'std'}, {'row_parameter_name': 'gastos cubiertos', 'value': '', 'unit': '', 'type': 'std'}, {'row_parameter_name': 'gastos no cubiertos', 'value': '', 'unit': '', 'type': 'std'}, {'row_parameter_name': 'aplicación de deducible y/o coaseguro', 'value': 'true', 'type': 'std'}, {'row_parameter_name': 'condiciones generales', 'value': 'Los demás términos y condiciones permanecen sin modificación alguna.', 'type': 'std'}, {'row_parameter_name': 'consulta postoperatoria', 'value': '', 'type': 'exception'}, {'row_parameter_name': 'consulta preoperatoria', 'value': '', 'type': 'exception'}]}]}]}, 'legal': 'Los demás términos y condiciones permanecen sin modificación alguna.'}, 'global_information': {'effective_date': '', 'expiration_date': '', 'factor': '', 'type': ''}, 'business_rules': {'experience': '', 'product_type': '', 'min_net_premium': '', 'min_population': ''}, 'status': '', 'comment': [{'name': '', 'date': '', 'comment': ''}]}","{'token_cost': 0.02024, 'image_cost': 0, 'total_cost': 0.02024}",GENERAL,FW64645A
