endoso_code,text,extracted_parameters,cost_metrics,nom_subg,contract_no
endoso_142,"Por medio de este documento se hace constar que:_Como litotripsia se entiende el desmenuzamiento o fragmentación de un cálculo_por medio del litotriptor__Este endoso ampara el pago de honorarios médicos, gastos de hospitalización,_medicamentos, renta del litotriptor endoscópico o extracorpóreo y demás_gastos cubiertos generados dentro del hospital.__El monto máximo a indemnizar para este beneficio y/o cobertura será:__De acuerdo a las condiciones generales (26 veces el S.M.G.M)____Monto Máximo a Indemnizar__Pago Directo (Médico y Hospital de Red):_Deducible: cero_Coaseguro: cero__Reembolso:_Deducible: cero_Coaseguro: cero_Sin periodo de espera__Se cubre únicamente en territorio nacional.__Los demás términos y condiciones, deben operar conforme se señala en las_Condiciones Generales del producto contratado.__Este endoso forma parte integral y complementa las Condiciones Generales del_Seguro","{'endoso_id': 'endoso_142', 'endoso_master_id': '142', 'contract_no': 'FW48116B', 'subgrupo': 'Emplead', 'type': 'standard', 'endoso_details': {'name': 'LITOTRIPSIAS', 'key': '', 'title': '', 'subtitle': '', 'description': 'Por medio de este documento se hace constar que: Como litotripsia se entiende el desmenuzamiento o fragmentación de un cálculo por medio del litotriptor. Este endoso ampara el pago de honorarios médicos, gastos de hospitalización, medicamentos, renta del litotriptor endoscópico o extracorpóreo y demás gastos cubiertos generados dentro del hospital. El monto máximo a indemnizar para este beneficio y/o cobertura será: De acuerdo a las condiciones generales (26 veces el S.M.G.M). Monto Máximo a Indemnizar. Pago Directo (Médico y Hospital de Red): Deducible: cero Coaseguro: cero. Reembolso: Deducible: cero Coaseguro: cero. Sin periodo de espera. Se cubre únicamente en territorio nacional. Los demás términos y condiciones, deben operar conforme se señala en las Condiciones Generales del producto contratado. Este endoso forma parte integral y complementa las Condiciones Generales del Seguro.', 'parameters': {'column_parameters': [{'column_parameter_name': 'Pago directo', 'column_parameter_details': [{'sub_column_parameter_name': '', 'row_parameters': [{'row_parameter_name': 'suma asegurada', 'value': '', 'unit': '', 'type': 'std'}, {'row_parameter_name': 'deducible', 'value': '0', 'unit': '', 'type': 'std'}, {'row_parameter_name': 'coaseguro', 'value': '0', 'unit': '', 'type': 'std'}, {'row_parameter_name': 'periodo espera', 'value': '0', 'unit': '', 'type': 'std'}, {'row_parameter_name': 'territorio de cobertura', 'value': 'nacional', 'unit': '', 'type': 'std'}, {'row_parameter_name': 'consulta postoperatoria', 'value': '', 'unit': '', 'type': 'std'}, {'row_parameter_name': 'consulta preoperatoria', 'value': '', 'unit': '', 'type': 'std'}, {'row_parameter_name': 'aplicación de deducible y/o coaseguro', 'value': '', 'unit': '', 'type': 'std'}, {'row_parameter_name': 'condiciones generales', 'value': 'Para los demás términos y condiciones, deben operar conforme se señala en las Condiciones Generales del producto contratado. Este endoso forma parte integral y complementa las Condiciones Generales del Seguro.', 'unit': '', 'type': 'std'}, {'row_parameter_name': 'elegibilidad', 'value': '', 'unit': '', 'type': 'exception'}, {'row_parameter_name': 'tope de coaseguro', 'value': '', 'unit': '', 'type': 'exception'}, {'row_parameter_name': 'número de sesiones', 'value': '', 'unit': '', 'type': 'exception'}]}]}, {'column_parameter_name': 'Reembolso', 'column_parameter_details': [{'sub_column_parameter_name': '', 'row_parameters': [{'row_parameter_name': 'suma asegurada', 'value': '', 'unit': '', 'type': 'std'}, {'row_parameter_name': 'deducible', 'value': '0', 'unit': '', 'type': 'std'}, {'row_parameter_name': 'coaseguro', 'value': '0', 'unit': '', 'type': 'std'}, {'row_parameter_name': 'periodo espera', 'value': '0', 'unit': '', 'type': 'std'}, {'row_parameter_name': 'territorio de cobertura', 'value': 'nacional', 'unit': '', 'type': 'std'}, {'row_parameter_name': 'consulta postoperatoria', 'value': '', 'unit': '', 'type': 'std'}, {'row_parameter_name': 'consulta preoperatoria', 'value': '', 'unit': '', 'type': 'std'}, {'row_parameter_name': 'aplicación de deducible y/o coaseguro', 'value': '', 'unit': '', 'type': 'std'}, {'row_parameter_name': 'condiciones generales', 'value': 'Para los demás términos y condiciones, deben operar conforme se señala en las Condiciones Generales del producto contratado. Este endoso forma parte integral y complementa las Condiciones Generales del Seguro.', 'unit': '', 'type': 'std'}, {'row_parameter_name': 'elegibilidad', 'value': '', 'unit': '', 'type': 'exception'}, {'row_parameter_name': 'tope de coaseguro', 'value': '', 'unit': '', 'type': 'exception'}, {'row_parameter_name': 'número de sesiones', 'value': '', 'unit': '', 'type': 'exception'}]}]}]}, 'legal': 'Para los demás términos y condiciones, deben operar conforme se señala en las Condiciones Generales del producto contratado. Este endoso forma parte integral y complementa las Condiciones Generales del Seguro.'}, 'global_information': {'effective_date': '', 'expiration_date': '', 'factor': '', 'type': ''}, 'business_rules': {'experience': '', 'product_type': '', 'min_net_premium': '', 'min_population': ''}, 'status': '', 'comment': [{'name': '', 'date': '', 'comment': ''}]}","{'token_cost': 0.02225, 'image_cost': 0, 'total_cost': 0.02225}",Emplead,FW48116B
endoso_142,"LITOTRIPSIAS_Por medio de este documento se hace constar que:_Como litotripsia se entiende el desmenuzamiento o fragmentación de un cálculo_por medio del litotriptor._Este endoso ampara el pago de honorarios médicos, gastos de hospitalización,_medicamentos, renta del litotriptor endoscópico o extracorpóreo y demás_gastos cubiertos  generados dentro del hospital._El monto máximo a indemnizar para este beneficio y/o cobertura será:_Hasta la suma asegurada contratada_Aplicación de deducible y coaseguro de la póliza_En caso de modificación del deducible y/o coaseguro originalmente pactado,_invariablemente se aplicarán los deducibles y coaseguros antes mencionados en_dicha cobertura/condición._El Asegurado deberá cumplir con un periodo de espera, a partir de su_inscripción en la póliza:_Sin periodo de espera_AXA Seguros, S.A. de C.V.:_Reconocerá el tiempo que el Asegurado haya tenido esta cobertura en esta_compañía u otra(s)  compañía(s) de seguros;  siempre y cuando no exista un_periodo al descubierto mayor a 30 días._Se cubre únicamente en territorio nacional._Los demás términos y condiciones, deben operar conforme se señala en las_Condiciones  Generales del producto contratado._Este endoso forma parte integral y complementa las Condiciones Generales del_Seguro","{'endoso_id': 'endoso_142', 'endoso_master_id': '142', 'contract_no': 'FW50017B', 'subgrupo': 'GERENTE', 'type': 'standard', 'endoso_details': {'name': 'LITOTRIPSIAS', 'key': '', 'title': '', 'subtitle': '', 'description': 'Por medio de este documento se hace constar que: Como litotripsia se entiende el desmenuzamiento o fragmentación de un cálculo por medio del litotriptor. Este endoso ampara el pago de honorarios médicos, gastos de hospitalización, medicamentos, renta del litotriptor endoscópico o extracorpóreo y demás gastos cubiertos generados dentro del hospital. El monto máximo a indemnizar para este beneficio y/o cobertura será: Hasta la suma asegurada contratada Aplicación de deducible y coaseguro de la póliza En caso de modificación del deducible y/o coaseguro originalmente pactado, invariablemente se aplicarán los deducibles y coaseguros antes mencionados en dicha cobertura/condición. El Asegurado deberá cumplir con un periodo de espera, a partir de su inscripción en la póliza: Sin periodo de espera AXA Seguros, S.A. de C.V.: Reconocerá el tiempo que el Asegurado haya tenido esta cobertura en esta compañía u otra(s) compañía(s) de seguros; siempre y cuando no exista un periodo al descubierto mayor a 30 días. Se cubre únicamente en territorio nacional. Los demás términos y condiciones, deben operar conforme se señala en las Condiciones Generales del producto contratado. Este endoso forma parte integral y complementa las Condiciones Generales del Seguro', 'parameters': {'column_parameters': [{'column_parameter_name': 'Pago directo', 'column_parameter_details': [{'sub_column_parameter_name': '', 'row_parameters': [{'row_parameter_name': 'suma asegurada', 'value': '', 'unit': '', 'type': 'std'}, {'row_parameter_name': 'deducible', 'value': '', 'unit': '', 'type': 'std'}, {'row_parameter_name': 'coaseguro', 'value': '', 'unit': '', 'type': 'std'}, {'row_parameter_name': 'periodo espera', 'value': 'Sin periodo de espera', 'unit': '', 'type': 'std'}, {'row_parameter_name': 'territorio de cobertura', 'value': 'nacional', 'unit': '', 'type': 'std'}, {'row_parameter_name': 'consulta postoperatoria', 'value': '', 'unit': '', 'type': 'std'}, {'row_parameter_name': 'consulta preoperatoria', 'value': '', 'unit': '', 'type': 'std'}, {'row_parameter_name': 'aplicación de deducible y/o coaseguro', 'value': 'true', 'unit': '', 'type': 'std'}, {'row_parameter_name': 'condiciones generales', 'value': 'Los demás términos y condiciones, deben operar conforme se señala en las Condiciones Generales del producto contratado. Este endoso forma parte integral y complementa las Condiciones Generales del Seguro', 'unit': '', 'type': 'std'}, {'row_parameter_name': 'elegibilidad', 'value': '', 'unit': '', 'type': 'exception'}, {'row_parameter_name': 'tope de coaseguro', 'value': '', 'unit': '', 'type': 'exception'}, {'row_parameter_name': 'número de sesiones', 'value': '', 'unit': '', 'type': 'exception'}]}]}, {'column_parameter_name': 'Reembolso', 'column_parameter_details': [{'sub_column_parameter_name': '', 'row_parameters': [{'row_parameter_name': 'suma asegurada', 'value': '', 'unit': '', 'type': 'std'}, {'row_parameter_name': 'deducible', 'value': '', 'unit': '', 'type': 'std'}, {'row_parameter_name': 'coaseguro', 'value': '', 'unit': '', 'type': 'std'}, {'row_parameter_name': 'periodo espera', 'value': 'Sin periodo de espera', 'unit': '', 'type': 'std'}, {'row_parameter_name': 'territorio de cobertura', 'value': 'nacional', 'unit': '', 'type': 'std'}, {'row_parameter_name': 'consulta postoperatoria', 'value': '', 'unit': '', 'type': 'std'}, {'row_parameter_name': 'consulta preoperatoria', 'value': '', 'unit': '', 'type': 'std'}, {'row_parameter_name': 'aplicación de deducible y/o coaseguro', 'value': 'true', 'unit': '', 'type': 'std'}, {'row_parameter_name': 'condiciones generales', 'value': 'Los demás términos y condiciones, deben operar conforme se señala en las Condiciones Generales del producto contratado. Este endoso forma parte integral y complementa las Condiciones Generales del Seguro', 'unit': '', 'type': 'std'}, {'row_parameter_name': 'elegibilidad', 'value': '', 'unit': '', 'type': 'exception'}, {'row_parameter_name': 'tope de coaseguro', 'value': '', 'unit': '', 'type': 'exception'}, {'row_parameter_name': 'número de sesiones', 'value': '', 'unit': '', 'type': 'exception'}]}]}]}, 'legal': 'Los demás términos y condiciones, deben operar conforme se señala en las Condiciones Generales del producto contratado. Este endoso forma parte integral y complementa las Condiciones Generales del Seguro'}, 'global_information': {'effective_date': '', 'expiration_date': '', 'factor': '', 'type': ''}, 'business_rules': {'experience': '', 'product_type': '', 'min_net_premium': '', 'min_population': ''}, 'status': '', 'comment': [{'name': '', 'date': '', 'comment': ''}]}","{'token_cost': 0.02323, 'image_cost': 0, 'total_cost': 0.02323}",GERENTE,FW50017B
endoso_142,"LITOTRIPSIAS__Por medio de este documento se hace constar que:_Como litotripsia se entiende el desmenuzamiento o fragmentación de un cálculo_por medio del litotriptor._Este endoso ampara el pago de honorarios médicos, gastos de hospitalización,_medicamentos, renta del litotriptor endoscópico o extracorpóreo y demás_gastos cubiertos  generados dentro del hospital._El monto máximo a indemnizar para este beneficio y/o cobertura será:_Hasta la suma asegurada contratada_Aplicación de deducible y coaseguro de la póliza_En caso de modificación del deducible y/o coaseguro originalmente pactado,_invariablemente se aplicarán los deducibles y coaseguros antes mencionados en_dicha cobertura/condición._El Asegurado deberá cumplir con un periodo de espera, a partir de su_inscripción en la póliza:_Sin periodo de espera_AXA Seguros, S.A. de C.V.:_Reconocerá el tiempo que el Asegurado haya tenido esta cobertura en esta_compañía u otra(s)  compañía(s) de seguros;  siempre y cuando no exista un_periodo al descubierto mayor a 30 días._Se cubre únicamente en territorio nacional._Los demás términos y condiciones, deben operar conforme se señala en las_Condiciones  Generales del producto contratado._Este endoso forma parte integral y complementa las Condiciones Generales del_Seguro","{'endoso_id': 'endoso_142', 'endoso_master_id': '142', 'contract_no': 'FW50017B', 'subgrupo': 'DIRECTO', 'type': 'standard', 'endoso_details': {'name': 'LITOTRIPSIAS', 'key': '', 'title': '', 'subtitle': '', 'description': 'Por medio de este documento se hace constar que: Como litotripsia se entiende el desmenuzamiento o fragmentación de un cálculo por medio del litotriptor. Este endoso ampara el pago de honorarios médicos, gastos de hospitalización, medicamentos, renta del litotriptor endoscópico o extracorpóreo y demás gastos cubiertos generados dentro del hospital. El monto máximo a indemnizar para este beneficio y/o cobertura será: Hasta la suma asegurada contratada Aplicación de deducible y coaseguro de la póliza En caso de modificación del deducible y/o coaseguro originalmente pactado, invariablemente se aplicarán los deducibles y coaseguros antes mencionados en dicha cobertura/condición. El Asegurado deberá cumplir con un periodo de espera, a partir de su inscripción en la póliza: Sin periodo de espera AXA Seguros, S.A. de C.V.: Reconocerá el tiempo que el Asegurado haya tenido esta cobertura en esta compañía u otra(s) compañía(s) de seguros; siempre y cuando no exista un periodo al descubierto mayor a 30 días. Se cubre únicamente en territorio nacional. Los demás términos y condiciones, deben operar conforme se señala en las Condiciones Generales del producto contratado. Este endoso forma parte integral y complementa las Condiciones Generales del Seguro', 'parameters': {'column_parameters': [{'column_parameter_name': 'Pago directo', 'column_parameter_details': [{'sub_column_parameter_name': '', 'row_parameters': [{'row_parameter_name': 'suma asegurada', 'value': '', 'unit': '', 'type': 'std'}, {'row_parameter_name': 'deducible', 'value': '', 'unit': '', 'type': 'std'}, {'row_parameter_name': 'coaseguro', 'value': '', 'unit': '', 'type': 'std'}, {'row_parameter_name': 'periodo espera', 'value': 'Sin periodo de espera', 'unit': '', 'type': 'std'}, {'row_parameter_name': 'territorio de cobertura', 'value': 'nacional', 'unit': '', 'type': 'std'}, {'row_parameter_name': 'consulta postoperatoria', 'value': '', 'unit': '', 'type': 'std'}, {'row_parameter_name': 'consulta preoperatoria', 'value': '', 'unit': '', 'type': 'std'}, {'row_parameter_name': 'aplicación de deducible y/o coaseguro', 'value': 'true', 'unit': '', 'type': 'std'}, {'row_parameter_name': 'condiciones generales', 'value': 'Los demás términos y condiciones, deben operar conforme se señala en las Condiciones Generales del producto contratado. Este endoso forma parte integral y complementa las Condiciones Generales del Seguro', 'unit': '', 'type': 'std'}, {'row_parameter_name': 'elegibilidad', 'value': '', 'unit': '', 'type': 'exception'}, {'row_parameter_name': 'tope de coaseguro', 'value': '', 'unit': '', 'type': 'exception'}, {'row_parameter_name': 'número de sesiones', 'value': '', 'unit': '', 'type': 'exception'}]}]}, {'column_parameter_name': 'Reembolso', 'column_parameter_details': [{'sub_column_parameter_name': '', 'row_parameters': [{'row_parameter_name': 'suma asegurada', 'value': '', 'unit': '', 'type': 'std'}, {'row_parameter_name': 'deducible', 'value': '', 'unit': '', 'type': 'std'}, {'row_parameter_name': 'coaseguro', 'value': '', 'unit': '', 'type': 'std'}, {'row_parameter_name': 'periodo espera', 'value': 'Sin periodo de espera', 'unit': '', 'type': 'std'}, {'row_parameter_name': 'territorio de cobertura', 'value': 'nacional', 'unit': '', 'type': 'std'}, {'row_parameter_name': 'consulta postoperatoria', 'value': '', 'unit': '', 'type': 'std'}, {'row_parameter_name': 'consulta preoperatoria', 'value': '', 'unit': '', 'type': 'std'}, {'row_parameter_name': 'aplicación de deducible y/o coaseguro', 'value': 'true', 'unit': '', 'type': 'std'}, {'row_parameter_name': 'condiciones generales', 'value': 'Los demás términos y condiciones, deben operar conforme se señala en las Condiciones Generales del producto contratado. Este endoso forma parte integral y complementa las Condiciones Generales del Seguro', 'unit': '', 'type': 'std'}, {'row_parameter_name': 'elegibilidad', 'value': '', 'unit': '', 'type': 'exception'}, {'row_parameter_name': 'tope de coaseguro', 'value': '', 'unit': '', 'type': 'exception'}, {'row_parameter_name': 'número de sesiones', 'value': '', 'unit': '', 'type': 'exception'}]}]}]}, 'legal': 'Los demás términos y condiciones, deben operar conforme se señala en las Condiciones Generales del producto contratado. Este endoso forma parte integral y complementa las Condiciones Generales del Seguro'}, 'global_information': {'effective_date': '', 'expiration_date': '', 'factor': '', 'type': ''}, 'business_rules': {'experience': '', 'product_type': '', 'min_net_premium': '', 'min_population': ''}, 'status': '', 'comment': [{'name': '', 'date': '', 'comment': ''}]}","{'token_cost': 0.02323, 'image_cost': 0, 'total_cost': 0.02323}",DIRECTO,FW50017B
endoso_84,los padres del titular siempre y cuando éste sea soltero.,"{'endoso_id': 'endoso_84', 'endoso_master_id': '84', 'contract_no': 'FW52354B', 'subgrupo': 'Ejecuti', 'type': 'standard', 'endoso_details': {'name': 'URGENCIA MÉDICA EN EL EXTRANJERO (UMEX)', 'key': '', 'title': '', 'subtitle': '', 'description': 'los padres del titular siempre y cuando éste sea soltero.', 'parameters': {'column_parameters': [{'column_parameter_name': 'Urgencias Médicas', 'column_parameter_details': [{'sub_column_parameter_name': '', 'row_parameters': [{'row_parameter_name': 'suma asegurada', 'value': '', 'unit': '', 'type': 'std'}, {'row_parameter_name': 'deducible', 'value': '', 'unit': '', 'type': 'std'}, {'row_parameter_name': 'coaseguro', 'value': '', 'unit': '', 'type': 'std'}, {'row_parameter_name': 'información adicional', 'value': '', 'type': 'std'}, {'row_parameter_name': 'gastos cubiertos', 'value': '', 'type': 'std'}, {'row_parameter_name': 'gastos no cubiertos', 'value': '', 'type': 'std'}, {'row_parameter_name': 'aplicación de deducible y/o coaseguro', 'value': '', 'type': 'std'}, {'row_parameter_name': 'condiciones generales', 'value': 'Para los demás términos y condiciones, aplicarán las Condiciones Generales vigentes del producto contratado. Este Endoso forma parte del Contrato de Seguro', 'type': 'std'}, {'row_parameter_name': 'elegibilidad', 'value': '', 'type': 'exception'}, {'row_parameter_name': 'periodo de espera', 'value': '', 'type': 'exception'}, {'row_parameter_name': 'tope de coaseguro', 'value': '', 'type': 'exception'}, {'row_parameter_name': 'territorio de cobertura', 'value': '', 'type': 'exception'}]}]}, {'column_parameter_name': 'Accidente', 'column_parameter_details': [{'sub_column_parameter_name': '', 'row_parameters': [{'row_parameter_name': 'suma asegurada', 'value': '', 'unit': '', 'type': 'std'}, {'row_parameter_name': 'deducible', 'value': '', 'unit': '', 'type': 'std'}, {'row_parameter_name': 'coaseguro', 'value': '', 'unit': '', 'type': 'std'}, {'row_parameter_name': 'información adicional', 'value': '', 'type': 'std'}, {'row_parameter_name': 'gastos cubiertos', 'value': '', 'type': 'std'}, {'row_parameter_name': 'gastos no cubiertos', 'value': '', 'type': 'std'}, {'row_parameter_name': 'aplicación de deducible y/o coaseguro', 'value': '', 'type': 'std'}, {'row_parameter_name': 'condiciones generales', 'value': 'Para los demás términos y condiciones, aplicarán las Condiciones Generales vigentes del producto contratado. Este Endoso forma parte del Contrato de Seguro', 'type': 'std'}, {'row_parameter_name': 'elegibilidad', 'value': '', 'type': 'exception'}, {'row_parameter_name': 'periodo de espera', 'value': '', 'type': 'exception'}, {'row_parameter_name': 'tope de coaseguro', 'value': '', 'type': 'exception'}, {'row_parameter_name': 'territorio de cobertura', 'value': '', 'type': 'exception'}]}]}]}, 'legal': ''}, 'global_information': {'effective_date': '', 'expiration_date': '', 'factor': '', 'type': ''}, 'business_rules': {'experience': '', 'product_type': '', 'min_net_premium': '', 'min_population': ''}, 'status': '', 'comment': [{'name': '', 'date': '', 'comment': ''}]}","{'token_cost': 0.018320000000000003, 'image_cost': 0, 'total_cost': 0.018320000000000003}",Ejecuti,FW52354B
endoso_84,de los siguientes 30 días a la fecha de baja.,"{'endoso_id': 'endoso_84', 'endoso_master_id': '84', 'contract_no': 'FW52354B', 'subgrupo': 'Ejecuti', 'type': 'standard', 'endoso_details': {'name': 'URGENCIA MÉDICA EN EL EXTRANJERO (UMEX)', 'key': '', 'title': '', 'subtitle': '', 'description': 'de los siguientes 30 días a la fecha de baja.', 'parameters': {'column_parameters': [{'column_parameter_name': 'Urgencias Médicas', 'column_parameter_details': [{'sub_column_parameter_name': '', 'row_parameters': [{'row_parameter_name': 'suma asegurada', 'value': '', 'unit': '', 'type': 'std'}, {'row_parameter_name': 'deducible', 'value': '', 'unit': '', 'type': 'std'}, {'row_parameter_name': 'coaseguro', 'value': '', 'unit': '', 'type': 'std'}, {'row_parameter_name': 'información adicional', 'value': '', 'type': 'std'}, {'row_parameter_name': 'gastos cubiertos', 'value': '', 'type': 'std'}, {'row_parameter_name': 'gastos no cubiertos', 'value': '', 'type': 'std'}, {'row_parameter_name': 'aplicación de deducible y/o coaseguro', 'value': '', 'type': 'std'}, {'row_parameter_name': 'condiciones generales', 'value': 'Para los demás términos y condiciones, aplicarán las Condiciones Generales vigentes del producto contratado. Este Endoso forma parte del Contrato de Seguro.', 'type': 'std'}, {'row_parameter_name': 'elegibilidad', 'value': '', 'type': 'exception'}, {'row_parameter_name': 'periodo de espera', 'value': '', 'type': 'exception'}, {'row_parameter_name': 'tope de coaseguro', 'value': '', 'type': 'exception'}, {'row_parameter_name': 'territorio de cobertura', 'value': '', 'type': 'exception'}]}]}, {'column_parameter_name': 'Accidente', 'column_parameter_details': [{'sub_column_parameter_name': '', 'row_parameters': [{'row_parameter_name': 'suma asegurada', 'value': '', 'unit': '', 'type': 'std'}, {'row_parameter_name': 'deducible', 'value': '', 'unit': '', 'type': 'std'}, {'row_parameter_name': 'coaseguro', 'value': '', 'unit': '', 'type': 'std'}, {'row_parameter_name': 'información adicional', 'value': '', 'type': 'std'}, {'row_parameter_name': 'gastos cubiertos', 'value': '', 'type': 'std'}, {'row_parameter_name': 'gastos no cubiertos', 'value': '', 'type': 'std'}, {'row_parameter_name': 'aplicación de deducible y/o coaseguro', 'value': '', 'type': 'std'}, {'row_parameter_name': 'condiciones generales', 'value': 'Para los demás términos y condiciones, aplicarán las Condiciones Generales vigentes del producto contratado. Este Endoso forma parte del Contrato de Seguro.', 'type': 'std'}, {'row_parameter_name': 'elegibilidad', 'value': '', 'type': 'exception'}, {'row_parameter_name': 'periodo de espera', 'value': '', 'type': 'exception'}, {'row_parameter_name': 'tope de coaseguro', 'value': '', 'type': 'exception'}, {'row_parameter_name': 'territorio de cobertura', 'value': '', 'type': 'exception'}]}]}]}, 'legal': ''}, 'global_information': {'effective_date': '', 'expiration_date': '', 'factor': '', 'type': ''}, 'business_rules': {'experience': '', 'product_type': '', 'min_net_premium': '', 'min_population': ''}, 'status': '', 'comment': [{'name': '', 'date': '', 'comment': ''}]}","{'token_cost': 0.01827, 'image_cost': 0, 'total_cost': 0.01827}",Ejecuti,FW52354B
