endoso_code,text,extracted_parameters,cost_metrics,nom_subg,contract_no
endoso_82,"PREEXISTENCIA ( APLICABLE PARA ASEGURADOS CON FECHA DE INGRESO ANTERIOR AL_01/01/2011)___Por medio de este documento se hace constar que:_Quedan cubiertas las enfermedades o accidentes preexistentes cubiertos por la_presente póliza, aún y cuando:_a) La sintomatología previa a dicha enfermedad no haya pasado desapercibida._b) Se hubiera establecido diagnóstico antes del alta del Asegurado en esta_póliza._c) Existan gastos efectuados con anterioridad al inicio de la Cobertura._Sólo quedarán cubiertos los gastos realizados durante la vigencia de esta_póliza._Este endoso modifica la exclusión estipulada en las Condiciones Generales del_producto contratado, en el apartado V. Gastos Médicos Mayores No Cubiertos,_inciso 1._Para que el presente endoso entre en vigor, El Asegurado deberá cumplir con_un periodo de espera a partir de su inscripción en cualquiera de las pólizas_del pool de Asesorías Asseg, de:_Se elimina el periodo de espera_Reconocimiento de Antigüedad: Aplica, siempre y cuando, en la(s) vigencia(s)_ anterior(es), cuente con la cobertura de preexistencia._Será cubierta:_Dentro del territorio nacional y en el extranjero, siempre y cuando la póliza_cuente con la cobertura en el extranjero_Este endoso forma parte integral y complementa las Condiciones Generales del_Seguro.","{'endoso_id': 'endoso_82', 'endoso_master_id': '82', 'contract_no': 'FW16810L', 'subgrupo': 'SIN LIMITE TARIFA', 'type': 'standard', 'endoso_details': {'name': 'PREEXISTENCIA', 'key': '', 'title': '', 'subtitle': '', 'description': 'PREEXISTENCIA ( APLICABLE PARA ASEGURADOS CON FECHA DE INGRESO ANTERIOR AL 01/01/2011) Por medio de este documento se hace constar que: Quedan cubiertas las enfermedades o accidentes preexistentes cubiertos por la presente póliza, aún y cuando: a) La sintomatología previa a dicha enfermedad no haya pasado desapercibida. b) Se hubiera establecido diagnóstico antes del alta del Asegurado en esta póliza. c) Existan gastos efectuados con anterioridad al inicio de la Cobertura. Sólo quedarán cubiertos los gastos realizados durante la vigencia de esta póliza. Este endoso modifica la exclusión estipulada en las Condiciones Generales del producto contratado, en el apartado V. Gastos Médicos Mayores No Cubiertos, inciso 1. Para que el presente endoso entre en vigor, El Asegurado deberá cumplir con un periodo de espera a partir de su inscripción en cualquiera de las pólizas del pool de Asesorías Asseg, de: Se elimina el periodo de espera Reconocimiento de Antigüedad: Aplica, siempre y cuando, en la(s) vigencia(s) anterior(es), cuente con la cobertura de preexistencia. Será cubierta: Dentro del territorio nacional y en el extranjero, siempre y cuando la póliza cuente con la cobertura en el extranjero Este endoso forma parte integral y complementa las Condiciones Generales del Seguro.', 'parameters': {'column_parameters': '', 'row_parameters': [{'row_parameter_name': 'suma asegurada', 'value': '', 'unit': '', 'type': 'std'}, {'row_parameter_name': 'deducible', 'value': '', 'unit': '', 'type': 'std'}, {'row_parameter_name': 'coaseguro', 'value': '', 'unit': '', 'type': 'std'}, {'row_parameter_name': 'tope de coaseguro', 'value': '', 'unit': '', 'type': 'std'}, {'row_parameter_name': 'periodo espera', 'value': 'Se elimina el periodo de espera', 'unit': '', 'type': 'std'}, {'row_parameter_name': 'reconocimiento de antigüedad', 'value': 'Aplica', 'type': 'std'}, {'row_parameter_name': 'requisitos', 'value': '', 'type': 'std'}, {'row_parameter_name': 'gastos cubiertos', 'value': 'Quedan cubiertas las enfermedades o accidentes preexistentes cubiertos por la presente póliza.', 'type': 'std'}, {'row_parameter_name': 'gastos no cubiertos', 'value': '', 'type': 'std'}, {'row_parameter_name': 'aplicación de deducible y/o coaseguro', 'value': '', 'type': 'std'}, {'row_parameter_name': 'condiciones generales', 'value': 'Este endoso forma parte integral y complementa las Condiciones Generales del Seguro.', 'type': 'std'}, {'row_parameter_name': 'elegibilidad', 'value': '', 'type': 'exception'}, {'row_parameter_name': 'territorio de cobertura', 'value': 'nacional y en el extranjero', 'type': 'exception'}], 'legal': 'Este endoso forma parte integral y complementa las Condiciones Generales del Seguro.'}}, 'global_information': {'effective_date': '', 'expiration_date': '', 'factor': '', 'type': ''}, 'business_rules': {'experience': '', 'product_type': '', 'min_net_premium': '', 'min_population': ''}, 'status': '', 'comment': [{'name': '', 'date': '', 'comment': ''}]}","{'token_cost': 0.01625, 'image_cost': 0, 'total_cost': 0.01625}",SIN LIMITE TARIFA,FW16810L
endoso_97,"VISI-055 VISIÓNQuedan cubiertas las asistencias de Visión para los asegurados_vigentes en esta póliza de acuerdo a lo siguiente:1. Paquete BásicoSIN COSTO:_- Examen de la vista COSTO PREFERENTE:- 20% de descuento en todas las marcas_del prestador en convenio, en los siguientes productos:o Armazones y lentes_graduados o Lentes de contacto graduados o Estuche duro*Los porcentajes_indicados corresponden al descuento que aplica el prestador en convenio.*El_límite anual por asegurado: Un servicio al añoLos descuentos sólo aplican en_micas blancas CR39 monofocales, bifocales (no cosméticos)Los servicios_indicados solo aplican en la República Mexicana, en los lugares que el_prestador de servicios indique y sujeto a disponibilidad en la localidad_correspondiente.Los descuentos no son acumulables con otras promociones.Este_servicio se cubre una vez por año, es decir que si se requiere lentes o_armazones, deberá haber transcurrido un año de que obtuvo los anteriores.Solo_un tipo de lente de contacto o armazón, en ningún caso se cubrirán ambos.La_autorización de cristales o micas será al cambio de graduación por_diferencias mayores a 0.25 dioptrías en cada ojo, con respecto al año_anterior o al lente actual.Los descuentos aplican de acuerdo a la óptica y_ciudad que el Proveedor refiera al asegurado.No se autorizan tratamientos de_color, tratamiento Photocromático o Fotogray, lentes solares aún graduados,_Armazones solos, Lentes oftálmicas sin graduar, Lentes de contacto cosméticos_aún graduados, Medicamentos, Estudios de laboratorio y gabinete.Para utilizar_este servicio el asegurado deberá seguir los siguientes pasos:1. Ingresar al_sitio: https://axa.mx/web/seguro-de-salud/beneficios y selecciona la ópticas_de tu preferencia.2. Llama al Centro de Atención Telefónica de ODONTOPREV:a._CDMX y/o Área Metropolitana: (55) 5480-0911/Interior de la República: (01_800) 833-6825 y/ob. AXA seguros: (01 800) 001 8700 opción 1Acudir a las_Ópticas en convenio y presentar su credencial de asegurado AXA e_identificación oficial.Si ya identificaste al proveedor con el que deseas_acudir, preséntate con tu credencial de asegurado e identificación oficial.En_caso que el asegurado llame a Tu Médico 24 horas éste será referido con el_proveedor.Para mayor información de los Servicios de Asistencia de Visión_consulta el documento ¿Conoce tu asistencia¿Los demás términos y condiciones,_deben aplicar de acuerdo a las Condiciones Generales del producto_contratado.Este endoso forma parte integral y complementa las Condiciones_Generales del Seguro.","{'endoso_id': 'endoso_97', 'endoso_master_id': '97', 'contract_no': 'FW40223D', 'subgrupo': 'SUBGRUPO 3', 'type': 'standard', 'endoso_details': {'name': 'VISIÓN', 'key': 'VISI-055', 'title': '', 'subtitle': '', 'description': 'Quedan cubiertas las asistencias de Visión para los asegurados vigentes en esta póliza de acuerdo a lo siguiente: 1. Paquete Básico SIN COSTO: - Examen de la vista COSTO PREFERENTE: - 20% de descuento en todas las marcas del prestador en convenio, en los siguientes productos: o Armazones y lentes graduados o Lentes de contacto graduados o Estuche duro *Los porcentajes indicados corresponden al descuento que aplica el prestador en convenio. *El límite anual por asegurado: Un servicio al año Los descuentos sólo aplican en micas blancas CR39 monofocales, bifocales (no cosméticos) Los servicios indicados solo aplican en la República Mexicana, en los lugares que el prestador de servicios indique y sujeto a disponibilidad en la localidad correspondiente. Los descuentos no son acumulables con otras promociones. Este servicio se cubre una vez por año, es decir que si se requiere lentes o armazones, deberá haber transcurrido un año de que obtuvo los anteriores. Solo un tipo de lente de contacto o armazón, en ningún caso se cubrirán ambos. La autorización de cristales o micas será al cambio de graduación por diferencias mayores a 0.25 dioptrías en cada ojo, con respecto al año anterior o al lente actual. Los descuentos aplican de acuerdo a la óptica y ciudad que el Proveedor refiera al asegurado. No se autorizan tratamientos de color, tratamiento Photocromático o Fotogray, lentes solares aún graduados, Armazones solos, Lentes oftálmicas sin graduar, Lentes de contacto cosméticos aún graduados, Medicamentos, Estudios de laboratorio y gabinete. Para utilizar este servicio el asegurado deberá seguir los siguientes pasos: 1. Ingresar al sitio: https://axa.mx/web/seguro-de-salud/beneficios y selecciona la ópticas de tu preferencia. 2. Llama al Centro de Atención Telefónica de ODONTOPREV: a. CDMX y/o Área Metropolitana: (55) 5480-0911/Interior de la República: (01 800) 833-6825 y/o b. AXA seguros: (01 800) 001 8700 opción 1 Acudir a las Ópticas en convenio y presentar su credencial de asegurado AXA e identificación oficial. Si ya identificaste al proveedor con el que deseas acudir, preséntate con tu credencial de asegurado e identificación oficial. En caso que el asegurado llame a Tu Médico 24 horas éste será referido con el proveedor. Para mayor información de los Servicios de Asistencia de Visión consulta el documento ¿Conoce tu asistencia¿ Los demás términos y condiciones, deben aplicar de acuerdo a las Condiciones Generales del producto contratado. Este endoso forma parte integral y complementa las Condiciones Generales del Seguro.', 'parameters': {'column_parameters': '', 'row_parameters': [{'row_parameter_name': 'Descripcion', 'editable': True, 'active': True, 'type': 'std', 'value_type': 'text'}, {'row_parameter_name': 'Condiciones Generales', 'editable': True, 'active': True, 'type': 'std', 'value_type': 'string', 'value': 'Para los demás términos y condiciones, aplicarán las Condiciones Generales vigentes del producto contratado. Este Endoso forma parte del Contrato de Seguro'}], 'legal': 'Los demás términos y condiciones, deben aplicar de acuerdo a las Condiciones Generales del producto contratado. Este endoso forma parte integral y complementa las Condiciones Generales del Seguro.'}}, 'global_information': {'effective_date': '', 'expiration_date': '', 'factor': '', 'type': ''}, 'business_rules': {'experience': '', 'product_type': '', 'min_net_premium': '', 'min_population': ''}, 'status': '', 'comment': [{'name': '', 'date': '', 'comment': ''}]}","{'token_cost': 0.0156925, 'image_cost': 0, 'total_cost': 0.0156925}",SUBGRUPO 3,FW40223D
endoso_38,"HALLUX VALGUS_____Se ampara el tratamiento médico quirúrgico de hallux valgus o juanetes,_____siempre y cuando no sea de carácter estético.__________Quedará cubierto de la siguiente manera:_____Hasta el monto máximo de: $20,000.00 M.N._____Con un periodo de espera de: Sin Periodo de Espera__________Aplicación deducible y coaseguro:__________Pago directo_____Deducible:_$1,000.00 M.N.____Coaseguro:_0%_________Pago por Reembolso_____Deducible:_$3,500.00 M.N.____Coaseguro:_25%_________El presente endoso modifica el capitulo de Gastos Médicos Mayores No_____Cubiertos en su inciso de Tratamiento médico o quirúrgico de hallux_valgus_____o juanetes.__________Invariablemente se aplicarán los deducibles y coaseguros antes_mencionados_____en dicha cobertura.__________En territorio: nacional__________Este endoso forma parte integral y complementa las condiciones generales_____del seguro._________","{'endoso_id': 'endoso_38', 'endoso_master_id': '38', 'contract_no': 'FW54030A', 'subgrupo': 'GENERAL', 'type': 'standard', 'endoso_details': {'name': 'HALLUX VALGUS', 'key': '', 'title': '', 'subtitle': '', 'description': 'Se ampara el tratamiento médico quirúrgico de hallux valgus o juanetes, siempre y cuando no sea de carácter estético. Quedará cubierto de la siguiente manera: Hasta el monto máximo de: $20,000.00 M.N. Con un periodo de espera de: Sin Periodo de Espera Aplicación deducible y coaseguro: Pago directo Deducible: $1,000.00 M.N. Coaseguro: 0% Pago por Reembolso Deducible: $3,500.00 M.N. Coaseguro: 25% El presente endoso modifica el capitulo de Gastos Médicos Mayores No Cubiertos en su inciso de Tratamiento médico o quirúrgico de hallux valgus o juanetes. Invariablemente se aplicarán los deducibles y coaseguros antes mencionados en dicha cobertura. En territorio: nacional Este endoso forma parte integral y complementa las condiciones generales del seguro.', 'parameters': {'column_parameters': [{'column_parameter_name': 'Pago directo', 'column_parameter_details': [{'sub_column_parameter_name': '', 'row_parameters': [{'row_parameter_name': 'suma asegurada', 'value': '20,000', 'unit': 'M.N.', 'type': 'std'}, {'row_parameter_name': 'deducible', 'value': '1,000', 'unit': 'M.N.', 'type': 'std'}, {'row_parameter_name': 'coaseguro', 'value': '0', 'unit': '%', 'type': 'std'}, {'row_parameter_name': 'tope de coaseguro', 'value': '', 'unit': '', 'type': 'std'}, {'row_parameter_name': 'territorio de cobertura', 'value': 'nacional', 'type': 'std'}, {'row_parameter_name': 'periodo espera', 'value': '0', 'unit': '', 'type': 'std'}, {'row_parameter_name': 'gastos cubiertos', 'value': '', 'type': 'std'}, {'row_parameter_name': 'gastos no cubiertos', 'value': '', 'type': 'std'}, {'row_parameter_name': 'aplicación de deducible y/o coaseguro', 'value': 'Y', 'type': 'std'}, {'row_parameter_name': 'condiciones generales', 'value': 'Este endoso forma parte integral y complementa las condiciones generales del seguro.', 'type': 'std'}, {'row_parameter_name': 'consulta postoperatoria', 'value': '', 'type': 'exception'}, {'row_parameter_name': 'consulta preoperatoria', 'value': '', 'type': 'exception'}]}]}, {'column_parameter_name': 'Reembolso', 'column_parameter_details': [{'sub_column_parameter_name': '', 'row_parameters': [{'row_parameter_name': 'suma asegurada', 'value': '20,000', 'unit': 'M.N.', 'type': 'std'}, {'row_parameter_name': 'deducible', 'value': '3,500', 'unit': 'M.N.', 'type': 'std'}, {'row_parameter_name': 'coaseguro', 'value': '25', 'unit': '%', 'type': 'std'}, {'row_parameter_name': 'tope de coaseguro', 'value': '', 'unit': '', 'type': 'std'}, {'row_parameter_name': 'territorio de cobertura', 'value': 'nacional', 'type': 'std'}, {'row_parameter_name': 'periodo espera', 'value': '0', 'unit': '', 'type': 'std'}, {'row_parameter_name': 'gastos cubiertos', 'value': '', 'type': 'std'}, {'row_parameter_name': 'gastos no cubiertos', 'value': '', 'type': 'std'}, {'row_parameter_name': 'aplicación de deducible y/o coaseguro', 'value': 'Y', 'type': 'std'}, {'row_parameter_name': 'condiciones generales', 'value': 'Este endoso forma parte integral y complementa las condiciones generales del seguro.', 'type': 'std'}, {'row_parameter_name': 'consulta postoperatoria', 'value': '', 'type': 'exception'}, {'row_parameter_name': 'consulta preoperatoria', 'value': '', 'type': 'exception'}]}]}]}, 'legal': 'Este endoso forma parte integral y complementa las condiciones generales del seguro.'}, 'global_information': {'effective_date': '', 'expiration_date': '', 'factor': '', 'type': ''}, 'business_rules': {'experience': '', 'product_type': '', 'min_net_premium': '', 'min_population': ''}, 'status': '', 'comment': [{'name': '', 'date': '', 'comment': ''}]}","{'token_cost': 0.0210725, 'image_cost': 0, 'total_cost': 0.0210725}",GENERAL,FW54030A
endoso_38,"_HALLUX VALGUS__Se ampara el tratamiento médico quirúrgico de hallux valgus o juanetes,_ siempre y cuando no sea de carácter estético.__El monto a indemnizar para este beneficio y/o cobertura será:_Hasta el G.U.A.__Monto Máximo a Indemnizar -__Con un periodo de espera de:_Sin periodo de espera__Aplicación de deducible y coaseguro:__Pago Directo (Médico y Hospital en convenio de acuerdo al nivel_ hospitalario contratado)__Deducible            1,500.00   M.N.__Coaseguro                0.00   %__Reembolso:__Deducible            4,000.00   M.N.__Coaseguro               10.00   %__En caso de modificación del deducible y/o coaseguro originalmente pactado,_ invariablemente se aplicarán los deducibles y coaseguros antes_ mencionados en dicha cobertura/condición.__El presente endoso modifica el capítulo de Gastos Médicos Mayores No_ Cubiertos en su inciso de Tratamiento Médico o Quirúrgico de Hallux_ Valgus o Juanetes.__Se cubre únicamente en territorio nacional.__Este endoso forma parte integral y complementa las Condiciones Generales_ del Seguro","{'endoso_id': 'endoso_38', 'endoso_master_id': '38', 'contract_no': 'FW33529E', 'subgrupo': 'GENERAL', 'type': 'standard', 'endoso_details': {'name': 'HALLUX VALGUS', 'key': '', 'title': '', 'subtitle': '', 'description': 'Se ampara el tratamiento médico quirúrgico de hallux valgus o juanetes, siempre y cuando no sea de carácter estético. El monto a indemnizar para este beneficio y/o cobertura será: Hasta el G.U.A. Monto Máximo a Indemnizar - Con un periodo de espera de: Sin periodo de espera Aplicación de deducible y coaseguro: Pago Directo (Médico y Hospital en convenio de acuerdo al nivel hospitalario contratado) Deducible 1,500.00 M.N. Coaseguro 0.00 % Reembolso: Deducible 4,000.00 M.N. Coaseguro 10.00 % En caso de modificación del deducible y/o coaseguro originalmente pactado, invariablemente se aplicarán los deducibles y coaseguros antes mencionados en dicha cobertura/condición. El presente endoso modifica el capítulo de Gastos Médicos Mayores No Cubiertos en su inciso de Tratamiento Médico o Quirúrgico de Hallux Valgus o Juanetes. Se cubre únicamente en territorio nacional. Este endoso forma parte integral y complementa las Condiciones Generales del Seguro', 'parameters': {'column_parameters': [{'column_parameter_name': 'Pago directo', 'column_parameter_details': [{'sub_column_parameter_name': '', 'row_parameters': [{'row_parameter_name': 'suma asegurada', 'value': '', 'unit': '', 'type': 'std'}, {'row_parameter_name': 'deducible', 'value': '1,500.00', 'unit': 'M.N.', 'type': 'std'}, {'row_parameter_name': 'coaseguro', 'value': '0.00', 'unit': '%', 'type': 'std'}, {'row_parameter_name': 'tope de coaseguro', 'value': '', 'unit': '', 'type': 'std'}, {'row_parameter_name': 'territorio de cobertura', 'value': 'nacional', 'type': 'std'}, {'row_parameter_name': 'periodo espera', 'value': 'Sin periodo de espera', 'type': 'std'}, {'row_parameter_name': 'gastos cubiertos', 'value': '', 'type': 'std'}, {'row_parameter_name': 'gastos no cubiertos', 'value': 'El presente endoso modifica el capítulo de Gastos Médicos Mayores No Cubiertos en su inciso de Tratamiento Médico o Quirúrgico de Hallux Valgus o Juanetes.', 'type': 'std'}, {'row_parameter_name': 'aplicación de deducible y/o coaseguro', 'value': 'true', 'type': 'std'}, {'row_parameter_name': 'condiciones generales', 'value': 'Este endoso forma parte integral y complementa las Condiciones Generales del Seguro', 'type': 'std'}, {'row_parameter_name': 'consulta postoperatoria', 'value': '', 'type': 'exception'}, {'row_parameter_name': 'consulta preoperatoria', 'value': '', 'type': 'exception'}]}]}, {'column_parameter_name': 'Reembolso', 'column_parameter_details': [{'sub_column_parameter_name': '', 'row_parameters': [{'row_parameter_name': 'suma asegurada', 'value': '', 'unit': '', 'type': 'std'}, {'row_parameter_name': 'deducible', 'value': '4,000.00', 'unit': 'M.N.', 'type': 'std'}, {'row_parameter_name': 'coaseguro', 'value': '10.00', 'unit': '%', 'type': 'std'}, {'row_parameter_name': 'tope de coaseguro', 'value': '', 'unit': '', 'type': 'std'}, {'row_parameter_name': 'territorio de cobertura', 'value': 'nacional', 'type': 'std'}, {'row_parameter_name': 'periodo espera', 'value': 'Sin periodo de espera', 'type': 'std'}, {'row_parameter_name': 'gastos cubiertos', 'value': '', 'type': 'std'}, {'row_parameter_name': 'gastos no cubiertos', 'value': 'El presente endoso modifica el capítulo de Gastos Médicos Mayores No Cubiertos en su inciso de Tratamiento Médico o Quirúrgico de Hallux Valgus o Juanetes.', 'type': 'std'}, {'row_parameter_name': 'aplicación de deducible y/o coaseguro', 'value': 'true', 'type': 'std'}, {'row_parameter_name': 'condiciones generales', 'value': 'Este endoso forma parte integral y complementa las Condiciones Generales del Seguro', 'type': 'std'}, {'row_parameter_name': 'consulta postoperatoria', 'value': '', 'type': 'exception'}, {'row_parameter_name': 'consulta preoperatoria', 'value': '', 'type': 'exception'}]}]}]}, 'legal': 'Este endoso forma parte integral y complementa las Condiciones Generales del Seguro'}, 'global_information': {'effective_date': '', 'expiration_date': '', 'factor': '', 'type': ''}, 'business_rules': {'experience': '', 'product_type': '', 'min_net_premium': '', 'min_population': ''}, 'status': '', 'comment': [{'name': '', 'date': '', 'comment': ''}]}","{'token_cost': 0.022315, 'image_cost': 0, 'total_cost': 0.022315}",GENERAL,FW33529E
