endoso_code,text,extracted_parameters,cost_metrics,nom_subg,contract_no
endoso_38,"_HALLUX VALGUS_La Compañía cubrirá los gastos médicos erogados durante la vigencia de esta_Póliza, para corregir hallux valgus o juanetes siempre_y cuando no sea de carácter estético, hasta los limites de responsabilidad_que se establecen en este endoso._Suma Asegurada: De la póliza_Para este Endoso si es aplicable el Endoso de Aplicación de Deducible y/o_Coaseguro._Para los demás términos y condiciones, aplicarán las Condiciones Generales_vigentes del producto contratado._Este Endoso forma parte del Contrato de Seguro.","{'endoso_id': 'endoso_38', 'endoso_master_id': '38', 'contract_no': 'FW81437B', 'subgrupo': 'SUBGRUP', 'type': 'standard', 'endoso_details': {'name': 'HALLUX VALGUS', 'key': '', 'title': '', 'subtitle': '', 'description': 'La Compañía cubrirá los gastos médicos erogados durante la vigencia de esta Póliza, para corregir hallux valgus o juanetes siempre y cuando no sea de carácter estético, hasta los limites de responsabilidad que se establecen en este endoso. Suma Asegurada: De la póliza Para este Endoso si es aplicable el Endoso de Aplicación de Deducible y/o Coaseguro. Para los demás términos y condiciones, aplicarán las Condiciones Generales vigentes del producto contratado. Este Endoso forma parte del Contrato de Seguro.', 'parameters': {'column_parameters': [{'column_parameter_name': 'Pago directo', 'column_parameter_details': [{'row_parameters': [{'row_parameter_name': 'suma asegurada', 'value': 'De la póliza', 'unit': '', 'type': 'std'}, {'row_parameter_name': 'deducible', 'value': '', 'unit': '', 'type': 'std'}, {'row_parameter_name': 'coaseguro', 'value': '', 'unit': '', 'type': 'std'}, {'row_parameter_name': 'tope de coaseguro', 'value': '', 'unit': '', 'type': 'std'}, {'row_parameter_name': 'territorio de cobertura', 'value': '', 'unit': '', 'type': 'std'}, {'row_parameter_name': 'periodo espera', 'value': '', 'unit': '', 'type': 'std'}, {'row_parameter_name': 'gastos cubiertos', 'value': '', 'unit': '', 'type': 'std'}, {'row_parameter_name': 'gastos no cubiertos', 'value': '', 'unit': '', 'type': 'std'}, {'row_parameter_name': 'aplicación de deducible y/o coaseguro', 'value': 'true', 'type': 'std'}, {'row_parameter_name': 'condiciones generales', 'value': 'Para los demás términos y condiciones, aplicarán las Condiciones Generales vigentes del producto contratado. Este Endoso forma parte del Contrato de Seguro.', 'type': 'std'}, {'row_parameter_name': 'consulta postoperatoria', 'value': '', 'type': 'exception'}, {'row_parameter_name': 'consulta preoperatoria', 'value': '', 'type': 'exception'}]}]}, {'column_parameter_name': 'Reembolso', 'column_parameter_details': [{'row_parameters': [{'row_parameter_name': 'suma asegurada', 'value': 'De la póliza', 'unit': '', 'type': 'std'}, {'row_parameter_name': 'deducible', 'value': '', 'unit': '', 'type': 'std'}, {'row_parameter_name': 'coaseguro', 'value': '', 'unit': '', 'type': 'std'}, {'row_parameter_name': 'tope de coaseguro', 'value': '', 'unit': '', 'type': 'std'}, {'row_parameter_name': 'territorio de cobertura', 'value': '', 'unit': '', 'type': 'std'}, {'row_parameter_name': 'periodo espera', 'value': '', 'unit': '', 'type': 'std'}, {'row_parameter_name': 'gastos cubiertos', 'value': '', 'unit': '', 'type': 'std'}, {'row_parameter_name': 'gastos no cubiertos', 'value': '', 'unit': '', 'type': 'std'}, {'row_parameter_name': 'aplicación de deducible y/o coaseguro', 'value': 'true', 'type': 'std'}, {'row_parameter_name': 'condiciones generales', 'value': 'Para los demás términos y condiciones, aplicarán las Condiciones Generales vigentes del producto contratado. Este Endoso forma parte del Contrato de Seguro.', 'type': 'std'}, {'row_parameter_name': 'consulta postoperatoria', 'value': '', 'type': 'exception'}, {'row_parameter_name': 'consulta preoperatoria', 'value': '', 'type': 'exception'}]}]}]}, 'legal': 'Para los demás términos y condiciones, aplicarán las Condiciones Generales vigentes del producto contratado. Este Endoso forma parte del Contrato de Seguro.'}, 'global_information': {'effective_date': '', 'expiration_date': '', 'factor': '', 'type': ''}, 'business_rules': {'experience': '', 'product_type': '', 'min_net_premium': '', 'min_population': ''}, 'status': '', 'comment': [{'name': '', 'date': '', 'comment': ''}]}","{'token_cost': 0.020285, 'image_cost': 0, 'total_cost': 0.020285}",SUBGRUP,FW81437B
endoso_84,"La Compañía cubrirá los gastos médicos erogados durante la vigencia de ésta_póliza, por Urgencias Médicas en el Extranjero modificando los límites de_responsabilidad de esta cobertura, hasta los que se indiquen en este endoso:__Suma Asegurada: 50,000 USD__Deducible: 50 USD__Para este Endoso no es aplicable el Endoso de Aplicación de Deducible y/o_Coaseguro.__Para los demás términos y condiciones, aplicarán las Condiciones Generales_vigentes del producto contratado.__Este Endoso forma parte del Contrato de Seguro.","{'endoso_id': 'endoso_84', 'endoso_master_id': '84', 'contract_no': 'FW29704G', 'subgrupo': 'EMPLEAD', 'type': 'standard', 'endoso_details': {'name': 'URGENCIA MÉDICA EN EL EXTRANJERO (UMEX)', 'key': '', 'title': '', 'subtitle': '', 'description': 'La Compañía cubrirá los gastos médicos erogados durante la vigencia de ésta póliza, por Urgencias Médicas en el Extranjero modificando los límites de responsabilidad de esta cobertura, hasta los que se indiquen en este endoso: Suma Asegurada: 50,000 USD Deducible: 50 USD Para este Endoso no es aplicable el Endoso de Aplicación de Deducible y/o Coaseguro.Para los demás términos y condiciones, aplicarán las Condiciones Generales vigentes del producto contratado.Este Endoso forma parte del Contrato de Seguro.', 'parameters': {'column_parameters': [{'column_parameter_name': 'Urgencias Médicas', 'column_parameter_details': [{'sub_column_parameter_name': '', 'row_parameters': [{'row_parameter_name': 'suma asegurada', 'value': '50,000', 'unit': 'USD', 'type': 'std'}, {'row_parameter_name': 'deducible', 'value': '50', 'unit': 'USD', 'type': 'std'}, {'row_parameter_name': 'coaseguro', 'value': '', 'type': 'std'}, {'row_parameter_name': 'información adicional', 'value': '', 'type': 'std'}, {'row_parameter_name': 'gastos cubiertos', 'value': '', 'type': 'std'}, {'row_parameter_name': 'gastos no cubiertos', 'value': '', 'type': 'std'}, {'row_parameter_name': 'aplicación de deducible y/o coaseguro', 'value': 'false', 'type': 'std'}, {'row_parameter_name': 'condiciones generales', 'value': 'Para los demás términos y condiciones, aplicarán las Condiciones Generales vigentes del producto contratado. Este Endoso forma parte del Contrato de Seguro.', 'type': 'std'}, {'row_parameter_name': 'elegibilidad', 'value': '', 'type': 'exception'}, {'row_parameter_name': 'periodo de espera', 'value': '', 'type': 'exception'}, {'row_parameter_name': 'tope de coaseguro', 'value': '', 'type': 'exception'}, {'row_parameter_name': 'territorio de cobertura', 'value': '', 'type': 'exception'}]}]}, {'column_parameter_name': 'Accidente', 'column_parameter_details': [{'sub_column_parameter_name': '', 'row_parameters': [{'row_parameter_name': 'suma asegurada', 'value': '', 'type': 'std'}, {'row_parameter_name': 'deducible', 'value': '', 'type': 'std'}, {'row_parameter_name': 'coaseguro', 'value': '', 'type': 'std'}, {'row_parameter_name': 'información adicional', 'value': '', 'type': 'std'}, {'row_parameter_name': 'gastos cubiertos', 'value': '', 'type': 'std'}, {'row_parameter_name': 'gastos no cubiertos', 'value': '', 'type': 'std'}, {'row_parameter_name': 'aplicación de deducible y/o coaseguro', 'value': '', 'type': 'std'}, {'row_parameter_name': 'condiciones generales', 'value': 'Para los demás términos y condiciones, aplicarán las Condiciones Generales vigentes del producto contratado. Este Endoso forma parte del Contrato de Seguro.', 'type': 'std'}, {'row_parameter_name': 'elegibilidad', 'value': '', 'type': 'exception'}, {'row_parameter_name': 'periodo de espera', 'value': '', 'type': 'exception'}, {'row_parameter_name': 'tope de coaseguro', 'value': '', 'type': 'exception'}, {'row_parameter_name': 'territorio de cobertura', 'value': '', 'type': 'exception'}]}]}], 'legal': 'Para los demás términos y condiciones, aplicarán las Condiciones Generales vigentes del producto contratado. Este Endoso forma parte del Contrato de Seguro.'}}, 'global_information': {'effective_date': '', 'expiration_date': '', 'factor': '', 'type': ''}, 'business_rules': {'experience': '', 'product_type': '', 'min_net_premium': '', 'min_population': ''}, 'status': '', 'comment': [{'name': '', 'date': '', 'comment': ''}]}","{'token_cost': 0.020657500000000002, 'image_cost': 0, 'total_cost': 0.020657500000000002}",EMPLEAD,FW29704G
endoso_38,"Se amparan los gastos médicos y quirúrgicos a consecuencia de Hallux Valgus_o Juanetes que no sean de carácter estético, fundamentando el diagnóstico_mediante un estudio radiológico.__Las condiciones que aplicarán para esta cobertura son las siguientes:_Suma Asegurada __        De la póliza_Deducible ___De la póliza_Coaseguro_ __De la póliza_Período de Espera __No aplica_Segunda Valoración Médica  _No requerida__Para esta cobertura opera el endoso de aplicación de deducible y coaseguro_con el que cuenta la presente póliza.__Los demás términos y condiciones permanecen sin modificación alguna.","{'endoso_id': 'endoso_38', 'endoso_master_id': '38', 'contract_no': 'FW52990A', 'subgrupo': 'GENERAL', 'type': 'standard', 'endoso_details': {'name': 'HALLUX VALGUS', 'key': '', 'title': '', 'subtitle': '', 'description': 'Se amparan los gastos médicos y quirúrgicos a consecuencia de Hallux Valgus o Juanetes que no sean de carácter estético, fundamentando el diagnóstico mediante un estudio radiológico. Las condiciones que aplicarán para esta cobertura son las siguientes: Suma Asegurada De la póliza Deducible De la póliza Coaseguro De la póliza Período de Espera No aplica Segunda Valoración Médica No requerida Para esta cobertura opera el endoso de aplicación de deducible y coaseguro con el que cuenta la presente póliza. Los demás términos y condiciones permanecen sin modificación alguna.', 'parameters': {'column_parameters': [{'column_parameter_name': 'Pago directo', 'column_parameter_details': [{'sub_column_parameter_name': '', 'row_parameters': [{'row_parameter_name': 'suma asegurada', 'value': 'De la póliza', 'unit': '', 'type': 'std'}, {'row_parameter_name': 'deducible', 'value': 'De la póliza', 'unit': '', 'type': 'std'}, {'row_parameter_name': 'coaseguro', 'value': 'De la póliza', 'unit': '', 'type': 'std'}, {'row_parameter_name': 'tope de coaseguro', 'value': '', 'unit': '', 'type': 'std'}, {'row_parameter_name': 'territorio de cobertura', 'value': '', 'unit': '', 'type': 'std'}, {'row_parameter_name': 'periodo espera', 'value': 'No aplica', 'unit': '', 'type': 'std'}, {'row_parameter_name': 'gastos cubiertos', 'value': '', 'unit': '', 'type': 'std'}, {'row_parameter_name': 'gastos no cubiertos', 'value': '', 'unit': '', 'type': 'std'}, {'row_parameter_name': 'aplicación de deducible y/o coaseguro', 'value': 'Y', 'unit': '', 'type': 'std'}, {'row_parameter_name': 'condiciones generales', 'value': 'Los demás términos y condiciones permanecen sin modificación alguna.', 'unit': '', 'type': 'std'}, {'row_parameter_name': 'consulta postoperatoria', 'value': '', 'unit': '', 'type': 'exception'}, {'row_parameter_name': 'consulta preoperatoria', 'value': '', 'unit': '', 'type': 'exception'}]}]}, {'column_parameter_name': 'Reembolso', 'column_parameter_details': [{'sub_column_parameter_name': '', 'row_parameters': [{'row_parameter_name': 'suma asegurada', 'value': 'De la póliza', 'unit': '', 'type': 'std'}, {'row_parameter_name': 'deducible', 'value': 'De la póliza', 'unit': '', 'type': 'std'}, {'row_parameter_name': 'coaseguro', 'value': 'De la póliza', 'unit': '', 'type': 'std'}, {'row_parameter_name': 'tope de coaseguro', 'value': '', 'unit': '', 'type': 'std'}, {'row_parameter_name': 'territorio de cobertura', 'value': '', 'unit': '', 'type': 'std'}, {'row_parameter_name': 'periodo espera', 'value': 'No aplica', 'unit': '', 'type': 'std'}, {'row_parameter_name': 'gastos cubiertos', 'value': '', 'unit': '', 'type': 'std'}, {'row_parameter_name': 'gastos no cubiertos', 'value': '', 'unit': '', 'type': 'std'}, {'row_parameter_name': 'aplicación de deducible y/o coaseguro', 'value': 'Y', 'unit': '', 'type': 'std'}, {'row_parameter_name': 'condiciones generales', 'value': 'Los demás términos y condiciones permanecen sin modificación alguna.', 'unit': '', 'type': 'std'}, {'row_parameter_name': 'consulta postoperatoria', 'value': '', 'unit': '', 'type': 'exception'}, {'row_parameter_name': 'consulta preoperatoria', 'value': '', 'unit': '', 'type': 'exception'}]}]}]}, 'legal': 'Para los demás términos y condiciones, aplicarán las Condiciones Generales vigentes del producto contratado. Este Endoso forma parte del Contrato de Seguro.'}, 'global_information': {'effective_date': '', 'expiration_date': '', 'factor': '', 'type': ''}, 'business_rules': {'experience': '', 'product_type': '', 'min_net_premium': '', 'min_population': ''}, 'status': '', 'comment': [{'name': '', 'date': '', 'comment': ''}]}","{'token_cost': 0.02076, 'image_cost': 0, 'total_cost': 0.02076}",GENERAL,FW52990A
endoso_84,"_Esta compañía se exime de toda responsabilidad proveniente de cualquier_reclamación, en donde el motivo de la misma ocurra dentro del periodo_comprendido entre:__El 13 de FEBRERO del 2017 al 05 de ABRIL del 2017, para las personas_incluidas mediante  el endoso: 11989574.__Lo anterior ya que el contratante presenta carta de no siniestro.__Los demás términos y condiciones quedan sin modificación alguna.","{'endoso_id': 'endoso_84', 'endoso_master_id': '84', 'contract_no': 'FW32254G', 'subgrupo': 'SUBGRUP', 'type': 'standard', 'endoso_details': {'name': 'URGENCIA MÉDICA EN EL EXTRANJERO (UMEX)', 'key': '', 'title': '', 'subtitle': '', 'description': 'Esta compañía se exime de toda responsabilidad proveniente de cualquier reclamación, en donde el motivo de la misma ocurra dentro del periodo comprendido entre: El 13 de FEBRERO del 2017 al 05 de ABRIL del 2017, para las personas incluidas mediante el endoso: 11989574. Lo anterior ya que el contratante presenta carta de no siniestro. Los demás términos y condiciones quedan sin modificación alguna.', 'parameters': {'column_parameters': [{'column_parameter_name': 'Urgencias Médicas', 'column_parameter_details': [{'sub_column_parameter_name': '', 'row_parameters': [{'row_parameter_name': 'suma asegurada', 'value': '', 'unit': '', 'type': 'std'}, {'row_parameter_name': 'deducible', 'value': '', 'unit': '', 'type': 'std'}, {'row_parameter_name': 'coaseguro', 'value': '', 'unit': '', 'type': 'std'}, {'row_parameter_name': 'información adicional', 'value': '', 'type': 'std'}, {'row_parameter_name': 'gastos cubiertos', 'value': '', 'type': 'std'}, {'row_parameter_name': 'gastos no cubiertos', 'value': '', 'type': 'std'}, {'row_parameter_name': 'aplicación de deducible y/o coaseguro', 'value': '', 'type': 'std'}, {'row_parameter_name': 'condiciones generales', 'value': 'Los demás términos y condiciones quedan sin modificación alguna.', 'type': 'std'}, {'row_parameter_name': 'elegibilidad', 'value': '', 'type': 'exception'}, {'row_parameter_name': 'periodo de espera', 'value': '', 'type': 'exception'}, {'row_parameter_name': 'tope de coaseguro', 'value': '', 'type': 'exception'}, {'row_parameter_name': 'territorio de cobertura', 'value': '', 'type': 'exception'}]}]}, {'column_parameter_name': 'Accidente', 'column_parameter_details': [{'sub_column_parameter_name': '', 'row_parameters': [{'row_parameter_name': 'suma asegurada', 'value': '', 'unit': '', 'type': 'std'}, {'row_parameter_name': 'deducible', 'value': '', 'unit': '', 'type': 'std'}, {'row_parameter_name': 'coaseguro', 'value': '', 'unit': '', 'type': 'std'}, {'row_parameter_name': 'información adicional', 'value': '', 'type': 'std'}, {'row_parameter_name': 'gastos cubiertos', 'value': '', 'type': 'std'}, {'row_parameter_name': 'gastos no cubiertos', 'value': '', 'type': 'std'}, {'row_parameter_name': 'aplicación de deducible y/o coaseguro', 'value': '', 'type': 'std'}, {'row_parameter_name': 'condiciones generales', 'value': 'Los demás términos y condiciones quedan sin modificación alguna.', 'type': 'std'}, {'row_parameter_name': 'elegibilidad', 'value': '', 'type': 'exception'}, {'row_parameter_name': 'periodo de espera', 'value': '', 'type': 'exception'}, {'row_parameter_name': 'tope de coaseguro', 'value': '', 'type': 'exception'}, {'row_parameter_name': 'territorio de cobertura', 'value': '', 'type': 'exception'}]}]}]}, 'legal': 'Los demás términos y condiciones quedan sin modificación alguna.'}, 'global_information': {'effective_date': '', 'expiration_date': '', 'factor': '', 'type': ''}, 'business_rules': {'experience': '', 'product_type': '', 'min_net_premium': '', 'min_population': ''}, 'status': '', 'comment': [{'name': '', 'date': '', 'comment': ''}]}","{'token_cost': 0.0186725, 'image_cost': 0, 'total_cost': 0.0186725}",SUBGRUP,FW32254G
endoso_38,"_HALLUX VALGUS__La Compañía cubrirá los gastos médicos erogados durante la vigencia de esta_Póliza, para corregir hallux valgus o juanetes siempre y cuando no sea de_carácter estético.__Los límites de responsabilidad para este Endoso aplican por Evento._Suma Asegurada: Póliza_Deducible: Póliza_Coaseguro: 50 %_Tope de coaseguro: Sin Tope_Periodo de Espera: 3 Años_Se cubre en territorio: Nacional__El beneficio en territorio extranjero estará condicionado a la contratación_de Cobertura de Atención Médica en el Extranjero.__Para este Endoso NO es aplicable el Endoso de  Aplicación de Deducible y/o_Coaseguro.__Para los demás términos y condiciones, aplicarán las Condiciones Generales_vigentes del producto contratado.__Este Endoso forma parte del Contrato de Seguro.","{'endoso_id': 'endoso_38', 'endoso_master_id': '38', 'contract_no': 'FW94168A', 'subgrupo': 'EMPLEAD', 'type': 'standard', 'endoso_details': {'name': 'HALLUX VALGUS', 'key': '', 'title': '', 'subtitle': '', 'description': 'La Compañía cubrirá los gastos médicos erogados durante la vigencia de esta Póliza, para corregir hallux valgus o juanetes siempre y cuando no sea de carácter estético. Los límites de responsabilidad para este Endoso aplican por Evento. Suma Asegurada: Póliza Deducible: Póliza Coaseguro: 50 % Tope de coaseguro: Sin Tope Periodo de Espera: 3 Años Se cubre en territorio: Nacional El beneficio en territorio extranjero estará condicionado a la contratación de Cobertura de Atención Médica en el Extranjero. Para este Endoso NO es aplicable el Endoso de  Aplicación de Deducible y/o Coaseguro. Para los demás términos y condiciones, aplicarán las Condiciones Generales vigentes del producto contratado. Este Endoso forma parte del Contrato de Seguro.', 'parameters': {'column_parameters': [{'column_parameter_name': 'Pago directo', 'column_parameter_details': [{'sub_column_parameter_name': '', 'row_parameters': [{'row_parameter_name': 'suma asegurada', 'value': 'Póliza', 'unit': '', 'type': 'std'}, {'row_parameter_name': 'deducible', 'value': 'Póliza', 'unit': '', 'type': 'std'}, {'row_parameter_name': 'coaseguro', 'value': '50', 'unit': '%', 'type': 'std'}, {'row_parameter_name': 'tope de coaseguro', 'value': 'Sin Tope', 'unit': '', 'type': 'std'}, {'row_parameter_name': 'territorio de cobertura', 'value': 'Nacional', 'unit': '', 'type': 'std'}, {'row_parameter_name': 'periodo espera', 'value': '3', 'unit': 'Años', 'type': 'std'}, {'row_parameter_name': 'gastos cubiertos', 'value': '', 'type': 'std'}, {'row_parameter_name': 'gastos no cubiertos', 'value': '', 'type': 'std'}, {'row_parameter_name': 'aplicación de deducible y/o coaseguro', 'value': 'false', 'type': 'std'}, {'row_parameter_name': 'condiciones generales', 'value': 'Para los demás términos y condiciones, aplicarán las Condiciones Generales vigentes del producto contratado. Este Endoso forma parte del Contrato de Seguro.', 'type': 'std'}, {'row_parameter_name': 'consulta postoperatoria', 'value': '', 'type': 'exception'}, {'row_parameter_name': 'consulta preoperatoria', 'value': '', 'type': 'exception'}]}]}, {'column_parameter_name': 'Reembolso', 'column_parameter_details': [{'sub_column_parameter_name': '', 'row_parameters': [{'row_parameter_name': 'suma asegurada', 'value': 'Póliza', 'unit': '', 'type': 'std'}, {'row_parameter_name': 'deducible', 'value': 'Póliza', 'unit': '', 'type': 'std'}, {'row_parameter_name': 'coaseguro', 'value': '50', 'unit': '%', 'type': 'std'}, {'row_parameter_name': 'tope de coaseguro', 'value': 'Sin Tope', 'unit': '', 'type': 'std'}, {'row_parameter_name': 'territorio de cobertura', 'value': 'Nacional', 'unit': '', 'type': 'std'}, {'row_parameter_name': 'periodo espera', 'value': '3', 'unit': 'Años', 'type': 'std'}, {'row_parameter_name': 'gastos cubiertos', 'value': '', 'type': 'std'}, {'row_parameter_name': 'gastos no cubiertos', 'value': '', 'type': 'std'}, {'row_parameter_name': 'aplicación de deducible y/o coaseguro', 'value': 'false', 'type': 'std'}, {'row_parameter_name': 'condiciones generales', 'value': 'Para los demás términos y condiciones, aplicarán las Condiciones Generales vigentes del producto contratado. Este Endoso forma parte del Contrato de Seguro.', 'type': 'std'}, {'row_parameter_name': 'consulta postoperatoria', 'value': '', 'type': 'exception'}, {'row_parameter_name': 'consulta preoperatoria', 'value': '', 'type': 'exception'}]}]}]}, 'legal': 'Para los demás términos y condiciones, aplicarán las Condiciones Generales vigentes del producto contratado. Este Endoso forma parte del Contrato de Seguro.'}, 'global_information': {'effective_date': '', 'expiration_date': '', 'factor': '', 'type': ''}, 'business_rules': {'experience': '', 'product_type': '', 'min_net_premium': '', 'min_population': ''}, 'status': '', 'comment': [{'name': '', 'date': '', 'comment': ''}]}","{'token_cost': 0.021410000000000002, 'image_cost': 0, 'total_cost': 0.021410000000000002}",EMPLEAD,FW94168A
