endoso_code,text,extracted_parameters,cost_metrics,nom_subg,contract_no
endoso_142,"'LITO-021 LITOTRIPSIAS                                                     _LA COMPAÑÍA CUBRIRÁ LOS GASTOS MÉDICOS EROGADOS DURANTE LA VIGENCIA DE ESTA_PÓLIZA PARA LITOTRIPSIAS, HASTA LOS LÍMITES QUE SE INDIQUEN EN ESTE ENDOSO._SUMA ASEGURADA: DE LA PÓLIZA.                                              _PARA ESTE ENDOSO SÍ ES APLICABLE EL ENDOSO DE APLICACIÓN DE DEDUCIBLE Y/O  _COASEGURO.                                                                 _PARA LOS DEMÁS TÉRMINOS Y CONDICIONES, APLICARÁN LAS CONDICIONES GENERALES _VIGENTES DEL PRODUCTO CONTRATADO.                                          _ESTE ENDOSO FORMA PARTE DEL CONTRATO DE SEGURO.                            _","{'endoso_id': 'endoso_142', 'endoso_master_id': '142', 'contract_no': 'FW80320B', 'subgrupo': 'GRUPO 6', 'type': 'standard', 'endoso_details': {'name': 'LITOTRIPSIAS', 'key': 'LITO-021', 'title': '', 'subtitle': '', 'description': 'LA COMPAÑÍA CUBRIRÁ LOS GASTOS MÉDICOS EROGADOS DURANTE LA VIGENCIA DE ESTA PÓLIZA PARA LITOTRIPSIAS, HASTA LOS LÍMITES QUE SE INDIQUEN EN ESTE ENDOSO. SUMA ASEGURADA: DE LA PÓLIZA. PARA ESTE ENDOSO SÍ ES APLICABLE EL ENDOSO DE APLICACIÓN DE DEDUCIBLE Y/O COASEGURO. PARA LOS DEMÁS TÉRMINOS Y CONDICIONES, APLICARÁN LAS CONDICIONES GENERALES VIGENTES DEL PRODUCTO CONTRATADO. ESTE ENDOSO FORMA PARTE DEL CONTRATO DE SEGURO.', 'parameters': {'column_parameters': [{'column_parameter_name': 'Pago directo', 'column_parameter_details': [{'sub_column_parameter_name': '', 'row_parameters': [{'row_parameter_name': 'suma asegurada', 'value': 'DE LA PÓLIZA', 'unit': '', 'type': 'std'}, {'row_parameter_name': 'deducible', 'value': '', 'unit': '', 'type': 'std'}, {'row_parameter_name': 'coaseguro', 'value': '', 'unit': '', 'type': 'std'}, {'row_parameter_name': 'periodo espera', 'value': '', 'unit': '', 'type': 'std'}, {'row_parameter_name': 'territorio de cobertura', 'value': '', 'unit': '', 'type': 'std'}, {'row_parameter_name': 'consulta postoperatoria', 'value': '', 'unit': '', 'type': 'std'}, {'row_parameter_name': 'consulta preoperatoria', 'value': '', 'unit': '', 'type': 'std'}, {'row_parameter_name': 'aplicación de deducible y/o coaseguro', 'value': 'true', 'type': 'std'}, {'row_parameter_name': 'condiciones generales', 'value': 'Para los demás términos y condiciones, aplicarán las Condiciones Generales vigentes del producto contratado. Este Endoso forma parte del Contrato de Seguro.', 'type': 'std'}, {'row_parameter_name': 'elegibilidad', 'value': '', 'unit': '', 'type': 'exception'}, {'row_parameter_name': 'tope de coaseguro', 'value': '', 'unit': '', 'type': 'exception'}, {'row_parameter_name': 'número de sesiones', 'value': '', 'unit': '', 'type': 'exception'}]}]}, {'column_parameter_name': 'Reembolso', 'column_parameter_details': [{'sub_column_parameter_name': '', 'row_parameters': [{'row_parameter_name': 'suma asegurada', 'value': 'DE LA PÓLIZA', 'unit': '', 'type': 'std'}, {'row_parameter_name': 'deducible', 'value': '', 'unit': '', 'type': 'std'}, {'row_parameter_name': 'coaseguro', 'value': '', 'unit': '', 'type': 'std'}, {'row_parameter_name': 'periodo espera', 'value': '', 'unit': '', 'type': 'std'}, {'row_parameter_name': 'territorio de cobertura', 'value': '', 'unit': '', 'type': 'std'}, {'row_parameter_name': 'consulta postoperatoria', 'value': '', 'unit': '', 'type': 'std'}, {'row_parameter_name': 'consulta preoperatoria', 'value': '', 'unit': '', 'type': 'std'}, {'row_parameter_name': 'aplicación de deducible y/o coaseguro', 'value': 'true', 'type': 'std'}, {'row_parameter_name': 'condiciones generales', 'value': 'Para los demás términos y condiciones, aplicarán las Condiciones Generales vigentes del producto contratado. Este Endoso forma parte del Contrato de Seguro.', 'type': 'std'}, {'row_parameter_name': 'elegibilidad', 'value': '', 'unit': '', 'type': 'exception'}, {'row_parameter_name': 'tope de coaseguro', 'value': '', 'unit': '', 'type': 'exception'}, {'row_parameter_name': 'número de sesiones', 'value': '', 'unit': '', 'type': 'exception'}]}]}]}, 'legal': 'Para los demás términos y condiciones, aplicarán las Condiciones Generales vigentes del producto contratado. Este Endoso forma parte del Contrato de Seguro.'}, 'global_information': {'effective_date': '', 'expiration_date': '', 'factor': '', 'type': ''}, 'business_rules': {'experience': '', 'product_type': '', 'min_net_premium': '', 'min_population': ''}, 'status': '', 'comment': [{'name': '', 'date': '', 'comment': ''}]}","{'token_cost': 0.021305, 'image_cost': 0, 'total_cost': 0.021305}",GRUPO 6,FW80320B
endoso_38,"'HALL-022 HALLUX VALGUS                                                    _LA COMPAÑÍA CUBRIRÁ LOS GASTOS MÉDICOS EROGADOS DURANTE LA VIGENCIA DE ESTA_PÓLIZA, PARA CORREGIR HALLUX VALGUS O JUANETES SIEMPRE Y CUANDO NO SEA DE  _CARÁCTER ESTÉTICO, HASTA LOS LÍMITES DE RESPONSABILIDAD QUE SE ESTABLECEN  _EN_ESTE ENDOSO.                                                               _PARA ESTE ENDOSO SÍ ES APLICABLE EL ENDOSO DE APLICACIÓN DE DEDUCIBLE Y/O  _COASEGURO.                                                                 _PARA LOS DEMÁS TÉRMINOS Y CONDICIONES, APLICARÁN LAS CONDICIONES GENERALES _VIGENTES DEL PRODUCTO CONTRATADO.                                          _ESTE ENDOSO FORMA PARTE DEL CONTRATO DE SEGURO.                            _","{'endoso_id': 'endoso_38', 'endoso_master_id': '38', 'contract_no': 'FW80320B', 'subgrupo': 'GRUPO 6', 'type': 'standard', 'endoso_details': {'name': 'HALLUX VALGUS', 'key': 'HALL-022', 'title': '', 'subtitle': '', 'description': 'LA COMPAÑÍA CUBRIRÁ LOS GASTOS MÉDICOS EROGADOS DURANTE LA VIGENCIA DE ESTA PÓLIZA, PARA CORREGIR HALLUX VALGUS O JUANETES SIEMPRE Y CUANDO NO SEA DE CARÁCTER ESTÉTICO, HASTA LOS LÍMITES DE RESPONSABILIDAD QUE SE ESTABLECEN EN ESTE ENDOSO. PARA ESTE ENDOSO SÍ ES APLICABLE EL ENDOSO DE APLICACIÓN DE DEDUCIBLE Y/O COASEGURO. PARA LOS DEMÁS TÉRMINOS Y CONDICIONES, APLICARÁN LAS CONDICIONES GENERALES VIGENTES DEL PRODUCTO CONTRATADO. ESTE ENDOSO FORMA PARTE DEL CONTRATO DE SEGURO.', 'parameters': {'column_parameters': [{'column_parameter_name': 'Pago directo', 'column_parameter_details': [{'row_parameters': [{'row_parameter_name': 'suma asegurada', 'value': '', 'unit': '', 'type': 'std'}, {'row_parameter_name': 'deducible', 'value': '', 'unit': '', 'type': 'std'}, {'row_parameter_name': 'coaseguro', 'value': '', 'unit': '', 'type': 'std'}, {'row_parameter_name': 'tope de coaseguro', 'value': '', 'unit': '', 'type': 'std'}, {'row_parameter_name': 'territorio de cobertura', 'value': '', 'type': 'std'}, {'row_parameter_name': 'periodo espera', 'value': '', 'unit': '', 'type': 'std'}, {'row_parameter_name': 'gastos cubiertos', 'value': '', 'type': 'std'}, {'row_parameter_name': 'gastos no cubiertos', 'value': '', 'type': 'std'}, {'row_parameter_name': 'aplicación de deducible y/o coaseguro', 'value': 'true', 'type': 'std'}, {'row_parameter_name': 'condiciones generales', 'value': 'Para los demás términos y condiciones, aplicarán las Condiciones Generales vigentes del producto contratado. Este Endoso forma parte del Contrato de Seguro.', 'type': 'std'}, {'row_parameter_name': 'consulta postoperatoria', 'value': '', 'type': 'exception'}, {'row_parameter_name': 'consulta preoperatoria', 'value': '', 'type': 'exception'}]}]}, {'column_parameter_name': 'Reembolso', 'column_parameter_details': [{'row_parameters': [{'row_parameter_name': 'suma asegurada', 'value': '', 'unit': '', 'type': 'std'}, {'row_parameter_name': 'deducible', 'value': '', 'unit': '', 'type': 'std'}, {'row_parameter_name': 'coaseguro', 'value': '', 'unit': '', 'type': 'std'}, {'row_parameter_name': 'tope de coaseguro', 'value': '', 'unit': '', 'type': 'std'}, {'row_parameter_name': 'territorio de cobertura', 'value': '', 'type': 'std'}, {'row_parameter_name': 'periodo espera', 'value': '', 'unit': '', 'type': 'std'}, {'row_parameter_name': 'gastos cubiertos', 'value': '', 'type': 'std'}, {'row_parameter_name': 'gastos no cubiertos', 'value': '', 'type': 'std'}, {'row_parameter_name': 'aplicación de deducible y/o coaseguro', 'value': 'true', 'type': 'std'}, {'row_parameter_name': 'condiciones generales', 'value': 'Para los demás términos y condiciones, aplicarán las Condiciones Generales vigentes del producto contratado. Este Endoso forma parte del Contrato de Seguro.', 'type': 'std'}, {'row_parameter_name': 'consulta postoperatoria', 'value': '', 'type': 'exception'}, {'row_parameter_name': 'consulta preoperatoria', 'value': '', 'type': 'exception'}]}]}]}, 'legal': 'Para los demás términos y condiciones, aplicarán las Condiciones Generales vigentes del producto contratado. Este Endoso forma parte del Contrato de Seguro.'}, 'global_information': {'effective_date': '', 'expiration_date': '', 'factor': '', 'type': ''}, 'business_rules': {'experience': '', 'product_type': '', 'min_net_premium': '', 'min_population': ''}, 'status': '', 'comment': [{'name': '', 'date': '', 'comment': ''}]}","{'token_cost': 0.020675, 'image_cost': 0, 'total_cost': 0.020675}",GRUPO 6,FW80320B
endoso_84,"UMEX-032 URGENCIA MÉDICA EN EL EXTRANJERO                                  _                                                                           _La Compañía cubrirá los gastos médicos erogados durante la vigencia de ésta_póliza, por Urgencias Médicas en el Extranjero modificando los límites de  _responsabilidad de esta cobertura, hasta los que se indiquen en este       _endoso:_                                                                           _Suma Asegurada: 50,000 USD                                                 _Deducible: 50 USD                                                          _                                                                           _Para este Endoso no es aplicable el Endoso de Aplicación de Deducible y/o  _Coaseguro.                                                                 _                                                                           _Para los demás términos y condiciones, aplicarán las Condiciones Generales _vigentes del producto contratado.                                          _                                                                           _Este Endoso forma parte del Contrato de Seguro.                            _","{'endoso_id': 'endoso_84', 'endoso_master_id': '84', 'contract_no': 'FW88835A', 'subgrupo': 'JEFATURAS Y GERENC', 'type': 'standard', 'endoso_details': {'name': 'URGENCIA MÉDICA EN EL EXTRANJERO (UMEX)', 'key': 'UMEX-032', 'title': '', 'subtitle': '', 'description': 'La Compañía cubrirá los gastos médicos erogados durante la vigencia de ésta póliza, por Urgencias Médicas en el Extranjero modificando los límites de responsabilidad de esta cobertura, hasta los que se indiquen en este endoso: Suma Asegurada: 50,000 USD Deducible: 50 USD Para este Endoso no es aplicable el Endoso de Aplicación de Deducible y/o Coaseguro. Para los demás términos y condiciones, aplicarán las Condiciones Generales vigentes del producto contratado. Este Endoso forma parte del Contrato de Seguro.', 'parameters': {'column_parameters': [{'column_parameter_name': 'Urgencias Médicas', 'column_parameter_details': [{'row_parameters': [{'row_parameter_name': 'suma asegurada', 'value': '50,000', 'unit': 'USD', 'type': 'std'}, {'row_parameter_name': 'deducible', 'value': '50', 'unit': 'USD', 'type': 'std'}, {'row_parameter_name': 'coaseguro', 'value': '', 'type': 'std'}, {'row_parameter_name': 'información adicional', 'value': '', 'type': 'std'}, {'row_parameter_name': 'gastos cubiertos', 'value': '', 'type': 'std'}, {'row_parameter_name': 'gastos no cubiertos', 'value': '', 'type': 'std'}, {'row_parameter_name': 'aplicación de deducible y/o coaseguro', 'value': 'false', 'type': 'std'}, {'row_parameter_name': 'condiciones generales', 'value': 'Para los demás términos y condiciones, aplicarán las Condiciones Generales vigentes del producto contratado. Este Endoso forma parte del Contrato de Seguro.', 'type': 'std'}, {'row_parameter_name': 'elegibilidad', 'value': '', 'type': 'exception'}, {'row_parameter_name': 'periodo de espera', 'value': '', 'type': 'exception'}, {'row_parameter_name': 'tope de coaseguro', 'value': '', 'type': 'exception'}, {'row_parameter_name': 'territorio de cobertura', 'value': '', 'type': 'exception'}]}]}, {'column_parameter_name': 'Accidente', 'column_parameter_details': [{'row_parameters': [{'row_parameter_name': 'suma asegurada', 'value': '', 'type': 'std'}, {'row_parameter_name': 'deducible', 'value': '', 'type': 'std'}, {'row_parameter_name': 'coaseguro', 'value': '', 'type': 'std'}, {'row_parameter_name': 'información adicional', 'value': '', 'type': 'std'}, {'row_parameter_name': 'gastos cubiertos', 'value': '', 'type': 'std'}, {'row_parameter_name': 'gastos no cubiertos', 'value': '', 'type': 'std'}, {'row_parameter_name': 'aplicación de deducible y/o coaseguro', 'value': '', 'type': 'std'}, {'row_parameter_name': 'condiciones generales', 'value': 'Para los demás términos y condiciones, aplicarán las Condiciones Generales vigentes del producto contratado. Este Endoso forma parte del Contrato de Seguro.', 'type': 'std'}, {'row_parameter_name': 'elegibilidad', 'value': '', 'type': 'exception'}, {'row_parameter_name': 'periodo de espera', 'value': '', 'type': 'exception'}, {'row_parameter_name': 'tope de coaseguro', 'value': '', 'type': 'exception'}, {'row_parameter_name': 'territorio de cobertura', 'value': '', 'type': 'exception'}]}]}], 'legal': 'Para los demás términos y condiciones, aplicarán las Condiciones Generales vigentes del producto contratado. Este Endoso forma parte del Contrato de Seguro.'}}, 'global_information': {'effective_date': '', 'expiration_date': '', 'factor': '', 'type': ''}, 'business_rules': {'experience': '', 'product_type': '', 'min_net_premium': '', 'min_population': ''}, 'status': '', 'comment': [{'name': '', 'date': '', 'comment': ''}]}","{'token_cost': 0.01939, 'image_cost': 0, 'total_cost': 0.01939}",JEFATURAS Y GERENC,FW88835A
endoso_155,"ENDOSO FACTOR DE REEMBOLSO                        _                                                                           _EL FACTOR DE REEMBOLSO DE CADA PROCEDIMIENTO TERAPÉUTICO INCLUIDO EN LAS   _CONDICIONES GENERALES CORRESPONDIENTES A ESTA PÓLIZA ESTA EXPRESADO DE     _MANERA PORCENTUAL, POR LO QUE PARA CUALQUIER EFECTO DICHO FACTOR DEBERÁ    _DIVIDIRSE ENTRE 100.                                                       _","{'endoso_id': 'endoso_155', 'endoso_master_id': '155', 'contract_no': 'FW19104U', 'subgrupo': 'SUGRUPO 1 TITULARE', 'type': 'standard', 'endoso_details': {'name': 'Factor', 'key': '', 'title': '', 'subtitle': '', 'description': 'EL FACTOR DE REEMBOLSO DE CADA PROCEDIMIENTO TERAPÉUTICO INCLUIDO EN LAS CONDICIONES GENERALES CORRESPONDIENTES A ESTA PÓLIZA ESTA EXPRESADO DE MANERA PORCENTUAL, POR LO QUE PARA CUALQUIER EFECTO DICHO FACTOR DEBERÁ DIVIDIRSE ENTRE 100.', 'parameters': {'column_parameters': '', 'row_parameters': [{'row_parameter_name': 'Descripcion', 'editable': True, 'active': True, 'type': 'std', 'value_type': 'text', 'value': 'EL FACTOR DE REEMBOLSO DE CADA PROCEDIMIENTO TERAPÉUTICO INCLUIDO EN LAS CONDICIONES GENERALES CORRESPONDIENTES A ESTA PÓLIZA ESTA EXPRESADO DE MANERA PORCENTUAL, POR LO QUE PARA CUALQUIER EFECTO DICHO FACTOR DEBERÁ DIVIDIRSE ENTRE 100.'}, {'row_parameter_name': 'Factor', 'editable': True, 'active': True, 'type': 'std', 'value_type': 'digits', 'value': '100'}, {'row_parameter_name': 'Condiciones Generales', 'editable': True, 'active': True, 'type': 'std', 'value_type': 'string', 'value': 'Para los demás términos y condiciones, aplicarán las Condiciones Generales vigentes del producto contratado. Este Endoso forma parte del Contrato de Seguro'}]}, 'legal': ''}, 'global_information': {'effective_date': '', 'expiration_date': '', 'factor': '', 'type': ''}, 'business_rules': {'experience': '', 'product_type': '', 'min_net_premium': '', 'min_population': ''}, 'status': '', 'comment': [{'name': '', 'date': '', 'comment': ''}]}","{'token_cost': 0.010117500000000001, 'image_cost': 0, 'total_cost': 0.010117500000000001}",SUGRUPO 1 TITULARE,FW19104U
endoso_84,"'UMEX-032 URGENCIA MÉDICA EN EL EXTRANJERO                                 _                                                                           _LA COMPAÑÍA CUBRIRÁ LOS GASTOS MÉDICOS EROGADOS DURANTE LA VIGENCIA DE ESTA_PÓLIZA, POR URGENCIAS MÉDICAS EN EL EXTRANJERO  MODIFICANDO LOS LÍMITES DE _RESPONSABILIDAD  DE ESTA COBERTURA, HASTA LOS QUE SE  INDIQUEN EN ESTE     _ENDOSO:                                                                    _                                                                           _SUMA ASEGURADA: USD 100,000                                                _DEDUCIBLE: USD 100                                                         _                                                                           _PARA ESTE ENDOSO NO ES APLICABLE EL ENDOSO DE  APLICACIÓN DE DEDUCIBLE Y/O _COASEGURO.                                                                 _                                                                           _PARA LOS DEMÁS TÉRMINOS Y CONDICIONES, APLICARÁN LAS CONDICIONES GENERALES _VIGENTES DEL PRODUCTO CONTRATADO.                                          _                                                                           _ESTE ENDOSO FORMA PARTE DEL CONTRATO DE SEGURO.'                           _","{'endoso_id': 'endoso_84', 'endoso_master_id': '84', 'contract_no': 'FW19104U', 'subgrupo': 'SUGRUPO 1 TITULARE', 'type': 'standard', 'endoso_details': {'name': 'URGENCIA MÉDICA EN EL EXTRANJERO (UMEX)', 'key': 'UMEX-032', 'title': '', 'subtitle': '', 'description': 'LA COMPAÑÍA CUBRIRÁ LOS GASTOS MÉDICOS EROGADOS DURANTE LA VIGENCIA DE ESTA PÓLIZA, POR URGENCIAS MÉDICAS EN EL EXTRANJERO  MODIFICANDO LOS LÍMITES DE RESPONSABILIDAD  DE ESTA COBERTURA, HASTA LOS QUE SE  INDIQUEN EN ESTE ENDOSO: SUMA ASEGURADA: USD 100,000 DEDUCIBLE: USD 100 PARA ESTE ENDOSO NO ES APLICABLE EL ENDOSO DE  APLICACIÓN DE DEDUCIBLE Y/O COASEGURO. PARA LOS DEMÁS TÉRMINOS Y CONDICIONES, APLICARÁN LAS CONDICIONES GENERALES VIGENTES DEL PRODUCTO CONTRATADO. ESTE ENDOSO FORMA PARTE DEL CONTRATO DE SEGURO.', 'parameters': {'column_parameters': [{'column_parameter_name': 'Urgencias Médicas', 'column_parameter_details': [{'row_parameters': [{'row_parameter_name': 'suma asegurada', 'value': '100,000', 'unit': 'USD', 'type': 'std'}, {'row_parameter_name': 'deducible', 'value': '100', 'unit': 'USD', 'type': 'std'}, {'row_parameter_name': 'coaseguro', 'value': '', 'type': 'std'}, {'row_parameter_name': 'información adicional', 'value': '', 'type': 'std'}, {'row_parameter_name': 'gastos cubiertos', 'value': '', 'type': 'std'}, {'row_parameter_name': 'gastos no cubiertos', 'value': '', 'type': 'std'}, {'row_parameter_name': 'aplicación de deducible y/o coaseguro', 'value': 'false', 'type': 'std'}, {'row_parameter_name': 'condiciones generales', 'value': 'Para los demás términos y condiciones, aplicarán las Condiciones Generales vigentes del producto contratado. Este Endoso forma parte del Contrato de Seguro.', 'type': 'std'}, {'row_parameter_name': 'elegibilidad', 'value': '', 'type': 'exception'}, {'row_parameter_name': 'periodo de espera', 'value': '', 'type': 'exception'}, {'row_parameter_name': 'tope de coaseguro', 'value': '', 'type': 'exception'}, {'row_parameter_name': 'territorio de cobertura', 'value': '', 'type': 'exception'}]}]}, {'column_parameter_name': 'Accidente', 'column_parameter_details': [{'row_parameters': [{'row_parameter_name': 'suma asegurada', 'value': '', 'type': 'std'}, {'row_parameter_name': 'deducible', 'value': '', 'type': 'std'}, {'row_parameter_name': 'coaseguro', 'value': '', 'type': 'std'}, {'row_parameter_name': 'información adicional', 'value': '', 'type': 'std'}, {'row_parameter_name': 'gastos cubiertos', 'value': '', 'type': 'std'}, {'row_parameter_name': 'gastos no cubiertos', 'value': '', 'type': 'std'}, {'row_parameter_name': 'aplicación de deducible y/o coaseguro', 'value': '', 'type': 'std'}, {'row_parameter_name': 'condiciones generales', 'value': 'Para los demás términos y condiciones, aplicarán las Condiciones Generales vigentes del producto contratado. Este Endoso forma parte del Contrato de Seguro.', 'type': 'std'}, {'row_parameter_name': 'elegibilidad', 'value': '', 'type': 'exception'}, {'row_parameter_name': 'periodo de espera', 'value': '', 'type': 'exception'}, {'row_parameter_name': 'tope de coaseguro', 'value': '', 'type': 'exception'}, {'row_parameter_name': 'territorio de cobertura', 'value': '', 'type': 'exception'}]}]}], 'legal': 'Para los demás términos y condiciones, aplicarán las Condiciones Generales vigentes del producto contratado. Este Endoso forma parte del Contrato de Seguro.'}}, 'global_information': {'effective_date': '', 'expiration_date': '', 'factor': '', 'type': ''}, 'business_rules': {'experience': '', 'product_type': '', 'min_net_premium': '', 'min_population': ''}, 'status': '', 'comment': [{'name': '', 'date': '', 'comment': ''}]}","{'token_cost': 0.020185, 'image_cost': 0, 'total_cost': 0.020185}",SUGRUPO 1 TITULARE,FW19104U
endoso_84,"UMEX-032 URGENCIA MÉDICA EN EL EXTRANJERO__La Compañía cubrirá los gastos médicos erogados durante la vigencia de esta_Póliza, por Urgencias Médicas en el Extranjero  modificando los límites de_responsabilidad  de esta cobertura, hasta los que se  indiquen en este_Endoso:__Suma Asegurada: USD 100,000.00__Deducible: USD 100.00__Para este Endoso no es aplicable el Endoso de  Aplicación de Deducible y/o_Coaseguro.__Para los demás términos y condiciones, aplicarán las Condiciones Generales_vigentes del producto contratado.__Este Endoso forma parte del Contrato de Seguro.","{'endoso_id': 'endoso_84', 'endoso_master_id': '84', 'contract_no': 'FW46638K', 'subgrupo': 'DIRECTIVOS', 'type': 'standard', 'endoso_details': {'name': 'URGENCIA MÉDICA EN EL EXTRANJERO (UMEX)', 'key': 'UMEX-032', 'title': '', 'subtitle': '', 'description': 'La Compañía cubrirá los gastos médicos erogados durante la vigencia de esta Póliza, por Urgencias Médicas en el Extranjero modificando los límites de responsabilidad de esta cobertura, hasta los que se indiquen en este Endoso: Suma Asegurada: USD 100,000.00 Deducible: USD 100.00 Para este Endoso no es aplicable el Endoso de Aplicación de Deducible y/o Coaseguro. Para los demás términos y condiciones, aplicarán las Condiciones Generales vigentes del producto contratado. Este Endoso forma parte del Contrato de Seguro.', 'parameters': {'column_parameters': [{'column_parameter_name': 'Urgencias Médicas', 'column_parameter_details': [{'sub_column_parameter_name': '', 'row_parameters': [{'row_parameter_name': 'suma asegurada', 'value': '100,000.00', 'unit': 'USD', 'type': 'std'}, {'row_parameter_name': 'deducible', 'value': '100.00', 'unit': 'USD', 'type': 'std'}, {'row_parameter_name': 'coaseguro', 'value': '', 'type': 'std'}, {'row_parameter_name': 'información adicional', 'value': '', 'type': 'std'}, {'row_parameter_name': 'gastos cubiertos', 'value': '', 'type': 'std'}, {'row_parameter_name': 'gastos no cubiertos', 'value': '', 'type': 'std'}, {'row_parameter_name': 'aplicación de deducible y/o coaseguro', 'value': 'false', 'type': 'std'}, {'row_parameter_name': 'condiciones generales', 'value': 'Para los demás términos y condiciones, aplicarán las Condiciones Generales vigentes del producto contratado. Este Endoso forma parte del Contrato de Seguro.', 'type': 'std'}, {'row_parameter_name': 'elegibilidad', 'value': '', 'type': 'exception'}, {'row_parameter_name': 'periodo de espera', 'value': '', 'type': 'exception'}, {'row_parameter_name': 'tope de coaseguro', 'value': '', 'type': 'exception'}, {'row_parameter_name': 'territorio de cobertura', 'value': '', 'type': 'exception'}]}]}, {'column_parameter_name': 'Accidente', 'column_parameter_details': [{'sub_column_parameter_name': '', 'row_parameters': [{'row_parameter_name': 'suma asegurada', 'value': '', 'type': 'std'}, {'row_parameter_name': 'deducible', 'value': '', 'type': 'std'}, {'row_parameter_name': 'coaseguro', 'value': '', 'type': 'std'}, {'row_parameter_name': 'información adicional', 'value': '', 'type': 'std'}, {'row_parameter_name': 'gastos cubiertos', 'value': '', 'type': 'std'}, {'row_parameter_name': 'gastos no cubiertos', 'value': '', 'type': 'std'}, {'row_parameter_name': 'aplicación de deducible y/o coaseguro', 'value': '', 'type': 'std'}, {'row_parameter_name': 'condiciones generales', 'value': 'Para los demás términos y condiciones, aplicarán las Condiciones Generales vigentes del producto contratado. Este Endoso forma parte del Contrato de Seguro.', 'type': 'std'}, {'row_parameter_name': 'elegibilidad', 'value': '', 'type': 'exception'}, {'row_parameter_name': 'periodo de espera', 'value': '', 'type': 'exception'}, {'row_parameter_name': 'tope de coaseguro', 'value': '', 'type': 'exception'}, {'row_parameter_name': 'territorio de cobertura', 'value': '', 'type': 'exception'}]}]}]}, 'legal': 'Para los demás términos y condiciones, aplicarán las Condiciones Generales vigentes del producto contratado. Este Endoso forma parte del Contrato de Seguro.'}, 'global_information': {'effective_date': '', 'expiration_date': '', 'factor': '', 'type': ''}, 'business_rules': {'experience': '', 'product_type': '', 'min_net_premium': '', 'min_population': ''}, 'status': '', 'comment': [{'name': '', 'date': '', 'comment': ''}]}","{'token_cost': 0.019527500000000003, 'image_cost': 0, 'total_cost': 0.019527500000000003}",DIRECTIVOS,FW46638K
