endoso_code,text,extracted_parameters,cost_metrics,nom_subg,contract_no
endoso_82,"Quedan cubiertas las enfermedades o accidentes preexistentes cubiertos por__la presentepóliza, aún y cuando:__a) La sintomatología previa a dicha enfermedad no haya pasado desapercibida._b) Se hubiera establecido diagnóstico antes del alta del Asegurado en esta_   póliza._c) Existan gastos efectuados con anterioridad al inicio de la Cobertura.__Sólo quedaran cubiertos los gastos realizados durante la vigencia de esta_póliza.__Este endoso modifica la exclusión estipulada en las Condiciones Generales_del producto contratado, en el apartado V. Gastos Médicos Mayores No_Cubiertos, inciso1.__El Asegurado deberá cumplir con un periodo de espera, a partir de su_inscripción en lapóliza, de: Sin periodo de espera__AXA Seguros, S.A. de C.V.:_Reconocerá el tiempo que el Asegurado haya tenido esta cobertura en__estacompañía u otra(s) compañía(s) de seguros; siempre y cuando no exista un_periodo aldescubierto mayor a 30 días.__No reconocerá la antigüedad generada en otras compañías__Esta cobertura aplicará de acuerdo a lo arriba señalado.__Se cubre únicamente en territorio nacional.__Los demás términos y condiciones, deben operar conforme se señala en_lasC ondiciones Generales del producto contratado.__Este endoso forma parte integral y complementa las Condiciones Generales_del Seguro.__","{'endoso_id': 'endoso_82', 'endoso_master_id': '82', 'contract_no': 'FC18115H', 'subgrupo': 'V   PLU', 'type': 'standard', 'endoso_details': {'name': 'PREEXISTENCIA', 'key': '', 'title': '', 'subtitle': '', 'description': 'Quedan cubiertas las enfermedades o accidentes preexistentes cubiertos por la presentepóliza, aún y cuando: a) La sintomatología previa a dicha enfermedad no haya pasado desapercibida. b) Se hubiera establecido diagnóstico antes del alta del Asegurado en esta póliza. c) Existan gastos efectuados con anterioridad al inicio de la Cobertura. Sólo quedaran cubiertos los gastos realizados durante la vigencia de esta póliza. Este endoso modifica la exclusión estipulada en las Condiciones Generales del producto contratado, en el apartado V. Gastos Médicos Mayores No Cubiertos, inciso1. El Asegurado deberá cumplir con un periodo de espera, a partir de su inscripción en lapóliza, de: Sin periodo de espera AXA Seguros, S.A. de C.V.: Reconocerá el tiempo que el Asegurado haya tenido esta cobertura en estacompañía u otra(s) compañía(s) de seguros; siempre y cuando no exista un periodo aldescubierto mayor a 30 días. No reconocerá la antigüedad generada en otras compañías Esta cobertura aplicará de acuerdo a lo arriba señalado. Se cubre únicamente en territorio nacional. Los demás términos y condiciones, deben operar conforme se señala en lasC ondiciones Generales del producto contratado. Este endoso forma parte integral y complementa las Condiciones Generales del Seguro.', 'parameters': {'column_parameters': '', 'row_parameters': [{'row_parameter_name': 'suma asegurada', 'editable': True, 'active': True, 'type': 'std', 'value_type': 'digits/currency (pesos, UMAM)/ de la poliza', 'value': ''}, {'row_parameter_name': 'deducible', 'editable': True, 'active': True, 'type': 'std', 'value_type': 'digits / de la poliza', 'value': ''}, {'row_parameter_name': 'coaseguro', 'editable': True, 'active': True, 'type': 'std', 'value_type': 'digits', 'value': ''}, {'row_parameter_name': 'tope de coaseguro', 'editable': True, 'active': True, 'type': 'std', 'value_type': 'digits / sin tope', 'value': ''}, {'row_parameter_name': 'periodo espera', 'editable': True, 'active': True, 'type': 'std', 'value_type': 'digits', 'value': 'Sin periodo de espera'}, {'row_parameter_name': 'reconocimiento de antigüedad', 'editable': True, 'active': True, 'type': 'std', 'value_type': 'aplica/no aplica', 'value': 'aplica'}, {'row_parameter_name': 'requisitos', 'editable': True, 'active': True, 'type': 'std', 'value_type': 'text', 'value': ''}, {'row_parameter_name': 'gastos cubiertos', 'editable': True, 'active': True, 'type': 'std', 'value_type': 'text', 'value': 'Quedan cubiertas las enfermedades o accidentes preexistentes cubiertos por la presentepóliza.'}, {'row_parameter_name': 'gastos no cubiertos', 'editable': True, 'active': True, 'type': 'std', 'value_type': 'text', 'value': 'No reconocerá la antigüedad generada en otras compañías'}, {'row_parameter_name': 'aplicación de deducible y/o coaseguro', 'editable': True, 'active': True, 'type': 'std', 'value_type': 'Y/N', 'value': ''}, {'row_parameter_name': 'condiciones generales', 'editable': True, 'active': True, 'type': 'std', 'value_type': 'string', 'value': 'Los demás términos y condiciones, deben operar conforme se señala en las Condiciones Generales del producto contratado. Este endoso forma parte integral y complementa las Condiciones Generales del Seguro.'}, {'row_parameter_name': 'elegibilidad', 'editable': True, 'active': True, 'type': 'exception', 'value_type': 'titular / conyuge / hijos', 'value': ''}, {'row_parameter_name': 'territorio de cobertura', 'editable': True, 'active': True, 'type': 'exception', 'value_type': 'nacional / extranjero / inetrnacional', 'value': 'nacional'}], 'legal': 'Los demás términos y condiciones, deben operar conforme se señala en las Condiciones Generales del producto contratado. Este endoso forma parte integral y complementa las Condiciones Generales del Seguro.'}}, 'global_information': {'effective_date': '', 'expiration_date': '', 'factor': '', 'type': ''}, 'business_rules': {'experience': '', 'product_type': '', 'min_net_premium': '', 'min_population': ''}, 'status': '', 'comment': [{'name': '', 'date': '', 'comment': ''}]}","{'token_cost': 0.01932, 'image_cost': 0, 'total_cost': 0.01932}",V   PLU,FC18115H
endoso_82,"Quedan cubiertas las enfermedades o accidentes preexistentes cubiertos por_la presentepóliza, aún y cuando:__a) La sintomatología previa a dicha enfermedad no haya pasado desapercibida._b) Se hubiera establecido diagnóstico antes del alta del Asegurado en esta_   póliza._c) Existan gastos efectuados con anterioridad al inicio de la Cobertura.__Sólo quedaran cubiertos los gastos realizados durante la vigencia de esta_póliza.__Este endoso modifica la exclusión estipulada en las Condiciones Generales_del producto contratado, en el apartado V. Gastos Médicos Mayores No_Cubiertos, inciso1.__El Asegurado deberá cumplir con un periodo de espera, a partir de su_inscripción en lapóliza, de: Sin periodo de espera__AXA Seguros, S.A. de C.V.:_Reconocerá el tiempo que el Asegurado haya tenido esta cobertura en_estacompañía u otra(s) compañía(s) de seguros; siempre y cuando no exista un_periodo aldescubierto mayor a 30 días.___No reconocerá la antigüedad generada en otras compañías__Esta cobertura aplicará de acuerdo a lo arriba señalado.__Se cubre únicamente en territorio nacional.__Los demás términos y condiciones, deben operar conforme se señala en_lasC ondiciones Generales del producto contratado.__Este endoso forma parte integral y complementa las Condiciones Generales_del Seguro.__","{'endoso_id': 'endoso_82', 'endoso_master_id': '82', 'contract_no': 'FC18115H', 'subgrupo': 'II  MUL', 'type': 'standard', 'endoso_details': {'name': 'PREEXISTENCIA', 'key': '', 'title': '', 'subtitle': '', 'description': 'Quedan cubiertas las enfermedades o accidentes preexistentes cubiertos por la presentepóliza, aún y cuando: a) La sintomatología previa a dicha enfermedad no haya pasado desapercibida. b) Se hubiera establecido diagnóstico antes del alta del Asegurado en esta póliza. c) Existan gastos efectuados con anterioridad al inicio de la Cobertura. Sólo quedaran cubiertos los gastos realizados durante la vigencia de esta póliza. Este endoso modifica la exclusión estipulada en las Condiciones Generales del producto contratado, en el apartado V. Gastos Médicos Mayores No Cubiertos, inciso1. El Asegurado deberá cumplir con un periodo de espera, a partir de su inscripción en lapóliza, de: Sin periodo de espera AXA Seguros, S.A. de C.V.: Reconocerá el tiempo que el Asegurado haya tenido esta cobertura en estacompañía u otra(s) compañía(s) de seguros; siempre y cuando no exista un periodo aldescubierto mayor a 30 días. No reconocerá la antigüedad generada en otras compañías Esta cobertura aplicará de acuerdo a lo arriba señalado. Se cubre únicamente en territorio nacional. Los demás términos y condiciones, deben operar conforme se señala en lasC ondiciones Generales del producto contratado. Este endoso forma parte integral y complementa las Condiciones Generales del Seguro.', 'parameters': {'column_parameters': '', 'row_parameters': [{'row_parameter_name': 'suma asegurada', 'editable': True, 'active': True, 'type': 'std', 'value_type': 'digits/currency (pesos, UMAM)/ de la poliza', 'value': ''}, {'row_parameter_name': 'deducible', 'editable': True, 'active': True, 'type': 'std', 'value_type': 'digits / de la poliza', 'value': ''}, {'row_parameter_name': 'coaseguro', 'editable': True, 'active': True, 'type': 'std', 'value_type': 'digits', 'value': ''}, {'row_parameter_name': 'tope de coaseguro', 'editable': True, 'active': True, 'type': 'std', 'value_type': 'digits / sin tope', 'value': ''}, {'row_parameter_name': 'periodo espera', 'editable': True, 'active': True, 'type': 'std', 'value_type': 'digits', 'value': 'Sin periodo de espera'}, {'row_parameter_name': 'reconocimiento de antigüedad', 'editable': True, 'active': True, 'type': 'std', 'value_type': 'aplica/no aplica', 'value': 'aplica'}, {'row_parameter_name': 'requisitos', 'editable': True, 'active': True, 'type': 'std', 'value_type': 'text', 'value': ''}, {'row_parameter_name': 'gastos cubiertos', 'editable': True, 'active': True, 'type': 'std', 'value_type': 'text', 'value': 'Quedan cubiertas las enfermedades o accidentes preexistentes cubiertos por la presentepóliza.'}, {'row_parameter_name': 'gastos no cubiertos', 'editable': True, 'active': True, 'type': 'std', 'value_type': 'text', 'value': ''}, {'row_parameter_name': 'aplicación de deducible y/o coaseguro', 'editable': True, 'active': True, 'type': 'std', 'value_type': 'Y/N', 'value': ''}, {'row_parameter_name': 'condiciones generales', 'editable': True, 'active': True, 'type': 'std', 'value_type': 'string', 'value': 'Los demás términos y condiciones, deben operar conforme se señala en las Condiciones Generales del producto contratado. Este endoso forma parte integral y complementa las Condiciones Generales del Seguro.'}, {'row_parameter_name': 'elegibilidad', 'editable': True, 'active': True, 'type': 'exception', 'value_type': 'titular / conyuge / hijos', 'value': ''}, {'row_parameter_name': 'territorio de cobertura', 'editable': True, 'active': True, 'type': 'exception', 'value_type': 'nacional / extranjero / inetrnacional', 'value': 'nacional'}], 'legal': 'Los demás términos y condiciones, deben operar conforme se señala en las Condiciones Generales del producto contratado. Este endoso forma parte integral y complementa las Condiciones Generales del Seguro.'}}, 'global_information': {'effective_date': '', 'expiration_date': '', 'factor': '', 'type': ''}, 'business_rules': {'experience': '', 'product_type': '', 'min_net_premium': '', 'min_population': ''}, 'status': '', 'comment': [{'name': '', 'date': '', 'comment': ''}]}","{'token_cost': 0.019175, 'image_cost': 0, 'total_cost': 0.019175}",II  MUL,FC18115H
endoso_142,"LITOTRIPSIAS_La Compañía cubrirá los gastos médicos erogados durante la vigencia de esta_Póliza para litotripsias, hasta los límites que se indiquen en este Endoso._Suma Asegurada: 80 S.M.G.M._Periodo de espera: No aplica_Para este Endoso sí es aplicable el Endoso de Aplicación de Deducible y/o_Coaseguro._Para los demás términos y condiciones, aplicarán las Condiciones Generales_vigentes del producto contratado.Este Endoso forma parte del Contrato de_Seguro.","{'endoso_id': 'endoso_142', 'endoso_master_id': '142', 'contract_no': 'FW46850B', 'subgrupo': 'GENERAL', 'type': 'standard', 'endoso_details': {'name': 'LITOTRIPSIAS', 'key': '', 'title': '', 'subtitle': '', 'description': 'La Compañía cubrirá los gastos médicos erogados durante la vigencia de esta Póliza para litotripsias, hasta los límites que se indiquen en este Endoso. Suma Asegurada: 80 S.M.G.M. Periodo de espera: No aplica Para este Endoso sí es aplicable el Endoso de Aplicación de Deducible y/o Coaseguro. Para los demás términos y condiciones, aplicarán las Condiciones Generales vigentes del producto contratado. Este Endoso forma parte del Contrato de Seguro.', 'parameters': {'column_parameters': [{'column_parameter_name': 'Pago directo', 'column_parameter_details': [{'sub_column_parameter_name': '', 'row_parameters': [{'row_parameter_name': 'suma asegurada', 'value': '80', 'unit': 'S.M.G.M.', 'type': 'std'}, {'row_parameter_name': 'deducible', 'value': '', 'unit': '', 'type': 'std'}, {'row_parameter_name': 'coaseguro', 'value': '', 'unit': '', 'type': 'std'}, {'row_parameter_name': 'periodo espera', 'value': 'No aplica', 'unit': '', 'type': 'std'}, {'row_parameter_name': 'territorio de cobertura', 'value': '', 'unit': '', 'type': 'std'}, {'row_parameter_name': 'consulta postoperatoria', 'value': '', 'type': 'std'}, {'row_parameter_name': 'consulta preoperatoria', 'value': '', 'type': 'std'}, {'row_parameter_name': 'aplicación de deducible y/o coaseguro', 'value': 'true', 'type': 'std'}, {'row_parameter_name': 'condiciones generales', 'value': 'Para los demás términos y condiciones, aplicarán las Condiciones Generales vigentes del producto contratado. Este Endoso forma parte del Contrato de Seguro.', 'type': 'std'}, {'row_parameter_name': 'elegibilidad', 'value': '', 'type': 'exception'}, {'row_parameter_name': 'tope de coaseguro', 'value': '', 'type': 'exception'}, {'row_parameter_name': 'número de sesiones', 'value': '', 'type': 'exception'}]}]}, {'column_parameter_name': 'Reembolso', 'column_parameter_details': [{'sub_column_parameter_name': '', 'row_parameters': [{'row_parameter_name': 'suma asegurada', 'value': '80', 'unit': 'S.M.G.M.', 'type': 'std'}, {'row_parameter_name': 'deducible', 'value': '', 'unit': '', 'type': 'std'}, {'row_parameter_name': 'coaseguro', 'value': '', 'unit': '', 'type': 'std'}, {'row_parameter_name': 'periodo espera', 'value': 'No aplica', 'unit': '', 'type': 'std'}, {'row_parameter_name': 'territorio de cobertura', 'value': '', 'unit': '', 'type': 'std'}, {'row_parameter_name': 'consulta postoperatoria', 'value': '', 'type': 'std'}, {'row_parameter_name': 'consulta preoperatoria', 'value': '', 'type': 'std'}, {'row_parameter_name': 'aplicación de deducible y/o coaseguro', 'value': 'true', 'type': 'std'}, {'row_parameter_name': 'condiciones generales', 'value': 'Para los demás términos y condiciones, aplicarán las Condiciones Generales vigentes del producto contratado. Este Endoso forma parte del Contrato de Seguro.', 'type': 'std'}, {'row_parameter_name': 'elegibilidad', 'value': '', 'type': 'exception'}, {'row_parameter_name': 'tope de coaseguro', 'value': '', 'type': 'exception'}, {'row_parameter_name': 'número de sesiones', 'value': '', 'type': 'exception'}]}]}]}, 'legal': 'Para los demás términos y condiciones, aplicarán las Condiciones Generales vigentes del producto contratado. Este Endoso forma parte del Contrato de Seguro.'}, 'global_information': {'effective_date': '', 'expiration_date': '', 'factor': '', 'type': ''}, 'business_rules': {'experience': '', 'product_type': '', 'min_net_premium': '', 'min_population': ''}, 'status': '', 'comment': [{'name': '', 'date': '', 'comment': ''}]}","{'token_cost': 0.02015, 'image_cost': 0, 'total_cost': 0.02015}",GENERAL,FW46850B
endoso_82,"PREEXISTENCIA__La Compañía cubrirá los gastos médicos erogados por el Asegurado, durante la_vigencia de esta Póliza, por tratamientos y/o procedimientos derivados de_Padecimientos Preexistentes a la fecha de alta del Asegurado en esta póliza_siempre y cuando no hayan sido cubiertos ni pagadosen una póliza de Gastos_Médicos Mayores del mismo Contratante o empresas del mismo grupo, emitida por_esta u otra institución de seguros, y el Asegurado no tenga periodos al_descubierto, hasta los límites de responsabilidad que se establecen en este_Endoso._Periodo de espera: No aplica_Se cubre en territorio: Nacional_Para los demás términos y condiciones, aplicarán las Condiciones Generales_vigentes del producto contratado._Este Endoso forma parte del Contrato de Seguro.","{'endoso_id': 'endoso_82', 'endoso_master_id': '82', 'contract_no': 'FW46850B', 'subgrupo': 'GENERAL', 'type': 'standard', 'endoso_details': {'name': 'PREEXISTENCIA', 'key': '', 'title': '', 'subtitle': '', 'description': 'La Compañía cubrirá los gastos médicos erogados por el Asegurado, durante la vigencia de esta Póliza, por tratamientos y/o procedimientos derivados de Padecimientos Preexistentes a la fecha de alta del Asegurado en esta póliza siempre y cuando no hayan sido cubiertos ni pagadosen una póliza de Gastos Médicos Mayores del mismo Contratante o empresas del mismo grupo, emitida por esta u otra institución de seguros, y el Asegurado no tenga periodos al descubierto, hasta los límites de responsabilidad que se establecen en este Endoso. Periodo de espera: No aplica Se cubre en territorio: Nacional Para los demás términos y condiciones, aplicarán las Condiciones Generales vigentes del producto contratado. Este Endoso forma parte del Contrato de Seguro.', 'parameters': {'column_parameters': [{'column_parameter_name': '', 'column_parameter_details': [{'sub_column_parameter_name': '', 'row_parameters': [{'row_parameter_name': 'suma asegurada', 'value': '', 'unit': '', 'type': 'std'}, {'row_parameter_name': 'deducible', 'value': '', 'unit': '', 'type': 'std'}, {'row_parameter_name': 'coaseguro', 'value': '', 'unit': '', 'type': 'std'}, {'row_parameter_name': 'tope de coaseguro', 'value': '', 'unit': '', 'type': 'std'}, {'row_parameter_name': 'periodo espera', 'value': 'No aplica', 'unit': '', 'type': 'std'}, {'row_parameter_name': 'reconocimiento de antigüedad', 'value': '', 'unit': '', 'type': 'std'}, {'row_parameter_name': 'requisitos', 'value': '', 'unit': '', 'type': 'std'}, {'row_parameter_name': 'gastos cubiertos', 'value': '', 'unit': '', 'type': 'std'}, {'row_parameter_name': 'gastos no cubiertos', 'value': '', 'unit': '', 'type': 'std'}, {'row_parameter_name': 'aplicación de deducible y/o coaseguro', 'value': '', 'unit': '', 'type': 'std'}, {'row_parameter_name': 'condiciones generales', 'value': 'Para los demás términos y condiciones, aplicarán las Condiciones Generales vigentes del producto contratado. Este Endoso forma parte del Contrato de Seguro.', 'unit': '', 'type': 'std'}, {'row_parameter_name': 'elegibilidad', 'value': '', 'unit': '', 'type': 'exception'}, {'row_parameter_name': 'territorio de cobertura', 'value': 'Nacional', 'unit': '', 'type': 'exception'}]}]}]}, 'legal': 'Para los demás términos y condiciones, aplicarán las Condiciones Generales vigentes del producto contratado. Este Endoso forma parte del Contrato de Seguro.'}, 'global_information': {'effective_date': '', 'expiration_date': '', 'factor': '', 'type': ''}, 'business_rules': {'experience': '', 'product_type': '', 'min_net_premium': '', 'min_population': ''}, 'status': '', 'comment': [{'name': '', 'date': '', 'comment': ''}]}","{'token_cost': 0.015240000000000002, 'image_cost': 0, 'total_cost': 0.015240000000000002}",GENERAL,FW46850B
endoso_142,"Como litotripsia se entiende el desmenuzamiento o fragmentación de un_cálculo por medio del litotriptor._Por concepto de la renta del litotriptor endoscópico o extracorpóreo, se_cubre con una suma asegurada de hasta: el G.U.A._Por concepto de honorarios quirúrgicos, gastos de hospitalización,_medicamentos y demás gastos cubiertos generados dentro y fuera del hospital,_aplicando los deducibles y coaseguros correspondientes, se tendrá una suma_asegurada hasta el GUA._Pago Directo_- Conforme al endoso deducible y coaseguro (VER ENDOSO)_Reembolso_- Conforme al endoso deducible y coaseguro (VER ENDOSO)_Invariablemente, El Asegurado deberá cumplir con un periodo de espera, a_partir de su inscripción en la póliza, de: Sin periodo de espera.__Será cubierta: únicamente en territorio nacional__Este endoso forma parte integral y complementa las Condiciones Generales_del Seguro.","{'endoso_id': 'endoso_142', 'endoso_master_id': '142', 'contract_no': 'FW18674N', 'subgrupo': 'FEDERAC', 'type': 'standard', 'endoso_details': {'name': 'LITOTRIPSIAS', 'key': '', 'title': '', 'subtitle': '', 'description': 'Como litotripsia se entiende el desmenuzamiento o fragmentación de un cálculo por medio del litotriptor. Por concepto de la renta del litotriptor endoscópico o extracorpóreo, se cubre con una suma asegurada de hasta: el G.U.A. Por concepto de honorarios quirúrgicos, gastos de hospitalización, medicamentos y demás gastos cubiertos generados dentro y fuera del hospital, aplicando los deducibles y coaseguros correspondientes, se tendrá una suma asegurada hasta el GUA. Pago Directo - Conforme al endoso deducible y coaseguro (VER ENDOSO) Reembolso - Conforme al endoso deducible y coaseguro (VER ENDOSO) Invariablemente, El Asegurado deberá cumplir con un periodo de espera, a partir de su inscripción en la póliza, de: Sin periodo de espera. Será cubierta: únicamente en territorio nacional Este endoso forma parte integral y complementa las Condiciones Generales del Seguro.', 'parameters': {'column_parameters': [{'column_parameter_name': 'Pago directo', 'column_parameter_details': [{'sub_column_parameter_name': '', 'row_parameters': [{'row_parameter_name': 'suma asegurada', 'value': 'G.U.A.', 'unit': '', 'type': 'std'}, {'row_parameter_name': 'deducible', 'value': '', 'unit': '', 'type': 'std'}, {'row_parameter_name': 'coaseguro', 'value': '', 'unit': '', 'type': 'std'}, {'row_parameter_name': 'periodo espera', 'value': 'Sin periodo de espera', 'unit': '', 'type': 'std'}, {'row_parameter_name': 'territorio de cobertura', 'value': 'nacional', 'unit': '', 'type': 'std'}, {'row_parameter_name': 'consulta postoperatoria', 'value': '', 'unit': '', 'type': 'std'}, {'row_parameter_name': 'consulta preoperatoria', 'value': '', 'unit': '', 'type': 'std'}, {'row_parameter_name': 'aplicación de deducible y/o coaseguro', 'value': '', 'unit': '', 'type': 'std'}, {'row_parameter_name': 'condiciones generales', 'value': 'Este endoso forma parte integral y complementa las Condiciones Generales del Seguro.', 'unit': '', 'type': 'std'}, {'row_parameter_name': 'elegibilidad', 'value': '', 'unit': '', 'type': 'exception'}, {'row_parameter_name': 'tope de coaseguro', 'value': '', 'unit': '', 'type': 'exception'}, {'row_parameter_name': 'número de sesiones', 'value': '', 'unit': '', 'type': 'exception'}]}]}, {'column_parameter_name': 'Reembolso', 'column_parameter_details': [{'sub_column_parameter_name': '', 'row_parameters': [{'row_parameter_name': 'suma asegurada', 'value': 'G.U.A.', 'unit': '', 'type': 'std'}, {'row_parameter_name': 'deducible', 'value': '', 'unit': '', 'type': 'std'}, {'row_parameter_name': 'coaseguro', 'value': '', 'unit': '', 'type': 'std'}, {'row_parameter_name': 'periodo espera', 'value': 'Sin periodo de espera', 'unit': '', 'type': 'std'}, {'row_parameter_name': 'territorio de cobertura', 'value': 'nacional', 'unit': '', 'type': 'std'}, {'row_parameter_name': 'consulta postoperatoria', 'value': '', 'unit': '', 'type': 'std'}, {'row_parameter_name': 'consulta preoperatoria', 'value': '', 'unit': '', 'type': 'std'}, {'row_parameter_name': 'aplicación de deducible y/o coaseguro', 'value': '', 'unit': '', 'type': 'std'}, {'row_parameter_name': 'condiciones generales', 'value': 'Este endoso forma parte integral y complementa las Condiciones Generales del Seguro.', 'unit': '', 'type': 'std'}, {'row_parameter_name': 'elegibilidad', 'value': '', 'unit': '', 'type': 'exception'}, {'row_parameter_name': 'tope de coaseguro', 'value': '', 'unit': '', 'type': 'exception'}, {'row_parameter_name': 'número de sesiones', 'value': '', 'unit': '', 'type': 'exception'}]}]}]}, 'legal': 'Este endoso forma parte integral y complementa las Condiciones Generales del Seguro.'}, 'global_information': {'effective_date': '', 'expiration_date': '', 'factor': '', 'type': ''}, 'business_rules': {'experience': '', 'product_type': '', 'min_net_premium': '', 'min_population': ''}, 'status': '', 'comment': [{'name': '', 'date': '', 'comment': ''}]}","{'token_cost': 0.0216975, 'image_cost': 0, 'total_cost': 0.0216975}",FEDERAC,FW18674N
