endoso_code,text,extracted_parameters,cost_metrics,nom_subg,contract_no
endoso_84,"Endoso de Urgencia Médica en el Extranjero__Por medio de este Endoso se hace constar que:__Queda excluido el beneficio de Urgencia Médica en el Extranjero, punto_número 23 de las condiciones generales.__Para los demás términos y condiciones, aplicarán las Condiciones Generales_vigentes del producto contratado.__Este Endoso forma parte del Contrato de Seguro.","{'endoso_id': 'endoso_84', 'endoso_master_id': '84', 'contract_no': 'FW44572C', 'subgrupo': 'ESTUDIA', 'type': 'standard', 'endoso_details': {'name': 'URGENCIA MÉDICA EN EL EXTRANJERO (UMEX)', 'key': '', 'title': '', 'subtitle': '', 'description': 'Por medio de este Endoso se hace constar que: Queda excluido el beneficio de Urgencia Médica en el Extranjero, punto número 23 de las condiciones generales. Para los demás términos y condiciones, aplicarán las Condiciones Generales vigentes del producto contratado. Este Endoso forma parte del Contrato de Seguro.', 'parameters': {'column_parameters': [{'column_parameter_name': 'Urgencias Médicas', 'column_parameter_details': [{'sub_column_parameter_name': '', 'row_parameters': [{'row_parameter_name': 'suma asegurada', 'value': '', 'unit': '', 'type': 'std'}, {'row_parameter_name': 'deducible', 'value': '', 'unit': '', 'type': 'std'}, {'row_parameter_name': 'coaseguro', 'value': '', 'unit': '', 'type': 'std'}, {'row_parameter_name': 'información adicional', 'value': '', 'type': 'std'}, {'row_parameter_name': 'gastos cubiertos', 'value': '', 'type': 'std'}, {'row_parameter_name': 'gastos no cubiertos', 'value': '', 'type': 'std'}, {'row_parameter_name': 'aplicación de deducible y/o coaseguro', 'value': '', 'type': 'std'}, {'row_parameter_name': 'condiciones generales', 'value': 'Para los demás términos y condiciones, aplicarán las Condiciones Generales vigentes del producto contratado. Este Endoso forma parte del Contrato de Seguro.', 'type': 'std'}, {'row_parameter_name': 'elegibilidad', 'value': '', 'type': 'exception'}, {'row_parameter_name': 'periodo de espera', 'value': '', 'type': 'exception'}, {'row_parameter_name': 'tope de coaseguro', 'value': '', 'type': 'exception'}, {'row_parameter_name': 'territorio de cobertura', 'value': '', 'type': 'exception'}]}]}, {'column_parameter_name': 'Accidente', 'column_parameter_details': [{'sub_column_parameter_name': '', 'row_parameters': [{'row_parameter_name': 'suma asegurada', 'value': '', 'unit': '', 'type': 'std'}, {'row_parameter_name': 'deducible', 'value': '', 'unit': '', 'type': 'std'}, {'row_parameter_name': 'coaseguro', 'value': '', 'unit': '', 'type': 'std'}, {'row_parameter_name': 'información adicional', 'value': '', 'type': 'std'}, {'row_parameter_name': 'gastos cubiertos', 'value': '', 'type': 'std'}, {'row_parameter_name': 'gastos no cubiertos', 'value': '', 'type': 'std'}, {'row_parameter_name': 'aplicación de deducible y/o coaseguro', 'value': '', 'type': 'std'}, {'row_parameter_name': 'condiciones generales', 'value': 'Para los demás términos y condiciones, aplicarán las Condiciones Generales vigentes del producto contratado. Este Endoso forma parte del Contrato de Seguro.', 'type': 'std'}, {'row_parameter_name': 'elegibilidad', 'value': '', 'type': 'exception'}, {'row_parameter_name': 'periodo de espera', 'value': '', 'type': 'exception'}, {'row_parameter_name': 'tope de coaseguro', 'value': '', 'type': 'exception'}, {'row_parameter_name': 'territorio de cobertura', 'value': '', 'type': 'exception'}]}]}]}, 'legal': 'Para los demás términos y condiciones, aplicarán las Condiciones Generales vigentes del producto contratado. Este Endoso forma parte del Contrato de Seguro.'}, 'global_information': {'effective_date': '', 'expiration_date': '', 'factor': '', 'type': ''}, 'business_rules': {'experience': '', 'product_type': '', 'min_net_premium': '', 'min_population': ''}, 'status': '', 'comment': [{'name': '', 'date': '', 'comment': ''}]}","{'token_cost': 0.01874, 'image_cost': 0, 'total_cost': 0.01874}",ESTUDIA,FW44572C
endoso_84,"UMEX- 032 URGENCIA MÉDICA EN EL EXTRANJERO                                 _                                                                           _La Compañía cubrirá los gastos médicos erogados durante la vigencia de esta_Póliza, por Urgencias Médicas en el Extranjero modificando los límites de  _responsabilidad de esta cobertura, hasta los que se indiquen en este       _Endoso:_                                                                           _Suma Asegurada: USD 100,000.00                                             _Deducible: USD 100.00                                                      _                                                                           _Para este Endoso no es aplicable el Endoso de Aplicación de Deducible y/o  _Coaseguro.                                                                 _                                                                           _Para los demás términos y condiciones, aplicarán las Condiciones Generales _vigentes del producto contratado.                                          _                                                                           _Este Endoso forma parte del Contrato de Seguro.                            _","{'endoso_id': 'endoso_84', 'endoso_master_id': '84', 'contract_no': 'FW46050G', 'subgrupo': 'GENERAL', 'type': 'standard', 'endoso_details': {'name': 'URGENCIA MÉDICA EN EL EXTRANJERO (UMEX)', 'key': 'UMEX- 032', 'title': '', 'subtitle': '', 'description': 'La Compañía cubrirá los gastos médicos erogados durante la vigencia de esta Póliza, por Urgencias Médicas en el Extranjero modificando los límites de responsabilidad de esta cobertura, hasta los que se indiquen en este Endoso: Suma Asegurada: USD 100,000.00 Deducible: USD 100.00 Para este Endoso no es aplicable el Endoso de Aplicación de Deducible y/o Coaseguro. Para los demás términos y condiciones, aplicarán las Condiciones Generales vigentes del producto contratado. Este Endoso forma parte del Contrato de Seguro.', 'parameters': {'column_parameters': [{'column_parameter_name': 'Urgencias Médicas', 'column_parameter_details': [{'sub_column_parameter_name': '', 'row_parameters': [{'row_parameter_name': 'suma asegurada', 'value': '100,000', 'unit': 'USD', 'type': 'std'}, {'row_parameter_name': 'deducible', 'value': '100', 'unit': 'USD', 'type': 'std'}, {'row_parameter_name': 'coaseguro', 'value': '', 'type': 'std'}, {'row_parameter_name': 'información adicional', 'value': '', 'type': 'std'}, {'row_parameter_name': 'gastos cubiertos', 'value': '', 'type': 'std'}, {'row_parameter_name': 'gastos no cubiertos', 'value': '', 'type': 'std'}, {'row_parameter_name': 'aplicación de deducible y/o coaseguro', 'value': 'false', 'type': 'std'}, {'row_parameter_name': 'condiciones generales', 'value': 'Para los demás términos y condiciones, aplicarán las Condiciones Generales vigentes del producto contratado. Este Endoso forma parte del Contrato de Seguro.', 'type': 'std'}, {'row_parameter_name': 'elegibilidad', 'value': '', 'type': 'exception'}, {'row_parameter_name': 'periodo de espera', 'value': '', 'type': 'exception'}, {'row_parameter_name': 'tope de coaseguro', 'value': '', 'type': 'exception'}, {'row_parameter_name': 'territorio de cobertura', 'value': '', 'type': 'exception'}]}]}, {'column_parameter_name': 'Accidente', 'column_parameter_details': [{'sub_column_parameter_name': '', 'row_parameters': [{'row_parameter_name': 'suma asegurada', 'value': '', 'type': 'std'}, {'row_parameter_name': 'deducible', 'value': '', 'type': 'std'}, {'row_parameter_name': 'coaseguro', 'value': '', 'type': 'std'}, {'row_parameter_name': 'información adicional', 'value': '', 'type': 'std'}, {'row_parameter_name': 'gastos cubiertos', 'value': '', 'type': 'std'}, {'row_parameter_name': 'gastos no cubiertos', 'value': '', 'type': 'std'}, {'row_parameter_name': 'aplicación de deducible y/o coaseguro', 'value': '', 'type': 'std'}, {'row_parameter_name': 'condiciones generales', 'value': 'Para los demás términos y condiciones, aplicarán las Condiciones Generales vigentes del producto contratado. Este Endoso forma parte del Contrato de Seguro.', 'type': 'std'}, {'row_parameter_name': 'elegibilidad', 'value': '', 'type': 'exception'}, {'row_parameter_name': 'periodo de espera', 'value': '', 'type': 'exception'}, {'row_parameter_name': 'tope de coaseguro', 'value': '', 'type': 'exception'}, {'row_parameter_name': 'territorio de cobertura', 'value': '', 'type': 'exception'}]}]}]}, 'legal': 'Para los demás términos y condiciones, aplicarán las Condiciones Generales vigentes del producto contratado. Este Endoso forma parte del Contrato de Seguro.'}, 'global_information': {'effective_date': '', 'expiration_date': '', 'factor': '', 'type': ''}, 'business_rules': {'experience': '', 'product_type': '', 'min_net_premium': '', 'min_population': ''}, 'status': '', 'comment': [{'name': '', 'date': '', 'comment': ''}]}","{'token_cost': 0.019535000000000004, 'image_cost': 0, 'total_cost': 0.019535000000000004}",GENERAL,FW46050G
endoso_82,"Quedan cubiertas las enfermedades o accidentes preexistentes cubiertos por_ la presente póliza, aún y cuando:__a) La sintomatología previa a dicha enfermedad no haya pasado_ desapercibida.__b) Se hubiera establecido diagnóstico antes del alta del Asegurado en esta_ póliza.__c) Existan  gastos efectuados con anterioridad al inicio de la Cobertura.__Sólo quedaran cubiertos los gastos realizados durante la vigencia de esta_ póliza.__Este endoso modifica la exclusión estipulada en las Condiciones Generales_ del producto contratado, en el apartado V. Gastos Médicos Mayores No_ Cubiertos, inciso 1.__El asegurado deberá cumplir con un periodo de espera, a partir de su_ inscripción en la póliza, de 1 año.__AXA Seguros, S.A. de C.V.:_Reconocerá el tiempo que el Asegurado haya tenido esta cobertura en esta_ compañía u otra(s) compañía(s) de seguros; siempre y cuando no exista un_ periodo al descubierto mayor a 30 días.__Esta cobertura aplicará de acuerdo a lo arriba señalado.__Se cubre únicamente en territorio nacional.__Los demás términos y condiciones, deben operar conforme se señala en las_ Condiciones Generales del producto contratado.__Este endoso forma parte integral y complementa las Condiciones Generales_ del Seguro","{'endoso_id': 'endoso_82', 'endoso_master_id': '82', 'contract_no': 'FW46779B', 'subgrupo': 'GENERAL', 'type': 'standard', 'endoso_details': {'name': 'PREEXISTENCIA', 'key': '', 'title': '', 'subtitle': '', 'description': 'Quedan cubiertas las enfermedades o accidentes preexistentes cubiertos por la presente póliza, aún y cuando: a) La sintomatología previa a dicha enfermedad no haya pasado desapercibida. b) Se hubiera establecido diagnóstico antes del alta del Asegurado en esta póliza. c) Existan  gastos efectuados con anterioridad al inicio de la Cobertura. Sólo quedaran cubiertos los gastos realizados durante la vigencia de esta póliza. Este endoso modifica la exclusión estipulada en las Condiciones Generales del producto contratado, en el apartado V. Gastos Médicos Mayores No Cubiertos, inciso 1. El asegurado deberá cumplir con un periodo de espera, a partir de su inscripción en la póliza, de 1 año. AXA Seguros, S.A. de C.V.: Reconocerá el tiempo que el Asegurado haya tenido esta cobertura en esta compañía u otra(s) compañía(s) de seguros; siempre y cuando no exista un periodo al descubierto mayor a 30 días. Esta cobertura aplicará de acuerdo a lo arriba señalado. Se cubre únicamente en territorio nacional. Los demás términos y condiciones, deben operar conforme se señala en las Condiciones Generales del producto contratado. Este endoso forma parte integral y complementa las Condiciones Generales del Seguro', 'parameters': {'column_parameters': '', 'row_parameters': [{'row_parameter_name': 'suma asegurada', 'value': '', 'unit': '', 'type': 'std'}, {'row_parameter_name': 'deducible', 'value': '', 'unit': '', 'type': 'std'}, {'row_parameter_name': 'coaseguro', 'value': '', 'unit': '', 'type': 'std'}, {'row_parameter_name': 'tope de coaseguro', 'value': '', 'unit': '', 'type': 'std'}, {'row_parameter_name': 'periodo espera', 'value': '1', 'unit': 'año', 'type': 'std'}, {'row_parameter_name': 'reconocimiento de antigüedad', 'value': 'aplica', 'type': 'std'}, {'row_parameter_name': 'requisitos', 'value': '', 'type': 'std'}, {'row_parameter_name': 'gastos cubiertos', 'value': 'Quedan cubiertas las enfermedades o accidentes preexistentes cubiertos por la presente póliza.', 'type': 'std'}, {'row_parameter_name': 'gastos no cubiertos', 'value': '', 'type': 'std'}, {'row_parameter_name': 'aplicación de deducible y/o coaseguro', 'value': '', 'type': 'std'}, {'row_parameter_name': 'condiciones generales', 'value': 'Los demás términos y condiciones, deben operar conforme se señala en las Condiciones Generales del producto contratado. Este endoso forma parte integral y complementa las Condiciones Generales del Seguro', 'type': 'std'}, {'row_parameter_name': 'elegibilidad', 'value': '', 'type': 'exception'}, {'row_parameter_name': 'territorio de cobertura', 'value': 'nacional', 'type': 'exception'}], 'legal': ''}}, 'global_information': {'effective_date': '', 'expiration_date': '', 'factor': '', 'type': ''}, 'business_rules': {'experience': '', 'product_type': '', 'min_net_premium': '', 'min_population': ''}, 'status': '', 'comment': [{'name': '', 'date': '', 'comment': ''}]}","{'token_cost': 0.015775, 'image_cost': 0, 'total_cost': 0.015775}",GENERAL,FW46779B
endoso_97,"MIRECA ENDOSO VISION__Se autoriza la inclusión del endoso de VISION en la póliza FW64613C desde_inicio de vigencia 01/01/2020. Autoriza Marcos Díaz de León_FW64613C_VISI-055 VISIÓN_Quedan cubiertas las asistencias de Visión para los asegurados vigentes en_esta Póliza de acuerdo a lo siguiente:_SIN COSTO:_- Examen de la vista_Descuento del 35% en los siguientes productos:__    ?  Armazones y lentes graduados o_    ?  Lentes de contacto graduados_    ?  Estuche duro_Se otorgará un 5% de descuento adicional a las promociones vigentes aplicará_en caso de que el descuento ofrecido en la óptica sea igual o mayor al de tu_seguro. En los casos en que la sucursal no lo aplique se autorizará vía_reembolso a través del CAT OdontoPrev._Los servicios indicados solo aplican en la República Mexicana, en los lugares_que el prestador de servicios indique y sujeto a disponibilidad en la_localidad correspondiente, disponibles en www.odontoprev.com.mx_Exclusiones y Restricciones generales._La cobertura de anteojos y lentes de contacto únicamente se aplicará cuando_se haya emitido un diagnóstico de 0.75 dioptrías._Los descuentos sólo aplican en micas blancas CR39 monofocales, bifocales y_progresivos (no cosméticos)_Este servicio se cubre una vez por año, es decir que si se requiere lentes o_armazones, deberá haber transcurrido un año de que obtuvo los anteriores._Los descuentos no son acumulables con otras promociones._Para utilizar este servicio el asegurado deberá seguir los siguientes pasos:_1.Ingresar al sitio: https://axa.mx/web/seguro-de-salud/beneficios y_selecciona las ópticas de tu preferencia.__    1.  Llama al Centro de Atención Telefónica de ODONTOPREV:(01 800)_833-6825 y/o_AXA seguros: (01 800) 001 8700 opción 1._Solo un tipo de lente de contacto o armazón, en ningún caso se cubrirán_ambos._La autorización de cristales o micas será al cambio de graduación por_diferencias mayores a 0.25 dioptrías en cada ojo, con respecto al año_anterior o al lente actual._No se autorizan armazones y lentes de contacto cosméticos, tratamientos de_color, Photocromático o Fotogray, lentes solares aún graduados, Armazones_solos, Lentes oftálmicas sin graduar, Lentes de contacto cosméticos aún_graduados, Medicamentos, Estudios de laboratorio y gabinete._Aplican restricciones de acuerdo a cada óptica.__    1.  Acude a las ópticas en convenio y presentar su credencial de_asegurado AXA e identificación oficial, mencionando el CONVENIO: AXA y_ODONTOPREV VISIÓN 35._Si ya identificaste al proveedor con el que deseas acudir, preséntate con tu_credencial de asegurado e identificación oficial._En caso que el asegurado llame a Tu Médico 24 horas éste será referido con el_proveedor._Para mayor información de los Servicios de Asistencia de Visión consulta el_documento Folleto Protección Visión._Los demás términos y condiciones, deben aplicar de acuerdo a las Condiciones_Generales del producto contratado._Este endoso forma parte integral y complementa las Condiciones Generales del_Seguro.","{'endoso_id': 'endoso_97', 'endoso_master_id': '97', 'contract_no': 'FW64613D', 'subgrupo': 'GENERAL', 'type': 'standard', 'endoso_details': {'name': 'VISIÓN', 'key': 'VISI-055', 'title': '', 'subtitle': '', 'description': 'Se autoriza la inclusión del endoso de VISION en la póliza FW64613C desde inicio de vigencia 01/01/2020. Autoriza Marcos Díaz de León FW64613C VISI-055 VISIÓN Quedan cubiertas las asistencias de Visión para los asegurados vigentes en esta Póliza de acuerdo a lo siguiente: SIN COSTO: - Examen de la vista Descuento del 35% en los siguientes productos: Armazones y lentes graduados o Lentes de contacto graduados Estuche duro Se otorgará un 5% de descuento adicional a las promociones vigentes aplicará en caso de que el descuento ofrecido en la óptica sea igual o mayor al de tu seguro. En los casos en que la sucursal no lo aplique se autorizará vía reembolso a través del CAT OdontoPrev. Los servicios indicados solo aplican en la República Mexicana, en los lugares que el prestador de servicios indique y sujeto a disponibilidad en la localidad correspondiente, disponibles en www.odontoprev.com.mx Exclusiones y Restricciones generales. La cobertura de anteojos y lentes de contacto únicamente se aplicará cuando se haya emitido un diagnóstico de 0.75 dioptrías. Los descuentos sólo aplican en micas blancas CR39 monofocales, bifocales y progresivos (no cosméticos) Este servicio se cubre una vez por año, es decir que si se requiere lentes o armazones, deberá haber transcurrido un año de que obtuvo los anteriores. Los descuentos no son acumulables con otras promociones. Para utilizar este servicio el asegurado deberá seguir los siguientes pasos: 1.Ingresar al sitio: https://axa.mx/web/seguro-de-salud/beneficios y selecciona las ópticas de tu preferencia. Llama al Centro de Atención Telefónica de ODONTOPREV:(01 800) 833-6825 y/o AXA seguros: (01 800) 001 8700 opción 1. Solo un tipo de lente de contacto o armazón, en ningún caso se cubrirán ambos. La autorización de cristales o micas será al cambio de graduación por diferencias mayores a 0.25 dioptrías en cada ojo, con respecto al año anterior o al lente actual. No se autorizan armazones y lentes de contacto cosméticos, tratamientos de color, Photocromático o Fotogray, lentes solares aún graduados, Armazones solos, Lentes oftálmicas sin graduar, Lentes de contacto cosméticos aún graduados, Medicamentos, Estudios de laboratorio y gabinete. Aplican restricciones de acuerdo a cada óptica. Acude a las ópticas en convenio y presentar su credencial de asegurado AXA e identificación oficial, mencionando el CONVENIO: AXA y ODONTOPREV VISIÓN 35. Si ya identificaste al proveedor con el que deseas acudir, preséntate con tu credencial de asegurado e identificación oficial. En caso que el asegurado llame a Tu Médico 24 horas éste será referido con el proveedor. Para mayor información de los Servicios de Asistencia de Visión consulta el documento Folleto Protección Visión. Los demás términos y condiciones, deben aplicar de acuerdo a las Condiciones Generales del producto contratado. Este endoso forma parte integral y complementa las Condiciones Generales del Seguro.', 'parameters': {'column_parameters': '', 'row_parameters': [{'row_parameter_name': 'Descripcion', 'editable': True, 'active': True, 'type': 'std', 'value_type': 'text'}, {'row_parameter_name': 'Condiciones Generales', 'editable': True, 'active': True, 'type': 'std', 'value_type': 'string', 'value': 'Para los demás términos y condiciones, aplicarán las Condiciones Generales vigentes del producto contratado. Este Endoso forma parte del Contrato de Seguro'}]}, 'legal': ''}, 'global_information': {'effective_date': '', 'expiration_date': '', 'factor': '', 'type': ''}, 'business_rules': {'experience': '', 'product_type': '', 'min_net_premium': '', 'min_population': ''}, 'status': '', 'comment': [{'name': '', 'date': '', 'comment': ''}]}","{'token_cost': 0.016522500000000002, 'image_cost': 0, 'total_cost': 0.016522500000000002}",GENERAL,FW64613D
endoso_84,ENDOSO DE MEDIOS CONVENIOS_Seguro.,"{'endoso_id': 'endoso_84', 'endoso_master_id': '84', 'contract_no': 'FW44259E', 'subgrupo': 'GENERAL', 'type': 'standard', 'endoso_details': {'name': 'MEDIOS CONVENIOS', 'key': '', 'title': '', 'subtitle': '', 'description': 'ENDOSO DE MEDIOS CONVENIOS_Seguro.', 'parameters': {'column_parameters': [{'column_parameter_name': 'Urgencias Médicas', 'column_parameter_details': [{'sub_column_parameter_name': '', 'row_parameters': [{'row_parameter_name': 'suma asegurada', 'value': '', 'unit': '', 'type': 'std'}, {'row_parameter_name': 'deducible', 'value': '', 'unit': '', 'type': 'std'}, {'row_parameter_name': 'coaseguro', 'value': '', 'unit': '', 'type': 'std'}, {'row_parameter_name': 'información adicional', 'value': '', 'type': 'std'}, {'row_parameter_name': 'gastos cubiertos', 'value': '', 'type': 'std'}, {'row_parameter_name': 'gastos no cubiertos', 'value': '', 'type': 'std'}, {'row_parameter_name': 'aplicación de deducible y/o coaseguro', 'value': '', 'type': 'std'}, {'row_parameter_name': 'condiciones generales', 'value': 'Para los demás términos y condiciones, aplicarán las Condiciones Generales vigentes del producto contratado. Este Endoso forma parte del Contrato de Seguro.', 'type': 'std'}, {'row_parameter_name': 'elegibilidad', 'value': '', 'type': 'exception'}, {'row_parameter_name': 'periodo de espera', 'value': '', 'type': 'exception'}, {'row_parameter_name': 'tope de coaseguro', 'value': '', 'type': 'exception'}, {'row_parameter_name': 'territorio de cobertura', 'value': '', 'type': 'exception'}]}]}, {'column_parameter_name': 'Accidente', 'column_parameter_details': [{'sub_column_parameter_name': '', 'row_parameters': [{'row_parameter_name': 'suma asegurada', 'value': '', 'unit': '', 'type': 'std'}, {'row_parameter_name': 'deducible', 'value': '', 'unit': '', 'type': 'std'}, {'row_parameter_name': 'coaseguro', 'value': '', 'unit': '', 'type': 'std'}, {'row_parameter_name': 'información adicional', 'value': '', 'type': 'std'}, {'row_parameter_name': 'gastos cubiertos', 'value': '', 'type': 'std'}, {'row_parameter_name': 'gastos no cubiertos', 'value': '', 'type': 'std'}, {'row_parameter_name': 'aplicación de deducible y/o coaseguro', 'value': '', 'type': 'std'}, {'row_parameter_name': 'condiciones generales', 'value': 'Para los demás términos y condiciones, aplicarán las Condiciones Generales vigentes del producto contratado. Este Endoso forma parte del Contrato de Seguro.', 'type': 'std'}, {'row_parameter_name': 'elegibilidad', 'value': '', 'type': 'exception'}, {'row_parameter_name': 'periodo de espera', 'value': '', 'type': 'exception'}, {'row_parameter_name': 'tope de coaseguro', 'value': '', 'type': 'exception'}, {'row_parameter_name': 'territorio de cobertura', 'value': '', 'type': 'exception'}]}]}]}, 'legal': ''}, 'global_information': {'effective_date': '', 'expiration_date': '', 'factor': '', 'type': ''}, 'business_rules': {'experience': '', 'product_type': '', 'min_net_premium': '', 'min_population': ''}, 'status': '', 'comment': [{'name': '', 'date': '', 'comment': ''}]}","{'token_cost': 0.01812, 'image_cost': 0, 'total_cost': 0.01812}",GENERAL,FW44259E
