endoso_code,text,extracted_parameters,cost_metrics,nom_subg,contract_no
endoso_142,"Como litotripsia se entiende el desmenuzamiento o fragmentación de un_cálculo por medio del litotriptor.    Este endoso ampara el pago de_honorarios médicos, gastos de   hospitalización, medicamentos, renta del_litotriptor endoscópico o   extracorpóreo y demás gastos cubiertos generados_dentro del hospital.    El monto máximo a indemnizar para este beneficio y/o_cobertura será:    De acuerdo a las condiciones generales (26 veces el_S.M.G.M)    Monto Máximo a Indemnizar 26 SMGM      Pago Directo (Médico y_Hospital en convenio de acuerdo al nivel   hospitalario contratado)_Deducible            7,500.00   M.N.       Coaseguro                0.00   %_    Reembolso:    Deducible           10,000.00   M.N.     Coaseguro_      10.00   %     En caso de modificación del deducible y/o coaseguro_originalmente pactado,   invariablemente se aplicarán los deducibles y_coaseguros antes   mencionados en dicha cobertura/condición.    El Asegurado_deberá cumplir con un periodo de espera, a partir de su   inscripción en la_póliza:   Se elimina periodo de espera    Se cubre únicamente en territorio_nacional.    Los demás términos y condiciones, deben operar conforme se_señala en las   Condiciones Generales del producto contratado.    Este endoso_forma parte integral y complementa las Condiciones Generales   del Seguro","{'endoso_id': 'endoso_142', 'endoso_master_id': '142', 'contract_no': 'FW35175J', 'subgrupo': 'GENERAL', 'type': 'standard', 'endoso_details': {'name': 'LITOTRIPSIAS', 'key': '', 'title': '', 'subtitle': '', 'description': 'Como litotripsia se entiende el desmenuzamiento o fragmentación de un cálculo por medio del litotriptor. Este endoso ampara el pago de honorarios médicos, gastos de hospitalización, medicamentos, renta del litotriptor endoscópico o extracorpóreo y demás gastos cubiertos generados dentro del hospital. El monto máximo a indemnizar para este beneficio y/o cobertura será: De acuerdo a las condiciones generales (26 veces el S.M.G.M) Monto Máximo a Indemnizar 26 SMGM Pago Directo (Médico y Hospital en convenio de acuerdo al nivel hospitalario contratado) Deducible 7,500.00 M.N. Coaseguro 0.00 % Reembolso: Deducible 10,000.00 M.N. Coaseguro 10.00 % En caso de modificación del deducible y/o coaseguro originalmente pactado, invariablemente se aplicarán los deducibles y coaseguros antes mencionados en dicha cobertura/condición. El Asegurado deberá cumplir con un periodo de espera, a partir de su inscripción en la póliza: Se elimina periodo de espera Se cubre únicamente en territorio nacional. Los demás términos y condiciones, deben operar conforme se señala en las Condiciones Generales del producto contratado. Este endoso forma parte integral y complementa las Condiciones Generales del Seguro', 'parameters': {'column_parameters': [{'column_parameter_name': 'Pago directo', 'column_parameter_details': [{'sub_column_parameter_name': '', 'row_parameters': [{'row_parameter_name': 'suma asegurada', 'value': '', 'unit': '', 'type': 'std'}, {'row_parameter_name': 'deducible', 'value': '7500.00', 'unit': 'M.N.', 'type': 'std'}, {'row_parameter_name': 'coaseguro', 'value': '0.00', 'unit': '%', 'type': 'std'}, {'row_parameter_name': 'periodo espera', 'value': 'Se elimina periodo de espera', 'unit': '', 'type': 'std'}, {'row_parameter_name': 'territorio de cobertura', 'value': 'nacional', 'unit': '', 'type': 'std'}, {'row_parameter_name': 'consulta postoperatoria', 'value': '', 'unit': '', 'type': 'std'}, {'row_parameter_name': 'consulta preoperatoria', 'value': '', 'unit': '', 'type': 'std'}, {'row_parameter_name': 'aplicación de deducible y/o coaseguro', 'value': 'true', 'unit': '', 'type': 'std'}, {'row_parameter_name': 'condiciones generales', 'value': 'Los demás términos y condiciones, deben operar conforme se señala en las Condiciones Generales del producto contratado. Este endoso forma parte integral y complementa las Condiciones Generales del Seguro', 'unit': '', 'type': 'std'}, {'row_parameter_name': 'elegibilidad', 'value': '', 'unit': '', 'type': 'exception'}, {'row_parameter_name': 'tope de coaseguro', 'value': '', 'unit': '', 'type': 'exception'}, {'row_parameter_name': 'número de sesiones', 'value': '', 'unit': '', 'type': 'exception'}]}]}, {'column_parameter_name': 'Reembolso', 'column_parameter_details': [{'sub_column_parameter_name': '', 'row_parameters': [{'row_parameter_name': 'suma asegurada', 'value': '', 'unit': '', 'type': 'std'}, {'row_parameter_name': 'deducible', 'value': '10000.00', 'unit': 'M.N.', 'type': 'std'}, {'row_parameter_name': 'coaseguro', 'value': '10.00', 'unit': '%', 'type': 'std'}, {'row_parameter_name': 'periodo espera', 'value': 'Se elimina periodo de espera', 'unit': '', 'type': 'std'}, {'row_parameter_name': 'territorio de cobertura', 'value': 'nacional', 'unit': '', 'type': 'std'}, {'row_parameter_name': 'consulta postoperatoria', 'value': '', 'unit': '', 'type': 'std'}, {'row_parameter_name': 'consulta preoperatoria', 'value': '', 'unit': '', 'type': 'std'}, {'row_parameter_name': 'aplicación de deducible y/o coaseguro', 'value': 'true', 'unit': '', 'type': 'std'}, {'row_parameter_name': 'condiciones generales', 'value': 'Los demás términos y condiciones, deben operar conforme se señala en las Condiciones Generales del producto contratado. Este endoso forma parte integral y complementa las Condiciones Generales del Seguro', 'unit': '', 'type': 'std'}, {'row_parameter_name': 'elegibilidad', 'value': '', 'unit': '', 'type': 'exception'}, {'row_parameter_name': 'tope de coaseguro', 'value': '', 'unit': '', 'type': 'exception'}, {'row_parameter_name': 'número de sesiones', 'value': '', 'unit': '', 'type': 'exception'}]}]}]}, 'legal': 'Los demás términos y condiciones, deben operar conforme se señala en las Condiciones Generales del producto contratado. Este endoso forma parte integral y complementa las Condiciones Generales del Seguro'}, 'global_information': {'effective_date': '', 'expiration_date': '', 'factor': '', 'type': ''}, 'business_rules': {'experience': '', 'product_type': '', 'min_net_premium': '', 'min_population': ''}, 'status': '', 'comment': [{'name': '', 'date': '', 'comment': ''}]}","{'token_cost': 0.0235975, 'image_cost': 0, 'total_cost': 0.0235975}",GENERAL,FW35175J
endoso_82,"PREEXISTENCIA:__La Compañía cubrirá los gastos médicos erogados durante la vigencia de esta_Póliza, por tratamientos y/o procedimientos derivados de Padecimiento_Preexistentes anteriores a la fecha de antigüedad reconocida por el_contratante, en esta Póliza. Hasta los límites de responsabilidad que se_establecen en este Endoso._______________________Periodo de espera: 24 meses_ __________Se cubre en territorio: Nacional___________""Para los demás términos y condiciones, aplicarán las Condiciones Generales_vigentes del producto contratado.__Este Endoso forma parte del Contrato de Seguro.""__","{'endoso_id': 'endoso_82', 'endoso_master_id': '82', 'contract_no': 'FW41609I', 'subgrupo': 'GENERAL', 'type': 'standard', 'endoso_details': {'name': 'PREEXISTENCIA', 'key': '', 'title': '', 'subtitle': '', 'description': 'La Compañía cubrirá los gastos médicos erogados durante la vigencia de esta Póliza, por tratamientos y/o procedimientos derivados de Padecimiento Preexistentes anteriores a la fecha de antigüedad reconocida por el contratante, en esta Póliza. Hasta los límites de responsabilidad que se establecen en este Endoso. Periodo de espera: 24 meses Se cubre en territorio: Nacional Para los demás términos y condiciones, aplicarán las Condiciones Generales vigentes del producto contratado. Este Endoso forma parte del Contrato de Seguro.', 'parameters': {'column_parameters': [], 'row_parameters': [{'row_parameter_name': 'suma asegurada', 'value': '', 'unit': '', 'type': 'std'}, {'row_parameter_name': 'deducible', 'value': '', 'unit': '', 'type': 'std'}, {'row_parameter_name': 'coaseguro', 'value': '', 'unit': '', 'type': 'std'}, {'row_parameter_name': 'tope de coaseguro', 'value': '', 'unit': '', 'type': 'std'}, {'row_parameter_name': 'periodo espera', 'value': '24', 'unit': 'meses', 'type': 'std'}, {'row_parameter_name': 'reconocimiento de antigüedad', 'value': '', 'type': 'std'}, {'row_parameter_name': 'requisitos', 'value': '', 'type': 'std'}, {'row_parameter_name': 'gastos cubiertos', 'value': '', 'type': 'std'}, {'row_parameter_name': 'gastos no cubiertos', 'value': '', 'type': 'std'}, {'row_parameter_name': 'aplicación de deducible y/o coaseguro', 'value': '', 'type': 'std'}, {'row_parameter_name': 'condiciones generales', 'value': 'Para los demás términos y condiciones, aplicarán las Condiciones Generales vigentes del producto contratado. Este Endoso forma parte del Contrato de Seguro.', 'type': 'std'}, {'row_parameter_name': 'elegibilidad', 'value': '', 'type': 'exception'}, {'row_parameter_name': 'territorio de cobertura', 'value': 'Nacional', 'type': 'exception'}]}, 'legal': 'Para los demás términos y condiciones, aplicarán las Condiciones Generales vigentes del producto contratado. Este Endoso forma parte del Contrato de Seguro.'}, 'global_information': {'effective_date': '', 'expiration_date': '', 'factor': '', 'type': ''}, 'business_rules': {'experience': '', 'product_type': '', 'min_net_premium': '', 'min_population': ''}, 'status': '', 'comment': [{'name': '', 'date': '', 'comment': ''}]}","{'token_cost': 0.013875000000000002, 'image_cost': 0, 'total_cost': 0.013875000000000002}",GENERAL,FW41609I
endoso_142,"LITOTRIPSIAS__La Compañía cubrirá los gastos médicos erogados durante la vigencia de esta_Póliza para litotripsias, hasta los límites que se indiquen en este Endoso.__Suma Asegurada: de la póliza._Deducible: 0 M.N._Coaseguro: 0%__Para este Endoso NO es aplicable el Endoso de Aplicación de Deducible y/o_Coaseguro.__Para los demás términos y condiciones, aplicarán las Condiciones Generales_vigentes del producto contratado.__Este Endoso forma parte del Contrato de Seguro.","{'endoso_id': 'endoso_142', 'endoso_master_id': '142', 'contract_no': 'FW95918C', 'subgrupo': 'EMPLEADOS SOLO TIT', 'type': 'standard', 'endoso_details': {'name': 'LITOTRIPSIAS', 'key': '', 'title': '', 'subtitle': '', 'description': 'La Compañía cubrirá los gastos médicos erogados durante la vigencia de esta Póliza para litotripsias, hasta los límites que se indiquen en este Endoso. Suma Asegurada: de la póliza. Deducible: 0 M.N. Coaseguro: 0% Para este Endoso NO es aplicable el Endoso de Aplicación de Deducible y/o Coaseguro. Para los demás términos y condiciones, aplicarán las Condiciones Generales vigentes del producto contratado. Este Endoso forma parte del Contrato de Seguro.', 'parameters': {'column_parameters': [{'column_parameter_name': 'Pago directo', 'column_parameter_details': [{'sub_column_parameter_name': '', 'row_parameters': [{'row_parameter_name': 'suma asegurada', 'value': 'de la póliza', 'unit': '', 'type': 'std'}, {'row_parameter_name': 'deducible', 'value': '0', 'unit': 'M.N.', 'type': 'std'}, {'row_parameter_name': 'coaseguro', 'value': '0', 'unit': '%', 'type': 'std'}, {'row_parameter_name': 'periodo espera', 'value': '', 'unit': '', 'type': 'std'}, {'row_parameter_name': 'territorio de cobertura', 'value': '', 'unit': '', 'type': 'std'}, {'row_parameter_name': 'consulta postoperatoria', 'value': '', 'unit': '', 'type': 'std'}, {'row_parameter_name': 'consulta preoperatoria', 'value': '', 'unit': '', 'type': 'std'}, {'row_parameter_name': 'aplicación de deducible y/o coaseguro', 'value': 'false', 'type': 'std'}, {'row_parameter_name': 'condiciones generales', 'value': 'Para los demás términos y condiciones, aplicarán las Condiciones Generales vigentes del producto contratado. Este Endoso forma parte del Contrato de Seguro.', 'type': 'std'}, {'row_parameter_name': 'elegibilidad', 'value': '', 'unit': '', 'type': 'exception'}, {'row_parameter_name': 'tope de coaseguro', 'value': '', 'unit': '', 'type': 'exception'}, {'row_parameter_name': 'número de sesiones', 'value': '', 'unit': '', 'type': 'exception'}]}]}, {'column_parameter_name': 'Reembolso', 'column_parameter_details': [{'sub_column_parameter_name': '', 'row_parameters': [{'row_parameter_name': 'suma asegurada', 'value': 'de la póliza', 'unit': '', 'type': 'std'}, {'row_parameter_name': 'deducible', 'value': '0', 'unit': 'M.N.', 'type': 'std'}, {'row_parameter_name': 'coaseguro', 'value': '0', 'unit': '%', 'type': 'std'}, {'row_parameter_name': 'periodo espera', 'value': '', 'unit': '', 'type': 'std'}, {'row_parameter_name': 'territorio de cobertura', 'value': '', 'unit': '', 'type': 'std'}, {'row_parameter_name': 'consulta postoperatoria', 'value': '', 'unit': '', 'type': 'std'}, {'row_parameter_name': 'consulta preoperatoria', 'value': '', 'unit': '', 'type': 'std'}, {'row_parameter_name': 'aplicación de deducible y/o coaseguro', 'value': 'false', 'type': 'std'}, {'row_parameter_name': 'condiciones generales', 'value': 'Para los demás términos y condiciones, aplicarán las Condiciones Generales vigentes del producto contratado. Este Endoso forma parte del Contrato de Seguro.', 'type': 'std'}, {'row_parameter_name': 'elegibilidad', 'value': '', 'unit': '', 'type': 'exception'}, {'row_parameter_name': 'tope de coaseguro', 'value': '', 'unit': '', 'type': 'exception'}, {'row_parameter_name': 'número de sesiones', 'value': '', 'unit': '', 'type': 'exception'}]}]}]}, 'legal': 'Para los demás términos y condiciones, aplicarán las Condiciones Generales vigentes del producto contratado. Este Endoso forma parte del Contrato de Seguro.'}, 'global_information': {'effective_date': '', 'expiration_date': '', 'factor': '', 'type': ''}, 'business_rules': {'experience': '', 'product_type': '', 'min_net_premium': '', 'min_population': ''}, 'status': '', 'comment': [{'name': '', 'date': '', 'comment': ''}]}","{'token_cost': 0.020837500000000002, 'image_cost': 0, 'total_cost': 0.020837500000000002}",EMPLEADOS SOLO TIT,FW95918C
endoso_84,"UMEX- 032 URGENCIA MÉDICA EN EL EXTRANJERO__La Compañía cubrirá los gastos médicos erogados durante la vigencia de esta_Póliza, por Urgencias Médicas en el Extranjero modificando los límites de_responsabilidad de esta cobertura, hasta los que se indiquen en este Endoso:_Suma Asegurada: USD 50,000.00Deducible: USD 50.00Para este Endoso no es_aplicable el Endoso de Aplicación de Deducible y/o Coaseguro.Para los demás_términos y condiciones, aplicarán las Condiciones Generales vigentes del_producto contratado.Este Endoso forma parte del Contrato de Seguro.","{'endoso_id': 'endoso_84', 'endoso_master_id': '84', 'contract_no': 'FW12426T', 'subgrupo': 'UNICO', 'type': 'standard', 'endoso_details': {'name': 'URGENCIA MÉDICA EN EL EXTRANJERO (UMEX)', 'key': 'UMEX- 032', 'title': '', 'subtitle': '', 'description': 'La Compañía cubrirá los gastos médicos erogados durante la vigencia de esta Póliza, por Urgencias Médicas en el Extranjero modificando los límites de responsabilidad de esta cobertura, hasta los que se indiquen en este Endoso: Suma Asegurada: USD 50,000.00 Deducible: USD 50.00 Para este Endoso no es aplicable el Endoso de Aplicación de Deducible y/o Coaseguro.Para los demás términos y condiciones, aplicarán las Condiciones Generales vigentes del producto contratado.Este Endoso forma parte del Contrato de Seguro.', 'parameters': {'column_parameters': [{'column_parameter_name': 'Urgencias Médicas', 'column_parameter_details': [{'row_parameters': [{'row_parameter_name': 'suma asegurada', 'value': '50,000.00', 'unit': 'USD', 'type': 'std'}, {'row_parameter_name': 'deducible', 'value': '50.00', 'unit': 'USD', 'type': 'std'}, {'row_parameter_name': 'coaseguro', 'value': '', 'type': 'std'}, {'row_parameter_name': 'información adicional', 'value': '', 'type': 'std'}, {'row_parameter_name': 'gastos cubiertos', 'value': '', 'type': 'std'}, {'row_parameter_name': 'gastos no cubiertos', 'value': '', 'type': 'std'}, {'row_parameter_name': 'aplicación de deducible y/o coaseguro', 'value': 'false', 'type': 'std'}, {'row_parameter_name': 'condiciones generales', 'value': 'Para los demás términos y condiciones, aplicarán las Condiciones Generales vigentes del producto contratado. Este Endoso forma parte del Contrato de Seguro.', 'type': 'std'}, {'row_parameter_name': 'elegibilidad', 'value': '', 'type': 'exception'}, {'row_parameter_name': 'periodo de espera', 'value': '', 'type': 'exception'}, {'row_parameter_name': 'tope de coaseguro', 'value': '', 'type': 'exception'}, {'row_parameter_name': 'territorio de cobertura', 'value': '', 'type': 'exception'}]}]}, {'column_parameter_name': 'Accidente', 'column_parameter_details': [{'row_parameters': [{'row_parameter_name': 'suma asegurada', 'value': '', 'type': 'std'}, {'row_parameter_name': 'deducible', 'value': '', 'type': 'std'}, {'row_parameter_name': 'coaseguro', 'value': '', 'type': 'std'}, {'row_parameter_name': 'información adicional', 'value': '', 'type': 'std'}, {'row_parameter_name': 'gastos cubiertos', 'value': '', 'type': 'std'}, {'row_parameter_name': 'gastos no cubiertos', 'value': '', 'type': 'std'}, {'row_parameter_name': 'aplicación de deducible y/o coaseguro', 'value': '', 'type': 'std'}, {'row_parameter_name': 'condiciones generales', 'value': 'Para los demás términos y condiciones, aplicarán las Condiciones Generales vigentes del producto contratado. Este Endoso forma parte del Contrato de Seguro.', 'type': 'std'}, {'row_parameter_name': 'elegibilidad', 'value': '', 'type': 'exception'}, {'row_parameter_name': 'periodo de espera', 'value': '', 'type': 'exception'}, {'row_parameter_name': 'tope de coaseguro', 'value': '', 'type': 'exception'}, {'row_parameter_name': 'territorio de cobertura', 'value': '', 'type': 'exception'}]}]}], 'legal': ''}}, 'global_information': {'effective_date': '', 'expiration_date': '', 'factor': '', 'type': ''}, 'business_rules': {'experience': '', 'product_type': '', 'min_net_premium': '', 'min_population': ''}, 'status': '', 'comment': [{'name': '', 'date': '', 'comment': ''}]}","{'token_cost': 0.019055000000000002, 'image_cost': 0, 'total_cost': 0.019055000000000002}",UNICO,FW12426T
endoso_38,"Se ampara el tratamiento médico quirúrgico de hallux valgus o juanetes,_ siempre y cuando no sea de carácter estético.__El monto a indemnizar para este beneficio y/o cobertura será: _De acuerdo a lo siguiente:___Monto Máximo a Indemnizar 10.00 SMGM __Con un periodo de espera de: _Sin periodo de espera__Aplicación de deducible y coaseguro:__Pago Directo (Médico y Hospital de Red):__Deducible                0.00   S.M.G.M. __Coaseguro                0.00   % __Reembolso:__Deducible                0.00   S.M.G.M. __Coaseguro                0.00   % __En caso de modificación del deducible y/o coaseguro originalmente pactado,_ invariablemente se aplicarán los deducibles y coaseguros antes_ mencionados en dicha cobertura/condición.__El presente endoso modifica el capítulo de Gastos Médicos Mayores No_ Cubiertos en su inciso de Tratamiento Médico o Quirúrgico de Hallux_ Valgus o Juanetes.__Se cubre únicamente en territorio nacional.__Este endoso forma parte integral y complementa las Condiciones Generales_ del Seguro_","{'endoso_id': 'endoso_38', 'endoso_master_id': '38', 'contract_no': 'FW16455O', 'subgrupo': 'TITULARES', 'type': 'standard', 'endoso_details': {'name': 'HALLUX VALGUS', 'key': '', 'title': '', 'subtitle': '', 'description': 'Se ampara el tratamiento médico quirúrgico de hallux valgus o juanetes, siempre y cuando no sea de carácter estético. El monto a indemnizar para este beneficio y/o cobertura será: De acuerdo a lo siguiente: Monto Máximo a Indemnizar 10.00 SMGM Con un periodo de espera de: Sin periodo de espera Aplicación de deducible y coaseguro: Pago Directo (Médico y Hospital de Red): Deducible 0.00 S.M.G.M. Coaseguro 0.00 % Reembolso: Deducible 0.00 S.M.G.M. Coaseguro 0.00 % En caso de modificación del deducible y/o coaseguro originalmente pactado, invariablemente se aplicarán los deducibles y coaseguros antes mencionados en dicha cobertura/condición. El presente endoso modifica el capítulo de Gastos Médicos Mayores No Cubiertos en su inciso de Tratamiento Médico o Quirúrgico de Hallux Valgus o Juanetes. Se cubre únicamente en territorio nacional. Este endoso forma parte integral y complementa las Condiciones Generales del Seguro', 'parameters': {'column_parameters': [{'column_parameter_name': 'Pago directo', 'column_parameter_details': [{'row_parameters': [{'row_parameter_name': 'suma asegurada', 'value': '10.00', 'unit': 'SMGM', 'type': 'std'}, {'row_parameter_name': 'deducible', 'value': '0.00', 'unit': 'S.M.G.M.', 'type': 'std'}, {'row_parameter_name': 'coaseguro', 'value': '0.00', 'unit': '%', 'type': 'std'}, {'row_parameter_name': 'tope de coaseguro', 'value': '', 'unit': '', 'type': 'std'}, {'row_parameter_name': 'territorio de cobertura', 'value': 'nacional', 'type': 'std'}, {'row_parameter_name': 'periodo espera', 'value': 'Sin periodo de espera', 'type': 'std'}, {'row_parameter_name': 'gastos cubiertos', 'value': '', 'type': 'std'}, {'row_parameter_name': 'gastos no cubiertos', 'value': 'El presente endoso modifica el capítulo de Gastos Médicos Mayores No Cubiertos en su inciso de Tratamiento Médico o Quirúrgico de Hallux Valgus o Juanetes.', 'type': 'std'}, {'row_parameter_name': 'aplicación de deducible y/o coaseguro', 'value': 'Y', 'type': 'std'}, {'row_parameter_name': 'condiciones generales', 'value': 'Este endoso forma parte integral y complementa las Condiciones Generales del Seguro', 'type': 'std'}, {'row_parameter_name': 'consulta postoperatoria', 'value': '', 'type': 'exception'}, {'row_parameter_name': 'consulta preoperatoria', 'value': '', 'type': 'exception'}]}]}, {'column_parameter_name': 'Reembolso', 'column_parameter_details': [{'row_parameters': [{'row_parameter_name': 'suma asegurada', 'value': '10.00', 'unit': 'SMGM', 'type': 'std'}, {'row_parameter_name': 'deducible', 'value': '0.00', 'unit': 'S.M.G.M.', 'type': 'std'}, {'row_parameter_name': 'coaseguro', 'value': '0.00', 'unit': '%', 'type': 'std'}, {'row_parameter_name': 'tope de coaseguro', 'value': '', 'unit': '', 'type': 'std'}, {'row_parameter_name': 'territorio de cobertura', 'value': 'nacional', 'type': 'std'}, {'row_parameter_name': 'periodo espera', 'value': 'Sin periodo de espera', 'type': 'std'}, {'row_parameter_name': 'gastos cubiertos', 'value': '', 'type': 'std'}, {'row_parameter_name': 'gastos no cubiertos', 'value': 'El presente endoso modifica el capítulo de Gastos Médicos Mayores No Cubiertos en su inciso de Tratamiento Médico o Quirúrgico de Hallux Valgus o Juanetes.', 'type': 'std'}, {'row_parameter_name': 'aplicación de deducible y/o coaseguro', 'value': 'Y', 'type': 'std'}, {'row_parameter_name': 'condiciones generales', 'value': 'Este endoso forma parte integral y complementa las Condiciones Generales del Seguro', 'type': 'std'}, {'row_parameter_name': 'consulta postoperatoria', 'value': '', 'type': 'exception'}, {'row_parameter_name': 'consulta preoperatoria', 'value': '', 'type': 'exception'}]}]}]}, 'legal': 'Este endoso forma parte integral y complementa las Condiciones Generales del Seguro'}, 'global_information': {'effective_date': '', 'expiration_date': '', 'factor': '', 'type': ''}, 'business_rules': {'experience': '', 'product_type': '', 'min_net_premium': '', 'min_population': ''}, 'status': '', 'comment': [{'name': '', 'date': '', 'comment': ''}]}","{'token_cost': 0.0223, 'image_cost': 0, 'total_cost': 0.0223}",TITULARES,FW16455O
