endoso_code,text,extracted_parameters,cost_metrics,nom_subg,contract_no
endoso_84,"_UMEX-032 URGENCIA MÉDICA EN EL EXTRANJERO__ __La Compañía cubrirá los gastos médicos erogados durante la vigencia de esta_Póliza, por Urgencias Médicas en el Extranjero  modificando los límites de_responsabilidad  de esta cobertura, hasta los que se  indiquen en este_Endoso:__ __Suma Asegurada: USD 50,000.00__ __Deducible: USD 50.00__ __Para este Endoso no es aplicable el Endoso de  Aplicación de Deducible y/o_Coaseguro.__ __Para los demás términos y condiciones, aplicarán las Condiciones Generales_vigentes del producto contratado.__ __Este Endoso forma parte del Contrato de Seguro.","{'endoso_id': 'endoso_84', 'endoso_master_id': '84', 'contract_no': 'FW49982K', 'subgrupo': 'SUBGRUPO 1', 'type': 'standard', 'endoso_details': {'name': 'URGENCIA MÉDICA EN EL EXTRANJERO (UMEX)', 'key': 'UMEX-032', 'title': '', 'subtitle': '', 'description': 'La Compañía cubrirá los gastos médicos erogados durante la vigencia de esta Póliza, por Urgencias Médicas en el Extranjero modificando los límites de responsabilidad de esta cobertura, hasta los que se indiquen en este Endoso: Suma Asegurada: USD 50,000.00 Deducible: USD 50.00 Para este Endoso no es aplicable el Endoso de Aplicación de Deducible y/o Coaseguro. Para los demás términos y condiciones, aplicarán las Condiciones Generales vigentes del producto contratado. Este Endoso forma parte del Contrato de Seguro.', 'parameters': {'column_parameters': [{'column_parameter_name': 'Urgencias Médicas', 'column_parameter_details': [{'sub_column_parameter_name': '', 'row_parameters': [{'row_parameter_name': 'suma asegurada', 'value': '50,000.00', 'unit': 'USD', 'type': 'std'}, {'row_parameter_name': 'deducible', 'value': '50.00', 'unit': 'USD', 'type': 'std'}, {'row_parameter_name': 'coaseguro', 'value': '', 'type': 'std'}, {'row_parameter_name': 'información adicional', 'value': '', 'type': 'std'}, {'row_parameter_name': 'gastos cubiertos', 'value': '', 'type': 'std'}, {'row_parameter_name': 'gastos no cubiertos', 'value': '', 'type': 'std'}, {'row_parameter_name': 'aplicación de deducible y/o coaseguro', 'value': 'false', 'type': 'std'}, {'row_parameter_name': 'condiciones generales', 'value': 'Para los demás términos y condiciones, aplicarán las Condiciones Generales vigentes del producto contratado. Este Endoso forma parte del Contrato de Seguro.', 'type': 'std'}, {'row_parameter_name': 'elegibilidad', 'value': '', 'type': 'exception'}, {'row_parameter_name': 'periodo de espera', 'value': '', 'type': 'exception'}, {'row_parameter_name': 'tope de coaseguro', 'value': '', 'type': 'exception'}, {'row_parameter_name': 'territorio de cobertura', 'value': '', 'type': 'exception'}]}]}, {'column_parameter_name': 'Accidente', 'column_parameter_details': [{'sub_column_parameter_name': '', 'row_parameters': [{'row_parameter_name': 'suma asegurada', 'value': '', 'type': 'std'}, {'row_parameter_name': 'deducible', 'value': '', 'type': 'std'}, {'row_parameter_name': 'coaseguro', 'value': '', 'type': 'std'}, {'row_parameter_name': 'información adicional', 'value': '', 'type': 'std'}, {'row_parameter_name': 'gastos cubiertos', 'value': '', 'type': 'std'}, {'row_parameter_name': 'gastos no cubiertos', 'value': '', 'type': 'std'}, {'row_parameter_name': 'aplicación de deducible y/o coaseguro', 'value': '', 'type': 'std'}, {'row_parameter_name': 'condiciones generales', 'value': 'Para los demás términos y condiciones, aplicarán las Condiciones Generales vigentes del producto contratado. Este Endoso forma parte del Contrato de Seguro.', 'type': 'std'}, {'row_parameter_name': 'elegibilidad', 'value': '', 'type': 'exception'}, {'row_parameter_name': 'periodo de espera', 'value': '', 'type': 'exception'}, {'row_parameter_name': 'tope de coaseguro', 'value': '', 'type': 'exception'}, {'row_parameter_name': 'territorio de cobertura', 'value': '', 'type': 'exception'}]}]}]}, 'legal': 'Para los demás términos y condiciones, aplicarán las Condiciones Generales vigentes del producto contratado. Este Endoso forma parte del Contrato de Seguro.'}, 'global_information': {'effective_date': '', 'expiration_date': '', 'factor': '', 'type': ''}, 'business_rules': {'experience': '', 'product_type': '', 'min_net_premium': '', 'min_population': ''}, 'status': '', 'comment': [{'name': '', 'date': '', 'comment': ''}]}","{'token_cost': 0.019595, 'image_cost': 0, 'total_cost': 0.019595}",SUBGRUPO 1,FW49982K
endoso_84,"La Compañía cubrirá los gastos médicos erogados durante la vigencia de ésta_póliza, por Urgencias Médicas en el Extranjero modificando los límites de_responsabilidad de esta cobertura, hasta los que se indiquen en este endoso:_Suma Asegurada: 100000 usd_Deducible: 100 usd_Para este Endoso no es aplicable el Endoso de Aplicación de Deducible y/o_Coaseguro._Para los demás términos y condiciones, aplicarán las Condiciones Generales_vigentes del producto contratado._Este Endoso forma parte del Contrato de Seguro.""","{'endoso_id': 'endoso_84', 'endoso_master_id': '84', 'contract_no': 'FW37560D', 'subgrupo': 'OP EMERALD', 'type': 'standard', 'endoso_details': {'name': 'URGENCIA MÉDICA EN EL EXTRANJERO (UMEX)', 'key': '', 'title': '', 'subtitle': '', 'description': 'La Compañía cubrirá los gastos médicos erogados durante la vigencia de ésta póliza, por Urgencias Médicas en el Extranjero modificando los límites de responsabilidad de esta cobertura, hasta los que se indiquen en este endoso: Suma Asegurada: 100000 usd Deducible: 100 usd Para este Endoso no es aplicable el Endoso de Aplicación de Deducible y/o Coaseguro. Para los demás términos y condiciones, aplicarán las Condiciones Generales vigentes del producto contratado. Este Endoso forma parte del Contrato de Seguro.', 'parameters': {'column_parameters': [{'column_parameter_name': 'Urgencias Médicas', 'column_parameter_details': [{'sub_column_parameter_name': '', 'row_parameters': [{'row_parameter_name': 'suma asegurada', 'value': '100000', 'unit': 'USD', 'type': 'std'}, {'row_parameter_name': 'deducible', 'value': '100', 'unit': 'USD', 'type': 'std'}, {'row_parameter_name': 'coaseguro', 'value': '', 'type': 'std'}, {'row_parameter_name': 'información adicional', 'value': '', 'type': 'std'}, {'row_parameter_name': 'gastos cubiertos', 'value': '', 'type': 'std'}, {'row_parameter_name': 'gastos no cubiertos', 'value': '', 'type': 'std'}, {'row_parameter_name': 'aplicación de deducible y/o coaseguro', 'value': 'false', 'type': 'std'}, {'row_parameter_name': 'condiciones generales', 'value': 'Para los demás términos y condiciones, aplicarán las Condiciones Generales vigentes del producto contratado. Este Endoso forma parte del Contrato de Seguro.', 'type': 'std'}, {'row_parameter_name': 'elegibilidad', 'value': '', 'type': 'exception'}, {'row_parameter_name': 'periodo de espera', 'value': '', 'type': 'exception'}, {'row_parameter_name': 'tope de coaseguro', 'value': '', 'type': 'exception'}, {'row_parameter_name': 'territorio de cobertura', 'value': '', 'type': 'exception'}]}]}, {'column_parameter_name': 'Accidente', 'column_parameter_details': [{'sub_column_parameter_name': '', 'row_parameters': [{'row_parameter_name': 'suma asegurada', 'value': '', 'type': 'std'}, {'row_parameter_name': 'deducible', 'value': '', 'type': 'std'}, {'row_parameter_name': 'coaseguro', 'value': '', 'type': 'std'}, {'row_parameter_name': 'información adicional', 'value': '', 'type': 'std'}, {'row_parameter_name': 'gastos cubiertos', 'value': '', 'type': 'std'}, {'row_parameter_name': 'gastos no cubiertos', 'value': '', 'type': 'std'}, {'row_parameter_name': 'aplicación de deducible y/o coaseguro', 'value': '', 'type': 'std'}, {'row_parameter_name': 'condiciones generales', 'value': 'Para los demás términos y condiciones, aplicarán las Condiciones Generales vigentes del producto contratado. Este Endoso forma parte del Contrato de Seguro.', 'type': 'std'}, {'row_parameter_name': 'elegibilidad', 'value': '', 'type': 'exception'}, {'row_parameter_name': 'periodo de espera', 'value': '', 'type': 'exception'}, {'row_parameter_name': 'tope de coaseguro', 'value': '', 'type': 'exception'}, {'row_parameter_name': 'territorio de cobertura', 'value': '', 'type': 'exception'}]}]}], 'legal': ''}}, 'global_information': {'effective_date': '', 'expiration_date': '', 'factor': '', 'type': ''}, 'business_rules': {'experience': '', 'product_type': '', 'min_net_premium': '', 'min_population': ''}, 'status': '', 'comment': [{'name': '', 'date': '', 'comment': ''}]}","{'token_cost': 0.0190125, 'image_cost': 0, 'total_cost': 0.0190125}",OP EMERALD,FW37560D
endoso_155,"FACTOR DE REEMBOLSO__El factor de Reembolso de cada Procedimiento Terapéutico incluido en las_Condiciones Generales correspondientes a esta póliza esta expresado de_manera porcentual, para determinar el monto máximo a pagar por la Compañía_por procedimiento terapéutico.","{'endoso_id': 'endoso_155', 'endoso_master_id': '155', 'contract_no': 'FD18204K', 'subgrupo': 'AEROVIAS DE MEXICO', 'type': 'standard', 'endoso_details': {'name': 'Factor', 'key': '', 'title': '', 'subtitle': '', 'description': 'FACTOR DE REEMBOLSO__El factor de Reembolso de cada Procedimiento Terapéutico incluido en las_Condiciones Generales correspondientes a esta póliza esta expresado de_manera porcentual, para determinar el monto máximo a pagar por la Compañía_por procedimiento terapéutico.', 'parameters': {'column_parameters': '', 'row_parameters': [{'row_parameter_name': 'Descripcion', 'editable': True, 'active': True, 'type': 'std', 'value_type': 'text', 'value': 'FACTOR DE REEMBOLSO__El factor de Reembolso de cada Procedimiento Terapéutico incluido en las_Condiciones Generales correspondientes a esta póliza esta expresado de_manera porcentual, para determinar el monto máximo a pagar por la Compañía_por procedimiento terapéutico.'}, {'row_parameter_name': 'Factor', 'editable': True, 'active': True, 'type': 'std', 'value_type': 'digits', 'value': ''}, {'row_parameter_name': 'Condiciones Generales', 'editable': True, 'active': True, 'type': 'std', 'value_type': 'string', 'value': 'Para los demás términos y condiciones, aplicarán las Condiciones Generales vigentes del producto contratado. Este Endoso forma parte del Contrato de Seguro'}]}, 'legal': ''}, 'global_information': {'effective_date': '', 'expiration_date': '', 'factor': '', 'type': ''}, 'business_rules': {'experience': '', 'product_type': '', 'min_net_premium': '', 'min_population': ''}, 'status': '', 'comment': [{'name': '', 'date': '', 'comment': ''}]}","{'token_cost': 0.009600000000000001, 'image_cost': 0, 'total_cost': 0.009600000000000001}",AEROVIAS DE MEXICO,FD18204K
endoso_84,"UMEX- 032 URGENCIA MÉDICA EN EL EXTRANJERO_La Compañía cubrirá los gastos médicos erogados durante la vigencia de_estaPóliza, por Urgencias Médicas en el Extranjero  modificando los límites_deresponsabilidad  de esta cobertura, hasta los que se  indiquen en_esteEndoso:Suma Asegurada: 100,000.00 DLLSDeducible: 100 DLLSPara este Endoso_no es aplicable el Endoso de  Aplicación de Deducible y/oCoaseguro.Para los_demás términos y condiciones, aplicarán las Condiciones Generalesvigentes del_producto contratado.Este Endoso forma parte del Contrato de Seguro.","{'endoso_id': 'endoso_84', 'endoso_master_id': '84', 'contract_no': 'FW43291E', 'subgrupo': 'SOCIOS Y DIRECTORE', 'type': 'standard', 'endoso_details': {'name': 'URGENCIA MÉDICA EN EL EXTRANJERO', 'key': 'UMEX- 032', 'title': '', 'subtitle': '', 'description': 'La Compañía cubrirá los gastos médicos erogados durante la vigencia de estaPóliza, por Urgencias Médicas en el Extranjero modificando los límites deresponsabilidad de esta cobertura, hasta los que se indiquen en esteEndoso:Suma Asegurada: 100,000.00 DLLSDeducible: 100 DLLSPara este Endoso no es aplicable el Endoso de Aplicación de Deducible y/oCoaseguro.Para los demás términos y condiciones, aplicarán las Condiciones Generalesvigentes del producto contratado.Este Endoso forma parte del Contrato de Seguro.', 'parameters': {'column_parameters': [{'column_parameter_name': 'Urgencias Médicas', 'column_parameter_details': [{'sub_column_parameter_name': '', 'row_parameters': [{'row_parameter_name': 'suma asegurada', 'value': '100,000.00', 'unit': 'DLLS', 'type': 'std'}, {'row_parameter_name': 'deducible', 'value': '100', 'unit': 'DLLS', 'type': 'std'}, {'row_parameter_name': 'coaseguro', 'value': '', 'type': 'std'}, {'row_parameter_name': 'información adicional', 'value': '', 'type': 'std'}, {'row_parameter_name': 'gastos cubiertos', 'value': '', 'type': 'std'}, {'row_parameter_name': 'gastos no cubiertos', 'value': '', 'type': 'std'}, {'row_parameter_name': 'aplicación de deducible y/o coaseguro', 'value': 'false', 'type': 'std'}, {'row_parameter_name': 'condiciones generales', 'value': 'Para los demás términos y condiciones, aplicarán las Condiciones Generales vigentes del producto contratado. Este Endoso forma parte del Contrato de Seguro.', 'type': 'std'}, {'row_parameter_name': 'elegibilidad', 'value': '', 'type': 'exception'}, {'row_parameter_name': 'periodo de espera', 'value': '', 'type': 'exception'}, {'row_parameter_name': 'tope de coaseguro', 'value': '', 'type': 'exception'}, {'row_parameter_name': 'territorio de cobertura', 'value': '', 'type': 'exception'}]}]}, {'column_parameter_name': 'Accidente', 'column_parameter_details': [{'sub_column_parameter_name': '', 'row_parameters': [{'row_parameter_name': 'suma asegurada', 'value': '', 'type': 'std'}, {'row_parameter_name': 'deducible', 'value': '', 'type': 'std'}, {'row_parameter_name': 'coaseguro', 'value': '', 'type': 'std'}, {'row_parameter_name': 'información adicional', 'value': '', 'type': 'std'}, {'row_parameter_name': 'gastos cubiertos', 'value': '', 'type': 'std'}, {'row_parameter_name': 'gastos no cubiertos', 'value': '', 'type': 'std'}, {'row_parameter_name': 'aplicación de deducible y/o coaseguro', 'value': '', 'type': 'std'}, {'row_parameter_name': 'condiciones generales', 'value': 'Para los demás términos y condiciones, aplicarán las Condiciones Generales vigentes del producto contratado. Este Endoso forma parte del Contrato de Seguro.', 'type': 'std'}, {'row_parameter_name': 'elegibilidad', 'value': '', 'type': 'exception'}, {'row_parameter_name': 'periodo de espera', 'value': '', 'type': 'exception'}, {'row_parameter_name': 'tope de coaseguro', 'value': '', 'type': 'exception'}, {'row_parameter_name': 'territorio de cobertura', 'value': '', 'type': 'exception'}]}]}]}, 'legal': 'Para los demás términos y condiciones, aplicarán las Condiciones Generales vigentes del producto contratado. Este Endoso forma parte del Contrato de Seguro.'}, 'global_information': {'effective_date': '', 'expiration_date': '', 'factor': '', 'type': ''}, 'business_rules': {'experience': '', 'product_type': '', 'min_net_premium': '', 'min_population': ''}, 'status': '', 'comment': [{'name': '', 'date': '', 'comment': ''}]}","{'token_cost': 0.019527500000000003, 'image_cost': 0, 'total_cost': 0.019527500000000003}",SOCIOS Y DIRECTORE,FW43291E
endoso_82,"Se cubren los gastos médicos erogados durante la vigencia de esta póliza,_por tratamientos y/o procedimientos del Asegurado vigente, que sean_procedentes de acuerdo a las Condiciones Generales vigentes del producto_contratado, de accidentes ocurridos y/o padecimientos diagnosticados previos_a la fecha de alta del asegurado en esta póliza.__Se reconocen padecimientos congénitos.__Dichos gastos se cubren bajo los términos y condiciones establecidos en el_apartado ""Gastos Médicos Mayores Cubiertos"" de las Condiciones Generales_vigentes del producto contratado, así como los endosos que forman parte de_este contrato, y hasta los límites que se establecen en este endoso.__Para los gastos médicos erogados por accidentes ocurridos y/o padecimientos_diagnosticados que hayan sido cubiertos por otra póliza de Gastos Médicos_Mayores de esta u otra Compañía de Seguros, aplicarán las condiciones del_endoso de Continuidad de Cobertura.__En caso de que aplique alguno de los endosos adicionales existentes en ésta_póliza para el accidente o padecimiento procedente, se aplican las_condiciones establecidas en el mismo, prevaleciendo sobre las condiciones_que se indican en este endoso.__Aplican los siguientes límites de responsabilidad:__Elegibilidad:_Todos los Asegurados de la Póliza__Suma Asegurada: De la póliza_Deducible: De la póliza_Coaseguro: De la póliza__Periodo de espera: 1 AÑO__Reconocimiento de antigüedad: Si Aplica__Se cubre en territorio: Nacional__Los demás términos y condiciones, deben aplicar de acuerdo a las Condiciones_Generales del producto contratado.__Este endoso forma parte integral y complementa las Condiciones Generales del_Seguro.","{'endoso_id': 'endoso_82', 'endoso_master_id': '82', 'contract_no': 'FW46302D', 'subgrupo': 'no dependientes', 'type': 'standard', 'endoso_details': {'name': 'PREEXISTENCIA', 'key': '', 'title': '', 'subtitle': '', 'description': 'Se cubren los gastos médicos erogados durante la vigencia de esta póliza, por tratamientos y/o procedimientos del Asegurado vigente, que sean procedentes de acuerdo a las Condiciones Generales vigentes del producto contratado, de accidentes ocurridos y/o padecimientos diagnosticados previos a la fecha de alta del asegurado en esta póliza. Se reconocen padecimientos congénitos. Dichos gastos se cubren bajo los términos y condiciones establecidos en el apartado ""Gastos Médicos Mayores Cubiertos"" de las Condiciones Generales vigentes del producto contratado, así como los endosos que forman parte de este contrato, y hasta los límites que se establecen en este endoso. Para los gastos médicos erogados por accidentes ocurridos y/o padecimientos diagnosticados que hayan sido cubiertos por otra póliza de Gastos Médicos Mayores de esta u otra Compañía de Seguros, aplicarán las condiciones del endoso de Continuidad de Cobertura. En caso de que aplique alguno de los endosos adicionales existentes en ésta póliza para el accidente o padecimiento procedente, se aplican las condiciones establecidas en el mismo, prevaleciendo sobre las condiciones que se indican en este endoso. Aplican los siguientes límites de responsabilidad: Elegibilidad: Todos los Asegurados de la Póliza Suma Asegurada: De la póliza Deducible: De la póliza Coaseguro: De la póliza Periodo de espera: 1 AÑO Reconocimiento de antigüedad: Si Aplica Se cubre en territorio: Nacional Los demás términos y condiciones, deben aplicar de acuerdo a las Condiciones Generales del producto contratado. Este endoso forma parte integral y complementa las Condiciones Generales del Seguro.', 'parameters': {'column_parameters': [{'column_parameter_name': '', 'column_parameter_details': [{'sub_column_parameter_name': '', 'row_parameters': [{'row_parameter_name': 'suma asegurada', 'value': '', 'unit': '', 'type': 'std'}, {'row_parameter_name': 'deducible', 'value': '', 'unit': '', 'type': 'std'}, {'row_parameter_name': 'coaseguro', 'value': '', 'unit': '', 'type': 'std'}, {'row_parameter_name': 'tope de coaseguro', 'value': '', 'unit': '', 'type': 'std'}, {'row_parameter_name': 'periodo espera', 'value': '1', 'unit': 'AÑO', 'type': 'std'}, {'row_parameter_name': 'reconocimiento de antigüedad', 'value': 'Si Aplica', 'type': 'std'}, {'row_parameter_name': 'requisitos', 'value': '', 'type': 'std'}, {'row_parameter_name': 'gastos cubiertos', 'value': '', 'type': 'std'}, {'row_parameter_name': 'gastos no cubiertos', 'value': '', 'type': 'std'}, {'row_parameter_name': 'aplicación de deducible y/o coaseguro', 'value': '', 'type': 'std'}, {'row_parameter_name': 'condiciones generales', 'value': 'Para los demás términos y condiciones, deben aplicar de acuerdo a las Condiciones Generales del producto contratado. Este endoso forma parte integral y complementa las Condiciones Generales del Seguro.', 'type': 'std'}, {'row_parameter_name': 'elegibilidad', 'value': 'Todos los Asegurados de la Póliza', 'type': 'exception'}, {'row_parameter_name': 'territorio de cobertura', 'value': 'Nacional', 'type': 'exception'}]}]}]}, 'legal': 'Para los demás términos y condiciones, deben aplicar de acuerdo a las Condiciones Generales del producto contratado. Este endoso forma parte integral y complementa las Condiciones Generales del Seguro.'}, 'global_information': {'effective_date': '', 'expiration_date': '', 'factor': '', 'type': ''}, 'business_rules': {'experience': '', 'product_type': '', 'min_net_premium': '', 'min_population': ''}, 'status': '', 'comment': [{'name': '', 'date': '', 'comment': ''}]}","{'token_cost': 0.017625000000000002, 'image_cost': 0, 'total_cost': 0.017625000000000002}",no dependientes  o,FW46302D
