endoso_code,text,extracted_parameters,cost_metrics,nom_subg,contract_no
endoso_82,"Quedan cubiertas las enfermedades o accidentes preexistentes cubiertos por_la presente póliza, aún y cuando:__a) La sintomatología previa a dicha enfermedad no haya pasado_desapercibida.__b) Se hubiera establecido diagnóstico antes del alta del Asegurado en esta_póliza.__c) Existan  gastos efectuados con anterioridad al inicio de la Cobertura.__Sólo quedaran cubiertos los gastos realizados durante la vigencia de esta_póliza.__Este endoso modifica la exclusión estipulada en las Condiciones Generales_del producto contratado, en el apartado V. Gastos Médicos Mayores No_Cubiertos, inciso 1.__El Asegurado deberá cumplir con un periodo de espera, a partir de su_inscripción en la póliza, de:_2 Años__AXA Seguros, S.A. de C.V.:_Reconocerá el tiempo que el Asegurado haya tenido esta cobertura en esta_compañía u otra(s) compañía(s) de seguros; siempre y cuando no exista un_periodo al descubierto mayor a 30 días.__Esta cobertura aplicará de acuerdo a lo arriba señalado.__Se cubre únicamente en territorio nacional.__Los demás términos y condiciones, deben operar conforme se señala en las_Condiciones Generales del producto contratado.__Este endoso forma parte integral y complementa las Condiciones Generales_del Seguro.__","{'endoso_id': 'endoso_82', 'endoso_master_id': '82', 'contract_no': 'FW16395V', 'subgrupo': 'SUBGRUPO 1', 'type': 'standard', 'endoso_details': {'name': 'PREEXISTENCIA', 'key': '', 'title': '', 'subtitle': '', 'description': 'Quedan cubiertas las enfermedades o accidentes preexistentes cubiertos por la presente póliza, aún y cuando: a) La sintomatología previa a dicha enfermedad no haya pasado desapercibida. b) Se hubiera establecido diagnóstico antes del alta del Asegurado en esta póliza. c) Existan  gastos efectuados con anterioridad al inicio de la Cobertura. Sólo quedaran cubiertos los gastos realizados durante la vigencia de esta póliza. Este endoso modifica la exclusión estipulada en las Condiciones Generales del producto contratado, en el apartado V. Gastos Médicos Mayores No Cubiertos, inciso 1. El Asegurado deberá cumplir con un periodo de espera, a partir de su inscripción en la póliza, de: 2 Años AXA Seguros, S.A. de C.V.: Reconocerá el tiempo que el Asegurado haya tenido esta cobertura en esta compañía u otra(s) compañía(s) de seguros; siempre y cuando no exista un periodo al descubierto mayor a 30 días. Esta cobertura aplicará de acuerdo a lo arriba señalado. Se cubre únicamente en territorio nacional. Los demás términos y condiciones, deben operar conforme se señala en las Condiciones Generales del producto contratado. Este endoso forma parte integral y complementa las Condiciones Generales del Seguro.', 'parameters': {'column_parameters': '', 'row_parameters': [{'row_parameter_name': 'suma asegurada', 'value': '', 'unit': '', 'type': 'std'}, {'row_parameter_name': 'deducible', 'value': '', 'unit': '', 'type': 'std'}, {'row_parameter_name': 'coaseguro', 'value': '', 'unit': '', 'type': 'std'}, {'row_parameter_name': 'tope de coaseguro', 'value': '', 'unit': '', 'type': 'std'}, {'row_parameter_name': 'periodo espera', 'value': '2', 'unit': 'Años', 'type': 'std'}, {'row_parameter_name': 'reconocimiento de antigüedad', 'value': 'aplica', 'type': 'std'}, {'row_parameter_name': 'requisitos', 'value': '', 'type': 'std'}, {'row_parameter_name': 'gastos cubiertos', 'value': 'Quedan cubiertas las enfermedades o accidentes preexistentes cubiertos por la presente póliza.', 'type': 'std'}, {'row_parameter_name': 'gastos no cubiertos', 'value': '', 'type': 'std'}, {'row_parameter_name': 'aplicación de deducible y/o coaseguro', 'value': '', 'type': 'std'}, {'row_parameter_name': 'condiciones generales', 'value': 'Los demás términos y condiciones, deben operar conforme se señala en las Condiciones Generales del producto contratado. Este endoso forma parte integral y complementa las Condiciones Generales del Seguro.', 'type': 'std'}, {'row_parameter_name': 'elegibilidad', 'value': '', 'type': 'exception'}, {'row_parameter_name': 'territorio de cobertura', 'value': 'nacional', 'type': 'exception'}], 'legal': 'Los demás términos y condiciones, deben operar conforme se señala en las Condiciones Generales del producto contratado. Este endoso forma parte integral y complementa las Condiciones Generales del Seguro.'}}, 'global_information': {'effective_date': '', 'expiration_date': '', 'factor': '', 'type': ''}, 'business_rules': {'experience': '', 'product_type': '', 'min_net_premium': '', 'min_population': ''}, 'status': '', 'comment': [{'name': '', 'date': '', 'comment': ''}]}","{'token_cost': 0.01624, 'image_cost': 0, 'total_cost': 0.01624}",SUBGRUPO 1,FW16395V
endoso_127,"No se considerarán enfermedades preexistentes aquellas cuyo inicio u origen_se haya dado durante el período en que éste contrato estuvo asegurado en la_(s) compañía (s) anterior (es), y  que no se  haya generado siniestro en la_misma por no rebasar el deducible, o no haberse atendido.__Es decir, en caso de que dicho siniestro hubiese sido cubierto por la misma_será cubierto  por Axa Seguros, S.A. de C.V., siempre y cuando el asegurado_haya estado vigente de manera ininterrumpida.__Los  demás términos  y  condiciones, deben operar conforme se señala en las_Condiciones Generales del producto contratado.__Este endoso  forma  parte  integral y complementa las Condiciones Generales_del Seguro._.","{'endoso_id': 'endoso_127', 'endoso_master_id': '127', 'contract_no': 'FW30128H', 'subgrupo': 'II   PLAN B', 'type': 'standard', 'endoso_details': {'name': 'CONTINUIDAD GARANTIZADA', 'key': '', 'title': '', 'subtitle': '', 'description': 'No se considerarán enfermedades preexistentes aquellas cuyo inicio u origen se haya dado durante el período en que éste contrato estuvo asegurado en la (s) compañía (s) anterior (es), y  que no se  haya generado siniestro en la misma por no rebasar el deducible, o no haberse atendido. Es decir, en caso de que dicho siniestro hubiese sido cubierto por la misma será cubierto  por Axa Seguros, S.A. de C.V., siempre y cuando el asegurado haya estado vigente de manera ininterrumpida. Los  demás términos  y  condiciones, deben operar conforme se señala en las Condiciones Generales del producto contratado. Este endoso  forma  parte  integral y complementa las Condiciones Generales del Seguro.', 'parameters': {'column_parameters': '', 'row_parameters': [{'row_parameter_name': 'Descripcion', 'editable': True, 'active': True, 'type': 'std', 'value_type': 'Titular/conyuge/hijos'}, {'row_parameter_name': 'Condiciones Generales', 'editable': True, 'active': True, 'type': 'std', 'value_type': 'string', 'value': 'Los  demás términos  y  condiciones, deben operar conforme se señala en las Condiciones Generales del producto contratado. Este endoso  forma  parte  integral y complementa las Condiciones Generales del Seguro.'}], 'legal': ''}}, 'global_information': {'effective_date': '', 'expiration_date': '', 'factor': '', 'type': ''}, 'business_rules': {'experience': '', 'product_type': '', 'min_net_premium': '', 'min_population': ''}, 'status': '', 'comment': [{'name': '', 'date': '', 'comment': ''}]}","{'token_cost': 0.0099275, 'image_cost': 0, 'total_cost': 0.0099275}",II   PLAN B,FW30128H
endoso_82,"""PREEXISTENCIA_Quedan cubiertas las enfermedades o accidentes preexistentes cubiertos por la_presente p¢liza, a£n y cuando:  a) La sintomatolog¡a previa a dicha_enfermedad no haya pasado desapercibida. b) Se hubiera establecido_diagn¢stico antes del alta del Asegurado en esta p¢liza. c) Existan  gastos_efectuados con anterioridad al inicio de la Cobertura. S¢lo quedaran_cubiertos los gastos realizados durante la vigencia de esta p¢liza. Este_endoso modifica la exclusi¢n estipulada en las Condiciones Generales del_producto contratado, en el apartado V. Gastos M¿dicos Mayores No Cubiertos,_inciso 1. El Asegurado deber  cumplir con un periodo de espera, a partir de_su inscripci¢n en la p¢liza, de: Sin periodo de espera AXA Seguros, S.A. de_C.V.: Reconocer  el tiempo que el Asegurado haya tenido esta cobertura en_esta compa¤¡a u otra(s) compa¤¡a(s) de seguros; siempre y cuando no exista un_periodo al descubierto mayor a 30 d¡as. Esta cobertura aplicar  de acuerdo a_lo arriba se¤alado. Se cubre £nicamente en territorio nacional. Los dem s_t¿rminos y condiciones, deben operar conforme se se¤ala en las Condiciones_Generales del producto contratado.   Este endoso forma parte integral y_complementa las Condiciones Generales del Seguro.""","{'endoso_id': 'endoso_82', 'endoso_master_id': '82', 'contract_no': 'FW22444L', 'subgrupo': 'FUNCIONARIOS', 'type': 'standard', 'endoso_details': {'name': 'PREEXISTENCIA', 'key': '', 'title': '', 'subtitle': '', 'description': 'Quedan cubiertas las enfermedades o accidentes preexistentes cubiertos por la presente p¢liza, a£n y cuando:  a) La sintomatolog¡a previa a dicha enfermedad no haya pasado desapercibida. b) Se hubiera establecido diagn¢stico antes del alta del Asegurado en esta p¢liza. c) Existan  gastos efectuados con anterioridad al inicio de la Cobertura. S¢lo quedaran cubiertos los gastos realizados durante la vigencia de esta p¢liza. Este endoso modifica la exclusi¢n estipulada en las Condiciones Generales del producto contratado, en el apartado V. Gastos M¿dicos Mayores No Cubiertos, inciso 1. El Asegurado deber\xa0 cumplir con un periodo de espera, a partir de su inscripci¢n en la p¢liza, de: Sin periodo de espera AXA Seguros, S.A. de C.V.: Reconocer\xa0 el tiempo que el Asegurado haya tenido esta cobertura en esta compa¤¡a u otra(s) compa¤¡a(s) de seguros; siempre y cuando no exista un periodo al descubierto mayor a 30 d¡as. Esta cobertura aplicar\xa0 de acuerdo a lo arriba se¤alado. Se cubre £nicamente en territorio nacional. Los dem\xa0s t¿rminos y condiciones, deben operar conforme se se¤ala en las Condiciones Generales del producto contratado.   Este endoso forma parte integral y complementa las Condiciones Generales del Seguro.', 'parameters': {'column_parameters': '', 'row_parameters': [{'row_parameter_name': 'suma asegurada', 'editable': True, 'active': True, 'type': 'std', 'value_type': 'digits/currency (pesos, UMAM)/ de la poliza', 'value': ''}, {'row_parameter_name': 'deducible', 'editable': True, 'active': True, 'type': 'std', 'value_type': 'digits / de la poliza', 'value': ''}, {'row_parameter_name': 'coaseguro', 'editable': True, 'active': True, 'type': 'std', 'value_type': 'digits', 'value': ''}, {'row_parameter_name': 'tope de coaseguro', 'editable': True, 'active': True, 'type': 'std', 'value_type': 'digits / sin tope', 'value': ''}, {'row_parameter_name': 'periodo espera', 'editable': True, 'active': True, 'type': 'std', 'value_type': 'digits', 'value': 'Sin periodo de espera'}, {'row_parameter_name': 'reconocimiento de antigüedad', 'editable': True, 'active': True, 'type': 'std', 'value_type': 'aplica/no aplica', 'value': 'aplica'}, {'row_parameter_name': 'requisitos', 'editable': True, 'active': True, 'type': 'std', 'value_type': 'text', 'value': ''}, {'row_parameter_name': 'gastos cubiertos', 'editable': True, 'active': True, 'type': 'std', 'value_type': 'text', 'value': 'Quedan cubiertas las enfermedades o accidentes preexistentes cubiertos por la presente póliza.'}, {'row_parameter_name': 'gastos no cubiertos', 'editable': True, 'active': True, 'type': 'std', 'value_type': 'text', 'value': ''}, {'row_parameter_name': 'aplicación de deducible y/o coaseguro', 'editable': True, 'active': True, 'type': 'std', 'value_type': 'Y/N', 'value': ''}, {'row_parameter_name': 'condiciones generales', 'editable': True, 'active': True, 'type': 'std', 'value_type': 'string', 'value': 'Los demás términos y condiciones, deben operar conforme se señala en las Condiciones Generales del producto contratado. Este endoso forma parte integral y complementa las Condiciones Generales del Seguro.'}, {'row_parameter_name': 'elegibilidad', 'editable': True, 'active': True, 'type': 'exception', 'value_type': 'titular / conyuge / hijos', 'value': ''}, {'row_parameter_name': 'territorio de cobertura', 'editable': True, 'active': True, 'type': 'exception', 'value_type': 'nacional / extranjero / inetrnacional', 'value': 'nacional'}], 'legal': 'Los demás términos y condiciones, deben operar conforme se señala en las Condiciones Generales del producto contratado. Este endoso forma parte integral y complementa las Condiciones Generales del Seguro.'}}, 'global_information': {'effective_date': '', 'expiration_date': '', 'factor': '', 'type': ''}, 'business_rules': {'experience': '', 'product_type': '', 'min_net_premium': '', 'min_population': ''}, 'status': '', 'comment': [{'name': '', 'date': '', 'comment': ''}]}","{'token_cost': 0.019620000000000002, 'image_cost': 0, 'total_cost': 0.019620000000000002}",FUNCIONARIOS,FW22444L
endoso_142,"Como litotripsia se entiende el desmenuzamiento o fragmentación de un_cálculo por medio del litotriptor.__Este endoso ampara el pago de honorarios médicos, gastos de hospitalización,_medicamentos, renta del litotriptor endoscópico o extracorpóreo y demás_gastos cubiertos generados dentro del hospital.__El monto máximo a indemnizar para este beneficio y/o cobertura será:_Hasta el G.U.A.__Pago Directo (Médico y Hospital en convenio de acuerdo al nivel hospitalario_contratado)_Deducible 1500.0 M.N._Coaseguro 10.0 %_Reembolso:_Deducible 1500.0 M.N._Coaseguro 10.0 %_En caso de modificación del deducible y/o coaseguro originalmente pactado,_invariablemente se aplicarán los deducibles y coaseguros antes mencionados_en dicha cobertura/condición.__El Asegurado deberá cumplir con un periodo de espera, a partir de su_inscripción en la póliza: Se elimina periodo de espera__Se cubre únicamente en territorio nacional.__Los demás términos y condiciones, deben operar conforme se señala en las_Condiciones Generales del producto contratado.__Este endoso forma parte integral y complementa las Condiciones Generales_del Seguro.","{'endoso_id': 'endoso_142', 'endoso_master_id': '142', 'contract_no': 'FW37758D', 'subgrupo': 'FUNCIONARIOS', 'type': 'standard', 'endoso_details': {'name': 'LITOTRIPSIAS', 'key': '', 'title': '', 'subtitle': '', 'description': 'Como litotripsia se entiende el desmenuzamiento o fragmentación de un cálculo por medio del litotriptor. Este endoso ampara el pago de honorarios médicos, gastos de hospitalización, medicamentos, renta del litotriptor endoscópico o extracorpóreo y demás gastos cubiertos generados dentro del hospital. El monto máximo a indemnizar para este beneficio y/o cobertura será: Hasta el G.U.A. Pago Directo (Médico y Hospital en convenio de acuerdo al nivel hospitalario contratado) Deducible 1500.0 M.N. Coaseguro 10.0 % Reembolso: Deducible 1500.0 M.N. Coaseguro 10.0 % En caso de modificación del deducible y/o coaseguro originalmente pactado, invariablemente se aplicarán los deducibles y coaseguros antes mencionados en dicha cobertura/condición. El Asegurado deberá cumplir con un periodo de espera, a partir de su inscripción en la póliza: Se elimina periodo de espera Se cubre únicamente en territorio nacional. Los demás términos y condiciones, deben operar conforme se señala en las Condiciones Generales del producto contratado. Este endoso forma parte integral y complementa las Condiciones Generales del Seguro.', 'parameters': {'column_parameters': [{'column_parameter_name': 'Pago directo', 'column_parameter_details': [{'sub_column_parameter_name': '', 'row_parameters': [{'row_parameter_name': 'suma asegurada', 'value': '', 'unit': '', 'type': 'std'}, {'row_parameter_name': 'deducible', 'value': '1500.0', 'unit': 'M.N.', 'type': 'std'}, {'row_parameter_name': 'coaseguro', 'value': '10.0', 'unit': '%', 'type': 'std'}, {'row_parameter_name': 'periodo espera', 'value': 'Se elimina periodo de espera', 'unit': '', 'type': 'std'}, {'row_parameter_name': 'territorio de cobertura', 'value': 'nacional', 'unit': '', 'type': 'std'}, {'row_parameter_name': 'consulta postoperatoria', 'value': '', 'unit': '', 'type': 'std'}, {'row_parameter_name': 'consulta preoperatoria', 'value': '', 'unit': '', 'type': 'std'}, {'row_parameter_name': 'aplicación de deducible y/o coaseguro', 'value': 'true', 'unit': '', 'type': 'std'}, {'row_parameter_name': 'condiciones generales', 'value': 'Los demás términos y condiciones, deben operar conforme se señala en las Condiciones Generales del producto contratado. Este endoso forma parte integral y complementa las Condiciones Generales del Seguro.', 'unit': '', 'type': 'std'}, {'row_parameter_name': 'elegibilidad', 'value': '', 'unit': '', 'type': 'exception'}, {'row_parameter_name': 'tope de coaseguro', 'value': '', 'unit': '', 'type': 'exception'}, {'row_parameter_name': 'número de sesiones', 'value': '', 'unit': '', 'type': 'exception'}]}]}, {'column_parameter_name': 'Reembolso', 'column_parameter_details': [{'sub_column_parameter_name': '', 'row_parameters': [{'row_parameter_name': 'suma asegurada', 'value': '', 'unit': '', 'type': 'std'}, {'row_parameter_name': 'deducible', 'value': '1500.0', 'unit': 'M.N.', 'type': 'std'}, {'row_parameter_name': 'coaseguro', 'value': '10.0', 'unit': '%', 'type': 'std'}, {'row_parameter_name': 'periodo espera', 'value': 'Se elimina periodo de espera', 'unit': '', 'type': 'std'}, {'row_parameter_name': 'territorio de cobertura', 'value': 'nacional', 'unit': '', 'type': 'std'}, {'row_parameter_name': 'consulta postoperatoria', 'value': '', 'unit': '', 'type': 'std'}, {'row_parameter_name': 'consulta preoperatoria', 'value': '', 'unit': '', 'type': 'std'}, {'row_parameter_name': 'aplicación de deducible y/o coaseguro', 'value': 'true', 'unit': '', 'type': 'std'}, {'row_parameter_name': 'condiciones generales', 'value': 'Los demás términos y condiciones, deben operar conforme se señala en las Condiciones Generales del producto contratado. Este endoso forma parte integral y complementa las Condiciones Generales del Seguro.', 'unit': '', 'type': 'std'}, {'row_parameter_name': 'elegibilidad', 'value': '', 'unit': '', 'type': 'exception'}, {'row_parameter_name': 'tope de coaseguro', 'value': '', 'unit': '', 'type': 'exception'}, {'row_parameter_name': 'número de sesiones', 'value': '', 'unit': '', 'type': 'exception'}]}]}]}, 'legal': 'Los demás términos y condiciones, deben operar conforme se señala en las Condiciones Generales del producto contratado. Este endoso forma parte integral y complementa las Condiciones Generales del Seguro.'}, 'global_information': {'effective_date': '', 'expiration_date': '', 'factor': '', 'type': ''}, 'business_rules': {'experience': '', 'product_type': '', 'min_net_premium': '', 'min_population': ''}, 'status': '', 'comment': [{'name': '', 'date': '', 'comment': ''}]}","{'token_cost': 0.0232425, 'image_cost': 0, 'total_cost': 0.0232425}",FUNCIONARIOS,FW37758D
endoso_142,"Como litotripsia se entiende el desmenuzamiento o fragmentación de un______ cálculo por medio del litotriptor.______Este endoso ampara el pago de honorarios médicos, gastos de______ hospitalización, medicamentos, renta del litotriptor endoscópico o______ extracorpóreo y demás gastos cubiertos generados dentro del hospital.______El monto máximo a indemnizar para este beneficio y/o cobertura será:______Hasta el G.U.A.______Monto Máximo a Indemnizar -______Pago Directo (Médico y Hospital en convenio de acuerdo al nivel______ hospitalario contratado)______Deducible                0.00   S.M.G.M.______Coaseguro                0.00   %______Reembolso:______Deducible                2,500.00   MN______Coaseguro                10.00   %______En caso de modificación del deducible y/o coaseguro originalmente pactado,_______ invariablemente se aplicarán los deducibles y coaseguros antes______ mencionados en dicha cobertura/condición.______El Asegurado deberá cumplir con un periodo de espera, a partir de su______ inscripción en la póliza:______Se elimina periodo de espera______Se cubre únicamente en territorio nacional.______Los demás términos y condiciones, deben operar conforme se señala en las______ Condiciones Generales del producto contratado.______Este endoso forma parte integral y complementa las Condiciones Generales______ del Seguro_____","{'endoso_id': 'endoso_142', 'endoso_master_id': '142', 'contract_no': 'FW42091C', 'subgrupo': 'DIRECTORES', 'type': 'standard', 'endoso_details': {'name': 'LITOTRIPSIAS', 'key': '', 'title': '', 'subtitle': '', 'description': 'Como litotripsia se entiende el desmenuzamiento o fragmentación de un cálculo por medio del litotriptor. Este endoso ampara el pago de honorarios médicos, gastos de hospitalización, medicamentos, renta del litotriptor endoscópico o extracorpóreo y demás gastos cubiertos generados dentro del hospital. El monto máximo a indemnizar para este beneficio y/o cobertura será: Hasta el G.U.A. Monto Máximo a Indemnizar - Pago Directo (Médico y Hospital en convenio de acuerdo al nivel hospitalario contratado) Deducible 0.00 S.M.G.M. Coaseguro 0.00 % Reembolso: Deducible 2,500.00 MN Coaseguro 10.00 % En caso de modificación del deducible y/o coaseguro originalmente pactado, invariablemente se aplicarán los deducibles y coaseguros antes mencionados en dicha cobertura/condición. El Asegurado deberá cumplir con un periodo de espera, a partir de su inscripción en la póliza: Se elimina periodo de espera Se cubre únicamente en territorio nacional. Los demás términos y condiciones, deben operar conforme se señala en las Condiciones Generales del producto contratado. Este endoso forma parte integral y complementa las Condiciones Generales del Seguro', 'parameters': {'column_parameters': [{'column_parameter_name': 'Pago directo', 'column_parameter_details': [{'sub_column_parameter_name': '', 'row_parameters': [{'row_parameter_name': 'suma asegurada', 'value': '', 'unit': '', 'type': 'std'}, {'row_parameter_name': 'deducible', 'value': '0.00', 'unit': 'S.M.G.M.', 'type': 'std'}, {'row_parameter_name': 'coaseguro', 'value': '0.00', 'unit': '%', 'type': 'std'}, {'row_parameter_name': 'periodo espera', 'value': 'Se elimina periodo de espera', 'unit': '', 'type': 'std'}, {'row_parameter_name': 'territorio de cobertura', 'value': 'nacional', 'unit': '', 'type': 'std'}, {'row_parameter_name': 'consulta postoperatoria', 'value': '', 'unit': '', 'type': 'std'}, {'row_parameter_name': 'consulta preoperatoria', 'value': '', 'unit': '', 'type': 'std'}, {'row_parameter_name': 'aplicación de deducible y/o coaseguro', 'value': '', 'unit': '', 'type': 'std'}, {'row_parameter_name': 'condiciones generales', 'value': 'Los demás términos y condiciones, deben operar conforme se señala en las Condiciones Generales del producto contratado. Este endoso forma parte integral y complementa las Condiciones Generales del Seguro', 'unit': '', 'type': 'std'}, {'row_parameter_name': 'elegibilidad', 'value': '', 'unit': '', 'type': 'exception'}, {'row_parameter_name': 'tope de coaseguro', 'value': '', 'unit': '', 'type': 'exception'}, {'row_parameter_name': 'número de sesiones', 'value': '', 'unit': '', 'type': 'exception'}]}]}, {'column_parameter_name': 'Reembolso', 'column_parameter_details': [{'sub_column_parameter_name': '', 'row_parameters': [{'row_parameter_name': 'suma asegurada', 'value': '', 'unit': '', 'type': 'std'}, {'row_parameter_name': 'deducible', 'value': '2,500.00', 'unit': 'MN', 'type': 'std'}, {'row_parameter_name': 'coaseguro', 'value': '10.00', 'unit': '%', 'type': 'std'}, {'row_parameter_name': 'periodo espera', 'value': 'Se elimina periodo de espera', 'unit': '', 'type': 'std'}, {'row_parameter_name': 'territorio de cobertura', 'value': 'nacional', 'unit': '', 'type': 'std'}, {'row_parameter_name': 'consulta postoperatoria', 'value': '', 'unit': '', 'type': 'std'}, {'row_parameter_name': 'consulta preoperatoria', 'value': '', 'unit': '', 'type': 'std'}, {'row_parameter_name': 'aplicación de deducible y/o coaseguro', 'value': '', 'unit': '', 'type': 'std'}, {'row_parameter_name': 'condiciones generales', 'value': 'Los demás términos y condiciones, deben operar conforme se señala en las Condiciones Generales del producto contratado. Este endoso forma parte integral y complementa las Condiciones Generales del Seguro', 'unit': '', 'type': 'std'}, {'row_parameter_name': 'elegibilidad', 'value': '', 'unit': '', 'type': 'exception'}, {'row_parameter_name': 'tope de coaseguro', 'value': '', 'unit': '', 'type': 'exception'}, {'row_parameter_name': 'número de sesiones', 'value': '', 'unit': '', 'type': 'exception'}]}]}]}, 'legal': 'Los demás términos y condiciones, deben operar conforme se señala en las Condiciones Generales del producto contratado. Este endoso forma parte integral y complementa las Condiciones Generales del Seguro'}, 'global_information': {'effective_date': '', 'expiration_date': '', 'factor': '', 'type': ''}, 'business_rules': {'experience': '', 'product_type': '', 'min_net_premium': '', 'min_population': ''}, 'status': '', 'comment': [{'name': '', 'date': '', 'comment': ''}]}","{'token_cost': 0.023365, 'image_cost': 0, 'total_cost': 0.023365}",DIRECTORES,FW42091C
