endoso_code,text,extracted_parameters,cost_metrics,nom_subg,contract_no
endoso_142,"Como litotripsia se entiende el desmenuzamiento o fragmentación de un_ cálculo por medio del litotriptor.__Este endoso ampara el pago de honorarios médicos, gastos de_ hospitalización, medicamentos, renta del litotriptor endoscópico o_ extracorpóreo y demás gastos cubiertos generados dentro del hospital.__El monto máximo a indemnizar para este beneficio y/o cobertura será:  _De acuerdo a las condiciones generales (26 veces el S.M.G.M)__Monto Máximo a Indemnizar . __Pago Directo (Médico y Hospital en convenio de acuerdo al nivel_ hospitalario contratado)__Deducible           10,500.00   M.N. __Coaseguro               10.00   % __Reembolso:__Deducible           10,500.00   M.N. __Coaseguro               10.00   % __En caso de modificación del deducible y/o coaseguro originalmente pactado,_ invariablemente se aplicarán los deducibles y coaseguros antes_ mencionados en dicha cobertura/condición.__El Asegurado deberá cumplir con un periodo de espera, a partir de su_ inscripción en la póliza: _De acuerdo a condiciones (1 año)__Se cubre únicamente en territorio nacional.__Los demás términos y condiciones, deben operar conforme se señala en las_ Condiciones Generales del producto contratado.__Este endoso forma parte integral y complementa las Condiciones Generales_ del Seguro_","{'endoso_id': 'endoso_142', 'endoso_master_id': '142', 'contract_no': 'FW48011B', 'subgrupo': 'GENERAL', 'type': 'standard', 'endoso_details': {'name': 'LITOTRIPSIAS', 'key': '', 'title': '', 'subtitle': '', 'description': 'Como litotripsia se entiende el desmenuzamiento o fragmentación de un cálculo por medio del litotriptor. Este endoso ampara el pago de honorarios médicos, gastos de hospitalización, medicamentos, renta del litotriptor endoscópico o extracorpóreo y demás gastos cubiertos generados dentro del hospital. El monto máximo a indemnizar para este beneficio y/o cobertura será: De acuerdo a las condiciones generales (26 veces el S.M.G.M) Monto Máximo a Indemnizar . Pago Directo (Médico y Hospital en convenio de acuerdo al nivel hospitalario contratado) Deducible 10,500.00 M.N. Coaseguro 10.00 % Reembolso: Deducible 10,500.00 M.N. Coaseguro 10.00 % En caso de modificación del deducible y/o coaseguro originalmente pactado, invariablemente se aplicarán los deducibles y coaseguros antes mencionados en dicha cobertura/condición. El Asegurado deberá cumplir con un periodo de espera, a partir de su inscripción en la póliza: De acuerdo a condiciones (1 año) Se cubre únicamente en territorio nacional. Los demás términos y condiciones, deben operar conforme se señala en las Condiciones Generales del producto contratado. Este endoso forma parte integral y complementa las Condiciones Generales del Seguro', 'parameters': {'column_parameters': [{'column_parameter_name': 'Pago directo', 'column_parameter_details': [{'sub_column_parameter_name': '', 'row_parameters': [{'row_parameter_name': 'suma asegurada', 'value': '', 'unit': '', 'type': 'std'}, {'row_parameter_name': 'deducible', 'value': '10,500.00', 'unit': 'M.N.', 'type': 'std'}, {'row_parameter_name': 'coaseguro', 'value': '10.00', 'unit': '%', 'type': 'std'}, {'row_parameter_name': 'periodo espera', 'value': '1', 'unit': 'año', 'type': 'std'}, {'row_parameter_name': 'territorio de cobertura', 'value': 'nacional', 'type': 'std'}, {'row_parameter_name': 'consulta postoperatoria', 'value': '', 'type': 'std'}, {'row_parameter_name': 'consulta preoperatoria', 'value': '', 'type': 'std'}, {'row_parameter_name': 'aplicación de deducible y/o coaseguro', 'value': 'true', 'type': 'std'}, {'row_parameter_name': 'condiciones generales', 'value': 'Los demás términos y condiciones, deben operar conforme se señala en las Condiciones Generales del producto contratado. Este endoso forma parte integral y complementa las Condiciones Generales del Seguro.', 'type': 'std'}, {'row_parameter_name': 'elegibilidad', 'value': '', 'type': 'exception'}, {'row_parameter_name': 'tope de coaseguro', 'value': '', 'type': 'exception'}, {'row_parameter_name': 'número de sesiones', 'value': '', 'type': 'exception'}]}]}, {'column_parameter_name': 'Reembolso', 'column_parameter_details': [{'sub_column_parameter_name': '', 'row_parameters': [{'row_parameter_name': 'suma asegurada', 'value': '', 'unit': '', 'type': 'std'}, {'row_parameter_name': 'deducible', 'value': '10,500.00', 'unit': 'M.N.', 'type': 'std'}, {'row_parameter_name': 'coaseguro', 'value': '10.00', 'unit': '%', 'type': 'std'}, {'row_parameter_name': 'periodo espera', 'value': '1', 'unit': 'año', 'type': 'std'}, {'row_parameter_name': 'territorio de cobertura', 'value': 'nacional', 'type': 'std'}, {'row_parameter_name': 'consulta postoperatoria', 'value': '', 'type': 'std'}, {'row_parameter_name': 'consulta preoperatoria', 'value': '', 'type': 'std'}, {'row_parameter_name': 'aplicación de deducible y/o coaseguro', 'value': 'true', 'type': 'std'}, {'row_parameter_name': 'condiciones generales', 'value': 'Los demás términos y condiciones, deben operar conforme se señala en las Condiciones Generales del producto contratado. Este endoso forma parte integral y complementa las Condiciones Generales del Seguro.', 'type': 'std'}, {'row_parameter_name': 'elegibilidad', 'value': '', 'type': 'exception'}, {'row_parameter_name': 'tope de coaseguro', 'value': '', 'type': 'exception'}, {'row_parameter_name': 'número de sesiones', 'value': '', 'type': 'exception'}]}]}]}, 'legal': 'Los demás términos y condiciones, deben operar conforme se señala en las Condiciones Generales del producto contratado. Este endoso forma parte integral y complementa las Condiciones Generales del Seguro.'}, 'global_information': {'effective_date': '', 'expiration_date': '', 'factor': '', 'type': ''}, 'business_rules': {'experience': '', 'product_type': '', 'min_net_premium': '', 'min_population': ''}, 'status': '', 'comment': [{'name': '', 'date': '', 'comment': ''}]}","{'token_cost': 0.022735000000000002, 'image_cost': 0, 'total_cost': 0.022735000000000002}",GENERAL,FW48011B
endoso_38,"HALLUX VALGUS__La Compañía cubrirá los gastos médicos erogados durante la vigencia de esta_Póliza, para corregir hallux valgus o juanetes siempre_y cuando no sea de carácter estético, hasta los limites de responsabilidad_que se establecen en este endoso._Suma Asegurada: De la póliza_Para este Endoso si es aplicable el Endoso de Aplicación de Deducible y/o_Coaseguro._Para los demás términos y condiciones, aplicarán las Condiciones Generales_vigentes del producto contratado._Este Endoso forma parte del Contrato de Seguro.","{'endoso_id': 'endoso_38', 'endoso_master_id': '38', 'contract_no': 'FW81646C', 'subgrupo': 'GENERAL', 'type': 'standard', 'endoso_details': {'name': 'HALLUX VALGUS', 'key': '', 'title': '', 'subtitle': '', 'description': 'La Compañía cubrirá los gastos médicos erogados durante la vigencia de esta Póliza, para corregir hallux valgus o juanetes siempre y cuando no sea de carácter estético, hasta los limites de responsabilidad que se establecen en este endoso. Suma Asegurada: De la póliza Para este Endoso si es aplicable el Endoso de Aplicación de Deducible y/o Coaseguro. Para los demás términos y condiciones, aplicarán las Condiciones Generales vigentes del producto contratado. Este Endoso forma parte del Contrato de Seguro.', 'parameters': {'column_parameters': [{'column_parameter_name': 'Pago directo', 'column_parameter_details': [{'sub_column_parameter_name': '', 'row_parameters': [{'row_parameter_name': 'suma asegurada', 'value': 'De la póliza', 'unit': '', 'type': 'std'}, {'row_parameter_name': 'deducible', 'value': '', 'unit': '', 'type': 'std'}, {'row_parameter_name': 'coaseguro', 'value': '', 'unit': '', 'type': 'std'}, {'row_parameter_name': 'tope de coaseguro', 'value': '', 'unit': '', 'type': 'std'}, {'row_parameter_name': 'territorio de cobertura', 'value': '', 'unit': '', 'type': 'std'}, {'row_parameter_name': 'periodo espera', 'value': '', 'unit': '', 'type': 'std'}, {'row_parameter_name': 'gastos cubiertos', 'value': '', 'unit': '', 'type': 'std'}, {'row_parameter_name': 'gastos no cubiertos', 'value': '', 'unit': '', 'type': 'std'}, {'row_parameter_name': 'aplicación de deducible y/o coaseguro', 'value': 'true', 'type': 'std'}, {'row_parameter_name': 'condiciones generales', 'value': 'Para los demás términos y condiciones, aplicarán las Condiciones Generales vigentes del producto contratado. Este Endoso forma parte del Contrato de Seguro.', 'type': 'std'}, {'row_parameter_name': 'consulta postoperatoria', 'value': '', 'type': 'exception'}, {'row_parameter_name': 'consulta preoperatoria', 'value': '', 'type': 'exception'}]}]}, {'column_parameter_name': 'Reembolso', 'column_parameter_details': [{'sub_column_parameter_name': '', 'row_parameters': [{'row_parameter_name': 'suma asegurada', 'value': 'De la póliza', 'unit': '', 'type': 'std'}, {'row_parameter_name': 'deducible', 'value': '', 'unit': '', 'type': 'std'}, {'row_parameter_name': 'coaseguro', 'value': '', 'unit': '', 'type': 'std'}, {'row_parameter_name': 'tope de coaseguro', 'value': '', 'unit': '', 'type': 'std'}, {'row_parameter_name': 'territorio de cobertura', 'value': '', 'unit': '', 'type': 'std'}, {'row_parameter_name': 'periodo espera', 'value': '', 'unit': '', 'type': 'std'}, {'row_parameter_name': 'gastos cubiertos', 'value': '', 'unit': '', 'type': 'std'}, {'row_parameter_name': 'gastos no cubiertos', 'value': '', 'unit': '', 'type': 'std'}, {'row_parameter_name': 'aplicación de deducible y/o coaseguro', 'value': 'true', 'type': 'std'}, {'row_parameter_name': 'condiciones generales', 'value': 'Para los demás términos y condiciones, aplicarán las Condiciones Generales vigentes del producto contratado. Este Endoso forma parte del Contrato de Seguro.', 'type': 'std'}, {'row_parameter_name': 'consulta postoperatoria', 'value': '', 'type': 'exception'}, {'row_parameter_name': 'consulta preoperatoria', 'value': '', 'type': 'exception'}]}]}]}, 'legal': 'Para los demás términos y condiciones, aplicarán las Condiciones Generales vigentes del producto contratado. Este Endoso forma parte del Contrato de Seguro.'}, 'global_information': {'effective_date': '', 'expiration_date': '', 'factor': '', 'type': ''}, 'business_rules': {'experience': '', 'product_type': '', 'min_net_premium': '', 'min_population': ''}, 'status': '', 'comment': [{'name': '', 'date': '', 'comment': ''}]}","{'token_cost': 0.02042, 'image_cost': 0, 'total_cost': 0.02042}",GENERAL,FW81646C
endoso_142,"Se cubre hasta 26 S.M.G.M. con periodo de espera de un año de antigüedad_en pólizas de seguros en Grupo NIDEC.__Para  eliminar el periodo de espera,  se reconocerá la antigüedad de los_asegurados de acuerdo a lo señalado en el endoso de Reconocimiento de_Antigüedad.__Los demás términos y condiciones de la póliza no sufren alteración alguna.___","{'endoso_id': 'endoso_142', 'endoso_master_id': '142', 'contract_no': 'FD09908S', 'subgrupo': 'USEM DE MEXICO', 'type': 'standard', 'endoso_details': {'name': 'LITOTRIPSIAS', 'key': '', 'title': '', 'subtitle': '', 'description': 'Se cubre hasta 26 S.M.G.M. con periodo de espera de un año de antigüedad en pólizas de seguros en Grupo NIDEC. Para eliminar el periodo de espera, se reconocerá la antigüedad de los asegurados de acuerdo a lo señalado en el endoso de Reconocimiento de Antigüedad. Los demás términos y condiciones de la póliza no sufren alteración alguna.', 'parameters': {'column_parameters': [{'column_parameter_name': 'Pago directo', 'column_parameter_details': [{'sub_column_parameter_name': '', 'row_parameters': [{'row_parameter_name': 'suma asegurada', 'value': '', 'unit': '', 'type': 'std'}, {'row_parameter_name': 'deducible', 'value': '', 'unit': '', 'type': 'std'}, {'row_parameter_name': 'coaseguro', 'value': '', 'unit': '', 'type': 'std'}, {'row_parameter_name': 'periodo espera', 'value': '1', 'unit': 'año', 'type': 'std'}, {'row_parameter_name': 'territorio de cobertura', 'value': '', 'unit': '', 'type': 'std'}, {'row_parameter_name': 'consulta postoperatoria', 'value': '', 'type': 'std'}, {'row_parameter_name': 'consulta preoperatoria', 'value': '', 'type': 'std'}, {'row_parameter_name': 'aplicación de deducible y/o coaseguro', 'value': '', 'type': 'std'}, {'row_parameter_name': 'condiciones generales', 'value': 'Los demás términos y condiciones de la póliza no sufren alteración alguna.', 'type': 'std'}, {'row_parameter_name': 'elegibilidad', 'value': '', 'type': 'exception'}, {'row_parameter_name': 'tope de coaseguro', 'value': '', 'type': 'exception'}, {'row_parameter_name': 'número de sesiones', 'value': '', 'type': 'exception'}]}]}, {'column_parameter_name': 'Reembolso', 'column_parameter_details': [{'sub_column_parameter_name': '', 'row_parameters': [{'row_parameter_name': 'suma asegurada', 'value': '', 'unit': '', 'type': 'std'}, {'row_parameter_name': 'deducible', 'value': '', 'unit': '', 'type': 'std'}, {'row_parameter_name': 'coaseguro', 'value': '', 'unit': '', 'type': 'std'}, {'row_parameter_name': 'periodo espera', 'value': '1', 'unit': 'año', 'type': 'std'}, {'row_parameter_name': 'territorio de cobertura', 'value': '', 'unit': '', 'type': 'std'}, {'row_parameter_name': 'consulta postoperatoria', 'value': '', 'type': 'std'}, {'row_parameter_name': 'consulta preoperatoria', 'value': '', 'type': 'std'}, {'row_parameter_name': 'aplicación de deducible y/o coaseguro', 'value': '', 'type': 'std'}, {'row_parameter_name': 'condiciones generales', 'value': 'Los demás términos y condiciones de la póliza no sufren alteración alguna.', 'type': 'std'}, {'row_parameter_name': 'elegibilidad', 'value': '', 'type': 'exception'}, {'row_parameter_name': 'tope de coaseguro', 'value': '', 'type': 'exception'}, {'row_parameter_name': 'número de sesiones', 'value': '', 'type': 'exception'}]}]}]}, 'legal': 'Los demás términos y condiciones de la póliza no sufren alteración alguna.'}, 'global_information': {'effective_date': '', 'expiration_date': '', 'factor': '', 'type': ''}, 'business_rules': {'experience': '', 'product_type': '', 'min_net_premium': '', 'min_population': ''}, 'status': '', 'comment': [{'name': '', 'date': '', 'comment': ''}]}","{'token_cost': 0.019245, 'image_cost': 0, 'total_cost': 0.019245}",USEM DE MEXICO,FD09908S
endoso_82,"PREEXISTENCIA___Este Endo La Compañía cubrirá los gastos médicos erogados durante la vigencia_de esta Póliza, por tratamientos y/o procedimientos derivados de Padecimiento_Preexistentes anteriores a la fecha de antigüedad reconocida por el_contratante, en esta Póliza. Hasta los límites de responsabilidad que se_establecen en este Endoso._________________________________________Periodo de espera:_________24 meses_ __________Se cubre en territorio:_________Nacional___________""Para los demás términos y condiciones, aplicarán las Condiciones Generales_vigentes del producto contratado.__Este Endoso forma parte del Contrato de Seguro","{'endoso_id': 'endoso_82', 'endoso_master_id': '82', 'contract_no': 'FW71026D', 'subgrupo': 'SUPERIOR', 'type': 'standard', 'endoso_details': {'name': 'PREEXISTENCIA', 'key': '', 'title': '', 'subtitle': '', 'description': 'Este Endo La Compañía cubrirá los gastos médicos erogados durante la vigencia de esta Póliza, por tratamientos y/o procedimientos derivados de Padecimiento Preexistentes anteriores a la fecha de antigüedad reconocida por el contratante, en esta Póliza. Hasta los límites de responsabilidad que se establecen en este Endoso. Periodo de espera: 24 meses Se cubre en territorio: Nacional Para los demás términos y condiciones, aplicarán las Condiciones Generales vigentes del producto contratado. Este Endoso forma parte del Contrato de Seguro', 'parameters': {'column_parameters': '', 'row_parameters': [{'row_parameter_name': 'suma asegurada', 'value': '', 'unit': '', 'type': 'std'}, {'row_parameter_name': 'deducible', 'value': '', 'unit': '', 'type': 'std'}, {'row_parameter_name': 'coaseguro', 'value': '', 'unit': '', 'type': 'std'}, {'row_parameter_name': 'tope de coaseguro', 'value': '', 'unit': '', 'type': 'std'}, {'row_parameter_name': 'periodo espera', 'value': '24', 'unit': 'meses', 'type': 'std'}, {'row_parameter_name': 'reconocimiento de antigüedad', 'value': '', 'type': 'std'}, {'row_parameter_name': 'requisitos', 'value': '', 'type': 'std'}, {'row_parameter_name': 'gastos cubiertos', 'value': '', 'type': 'std'}, {'row_parameter_name': 'gastos no cubiertos', 'value': '', 'type': 'std'}, {'row_parameter_name': 'aplicación de deducible y/o coaseguro', 'value': '', 'type': 'std'}, {'row_parameter_name': 'condiciones generales', 'value': 'Para los demás términos y condiciones, aplicarán las Condiciones Generales vigentes del producto contratado. Este Endoso forma parte del Contrato de Seguro', 'type': 'std'}, {'row_parameter_name': 'elegibilidad', 'value': '', 'type': 'exception'}, {'row_parameter_name': 'territorio de cobertura', 'value': 'Nacional', 'type': 'exception'}]}, 'legal': 'Para los demás términos y condiciones, aplicarán las Condiciones Generales vigentes del producto contratado. Este Endoso forma parte del Contrato de Seguro'}, 'global_information': {'effective_date': '', 'expiration_date': '', 'factor': '', 'type': ''}, 'business_rules': {'experience': '', 'product_type': '', 'min_net_premium': '', 'min_population': ''}, 'status': '', 'comment': [{'name': '', 'date': '', 'comment': ''}]}","{'token_cost': 0.013932500000000002, 'image_cost': 0, 'total_cost': 0.013932500000000002}",SUPERIOR,FW71026D
endoso_82,"Quedan cubiertas las enfermedades o accidentes preexistentes cubiertos por_la presente póliza, aún y cuando:_a) La sintomatología previa a dicha enfermedad no haya pasado desapercibida._b) Se hubiera establecido diagnóstico antes del alta del Asegurado en esta_póliza._c) Existan  gastos efectuados con anterioridad al inicio de la Cobertura._Sólo quedaran cubiertos los gastos realizados durante la vigencia de esta_póliza._Este endoso modifica la exclusión estipulada en las Condiciones Generales_del producto contratado, en el apartado V. Gastos Médicos Mayores No_Cubiertos, inciso 1._El Asegurado deberá cumplir con un periodo de espera, a partir de su_inscripción en la póliza, de:    2 Años._AXA Seguros, S.A. de C.V.:_Reconocerá el tiempo que el Asegurado haya tenido esta cobertura en esta_compañía u otra(s) compañía(s) de seguros; siempre y cuando no exista un_periodo al descubierto mayor a 30 días._Esta cobertura aplicará de acuerdo a lo arriba señalado._Se cubre únicamente en territorio nacional._Los demás términos y condiciones, deben operar conforme se señala en las_Condiciones Generales del producto contratado.__Este endoso forma parte integral y complementa las Condiciones Generales_del Seguro.__","{'endoso_id': 'endoso_82', 'endoso_master_id': '82', 'contract_no': 'FW16389T', 'subgrupo': 'GENERAL', 'type': 'standard', 'endoso_details': {'name': 'PREEXISTENCIA', 'key': '', 'title': '', 'subtitle': '', 'description': 'Quedan cubiertas las enfermedades o accidentes preexistentes cubiertos por la presente póliza, aún y cuando: a) La sintomatología previa a dicha enfermedad no haya pasado desapercibida. b) Se hubiera establecido diagnóstico antes del alta del Asegurado en esta póliza. c) Existan  gastos efectuados con anterioridad al inicio de la Cobertura. Sólo quedaran cubiertos los gastos realizados durante la vigencia de esta póliza. Este endoso modifica la exclusión estipulada en las Condiciones Generales del producto contratado, en el apartado V. Gastos Médicos Mayores No Cubiertos, inciso 1. El Asegurado deberá cumplir con un periodo de espera, a partir de su inscripción en la póliza, de: 2 Años. AXA Seguros, S.A. de C.V.: Reconocerá el tiempo que el Asegurado haya tenido esta cobertura en esta compañía u otra(s) compañía(s) de seguros; siempre y cuando no exista un periodo al descubierto mayor a 30 días. Esta cobertura aplicará de acuerdo a lo arriba señalado. Se cubre únicamente en territorio nacional. Los demás términos y condiciones, deben operar conforme se señala en las Condiciones Generales del producto contratado. Este endoso forma parte integral y complementa las Condiciones Generales del Seguro.', 'parameters': {'column_parameters': [{'column_parameter_name': '', 'column_parameter_details': [{'sub_column_parameter_name': '', 'row_parameters': [{'row_parameter_name': 'suma asegurada', 'value': '', 'unit': '', 'type': 'std'}, {'row_parameter_name': 'deducible', 'value': '', 'unit': '', 'type': 'std'}, {'row_parameter_name': 'coaseguro', 'value': '', 'unit': '', 'type': 'std'}, {'row_parameter_name': 'tope de coaseguro', 'value': '', 'unit': '', 'type': 'std'}, {'row_parameter_name': 'periodo espera', 'value': '2', 'unit': 'Años', 'type': 'std'}, {'row_parameter_name': 'reconocimiento de antigüedad', 'value': 'aplica', 'type': 'std'}, {'row_parameter_name': 'requisitos', 'value': '', 'type': 'std'}, {'row_parameter_name': 'gastos cubiertos', 'value': '', 'type': 'std'}, {'row_parameter_name': 'gastos no cubiertos', 'value': '', 'type': 'std'}, {'row_parameter_name': 'aplicación de deducible y/o coaseguro', 'value': '', 'type': 'std'}, {'row_parameter_name': 'condiciones generales', 'value': 'Los demás términos y condiciones, deben operar conforme se señala en las Condiciones Generales del producto contratado. Este endoso forma parte integral y complementa las Condiciones Generales del Seguro.', 'type': 'std'}, {'row_parameter_name': 'elegibilidad', 'value': '', 'type': 'exception'}, {'row_parameter_name': 'territorio de cobertura', 'value': 'nacional', 'type': 'exception'}]}]}]}, 'legal': 'Los demás términos y condiciones, deben operar conforme se señala en las Condiciones Generales del producto contratado. Este endoso forma parte integral y complementa las Condiciones Generales del Seguro.'}, 'global_information': {'effective_date': '', 'expiration_date': '', 'factor': '', 'type': ''}, 'business_rules': {'experience': '', 'product_type': '', 'min_net_premium': '', 'min_population': ''}, 'status': '', 'comment': [{'name': '', 'date': '', 'comment': ''}]}","{'token_cost': 0.0163375, 'image_cost': 0, 'total_cost': 0.0163375}",GENERAL,FW16389T
