endoso_code,text,extracted_parameters,cost_metrics,nom_subg,contract_no
endoso_142,"Los tratamientos por desmenuzamiento o fragmentación de un cálculo, conocido_como litotripsias, estarán cubiertos hasta la suma asegurada de la póliza._La presente cobertura no presenta periodo de espera.__Los demás términos y condiciones del contrato no sufren modificación alguna.____","{'endoso_id': 'endoso_142', 'endoso_master_id': '142', 'contract_no': 'FD13512L', 'subgrupo': 'CORPORA', 'type': 'standard', 'endoso_details': {'name': 'LITOTRIPSIAS', 'key': '', 'title': '', 'subtitle': '', 'description': 'Los tratamientos por desmenuzamiento o fragmentación de un cálculo, conocido como litotripsias, estarán cubiertos hasta la suma asegurada de la póliza. La presente cobertura no presenta periodo de espera. Los demás términos y condiciones del contrato no sufren modificación alguna.', 'parameters': {'column_parameters': [{'column_parameter_name': 'Pago directo', 'column_parameter_details': [{'sub_column_parameter_name': '', 'row_parameters': [{'row_parameter_name': 'suma asegurada', 'value': '', 'unit': '', 'type': 'std'}, {'row_parameter_name': 'deducible', 'value': '', 'unit': '', 'type': 'std'}, {'row_parameter_name': 'coaseguro', 'value': '', 'unit': '', 'type': 'std'}, {'row_parameter_name': 'periodo espera', 'value': '0', 'unit': '', 'type': 'std'}, {'row_parameter_name': 'territorio de cobertura', 'value': '', 'unit': '', 'type': 'std'}, {'row_parameter_name': 'consulta postoperatoria', 'value': '', 'type': 'std'}, {'row_parameter_name': 'consulta preoperatoria', 'value': '', 'type': 'std'}, {'row_parameter_name': 'aplicación de deducible y/o coaseguro', 'value': '', 'type': 'std'}, {'row_parameter_name': 'condiciones generales', 'value': 'Los demás términos y condiciones del contrato no sufren modificación alguna.', 'type': 'std'}, {'row_parameter_name': 'elegibilidad', 'value': '', 'type': 'exception'}, {'row_parameter_name': 'tope de coaseguro', 'value': '', 'type': 'exception'}, {'row_parameter_name': 'número de sesiones', 'value': '', 'type': 'exception'}]}]}, {'column_parameter_name': 'Reembolso', 'column_parameter_details': [{'sub_column_parameter_name': '', 'row_parameters': [{'row_parameter_name': 'suma asegurada', 'value': '', 'unit': '', 'type': 'std'}, {'row_parameter_name': 'deducible', 'value': '', 'unit': '', 'type': 'std'}, {'row_parameter_name': 'coaseguro', 'value': '', 'unit': '', 'type': 'std'}, {'row_parameter_name': 'periodo espera', 'value': '0', 'unit': '', 'type': 'std'}, {'row_parameter_name': 'territorio de cobertura', 'value': '', 'unit': '', 'type': 'std'}, {'row_parameter_name': 'consulta postoperatoria', 'value': '', 'type': 'std'}, {'row_parameter_name': 'consulta preoperatoria', 'value': '', 'type': 'std'}, {'row_parameter_name': 'aplicación de deducible y/o coaseguro', 'value': '', 'type': 'std'}, {'row_parameter_name': 'condiciones generales', 'value': 'Los demás términos y condiciones del contrato no sufren modificación alguna.', 'type': 'std'}, {'row_parameter_name': 'elegibilidad', 'value': '', 'type': 'exception'}, {'row_parameter_name': 'tope de coaseguro', 'value': '', 'type': 'exception'}, {'row_parameter_name': 'número de sesiones', 'value': '', 'type': 'exception'}]}]}]}, 'legal': 'Los demás términos y condiciones del contrato no sufren modificación alguna.'}, 'global_information': {'effective_date': '', 'expiration_date': '', 'factor': '', 'type': ''}, 'business_rules': {'experience': '', 'product_type': '', 'min_net_premium': '', 'min_population': ''}, 'status': '', 'comment': [{'name': '', 'date': '', 'comment': ''}]}","{'token_cost': 0.018687500000000003, 'image_cost': 0, 'total_cost': 0.018687500000000003}",CORPORA,FD13512L
endoso_38,"HALLUX VALGUS_______Se cubre con suma asegurada de $40,000 mn, aplica deducible y coaseguro de________poliza y periodo de espera de un año._______Para este endoso no es aplicable el Endoso de Aplicacion de Deducible y/o_Coaseguro_____________","{'endoso_id': 'endoso_38', 'endoso_master_id': '38', 'contract_no': 'FW16600T', 'subgrupo': 'DEPENDI', 'type': 'standard', 'endoso_details': {'name': 'HALLUX VALGUS', 'key': '', 'title': '', 'subtitle': '', 'description': 'Se cubre con suma asegurada de $40,000 mn, aplica deducible y coaseguro de poliza y periodo de espera de un año. Para este endoso no es aplicable el Endoso de Aplicacion de Deducible y/o Coaseguro', 'parameters': {'column_parameters': [{'column_parameter_name': 'Pago directo', 'column_parameter_details': [{'sub_column_parameter_name': '', 'row_parameters': [{'row_parameter_name': 'suma asegurada', 'value': '40,000', 'unit': 'mn', 'type': 'std'}, {'row_parameter_name': 'deducible', 'value': '', 'unit': '', 'type': 'std'}, {'row_parameter_name': 'coaseguro', 'value': '', 'unit': '', 'type': 'std'}, {'row_parameter_name': 'tope de coaseguro', 'value': '', 'unit': '', 'type': 'std'}, {'row_parameter_name': 'territorio de cobertura', 'value': '', 'type': 'std'}, {'row_parameter_name': 'periodo espera', 'value': '1', 'unit': 'año', 'type': 'std'}, {'row_parameter_name': 'gastos cubiertos', 'value': '', 'type': 'std'}, {'row_parameter_name': 'gastos no cubiertos', 'value': '', 'type': 'std'}, {'row_parameter_name': 'aplicación de deducible y/o coaseguro', 'value': 'false', 'type': 'std'}, {'row_parameter_name': 'condiciones generales', 'value': 'Para los demás términos y condiciones, aplicarán las Condiciones Generales vigentes del producto contratado. Este Endoso forma parte del Contrato de Seguro.', 'type': 'std'}, {'row_parameter_name': 'consulta postoperatoria', 'value': '', 'type': 'exception'}, {'row_parameter_name': 'consulta preoperatoria', 'value': '', 'type': 'exception'}]}]}, {'column_parameter_name': 'Reembolso', 'column_parameter_details': [{'sub_column_parameter_name': '', 'row_parameters': [{'row_parameter_name': 'suma asegurada', 'value': '40,000', 'unit': 'mn', 'type': 'std'}, {'row_parameter_name': 'deducible', 'value': '', 'unit': '', 'type': 'std'}, {'row_parameter_name': 'coaseguro', 'value': '', 'unit': '', 'type': 'std'}, {'row_parameter_name': 'tope de coaseguro', 'value': '', 'unit': '', 'type': 'std'}, {'row_parameter_name': 'territorio de cobertura', 'value': '', 'type': 'std'}, {'row_parameter_name': 'periodo espera', 'value': '1', 'unit': 'año', 'type': 'std'}, {'row_parameter_name': 'gastos cubiertos', 'value': '', 'type': 'std'}, {'row_parameter_name': 'gastos no cubiertos', 'value': '', 'type': 'std'}, {'row_parameter_name': 'aplicación de deducible y/o coaseguro', 'value': 'false', 'type': 'std'}, {'row_parameter_name': 'condiciones generales', 'value': 'Para los demás términos y condiciones, aplicarán las Condiciones Generales vigentes del producto contratado. Este Endoso forma parte del Contrato de Seguro.', 'type': 'std'}, {'row_parameter_name': 'consulta postoperatoria', 'value': '', 'type': 'exception'}, {'row_parameter_name': 'consulta preoperatoria', 'value': '', 'type': 'exception'}]}]}]}, 'legal': 'Para los demás términos y condiciones, aplicarán las Condiciones Generales vigentes del producto contratado. Este Endoso forma parte del Contrato de Seguro.'}, 'global_information': {'effective_date': '', 'expiration_date': '', 'factor': '', 'type': ''}, 'business_rules': {'experience': '', 'product_type': '', 'min_net_premium': '', 'min_population': ''}, 'status': '', 'comment': [{'name': '', 'date': '', 'comment': ''}]}","{'token_cost': 0.019467500000000002, 'image_cost': 0, 'total_cost': 0.019467500000000002}",DEPENDI,FW16600T
endoso_132,DEPENDIENTES_______Se consideran dependientes económicos a los hijos hasta la edad de 35_años______,"{'endoso_id': 'endoso_132', 'endoso_master_id': '132', 'contract_no': 'FW16600T', 'subgrupo': 'DEPENDI', 'type': 'standard', 'endoso_details': {'name': 'Dependientes Economicos y Edades de Aceptacion', 'key': '', 'title': '', 'subtitle': '', 'description': 'Se consideran dependientes económicos a los hijos hasta la edad de 35 años', 'parameters': {'column_parameters': '', 'row_parameters': [{'row_parameter_name': 'Descripcion', 'editable': True, 'active': True, 'type': 'std', 'value_type': 'text', 'value': 'Se consideran dependientes económicos a los hijos hasta la edad de 35 años'}, {'row_parameter_name': 'Elegibilidad', 'editable': True, 'active': True, 'type': 'std', 'value_type': 'titular/conyuge/hijos', 'value': ''}, {'row_parameter_name': 'Hijos menores a', 'editable': True, 'active': True, 'type': 'std', 'value_type': 'digits', 'unit': 'anos', 'value': '35'}, {'row_parameter_name': 'Edad de aceptación', 'editable': True, 'active': True, 'type': 'std', 'value_type': 'digits', 'value': ''}, {'row_parameter_name': 'Condiciones Generales', 'editable': True, 'active': True, 'type': 'std', 'value_type': 'string', 'value': 'Para los demás términos y condiciones, aplicarán las Condiciones Generales vigentes del producto contratado. Este Endoso forma parte del Contrato de Seguro'}, {'row_parameter_name': 'Gastos cubiertos', 'editable': True, 'active': True, 'type': 'exception', 'value_type': 'text', 'value': ''}], 'legal': ''}}, 'global_information': {'effective_date': '', 'expiration_date': '', 'factor': '', 'type': ''}, 'business_rules': {'experience': '', 'product_type': '', 'min_net_premium': '', 'min_population': ''}, 'status': '', 'comment': [{'name': '', 'date': '', 'comment': ''}]}","{'token_cost': 0.0105975, 'image_cost': 0, 'total_cost': 0.0105975}",DEPENDI,FW16600T
endoso_38,"Se ampara el tratamiento médico quirúrgico de hallux valgus o juanetes,_siempre y cuando no sea de carácter estético. __________El monto a indemnizar para este beneficio y/o cobertura será: __________Hasta el G.U.A. ____________________Con un periodo de espera de: __________-  Sin periodo de espera____________________Aplicación de deducible y coaseguro: __________Pago Directo (Médico y Hospital de Red): ___________Deducible   ver endoso deducibles__________Coaseguro  ver endoso deducibles__________Reembolso: __________Deducible   ver endoso deducibles__________Coaseguro  ver endoso deducibles____________________En caso de modificación del deducible y/o coaseguro originalmente pactado,_invariablemente se aplicarán los deducibles y coaseguros antes mencionados_en dicha cobertura/condición.__________El presente endoso modifica el capítulo de Gastos Médicos Mayores No_Cubiertos en su inciso de Tratamiento Médico o Quirúrgico de Hallux Valgus o_Juanetes. ___________Se cubre únicamente en territorio nacional. __________Este endoso forma parte integral y complementa las Condiciones Generales del_Seguro.","{'endoso_id': 'endoso_38', 'endoso_master_id': '38', 'contract_no': 'FC05010R', 'subgrupo': 'EMPLEAD', 'type': 'standard', 'endoso_details': {'name': 'HALLUX VALGUS', 'key': '', 'title': '', 'subtitle': '', 'description': 'Se ampara el tratamiento médico quirúrgico de hallux valgus o juanetes, siempre y cuando no sea de carácter estético. El monto a indemnizar para este beneficio y/o cobertura será: Hasta el G.U.A. Con un periodo de espera de: - Sin periodo de espera Aplicación de deducible y coaseguro: Pago Directo (Médico y Hospital de Red): Deducible ver endoso deducibles Coaseguro ver endoso deducibles Reembolso: Deducible ver endoso deducibles Coaseguro ver endoso deducibles En caso de modificación del deducible y/o coaseguro originalmente pactado, invariablemente se aplicarán los deducibles y coaseguros antes mencionados en dicha cobertura/condición. El presente endoso modifica el capítulo de Gastos Médicos Mayores No Cubiertos en su inciso de Tratamiento Médico o Quirúrgico de Hallux Valgus o Juanetes. Se cubre únicamente en territorio nacional. Este endoso forma parte integral y complementa las Condiciones Generales del Seguro.', 'parameters': {'column_parameters': [{'column_parameter_name': 'Pago directo', 'column_parameter_details': [{'sub_column_parameter_name': '', 'row_parameters': [{'row_parameter_name': 'suma asegurada', 'value': '', 'unit': '', 'type': 'std'}, {'row_parameter_name': 'deducible', 'value': 'ver endoso deducibles', 'unit': '', 'type': 'std'}, {'row_parameter_name': 'coaseguro', 'value': 'ver endoso deducibles', 'unit': '', 'type': 'std'}, {'row_parameter_name': 'tope de coaseguro', 'value': '', 'unit': '', 'type': 'std'}, {'row_parameter_name': 'territorio de cobertura', 'value': 'nacional', 'unit': '', 'type': 'std'}, {'row_parameter_name': 'periodo espera', 'value': '0', 'unit': '', 'type': 'std'}, {'row_parameter_name': 'gastos cubiertos', 'value': '', 'unit': '', 'type': 'std'}, {'row_parameter_name': 'gastos no cubiertos', 'value': '', 'unit': '', 'type': 'std'}, {'row_parameter_name': 'aplicación de deducible y/o coaseguro', 'value': 'Y', 'unit': '', 'type': 'std'}, {'row_parameter_name': 'condiciones generales', 'value': 'Para los demás términos y condiciones, aplicarán las Condiciones Generales vigentes del producto contratado. Este Endoso forma parte del Contrato de Seguro.', 'unit': '', 'type': 'std'}, {'row_parameter_name': 'consulta postoperatoria', 'value': '', 'unit': '', 'type': 'exception'}, {'row_parameter_name': 'consulta preoperatoria', 'value': '', 'unit': '', 'type': 'exception'}]}]}, {'column_parameter_name': 'Reembolso', 'column_parameter_details': [{'sub_column_parameter_name': '', 'row_parameters': [{'row_parameter_name': 'suma asegurada', 'value': '', 'unit': '', 'type': 'std'}, {'row_parameter_name': 'deducible', 'value': 'ver endoso deducibles', 'unit': '', 'type': 'std'}, {'row_parameter_name': 'coaseguro', 'value': 'ver endoso deducibles', 'unit': '', 'type': 'std'}, {'row_parameter_name': 'tope de coaseguro', 'value': '', 'unit': '', 'type': 'std'}, {'row_parameter_name': 'territorio de cobertura', 'value': 'nacional', 'unit': '', 'type': 'std'}, {'row_parameter_name': 'periodo espera', 'value': '0', 'unit': '', 'type': 'std'}, {'row_parameter_name': 'gastos cubiertos', 'value': '', 'unit': '', 'type': 'std'}, {'row_parameter_name': 'gastos no cubiertos', 'value': '', 'unit': '', 'type': 'std'}, {'row_parameter_name': 'aplicación de deducible y/o coaseguro', 'value': 'Y', 'unit': '', 'type': 'std'}, {'row_parameter_name': 'condiciones generales', 'value': 'Para los demás términos y condiciones, aplicarán las Condiciones Generales vigentes del producto contratado. Este Endoso forma parte del Contrato de Seguro.', 'unit': '', 'type': 'std'}, {'row_parameter_name': 'consulta postoperatoria', 'value': '', 'unit': '', 'type': 'exception'}, {'row_parameter_name': 'consulta preoperatoria', 'value': '', 'unit': '', 'type': 'exception'}]}]}]}, 'legal': 'Este endoso forma parte integral y complementa las Condiciones Generales del Seguro.'}, 'global_information': {'effective_date': '', 'expiration_date': '', 'factor': '', 'type': ''}, 'business_rules': {'experience': '', 'product_type': '', 'min_net_premium': '', 'min_population': ''}, 'status': '', 'comment': [{'name': '', 'date': '', 'comment': ''}]}","{'token_cost': 0.022405, 'image_cost': 0, 'total_cost': 0.022405}",EMPLEAD,FC05010R
endoso_84,"LA COMPAÑÍA CUBRIRÁ LOS GASTOS MÉDICOS EROGADOS DURANTE LA VIGENCIA DE ÉSTA PÓLIZA, POR URGENCIAS MÉDICAS EN EL EXTRANJERO  MODIFICANDO LOS LÍMITES DE RESPONSABILIDAD  DE ESTA COBERTURA, HASTA LOS QUE SE  INDIQUEN EN ESTE ENDOSO:_ _SUMA ASEGURADA: 100,000 USD_DEDUCIBLE:   100  USD_COASEGURO: 0%_PARA ESTE ENDOSO NO ES APLICABLE LA CLÁUSULA 27. PAGO DE INDEMNIZACIONES DE SINIESTROS DE LAS CONDICIONES GENERALES DEL PRODUCTO._ _PARA LOS DEMÁS TÉRMINOS Y CONDICIONES, APLICARÁN LAS CONDICIONES GENERALES VIGENTES DEL PRODUCTO CONTRATADO._ESTE ENDOSO FORMA PARTE DEL CONTRATO DE SEGURO.","{'endoso_id': 'endoso_84', 'endoso_master_id': '84', 'contract_no': 'FW80176B', 'subgrupo': 'MEXICO/', 'type': 'standard', 'endoso_details': {'name': 'URGENCIA MÉDICA EN EL EXTRANJERO (UMEX)', 'key': '', 'title': '', 'subtitle': '', 'description': 'LA COMPAÑÍA CUBRIRÁ LOS GASTOS MÉDICOS EROGADOS DURANTE LA VIGENCIA DE ÉSTA PÓLIZA, POR URGENCIAS MÉDICAS EN EL EXTRANJERO  MODIFICANDO LOS LÍMITES DE RESPONSABILIDAD  DE ESTA COBERTURA, HASTA LOS QUE SE  INDIQUEN EN ESTE ENDOSO: SUMA ASEGURADA: 100,000 USD DEDUCIBLE: 100 USD COASEGURO: 0% PARA ESTE ENDOSO NO ES APLICABLE LA CLÁUSULA 27. PAGO DE INDEMNIZACIONES DE SINIESTROS DE LAS CONDICIONES GENERALES DEL PRODUCTO. PARA LOS DEMÁS TÉRMINOS Y CONDICIONES, APLICARÁN LAS CONDICIONES GENERALES VIGENTES DEL PRODUCTO CONTRATADO. ESTE ENDOSO FORMA PARTE DEL CONTRATO DE SEGURO.', 'parameters': {'column_parameters': [{'column_parameter_name': 'Urgencias Médicas', 'column_parameter_details': [{'sub_column_parameter_name': '', 'row_parameters': [{'row_parameter_name': 'suma asegurada', 'value': '100,000', 'unit': 'USD', 'type': 'std'}, {'row_parameter_name': 'deducible', 'value': '100', 'unit': 'USD', 'type': 'std'}, {'row_parameter_name': 'coaseguro', 'value': '0', 'unit': '%', 'type': 'std'}, {'row_parameter_name': 'información adicional', 'value': '', 'type': 'std'}, {'row_parameter_name': 'gastos cubiertos', 'value': '', 'type': 'std'}, {'row_parameter_name': 'gastos no cubiertos', 'value': '', 'type': 'std'}, {'row_parameter_name': 'aplicación de deducible y/o coaseguro', 'value': 'false', 'type': 'std'}, {'row_parameter_name': 'condiciones generales', 'value': 'Para los demás términos y condiciones, aplicarán las Condiciones Generales vigentes del producto contratado. Este Endoso forma parte del Contrato de Seguro.', 'type': 'std'}, {'row_parameter_name': 'elegibilidad', 'value': '', 'type': 'exception'}, {'row_parameter_name': 'periodo de espera', 'value': '', 'type': 'exception'}, {'row_parameter_name': 'tope de coaseguro', 'value': '', 'type': 'exception'}, {'row_parameter_name': 'territorio de cobertura', 'value': '', 'type': 'exception'}]}]}, {'column_parameter_name': 'Accidente', 'column_parameter_details': [{'sub_column_parameter_name': '', 'row_parameters': [{'row_parameter_name': 'suma asegurada', 'value': '', 'unit': '', 'type': 'std'}, {'row_parameter_name': 'deducible', 'value': '', 'unit': '', 'type': 'std'}, {'row_parameter_name': 'coaseguro', 'value': '', 'unit': '', 'type': 'std'}, {'row_parameter_name': 'información adicional', 'value': '', 'type': 'std'}, {'row_parameter_name': 'gastos cubiertos', 'value': '', 'type': 'std'}, {'row_parameter_name': 'gastos no cubiertos', 'value': '', 'type': 'std'}, {'row_parameter_name': 'aplicación de deducible y/o coaseguro', 'value': '', 'type': 'std'}, {'row_parameter_name': 'condiciones generales', 'value': 'Para los demás términos y condiciones, aplicarán las Condiciones Generales vigentes del producto contratado. Este Endoso forma parte del Contrato de Seguro.', 'type': 'std'}, {'row_parameter_name': 'elegibilidad', 'value': '', 'type': 'exception'}, {'row_parameter_name': 'periodo de espera', 'value': '', 'type': 'exception'}, {'row_parameter_name': 'tope de coaseguro', 'value': '', 'type': 'exception'}, {'row_parameter_name': 'territorio de cobertura', 'value': '', 'type': 'exception'}]}]}]}, 'legal': 'Para los demás términos y condiciones, aplicarán las Condiciones Generales vigentes del producto contratado. Este Endoso forma parte del Contrato de Seguro.'}, 'global_information': {'effective_date': '', 'expiration_date': '', 'factor': '', 'type': ''}, 'business_rules': {'experience': '', 'product_type': '', 'min_net_premium': '', 'min_population': ''}, 'status': '', 'comment': [{'name': '', 'date': '', 'comment': ''}]}","{'token_cost': 0.020595000000000002, 'image_cost': 0, 'total_cost': 0.020595000000000002}",MEXICO/,FW80176B
endoso_84,"UMEX- 032 URGENCIA MEDICA EN EL EXTRANJERO La Compañía cubrirá los gastos_médicos erogados durante la vigencia de esta Póliza, por Urgencias Médicas en_el Extranjero   modificando los límites de responsabilidad   de esta_cobertura, hasta los que se   indiquen en este Endoso: Suma Asegurada: 100,_000.00 USD Deducible: 100 USD__Para los demás términos y condiciones, aplicarán las Condiciones Generales_vigentes del producto contratado. Este Endoso forma parte del Contrato de_Seguro.","{'endoso_id': 'endoso_84', 'endoso_master_id': '84', 'contract_no': 'FW79611A', 'subgrupo': 'ADMINIS', 'type': 'standard', 'endoso_details': {'name': 'URGENCIA MÉDICA EN EL EXTRANJERO (UMEX)', 'key': 'UMEX- 032', 'title': '', 'subtitle': '', 'description': 'La Compañía cubrirá los gastos médicos erogados durante la vigencia de esta Póliza, por Urgencias Médicas en el Extranjero modificando los límites de responsabilidad de esta cobertura, hasta los que se indiquen en este Endoso: Suma Asegurada: 100,000.00 USD Deducible: 100 USD Para los demás términos y condiciones, aplicarán las Condiciones Generales vigentes del producto contratado. Este Endoso forma parte del Contrato de Seguro.', 'parameters': {'column_parameters': [{'column_parameter_name': 'Urgencias Médicas', 'column_parameter_details': [{'sub_column_parameter_name': '', 'row_parameters': [{'row_parameter_name': 'suma asegurada', 'value': '100,000.00', 'unit': 'USD', 'type': 'std'}, {'row_parameter_name': 'deducible', 'value': '100', 'unit': 'USD', 'type': 'std'}, {'row_parameter_name': 'coaseguro', 'value': '', 'type': 'std'}, {'row_parameter_name': 'información adicional', 'value': '', 'type': 'std'}, {'row_parameter_name': 'gastos cubiertos', 'value': '', 'type': 'std'}, {'row_parameter_name': 'gastos no cubiertos', 'value': '', 'type': 'std'}, {'row_parameter_name': 'aplicación de deducible y/o coaseguro', 'value': 'false', 'type': 'std'}, {'row_parameter_name': 'condiciones generales', 'value': 'Para los demás términos y condiciones, aplicarán las Condiciones Generales vigentes del producto contratado. Este Endoso forma parte del Contrato de Seguro.', 'type': 'std'}, {'row_parameter_name': 'elegibilidad', 'value': '', 'type': 'exception'}, {'row_parameter_name': 'periodo de espera', 'value': '', 'type': 'exception'}, {'row_parameter_name': 'tope de coaseguro', 'value': '', 'type': 'exception'}, {'row_parameter_name': 'territorio de cobertura', 'value': '', 'type': 'exception'}]}]}, {'column_parameter_name': 'Accidente', 'column_parameter_details': [{'sub_column_parameter_name': '', 'row_parameters': [{'row_parameter_name': 'suma asegurada', 'value': '', 'type': 'std'}, {'row_parameter_name': 'deducible', 'value': '', 'type': 'std'}, {'row_parameter_name': 'coaseguro', 'value': '', 'type': 'std'}, {'row_parameter_name': 'información adicional', 'value': '', 'type': 'std'}, {'row_parameter_name': 'gastos cubiertos', 'value': '', 'type': 'std'}, {'row_parameter_name': 'gastos no cubiertos', 'value': '', 'type': 'std'}, {'row_parameter_name': 'aplicación de deducible y/o coaseguro', 'value': '', 'type': 'std'}, {'row_parameter_name': 'condiciones generales', 'value': 'Para los demás términos y condiciones, aplicarán las Condiciones Generales vigentes del producto contratado. Este Endoso forma parte del Contrato de Seguro.', 'type': 'std'}, {'row_parameter_name': 'elegibilidad', 'value': '', 'type': 'exception'}, {'row_parameter_name': 'periodo de espera', 'value': '', 'type': 'exception'}, {'row_parameter_name': 'tope de coaseguro', 'value': '', 'type': 'exception'}, {'row_parameter_name': 'territorio de cobertura', 'value': '', 'type': 'exception'}]}]}]}, 'legal': 'Para los demás términos y condiciones, aplicarán las Condiciones Generales vigentes del producto contratado. Este Endoso forma parte del Contrato de Seguro.'}, 'global_information': {'effective_date': '', 'expiration_date': '', 'factor': '', 'type': ''}, 'business_rules': {'experience': '', 'product_type': '', 'min_net_premium': '', 'min_population': ''}, 'status': '', 'comment': [{'name': '', 'date': '', 'comment': ''}]}","{'token_cost': 0.020387500000000003, 'image_cost': 0, 'total_cost': 0.020387500000000003}",ADMINIS,FW79611A
