endoso_code,text,extracted_parameters,cost_metrics,nom_subg,contract_no
endoso_38,"Se ampara el tratamiento médico quirúrgico de hallux valgus o juanetes,_ siempre y cuando no sea de carácter estético.__El monto a indemnizar para este beneficio y/o cobertura será: _De acuerdo a lo siguiente:__Monto Máximo a Indemnizar 10.00 SMGM __Con un periodo de espera de: _Sin periodo de espera__Aplicación de deducible y coaseguro:__Pago Directo (Médico y Hospital de Red):__Deducible                0.00   S.M.G.M. __Coaseguro                0.00   % __Reembolso:__Deducible                0.00   S.M.G.M. __Coaseguro                0.00   % __En caso de modificación del deducible y/o coaseguro originalmente pactado,_ invariablemente se aplicarán los deducibles y coaseguros antes_ mencionados en dicha cobertura/condición.__El presente endoso modifica el capítulo de Gastos Médicos Mayores No_ Cubiertos en su inciso de Tratamiento Médico o Quirúrgico de Hallux_ Valgus o Juanetes.__Se cubre únicamente en territorio nacional.__Este endoso forma parte integral y complementa las Condiciones Generales_ del Seguro_","{'endoso_id': 'endoso_38', 'endoso_master_id': '38', 'contract_no': 'FW16455N', 'subgrupo': 'TITULAR', 'type': 'standard', 'endoso_details': {'name': 'HALLUX VALGUS', 'key': '', 'title': '', 'subtitle': '', 'description': 'Se ampara el tratamiento médico quirúrgico de hallux valgus o juanetes, siempre y cuando no sea de carácter estético. El monto a indemnizar para este beneficio y/o cobertura será: De acuerdo a lo siguiente: Monto Máximo a Indemnizar 10.00 SMGM Con un periodo de espera de: Sin periodo de espera Aplicación de deducible y coaseguro: Pago Directo (Médico y Hospital de Red): Deducible 0.00 S.M.G.M. Coaseguro 0.00 % Reembolso: Deducible 0.00 S.M.G.M. Coaseguro 0.00 % En caso de modificación del deducible y/o coaseguro originalmente pactado, invariablemente se aplicarán los deducibles y coaseguros antes mencionados en dicha cobertura/condición. El presente endoso modifica el capítulo de Gastos Médicos Mayores No Cubiertos en su inciso de Tratamiento Médico o Quirúrgico de Hallux Valgus o Juanetes. Se cubre únicamente en territorio nacional. Este endoso forma parte integral y complementa las Condiciones Generales del Seguro', 'parameters': {'column_parameters': [{'column_parameter_name': 'Pago directo', 'column_parameter_details': [{'sub_column_parameter_name': '', 'row_parameters': [{'row_parameter_name': 'suma asegurada', 'value': '10.00', 'unit': 'SMGM', 'type': 'std'}, {'row_parameter_name': 'deducible', 'value': '0.00', 'unit': 'S.M.G.M.', 'type': 'std'}, {'row_parameter_name': 'coaseguro', 'value': '0.00', 'unit': '%', 'type': 'std'}, {'row_parameter_name': 'tope de coaseguro', 'value': '', 'unit': '', 'type': 'std'}, {'row_parameter_name': 'territorio de cobertura', 'value': 'nacional', 'type': 'std'}, {'row_parameter_name': 'periodo espera', 'value': 'Sin periodo de espera', 'type': 'std'}, {'row_parameter_name': 'gastos cubiertos', 'value': '', 'type': 'std'}, {'row_parameter_name': 'gastos no cubiertos', 'value': 'El presente endoso modifica el capítulo de Gastos Médicos Mayores No Cubiertos en su inciso de Tratamiento Médico o Quirúrgico de Hallux Valgus o Juanetes.', 'type': 'std'}, {'row_parameter_name': 'aplicación de deducible y/o coaseguro', 'value': 'Y', 'type': 'std'}, {'row_parameter_name': 'condiciones generales', 'value': 'Este endoso forma parte integral y complementa las Condiciones Generales del Seguro', 'type': 'std'}, {'row_parameter_name': 'consulta postoperatoria', 'value': '', 'type': 'exception'}, {'row_parameter_name': 'consulta preoperatoria', 'value': '', 'type': 'exception'}]}]}, {'column_parameter_name': 'Reembolso', 'column_parameter_details': [{'sub_column_parameter_name': '', 'row_parameters': [{'row_parameter_name': 'suma asegurada', 'value': '10.00', 'unit': 'SMGM', 'type': 'std'}, {'row_parameter_name': 'deducible', 'value': '0.00', 'unit': 'S.M.G.M.', 'type': 'std'}, {'row_parameter_name': 'coaseguro', 'value': '0.00', 'unit': '%', 'type': 'std'}, {'row_parameter_name': 'tope de coaseguro', 'value': '', 'unit': '', 'type': 'std'}, {'row_parameter_name': 'territorio de cobertura', 'value': 'nacional', 'type': 'std'}, {'row_parameter_name': 'periodo espera', 'value': 'Sin periodo de espera', 'type': 'std'}, {'row_parameter_name': 'gastos cubiertos', 'value': '', 'type': 'std'}, {'row_parameter_name': 'gastos no cubiertos', 'value': 'El presente endoso modifica el capítulo de Gastos Médicos Mayores No Cubiertos en su inciso de Tratamiento Médico o Quirúrgico de Hallux Valgus o Juanetes.', 'type': 'std'}, {'row_parameter_name': 'aplicación de deducible y/o coaseguro', 'value': 'Y', 'type': 'std'}, {'row_parameter_name': 'condiciones generales', 'value': 'Este endoso forma parte integral y complementa las Condiciones Generales del Seguro', 'type': 'std'}, {'row_parameter_name': 'consulta postoperatoria', 'value': '', 'type': 'exception'}, {'row_parameter_name': 'consulta preoperatoria', 'value': '', 'type': 'exception'}]}]}]}, 'legal': 'Este endoso forma parte integral y complementa las Condiciones Generales del Seguro'}, 'global_information': {'effective_date': '', 'expiration_date': '', 'factor': '', 'type': ''}, 'business_rules': {'experience': '', 'product_type': '', 'min_net_premium': '', 'min_population': ''}, 'status': '', 'comment': [{'name': '', 'date': '', 'comment': ''}]}","{'token_cost': 0.022447500000000002, 'image_cost': 0, 'total_cost': 0.022447500000000002}",TITULAR,FW16455N
endoso_155,"Endoso Factor de Reembolso__El Factor de Reembolso de cada Procedimiento Terapéutico incluido en la_Condiciones Generales correspondientes a esta póliza esta expresado de manera_porcentual, por lo que para cualquier efecto dicho factor deberá dividirse_entre 100.","{'endoso_id': 'endoso_155', 'endoso_master_id': '155', 'contract_no': 'FW54588D', 'subgrupo': 'GENERAL', 'type': 'standard', 'endoso_details': {'name': 'Factor', 'key': '', 'title': '', 'subtitle': '', 'description': 'El Factor de Reembolso de cada Procedimiento Terapéutico incluido en la Condiciones Generales correspondientes a esta póliza esta expresado de manera porcentual, por lo que para cualquier efecto dicho factor deberá dividirse entre 100.', 'parameters': {'column_parameters': '', 'row_parameters': [{'row_parameter_name': 'Descripcion', 'editable': True, 'active': True, 'type': 'std', 'value_type': 'text', 'value': 'El Factor de Reembolso de cada Procedimiento Terapéutico incluido en la Condiciones Generales correspondientes a esta póliza esta expresado de manera porcentual, por lo que para cualquier efecto dicho factor deberá dividirse entre 100.'}, {'row_parameter_name': 'Factor', 'editable': True, 'active': True, 'type': 'std', 'value_type': 'digits', 'value': ''}, {'row_parameter_name': 'Condiciones Generales', 'editable': True, 'active': True, 'type': 'std', 'value_type': 'string', 'value': 'Para los demás términos y condiciones, aplicarán las Condiciones Generales vigentes del producto contratado. Este Endoso forma parte del Contrato de Seguro'}]}, 'legal': ''}, 'global_information': {'effective_date': '', 'expiration_date': '', 'factor': '', 'type': ''}, 'business_rules': {'experience': '', 'product_type': '', 'min_net_premium': '', 'min_population': ''}, 'status': '', 'comment': [{'name': '', 'date': '', 'comment': ''}]}","{'token_cost': 0.009222500000000002, 'image_cost': 0, 'total_cost': 0.009222500000000002}",GENERAL,FW54588D
endoso_84,"La Compañía cubrirá los gastos médicos erogados durante la vigencia de esta_Póliza, por Urgencias Médicas en el Extranjero  modificando los límites de_responsabilidad  de esta cobertura, hasta los que se  indiquen en este_Endoso:__Suma Asegurada: 50,000 usd__Deducible: 50usd__Para este Endoso no es aplicable el Endoso de  Aplicación de Deducible y/o_Coaseguro.__Para los demás términos y condiciones, aplicarán las Condiciones Generales_vigentes del producto contratado.__Este Endoso forma parte del Contrato de Seguro.","{'endoso_id': 'endoso_84', 'endoso_master_id': '84', 'contract_no': 'FW54028C', 'subgrupo': 'GENERAL', 'type': 'standard', 'endoso_details': {'name': 'URGENCIA MÉDICA EN EL EXTRANJERO (UMEX)', 'key': '', 'title': '', 'subtitle': '', 'description': 'La Compañía cubrirá los gastos médicos erogados durante la vigencia de esta Póliza, por Urgencias Médicas en el Extranjero modificando los límites de responsabilidad de esta cobertura, hasta los que se indiquen en este Endoso: Suma Asegurada: 50,000 usd Deducible: 50usd Para este Endoso no es aplicable el Endoso de Aplicación de Deducible y/o Coaseguro. Para los demás términos y condiciones, aplicarán las Condiciones Generales vigentes del producto contratado. Este Endoso forma parte del Contrato de Seguro.', 'parameters': {'column_parameters': [{'column_parameter_name': 'Urgencias Médicas', 'column_parameter_details': [{'sub_column_parameter_name': '', 'row_parameters': [{'row_parameter_name': 'suma asegurada', 'value': '50,000', 'unit': 'USD', 'type': 'std'}, {'row_parameter_name': 'deducible', 'value': '50', 'unit': 'USD', 'type': 'std'}, {'row_parameter_name': 'coaseguro', 'value': '', 'type': 'std'}, {'row_parameter_name': 'información adicional', 'value': '', 'type': 'std'}, {'row_parameter_name': 'gastos cubiertos', 'value': '', 'type': 'std'}, {'row_parameter_name': 'gastos no cubiertos', 'value': '', 'type': 'std'}, {'row_parameter_name': 'aplicación de deducible y/o coaseguro', 'value': 'false', 'type': 'std'}, {'row_parameter_name': 'condiciones generales', 'value': 'Para los demás términos y condiciones, aplicarán las Condiciones Generales vigentes del producto contratado. Este Endoso forma parte del Contrato de Seguro.', 'type': 'std'}, {'row_parameter_name': 'elegibilidad', 'value': '', 'type': 'exception'}, {'row_parameter_name': 'periodo de espera', 'value': '', 'type': 'exception'}, {'row_parameter_name': 'tope de coaseguro', 'value': '', 'type': 'exception'}, {'row_parameter_name': 'territorio de cobertura', 'value': '', 'type': 'exception'}]}]}, {'column_parameter_name': 'Accidente', 'column_parameter_details': [{'sub_column_parameter_name': '', 'row_parameters': [{'row_parameter_name': 'suma asegurada', 'value': '', 'type': 'std'}, {'row_parameter_name': 'deducible', 'value': '', 'type': 'std'}, {'row_parameter_name': 'coaseguro', 'value': '', 'type': 'std'}, {'row_parameter_name': 'información adicional', 'value': '', 'type': 'std'}, {'row_parameter_name': 'gastos cubiertos', 'value': '', 'type': 'std'}, {'row_parameter_name': 'gastos no cubiertos', 'value': '', 'type': 'std'}, {'row_parameter_name': 'aplicación de deducible y/o coaseguro', 'value': '', 'type': 'std'}, {'row_parameter_name': 'condiciones generales', 'value': 'Para los demás términos y condiciones, aplicarán las Condiciones Generales vigentes del producto contratado. Este Endoso forma parte del Contrato de Seguro.', 'type': 'std'}, {'row_parameter_name': 'elegibilidad', 'value': '', 'type': 'exception'}, {'row_parameter_name': 'periodo de espera', 'value': '', 'type': 'exception'}, {'row_parameter_name': 'tope de coaseguro', 'value': '', 'type': 'exception'}, {'row_parameter_name': 'territorio de cobertura', 'value': '', 'type': 'exception'}]}]}], 'legal': 'Para los demás términos y condiciones, aplicarán las Condiciones Generales vigentes del producto contratado. Este Endoso forma parte del Contrato de Seguro.'}}, 'global_information': {'effective_date': '', 'expiration_date': '', 'factor': '', 'type': ''}, 'business_rules': {'experience': '', 'product_type': '', 'min_net_premium': '', 'min_population': ''}, 'status': '', 'comment': [{'name': '', 'date': '', 'comment': ''}]}","{'token_cost': 0.019332500000000002, 'image_cost': 0, 'total_cost': 0.019332500000000002}",GENERAL,FW54028C
endoso_84,"UMEX- 032 URGENCIA MEDICA EN EL EXTRANJERO                                 _La Compañía cubrirá los gastos médicos erogados durante la vigencia de esta_Póliza, por Urgencias Médicas en el Extranjero   modificando los límites de_responsabilidad   de esta cobertura, hasta los que se   indiquen en este   _Endoso:                                                                    _Suma Asegurada: 100,000.00 USD                                             _Deducible: 100 USD                                                         _                                                                           _Para los demás términos y condiciones, aplicarán las Condiciones Generales _vigentes del producto contratado.                                          _Este Endoso forma parte del Contrato de Seguro.                            _                                                                           _                                                                           _                                                                           _                                                                           _","{'endoso_id': 'endoso_84', 'endoso_master_id': '84', 'contract_no': 'FW94287B', 'subgrupo': '1', 'type': 'standard', 'endoso_details': {'name': 'URGENCIA MÉDICA EN EL EXTRANJERO (UMEX)', 'key': 'UMEX- 032', 'title': '', 'subtitle': '', 'description': 'La Compañía cubrirá los gastos médicos erogados durante la vigencia de esta Póliza, por Urgencias Médicas en el Extranjero   modificando los límites de responsabilidad   de esta cobertura, hasta los que se   indiquen en este   Endoso: Suma Asegurada: 100,000.00 USD Deducible: 100 USD Para los demás términos y condiciones, aplicarán las Condiciones Generales vigentes del producto contratado. Este Endoso forma parte del Contrato de Seguro.', 'parameters': {'column_parameters': [{'column_parameter_name': 'Urgencias Médicas', 'column_parameter_details': [{'row_parameters': [{'row_parameter_name': 'suma asegurada', 'type': 'std', 'value': '100,000.00', 'unit': 'USD'}, {'row_parameter_name': 'deducible', 'type': 'std', 'value': '100', 'unit': 'USD'}, {'row_parameter_name': 'coaseguro', 'type': 'std', 'value': ''}, {'row_parameter_name': 'información adicional', 'type': 'std', 'value': ''}, {'row_parameter_name': 'gastos cubiertos', 'type': 'std', 'value': ''}, {'row_parameter_name': 'gastos no cubiertos', 'type': 'std', 'value': ''}, {'row_parameter_name': 'aplicación de deducible y/o coaseguro', 'type': 'std', 'value': 'N'}, {'row_parameter_name': 'condiciones generales', 'type': 'std', 'value': 'Para los demás términos y condiciones, aplicarán las Condiciones Generales vigentes del producto contratado. Este Endoso forma parte del Contrato de Seguro.'}, {'row_parameter_name': 'elegibilidad', 'type': 'exception', 'value': ''}, {'row_parameter_name': 'periodo de espera', 'type': 'exception', 'value': ''}, {'row_parameter_name': 'tope de coaseguro', 'type': 'exception', 'value': ''}, {'row_parameter_name': 'territorio de cobertura', 'type': 'exception', 'value': ''}]}]}, {'column_parameter_name': 'Accidente', 'column_parameter_details': [{'row_parameters': [{'row_parameter_name': 'suma asegurada', 'type': 'std', 'value': ''}, {'row_parameter_name': 'deducible', 'type': 'std', 'value': ''}, {'row_parameter_name': 'coaseguro', 'type': 'std', 'value': ''}, {'row_parameter_name': 'información adicional', 'type': 'std', 'value': ''}, {'row_parameter_name': 'gastos cubiertos', 'type': 'std', 'value': ''}, {'row_parameter_name': 'gastos no cubiertos', 'type': 'std', 'value': ''}, {'row_parameter_name': 'aplicación de deducible y/o coaseguro', 'type': 'std', 'value': ''}, {'row_parameter_name': 'condiciones generales', 'type': 'std', 'value': 'Para los demás términos y condiciones, aplicarán las Condiciones Generales vigentes del producto contratado. Este Endoso forma parte del Contrato de Seguro.'}, {'row_parameter_name': 'elegibilidad', 'type': 'exception', 'value': ''}, {'row_parameter_name': 'periodo de espera', 'type': 'exception', 'value': ''}, {'row_parameter_name': 'tope de coaseguro', 'type': 'exception', 'value': ''}, {'row_parameter_name': 'territorio de cobertura', 'type': 'exception', 'value': ''}]}]}], 'legal': 'Para los demás términos y condiciones, aplicarán las Condiciones Generales vigentes del producto contratado. Este Endoso forma parte del Contrato de Seguro.'}}, 'global_information': {'effective_date': '', 'expiration_date': '', 'factor': '', 'type': ''}, 'business_rules': {'experience': '', 'product_type': '', 'min_net_premium': '', 'min_population': ''}, 'status': '', 'comment': [{'name': '', 'date': '', 'comment': ''}]}","{'token_cost': 0.02031, 'image_cost': 0, 'total_cost': 0.02031}",1,FW94287B
endoso_142,"Como litotripsia se entiende el desmenuzamiento o fragmentación de un_ cálculo por medio del litotriptor.__Este endoso ampara el pago de honorarios médicos, gastos de_ hospitalización, medicamentos, renta del litotriptor endoscópico o_ extracorpóreo y demás gastos cubiertos generados dentro del hospital.__El monto máximo a indemnizar para este beneficio y/o cobertura será:  _De acuerdo a las condiciones generales (26 veces el S.M.G.M)__Monto Máximo a Indemnizar 26 SMGM  __Pago Directo (Médico y Hospital en convenio de acuerdo al nivel_ hospitalario contratado)__Deducible            7,500.00   M.N. __Coaseguro                0.00   % __Reembolso:__Deducible           10,000.00   M.N. __Coaseguro               10.00   % __En caso de modificación del deducible y/o coaseguro originalmente pactado,_ invariablemente se aplicarán los deducibles y coaseguros antes_ mencionados en dicha cobertura/condición.__El Asegurado deberá cumplir con un periodo de espera, a partir de su_ inscripción en la póliza: _Se elimina periodo de espera__Se cubre únicamente en territorio nacional.__Los demás términos y condiciones, deben operar conforme se señala en las_ Condiciones Generales del producto contratado.__Este endoso forma parte integral y complementa las Condiciones Generales_ del Seguro_","{'endoso_id': 'endoso_142', 'endoso_master_id': '142', 'contract_no': 'FW35175E', 'subgrupo': 'GENERAL', 'type': 'standard', 'endoso_details': {'name': 'LITOTRIPSIAS', 'key': '', 'title': '', 'subtitle': '', 'description': 'Como litotripsia se entiende el desmenuzamiento o fragmentación de un cálculo por medio del litotriptor. Este endoso ampara el pago de honorarios médicos, gastos de hospitalización, medicamentos, renta del litotriptor endoscópico o extracorpóreo y demás gastos cubiertos generados dentro del hospital. El monto máximo a indemnizar para este beneficio y/o cobertura será: De acuerdo a las condiciones generales (26 veces el S.M.G.M) Monto Máximo a Indemnizar 26 SMGM Pago Directo (Médico y Hospital en convenio de acuerdo al nivel hospitalario contratado) Deducible 7,500.00 M.N. Coaseguro 0.00 % Reembolso: Deducible 10,000.00 M.N. Coaseguro 10.00 % En caso de modificación del deducible y/o coaseguro originalmente pactado, invariablemente se aplicarán los deducibles y coaseguros antes mencionados en dicha cobertura/condición. El Asegurado deberá cumplir con un periodo de espera, a partir de su inscripción en la póliza: Se elimina periodo de espera Se cubre únicamente en territorio nacional. Los demás términos y condiciones, deben operar conforme se señala en las Condiciones Generales del producto contratado. Este endoso forma parte integral y complementa las Condiciones Generales del Seguro', 'parameters': {'column_parameters': [{'column_parameter_name': 'Pago directo', 'column_parameter_details': [{'sub_column_parameter_name': '', 'row_parameters': [{'row_parameter_name': 'suma asegurada', 'value': '', 'unit': '', 'type': 'std'}, {'row_parameter_name': 'deducible', 'value': '7500.00', 'unit': 'M.N.', 'type': 'std'}, {'row_parameter_name': 'coaseguro', 'value': '0.00', 'unit': '%', 'type': 'std'}, {'row_parameter_name': 'periodo espera', 'value': 'Se elimina periodo de espera', 'unit': '', 'type': 'std'}, {'row_parameter_name': 'territorio de cobertura', 'value': 'nacional', 'unit': '', 'type': 'std'}, {'row_parameter_name': 'consulta postoperatoria', 'value': '', 'unit': '', 'type': 'std'}, {'row_parameter_name': 'consulta preoperatoria', 'value': '', 'unit': '', 'type': 'std'}, {'row_parameter_name': 'aplicación de deducible y/o coaseguro', 'value': 'true', 'unit': '', 'type': 'std'}, {'row_parameter_name': 'condiciones generales', 'value': 'Los demás términos y condiciones, deben operar conforme se señala en las Condiciones Generales del producto contratado. Este endoso forma parte integral y complementa las Condiciones Generales del Seguro.', 'unit': '', 'type': 'std'}, {'row_parameter_name': 'elegibilidad', 'value': '', 'unit': '', 'type': 'exception'}, {'row_parameter_name': 'tope de coaseguro', 'value': '', 'unit': '', 'type': 'exception'}, {'row_parameter_name': 'número de sesiones', 'value': '', 'unit': '', 'type': 'exception'}]}]}, {'column_parameter_name': 'Reembolso', 'column_parameter_details': [{'sub_column_parameter_name': '', 'row_parameters': [{'row_parameter_name': 'suma asegurada', 'value': '', 'unit': '', 'type': 'std'}, {'row_parameter_name': 'deducible', 'value': '10000.00', 'unit': 'M.N.', 'type': 'std'}, {'row_parameter_name': 'coaseguro', 'value': '10.00', 'unit': '%', 'type': 'std'}, {'row_parameter_name': 'periodo espera', 'value': 'Se elimina periodo de espera', 'unit': '', 'type': 'std'}, {'row_parameter_name': 'territorio de cobertura', 'value': 'nacional', 'unit': '', 'type': 'std'}, {'row_parameter_name': 'consulta postoperatoria', 'value': '', 'unit': '', 'type': 'std'}, {'row_parameter_name': 'consulta preoperatoria', 'value': '', 'unit': '', 'type': 'std'}, {'row_parameter_name': 'aplicación de deducible y/o coaseguro', 'value': 'true', 'unit': '', 'type': 'std'}, {'row_parameter_name': 'condiciones generales', 'value': 'Los demás términos y condiciones, deben operar conforme se señala en las Condiciones Generales del producto contratado. Este endoso forma parte integral y complementa las Condiciones Generales del Seguro.', 'unit': '', 'type': 'std'}, {'row_parameter_name': 'elegibilidad', 'value': '', 'unit': '', 'type': 'exception'}, {'row_parameter_name': 'tope de coaseguro', 'value': '', 'unit': '', 'type': 'exception'}, {'row_parameter_name': 'número de sesiones', 'value': '', 'unit': '', 'type': 'exception'}]}]}]}, 'legal': 'Los demás términos y condiciones, deben operar conforme se señala en las Condiciones Generales del producto contratado. Este endoso forma parte integral y complementa las Condiciones Generales del Seguro.'}, 'global_information': {'effective_date': '', 'expiration_date': '', 'factor': '', 'type': ''}, 'business_rules': {'experience': '', 'product_type': '', 'min_net_premium': '', 'min_population': ''}, 'status': '', 'comment': [{'name': '', 'date': '', 'comment': ''}]}","{'token_cost': 0.023540000000000002, 'image_cost': 0, 'total_cost': 0.023540000000000002}",GENERAL,FW35175E
